group_id,Component_3,apul,peve,ptua,type,avg_identity,query,accession,id,reviewed,protein_name,organism,pident,length,evalue,bitscore,title,go_ids,go_bp,go_cc,go_mf,goslim_ids,goslim_names
OG_04243,3.5073686753042126,FUN_017765-T1,Peve_00003282,Pocillopora_meandrina_HIv1___RNAseq.g446.t1,three_way,79.75516666666667,FUN_017765-T1,Q5RD44,B3A2_PONAB,,Anion exchange protein 2 (AE 2) (Anion exchanger 2) (Solute carrier family 4 member 2),Pongo abelii (Sumatran orangutan) (Pongo pygmaeus abelii),43.1,1043.0,1.9e-207,724.5,sp|Q5RD44|B3A2_PONAB Anion exchange protein 2 OS=Pongo abelii OX=9601 GN=SLC4A2 PE=2 SV=2,GO:0016323; GO:0016324; GO:0030316; GO:0032956; GO:0043377; GO:0045124; GO:0051453; GO:0140900; GO:2000565,"negative regulation of CD8-positive, alpha-beta T cell differentiation [GO:0043377]; negative regulation of CD8-positive, alpha-beta T cell proliferation [GO:2000565]; osteoclast differentiation [GO:0030316]; regulation of actin cytoskeleton organization [GO:0032956]; regulation of bone resorption [GO:0045124]; regulation of intracellular pH [GO:0051453]",apical plasma membrane [GO:0016324]; basolateral plasma membrane [GO:0016323],chloride:bicarbonate antiporter activity [GO:0140900],GO:0005215; GO:0030154,transporter activity; cell differentiation
OG_05220,3.505380732453943,FUN_023632-T1,Peve_00017477,Pocillopora_meandrina_HIv1___RNAseq.g527.t1,three_way,59.04733333333333,,,,,,,,,,,,,,,,,
OG_08057,3.5000985951159653,FUN_035752-T1,Peve_00044203,Pocillopora_meandrina_HIv1___RNAseq.g11880.t1,three_way,86.57133333333333,FUN_035752-T1,Q64701,RBL1_MOUSE,,Retinoblastoma-like protein 1 (107 kDa retinoblastoma-associated protein) (p107) (pRb1),Mus musculus (Mouse),50.0,1056.0,2.6e-275,949.9,sp|Q64701|RBL1_MOUSE Retinoblastoma-like protein 1 OS=Mus musculus OX=10090 GN=Rbl1 PE=1 SV=3,GO:0000122; GO:0005634; GO:0005654; GO:0005667; GO:0006325; GO:0010629; GO:0051726; GO:1990841; GO:2000773,chromatin organization [GO:0006325]; negative regulation of cellular senescence [GO:2000773]; negative regulation of gene expression [GO:0010629]; negative regulation of transcription by RNA polymerase II [GO:0000122]; regulation of cell cycle [GO:0051726],nucleoplasm [GO:0005654]; nucleus [GO:0005634]; transcription regulator complex [GO:0005667],promoter-specific chromatin binding [GO:1990841],GO:0005634; GO:0005654; GO:0006325; GO:0006355; GO:0043226,nucleus; nucleoplasm; chromatin organization; regulation of DNA-templated transcription; organelle
OG_07408,3.489448603515215,FUN_033861-T1,Peve_00043296,Pocillopora_meandrina_HIv1___RNAseq.g28415.t1,three_way,63.10766666666667,FUN_033861-T1,Q95JR6,,,,,28.8,295.0,3.5e-27,124.8,sp|Q95JR6|CNBD2_MACFA Cyclic nucleotide-binding domain-containing protein 2 OS=Macaca fascicularis OX=9541 GN=CNBD2 PE=2 SV=1,,,,,,
OG_04006,3.487666287882647,FUN_016305-T1,Peve_00032293,Pocillopora_meandrina_HIv1___RNAseq.g10040.t1,three_way,94.53566666666669,FUN_016305-T1,Q6NZ04,SIX1B_DANRE,,Homeobox protein six1b (Homeobox protein six1a) (Sine oculis homeobox homolog 1a) (Sine oculis homeobox homolog 1b),Danio rerio (Zebrafish) (Brachydanio rerio),61.8,285.0,6.9e-92,338.6,sp|Q6NZ04|SIX1B_DANRE Homeobox protein six1b OS=Danio rerio OX=7955 GN=six1b PE=1 SV=1,GO:0000978; GO:0000981; GO:0002074; GO:0005634; GO:0005667; GO:0005737; GO:0006357; GO:0006915; GO:0014857; GO:0021984; GO:0043282; GO:0048741; GO:0048839; GO:0048935; GO:0051146,adenohypophysis development [GO:0021984]; apoptotic process [GO:0006915]; chordate pharyngeal muscle development [GO:0043282]; extraocular skeletal muscle development [GO:0002074]; inner ear development [GO:0048839]; peripheral nervous system neuron development [GO:0048935]; regulation of skeletal muscle cell proliferation [GO:0014857]; regulation of transcription by RNA polymerase II [GO:0006357]; skeletal muscle fiber development [GO:0048741]; striated muscle cell differentiation [GO:0051146],cytoplasm [GO:0005737]; nucleus [GO:0005634]; transcription regulator complex [GO:0005667],"DNA-binding transcription factor activity, RNA polymerase II-specific [GO:0000981]; RNA polymerase II cis-regulatory region sequence-specific DNA binding [GO:0000978]",GO:0003677; GO:0005634; GO:0006355; GO:0012501; GO:0030154; GO:0043226; GO:0048856; GO:0140110,DNA binding; nucleus; regulation of DNA-templated transcription; programmed cell death; cell differentiation; organelle; anatomical structure development; transcription regulator activity
OG_05498,3.480906608410708,FUN_024557-T1,Peve_00039513,Pocillopora_meandrina_HIv1___RNAseq.g18656.t1,three_way,51.671,,,,,,,,,,,,,,,,,
OG_05208,3.472025954547813,FUN_023592-T1,Peve_00023919,Pocillopora_meandrina_HIv1___RNAseq.g3311.t1,three_way,44.60383333333333,FUN_023592-T1,E9PVX6,KI67_MOUSE,,Proliferation marker protein Ki-67 (Antigen identified by monoclonal antibody Ki-67 homolog) (Antigen KI-67 homolog) (Antigen Ki67 homolog),Mus musculus (Mouse),42.2,135.0,5.7e-18,95.9,sp|E9PVX6|KI67_MOUSE Proliferation marker protein Ki-67 OS=Mus musculus OX=10090 GN=Mki67 PE=1 SV=1,GO:0000775; GO:0000793; GO:0003677; GO:0003723; GO:0005524; GO:0005634; GO:0005730; GO:0005737; GO:0007059; GO:0007088; GO:0008283; GO:0050673; GO:0051321; GO:0072089; GO:0072574; GO:0140693; GO:1902275; GO:1990705,cell population proliferation [GO:0008283]; cholangiocyte proliferation [GO:1990705]; chromosome segregation [GO:0007059]; epithelial cell proliferation [GO:0050673]; hepatocyte proliferation [GO:0072574]; meiotic cell cycle [GO:0051321]; regulation of chromatin organization [GO:1902275]; regulation of mitotic nuclear division [GO:0007088]; stem cell proliferation [GO:0072089],"chromosome, centromeric region [GO:0000775]; condensed chromosome [GO:0000793]; cytoplasm [GO:0005737]; nucleolus [GO:0005730]; nucleus [GO:0005634]",ATP binding [GO:0005524]; DNA binding [GO:0003677]; molecular condensate scaffold activity [GO:0140693]; RNA binding [GO:0003723],GO:0003677; GO:0003723; GO:0005634; GO:0005694; GO:0005730; GO:0007059; GO:0022414; GO:0043226; GO:0060090,DNA binding; RNA binding; nucleus; chromosome; nucleolus; chromosome segregation; reproductive process; organelle; molecular adaptor activity
OG_02090,3.4699887379520487,FUN_008328-T1,Peve_00040489,Pocillopora_meandrina_HIv1___TS.g24166.t1,three_way,48.269666666666666,FUN_008328-T1,B3EWY9,,,,,39.3,990.0,2.1999999999999998e-166,589.3,sp|B3EWY9|MLP_ACRMI Mucin-like protein (Fragment) OS=Acropora millepora OX=45264 PE=1 SV=1,,,,,,
OG_01608,3.467763700371058,FUN_006652-T1,Peve_00029039,Pocillopora_meandrina_HIv1___RNAseq.g19955.t1,three_way,64.58433333333333,FUN_006652-T1,Q6V0I7,FAT4_HUMAN,,Protocadherin Fat 4 (hFat4) (Cadherin family member 14) (FAT tumor suppressor homolog 4) (Fat-like cadherin protein FAT-J),Homo sapiens (Human),32.4,1666.0,2.3000000000000004e-224,781.6,sp|Q6V0I7|FAT4_HUMAN Protocadherin Fat 4 OS=Homo sapiens OX=9606 GN=FAT4 PE=1 SV=2,GO:0005509; GO:0005886; GO:0007156; GO:0007157; GO:0021987; GO:0022008; GO:0035329; GO:0070062; GO:0098609,cell-cell adhesion [GO:0098609]; cerebral cortex development [GO:0021987]; heterophilic cell-cell adhesion via plasma membrane cell adhesion molecules [GO:0007157]; hippo signaling [GO:0035329]; homophilic cell adhesion via plasma membrane adhesion molecules [GO:0007156]; neurogenesis [GO:0022008],extracellular exosome [GO:0070062]; plasma membrane [GO:0005886],calcium ion binding [GO:0005509],GO:0005886; GO:0007155; GO:0030154; GO:0043226; GO:0048856,plasma membrane; cell adhesion; cell differentiation; organelle; anatomical structure development
OG_01941,3.4677383985920223,FUN_007993-T1,Peve_00018053,Pocillopora_meandrina_HIv1___RNAseq.g5090.t1,three_way,42.72566666666666,FUN_007993-T1,Q96RW7,HMCN1_HUMAN,,Hemicentin-1 (Fibulin-6) (FIBL-6),Homo sapiens (Human),25.9,587.0,7.1e-39,163.7,sp|Q96RW7|HMCN1_HUMAN Hemicentin-1 OS=Homo sapiens OX=9606 GN=HMCN1 PE=1 SV=2,GO:0005201; GO:0005509; GO:0005604; GO:0005737; GO:0005912; GO:0005927; GO:0005938; GO:0007156; GO:0007157; GO:0007601; GO:0009617; GO:0030036; GO:0032154; GO:0051301; GO:0062023; GO:0070062; GO:0071711,actin cytoskeleton organization [GO:0030036]; basement membrane organization [GO:0071711]; cell division [GO:0051301]; heterophilic cell-cell adhesion via plasma membrane cell adhesion molecules [GO:0007157]; homophilic cell adhesion via plasma membrane adhesion molecules [GO:0007156]; response to bacterium [GO:0009617]; visual perception [GO:0007601],adherens junction [GO:0005912]; basement membrane [GO:0005604]; cell cortex [GO:0005938]; cleavage furrow [GO:0032154]; collagen-containing extracellular matrix [GO:0062023]; cytoplasm [GO:0005737]; extracellular exosome [GO:0070062]; muscle tendon junction [GO:0005927],calcium ion binding [GO:0005509]; extracellular matrix structural constituent [GO:0005201],GO:0005198; GO:0007010; GO:0007155; GO:0030198; GO:0030312; GO:0031012; GO:0043226; GO:0050877,structural molecule activity; cytoskeleton organization; cell adhesion; extracellular matrix organization; external encapsulating structure; extracellular matrix; organelle; nervous system process
OG_06754,3.466543228340051,FUN_031565-T1,Peve_00021513,Pocillopora_meandrina_HIv1___RNAseq.g5072.t1,three_way,87.24600000000001,FUN_031565-T1,Q01728,,,,,54.5,932.0,1.8e-266,920.2,sp|Q01728|NAC1_RAT Sodium/calcium exchanger 1 OS=Rattus norvegicus OX=10116 GN=Slc8a1 PE=1 SV=3,,,,,,
OG_05572,3.4653568313167478,FUN_024815-T1,Peve_00026076,Pocillopora_meandrina_HIv1___RNAseq.g18772.t1,three_way,69.34433333333334,FUN_024815-T1,Q96PE2,ARHGH_HUMAN,,Rho guanine nucleotide exchange factor 17 (164 kDa Rho-specific guanine-nucleotide exchange factor) (p164-RhoGEF) (p164RhoGEF) (Tumor endothelial marker 4),Homo sapiens (Human),40.1,1066.0,9.2e-179,630.2,sp|Q96PE2|ARHGH_HUMAN Rho guanine nucleotide exchange factor 17 OS=Homo sapiens OX=9606 GN=ARHGEF17 PE=1 SV=1,GO:0005085; GO:0005737; GO:0005829; GO:0030036; GO:0051056,actin cytoskeleton organization [GO:0030036]; regulation of small GTPase mediated signal transduction [GO:0051056],cytoplasm [GO:0005737]; cytosol [GO:0005829],guanyl-nucleotide exchange factor activity [GO:0005085],GO:0005829; GO:0007010; GO:0098772,cytosol; cytoskeleton organization; molecular function regulator activity
OG_06203,3.464664348839638,FUN_028139-T1,Peve_00025714,Pocillopora_meandrina_HIv1___RNAseq.g16451.t1,three_way,81.30433333333333,FUN_028139-T1,A1L3P4,SL9A6_MOUSE,,Sodium/hydrogen exchanger 6 (Na(+)/H(+) exchanger 6) (NHE-6) (Sodium/hydrogen exchanger) (Solute carrier family 9 member 6),Mus musculus (Mouse),55.7,587.0,3.3e-153,543.5,sp|A1L3P4|SL9A6_MOUSE Sodium/hydrogen exchanger 6 OS=Mus musculus OX=10090 GN=Slc9a6 PE=1 SV=1,GO:0005739; GO:0005768; GO:0005769; GO:0005770; GO:0005886; GO:0015385; GO:0015386; GO:0030010; GO:0030425; GO:0031410; GO:0031547; GO:0031901; GO:0031902; GO:0043679; GO:0044308; GO:0045202; GO:0048675; GO:0048812; GO:0050808; GO:0051386; GO:0051453; GO:0055037; GO:0055038; GO:0060996; GO:0097484; GO:0098685; GO:0098978; GO:0099072; GO:1902600,axon extension [GO:0048675]; brain-derived neurotrophic factor receptor signaling pathway [GO:0031547]; dendrite extension [GO:0097484]; dendritic spine development [GO:0060996]; establishment of cell polarity [GO:0030010]; neuron projection morphogenesis [GO:0048812]; proton transmembrane transport [GO:1902600]; regulation of intracellular pH [GO:0051453]; regulation of neurotrophin TRK receptor signaling pathway [GO:0051386]; regulation of postsynaptic membrane neurotransmitter receptor levels [GO:0099072]; synapse organization [GO:0050808],axon terminus [GO:0043679]; axonal spine [GO:0044308]; cytoplasmic vesicle [GO:0031410]; dendrite [GO:0030425]; early endosome [GO:0005769]; early endosome membrane [GO:0031901]; endosome [GO:0005768]; glutamatergic synapse [GO:0098978]; late endosome [GO:0005770]; late endosome membrane [GO:0031902]; mitochondrion [GO:0005739]; plasma membrane [GO:0005886]; recycling endosome [GO:0055037]; recycling endosome membrane [GO:0055038]; Schaffer collateral - CA1 synapse [GO:0098685]; synapse [GO:0045202],potassium:proton antiporter activity [GO:0015386]; sodium:proton antiporter activity [GO:0015385],GO:0005215; GO:0005739; GO:0005768; GO:0005886; GO:0007163; GO:0031410; GO:0034330; GO:0043226; GO:0048856; GO:0055085,transporter activity; mitochondrion; endosome; plasma membrane; establishment or maintenance of cell polarity; cytoplasmic vesicle; cell junction organization; organelle; anatomical structure development; transmembrane transport
OG_00361,3.459422328916048,FUN_001195-T1,Peve_00006935,Pocillopora_meandrina_HIv1___RNAseq.g29525.t1,three_way,41.97683333333333,,,,,,,,,,,,,,,,,
OG_04439,3.458206799902105,FUN_018835-T2,Peve_00035787,Pocillopora_meandrina_HIv1___RNAseq.g9856.t1,three_way,77.22033333333333,FUN_018835-T2,Q9C0G6,DYH6_HUMAN,,Dynein axonemal heavy chain 6 (Axonemal beta dynein heavy chain 6) (Ciliary dynein heavy chain 6),Homo sapiens (Human),37.1,4337.0,0.0,2654.0,sp|Q9C0G6|DYH6_HUMAN Dynein axonemal heavy chain 6 OS=Homo sapiens OX=9606 GN=DNAH6 PE=1 SV=3,GO:0005524; GO:0005874; GO:0005930; GO:0008569; GO:0016887; GO:0030286; GO:0045505; GO:0051959; GO:0060294; GO:0097729,cilium movement involved in cell motility [GO:0060294],9+2 motile cilium [GO:0097729]; axoneme [GO:0005930]; dynein complex [GO:0030286]; microtubule [GO:0005874],ATP binding [GO:0005524]; ATP hydrolysis activity [GO:0016887]; dynein intermediate chain binding [GO:0045505]; dynein light intermediate chain binding [GO:0051959]; minus-end-directed microtubule motor activity [GO:0008569],GO:0003774; GO:0003824; GO:0005929; GO:0007018; GO:0016787; GO:0016853; GO:0043226; GO:0140657,cytoskeletal motor activity; catalytic activity; cilium; microtubule-based movement; hydrolase activity; isomerase activity; organelle; ATP-dependent activity
OG_08704,3.455843660113924,FUN_037953-T1,Peve_00040733,Pocillopora_meandrina_HIv1___RNAseq.g26512.t1,three_way,50.168,FUN_037953-T1,Q91905,,,,,68.3,60.0,4.7e-18,92.8,sp|Q91905|FXI1B_XENLA Forkhead box protein I1-B OS=Xenopus laevis OX=8355 GN=foxi1-b PE=2 SV=1,,,,,,
OG_05256,3.4456291768310083,FUN_023759-T1,Peve_00044461,Pocillopora_meandrina_HIv1___RNAseq.g3497.t1,three_way,51.79566666666666,FUN_023759-T1,E7FBY6,AGRA2_DANRE,,Adhesion G protein-coupled receptor A2 (G-protein coupled receptor 124),Danio rerio (Zebrafish) (Brachydanio rerio),26.0,889.0,4.7e-66,255.4,sp|E7FBY6|AGRA2_DANRE Adhesion G protein-coupled receptor A2 OS=Danio rerio OX=7955 GN=adgra2 PE=1 SV=2,GO:0001525; GO:0004930; GO:0005886; GO:0007399; GO:0060070; GO:1990909,angiogenesis [GO:0001525]; canonical Wnt signaling pathway [GO:0060070]; nervous system development [GO:0007399],plasma membrane [GO:0005886]; Wnt signalosome [GO:1990909],G protein-coupled receptor activity [GO:0004930],GO:0005886; GO:0048856; GO:0060089,plasma membrane; anatomical structure development; molecular transducer activity
OG_05731,3.438792616794216,FUN_025657-T1,Peve_00042176,Pocillopora_meandrina_HIv1___RNAseq.g23075.t1,three_way,71.07683333333333,FUN_025657-T1,P17863,,,,,33.1,341.0,1.1e-45,186.4,sp|P17863|SKI_AVIES Transforming protein Ski OS=Avian erythroblastosis virus (strain Sloan-Kettering) OX=11862 GN=V-SKI PE=1 SV=1,,,,,,
OG_09806,3.433947580978222,FUN_042624-T1,Peve_00016197,Pocillopora_meandrina_HIv1___RNAseq.g11511.t1,three_way,48.837833333333336,FUN_042624-T1,E9Q414,APOB_MOUSE,,Apolipoprotein B-100 (Apo B-100) [Cleaved into: Apolipoprotein B-48 (Apo B-48)],Mus musculus (Mouse),24.7,1102.0,3e-65,254.6,sp|E9Q414|APOB_MOUSE Apolipoprotein B-100 OS=Mus musculus OX=10090 GN=Apob PE=1 SV=1,GO:0001701; GO:0005543; GO:0005576; GO:0005783; GO:0005811; GO:0005829; GO:0006629; GO:0006642; GO:0007283; GO:0007399; GO:0008201; GO:0008203; GO:0009566; GO:0009615; GO:0009791; GO:0010628; GO:0010744; GO:0010886; GO:0016042; GO:0019433; GO:0030301; GO:0030317; GO:0033344; GO:0034359; GO:0034361; GO:0034362; GO:0034363; GO:0034374; GO:0034383; GO:0035473; GO:0042157; GO:0042158; GO:0042159; GO:0042632; GO:0042953; GO:0043025; GO:0045540; GO:0048018; GO:0048844; GO:0050750; GO:0051649; GO:0070971; GO:0071402; GO:0120020,artery morphogenesis [GO:0048844]; cellular response to lipoprotein particle stimulus [GO:0071402]; cholesterol efflux [GO:0033344]; cholesterol homeostasis [GO:0042632]; cholesterol metabolic process [GO:0008203]; cholesterol transport [GO:0030301]; establishment of localization in cell [GO:0051649]; fertilization [GO:0009566]; flagellated sperm motility [GO:0030317]; in utero embryonic development [GO:0001701]; lipid catabolic process [GO:0016042]; lipid metabolic process [GO:0006629]; lipoprotein biosynthetic process [GO:0042158]; lipoprotein catabolic process [GO:0042159]; lipoprotein metabolic process [GO:0042157]; lipoprotein transport [GO:0042953]; low-density lipoprotein particle clearance [GO:0034383]; low-density lipoprotein particle remodeling [GO:0034374]; nervous system development [GO:0007399]; positive regulation of cholesterol storage [GO:0010886]; positive regulation of gene expression [GO:0010628]; positive regulation of macrophage derived foam cell differentiation [GO:0010744]; post-embryonic development [GO:0009791]; regulation of cholesterol biosynthetic process [GO:0045540]; response to virus [GO:0009615]; spermatogenesis [GO:0007283]; triglyceride catabolic process [GO:0019433]; triglyceride mobilization [GO:0006642],cytosol [GO:0005829]; endoplasmic reticulum [GO:0005783]; endoplasmic reticulum exit site [GO:0070971]; extracellular region [GO:0005576]; intermediate-density lipoprotein particle [GO:0034363]; lipid droplet [GO:0005811]; low-density lipoprotein particle [GO:0034362]; mature chylomicron [GO:0034359]; neuronal cell body [GO:0043025]; very-low-density lipoprotein particle [GO:0034361],cholesterol transfer activity [GO:0120020]; heparin binding [GO:0008201]; lipase binding [GO:0035473]; low-density lipoprotein particle receptor binding [GO:0050750]; phospholipid binding [GO:0005543]; receptor ligand activity [GO:0048018],GO:0005215; GO:0005576; GO:0005783; GO:0005811; GO:0005829; GO:0006629; GO:0007018; GO:0008289; GO:0022414; GO:0030163; GO:0043226; GO:0048018; GO:0048856; GO:0048870; GO:0098772,transporter activity; extracellular region; endoplasmic reticulum; lipid droplet; cytosol; lipid metabolic process; microtubule-based movement; lipid binding; reproductive process; protein catabolic process; organelle; receptor ligand activity; anatomical structure development; cell motility; molecular function regulator activity
OG_00596,3.431047764076026,FUN_001733-T1,Peve_00007896,Pocillopora_meandrina_HIv1___RNAseq.g2642.t1,three_way,61.95166666666667,FUN_001733-T1,P27544,CERS1_HUMAN,,Ceramide synthase 1 (CerS1) (LAG1 longevity assurance homolog 1) (Longevity assurance gene 1 protein homolog 1) (Protein UOG-1) (Sphingoid base N-stearoyltransferase CERS1) (EC 2.3.1.299),Homo sapiens (Human),43.5,269.0,6.9e-55,216.1,sp|P27544|CERS1_HUMAN Ceramide synthase 1 OS=Homo sapiens OX=9606 GN=CERS1 PE=1 SV=1,GO:0005783; GO:0005789; GO:0007420; GO:0010614; GO:0016020; GO:0030148; GO:0036146; GO:0043231; GO:0046325; GO:0046513; GO:0050291; GO:0071466; GO:0071492; GO:0072721; GO:1901526,brain development [GO:0007420]; cellular response to dithiothreitol [GO:0072721]; cellular response to mycotoxin [GO:0036146]; cellular response to UV-A [GO:0071492]; cellular response to xenobiotic stimulus [GO:0071466]; ceramide biosynthetic process [GO:0046513]; negative regulation of cardiac muscle hypertrophy [GO:0010614]; negative regulation of D-glucose import [GO:0046325]; positive regulation of mitophagy [GO:1901526]; sphingolipid biosynthetic process [GO:0030148],endoplasmic reticulum [GO:0005783]; endoplasmic reticulum membrane [GO:0005789]; intracellular membrane-bounded organelle [GO:0043231]; membrane [GO:0016020],sphingosine N-acyltransferase activity [GO:0050291],GO:0003824; GO:0005783; GO:0006629; GO:0016740; GO:0043226; GO:0048856,catalytic activity; endoplasmic reticulum; lipid metabolic process; transferase activity; organelle; anatomical structure development
OG_00772,3.4267498826524423,FUN_003840-T1,Peve_00003890,Pocillopora_meandrina_HIv1___RNAseq.g11708.t1,three_way,63.461333333333336,FUN_003840-T1,A7MBJ4,PTPRF_BOVIN,,Receptor-type tyrosine-protein phosphatase F (EC 3.1.3.48),Bos taurus (Bovine),31.0,1540.0,1.8000000000000001e-162,575.5,sp|A7MBJ4|PTPRF_BOVIN Receptor-type tyrosine-protein phosphatase F OS=Bos taurus OX=9913 GN=PTPRF PE=2 SV=1,GO:0004725; GO:0007165; GO:0008201; GO:0016020; GO:0016477; GO:0035335; GO:0099560; GO:1900121,cell migration [GO:0016477]; negative regulation of receptor binding [GO:1900121]; peptidyl-tyrosine dephosphorylation [GO:0035335]; signal transduction [GO:0007165]; synaptic membrane adhesion [GO:0099560],membrane [GO:0016020],heparin binding [GO:0008201]; protein tyrosine phosphatase activity [GO:0004725],GO:0003824; GO:0007155; GO:0016787; GO:0048870; GO:0140096,"catalytic activity; cell adhesion; hydrolase activity; cell motility; catalytic activity, acting on a protein"
OG_02220,3.4249281435263064,FUN_008615-T1,Peve_00015389,Pocillopora_meandrina_HIv1___RNAseq.g12744.t1,three_way,73.05916666666667,FUN_008615-T1,O35161,CELR1_MOUSE,,Cadherin EGF LAG seven-pass G-type receptor 1,Mus musculus (Mouse),33.5,2618.0,0.0,1375.5,sp|O35161|CELR1_MOUSE Cadherin EGF LAG seven-pass G-type receptor 1 OS=Mus musculus OX=10090 GN=Celsr1 PE=1 SV=3,GO:0001736; GO:0001843; GO:0001942; GO:0004930; GO:0005509; GO:0005654; GO:0005886; GO:0007156; GO:0007166; GO:0007266; GO:0007626; GO:0009952; GO:0016020; GO:0032956; GO:0042060; GO:0042249; GO:0042472; GO:0045176; GO:0048105; GO:0060488; GO:0060489; GO:0060490; GO:0090251; GO:0097475,anterior/posterior pattern specification [GO:0009952]; apical protein localization [GO:0045176]; cell surface receptor signaling pathway [GO:0007166]; establishment of body hair planar orientation [GO:0048105]; establishment of planar polarity [GO:0001736]; establishment of planar polarity of embryonic epithelium [GO:0042249]; hair follicle development [GO:0001942]; homophilic cell adhesion via plasma membrane adhesion molecules [GO:0007156]; inner ear morphogenesis [GO:0042472]; lateral sprouting involved in lung morphogenesis [GO:0060490]; locomotory behavior [GO:0007626]; motor neuron migration [GO:0097475]; neural tube closure [GO:0001843]; orthogonal dichotomous subdivision of terminal units involved in lung branching morphogenesis [GO:0060488]; planar dichotomous subdivision of terminal units involved in lung branching morphogenesis [GO:0060489]; protein localization involved in establishment of planar polarity [GO:0090251]; regulation of actin cytoskeleton organization [GO:0032956]; Rho protein signal transduction [GO:0007266]; wound healing [GO:0042060],membrane [GO:0016020]; nucleoplasm [GO:0005654]; plasma membrane [GO:0005886],calcium ion binding [GO:0005509]; G protein-coupled receptor activity [GO:0004930],GO:0005654; GO:0005886; GO:0007155; GO:0042060; GO:0048856; GO:0048870; GO:0060089,nucleoplasm; plasma membrane; cell adhesion; wound healing; anatomical structure development; cell motility; molecular transducer activity
OG_02949,3.424815026893408,FUN_012067-T1,Peve_00004104,Pocillopora_meandrina_HIv1___RNAseq.g23636.t1,three_way,67.023,FUN_012067-T1,Q7Z020,,,,,28.6,553.0,9.3e-45,184.1,sp|Q7Z020|TRPA1_DROME Transient receptor potential cation channel subfamily A member 1 OS=Drosophila melanogaster OX=7227 GN=TrpA1 PE=1 SV=4,,,,,,
OG_00020,3.4195892843255966,FUN_000216-T1,Peve_00018873,Pocillopora_meandrina_HIv1___RNAseq.g28926.t1,three_way,52.28366666666667,,,,,,,,,,,,,,,,,
OG_02043,3.417606783121154,FUN_008248-T1,Peve_00031792,Pocillopora_meandrina_HIv1___RNAseq.g17952.t2,three_way,55.662,FUN_008248-T1,P83618,,,,,25.9,185.0,9.7e-14,78.6,sp|P83618|RN28_PANGI Ribonuclease-like storage protein OS=Panax ginseng OX=4054 PE=1 SV=2,,,,,,
