group_id,Component_7,apul,peve,ptua,type,avg_identity,query,accession,id,reviewed,protein_name,organism,pident,length,evalue,bitscore,title,go_ids,go_bp,go_cc,go_mf,goslim_ids,goslim_names
OG_02338,1.966716877460396,FUN_008934-T1,Peve_00036402,Pocillopora_meandrina_HIv1___RNAseq.g14257.t1,three_way,76.08966666666667,FUN_008934-T1,A5D7I4,EXT1_BOVIN,,Exostosin-1 (EC 2.4.1.225) (N-acetylglucosaminyl-proteoglycan 4-beta-glucuronosyltransferase),Bos taurus (Bovine),50.3,749.0,7.999999999999999e-217,755.0,sp|A5D7I4|EXT1_BOVIN Exostosin-1 OS=Bos taurus OX=9913 GN=EXT1 PE=2 SV=1,GO:0000139; GO:0000271; GO:0001958; GO:0001974; GO:0002067; GO:0002524; GO:0003128; GO:0003415; GO:0003416; GO:0005783; GO:0005789; GO:0005794; GO:0006024; GO:0006486; GO:0007033; GO:0007369; GO:0007411; GO:0007492; GO:0007498; GO:0008217; GO:0008375; GO:0008543; GO:0009642; GO:0010467; GO:0010803; GO:0014033; GO:0015012; GO:0015020; GO:0017145; GO:0019882; GO:0021554; GO:0021772; GO:0030163; GO:0030199; GO:0030210; GO:0030509; GO:0031069; GO:0032836; GO:0033627; GO:0035176; GO:0035249; GO:0035264; GO:0035988; GO:0036022; GO:0036336; GO:0036339; GO:0042044; GO:0042060; GO:0042311; GO:0042596; GO:0042803; GO:0043931; GO:0045165; GO:0045202; GO:0045453; GO:0046872; GO:0046982; GO:0048733; GO:0050508; GO:0050509; GO:0050891; GO:0050901; GO:0051923; GO:0055078; GO:0060047; GO:0060070; GO:0060218; GO:0060351; GO:0060441; GO:0060506; GO:0060560; GO:0060792; GO:0061484; GO:0061744; GO:0061974; GO:0062094; GO:0065003; GO:0070593; GO:0071503; GO:0071625; GO:0071711; GO:0072112; GO:0072498; GO:0097021; GO:0097241; GO:0098586; GO:0120193; GO:1901706; GO:1902494; GO:1904888; GO:1990823,"antigen processing and presentation [GO:0019882]; axon guidance [GO:0007411]; basement membrane organization [GO:0071711]; blood vessel remodeling [GO:0001974]; BMP signaling pathway [GO:0030509]; bone resorption [GO:0045453]; canonical Wnt signaling pathway [GO:0060070]; cartilage development involved in endochondral bone morphogenesis [GO:0060351]; cell adhesion mediated by integrin [GO:0033627]; cell fate commitment [GO:0045165]; cellular response to virus [GO:0098586]; chondrocyte hypertrophy [GO:0003415]; chondrocyte proliferation [GO:0035988]; collagen fibril organization [GO:0030199]; cranial skeletal system development [GO:1904888]; dendrite self-avoidance [GO:0070593]; dendritic cell migration [GO:0036336]; developmental growth involved in morphogenesis [GO:0060560]; embryonic skeletal joint development [GO:0072498]; endochondral bone growth [GO:0003416]; endochondral ossification [GO:0001958]; endoderm development [GO:0007492]; epithelial tube branching involved in lung morphogenesis [GO:0060441]; fear response [GO:0042596]; fibroblast growth factor receptor signaling pathway [GO:0008543]; fluid transport [GO:0042044]; gastrulation [GO:0007369]; gene expression [GO:0010467]; glandular epithelial cell differentiation [GO:0002067]; glomerular basement membrane development [GO:0032836]; glycosaminoglycan biosynthetic process [GO:0006024]; hair follicle morphogenesis [GO:0031069]; heart contraction [GO:0060047]; heart field specification [GO:0003128]; hematopoietic stem cell differentiation [GO:0060218]; hematopoietic stem cell homeostasis [GO:0061484]; hematopoietic stem cell migration to bone marrow [GO:0097241]; heparan sulfate proteoglycan biosynthetic process [GO:0015012]; heparin proteoglycan biosynthetic process [GO:0030210]; hypersensitivity [GO:0002524]; leukocyte tethering or rolling [GO:0050901]; limb joint morphogenesis [GO:0036022]; lymphocyte adhesion to endothelial cell of high endothelial venule [GO:0036339]; lymphocyte migration into lymphoid organs [GO:0097021]; mesenchymal cell differentiation involved in bone development [GO:1901706]; mesoderm development [GO:0007498]; motor behavior [GO:0061744]; multicellular organism growth [GO:0035264]; multicellular organismal-level water homeostasis [GO:0050891]; neural crest cell differentiation [GO:0014033]; olfactory bulb development [GO:0021772]; optic nerve development [GO:0021554]; ossification involved in bone maturation [GO:0043931]; perichondral bone morphogenesis [GO:0061974]; podocyte differentiation [GO:0072112]; polysaccharide biosynthetic process [GO:0000271]; protein catabolic process [GO:0030163]; protein glycosylation [GO:0006486]; protein-containing complex assembly [GO:0065003]; regulation of blood pressure [GO:0008217]; regulation of tumor necrosis factor-mediated signaling pathway [GO:0010803]; response to heparin [GO:0071503]; response to leukemia inhibitory factor [GO:1990823]; response to light intensity [GO:0009642]; sebaceous gland development [GO:0048733]; smoothened signaling pathway involved in lung development [GO:0060506]; social behavior [GO:0035176]; sodium ion homeostasis [GO:0055078]; stem cell division [GO:0017145]; stomach development [GO:0062094]; sulfation [GO:0051923]; sweat gland development [GO:0060792]; synaptic transmission, glutamatergic [GO:0035249]; tight junction organization [GO:0120193]; vacuole organization [GO:0007033]; vasodilation [GO:0042311]; vocalization behavior [GO:0071625]; wound healing [GO:0042060]",catalytic complex [GO:1902494]; endoplasmic reticulum [GO:0005783]; endoplasmic reticulum membrane [GO:0005789]; Golgi apparatus [GO:0005794]; Golgi membrane [GO:0000139]; synapse [GO:0045202],acetylglucosaminyltransferase activity [GO:0008375]; glucuronosyl-N-acetylglucosaminyl-proteoglycan 4-alpha-N-acetylglucosaminyltransferase activity [GO:0050508]; glucuronosyltransferase activity [GO:0015020]; metal ion binding [GO:0046872]; N-acetylglucosaminyl-proteoglycan 4-beta-glucuronosyltransferase activity [GO:0050509]; protein heterodimerization activity [GO:0046982]; protein homodimerization activity [GO:0042803],GO:0002376; GO:0003013; GO:0003824; GO:0005783; GO:0005794; GO:0005975; GO:0006486; GO:0006790; GO:0006954; GO:0007155; GO:0009101; GO:0016740; GO:0023052; GO:0030154; GO:0030163; GO:0030198; GO:0034330; GO:0042060; GO:0043226; GO:0048856; GO:0048870; GO:0065003; GO:1901135,immune system process; circulatory system process; catalytic activity; endoplasmic reticulum; Golgi apparatus; carbohydrate metabolic process; protein glycosylation; sulfur compound metabolic process; inflammatory response; cell adhesion; glycoprotein biosynthetic process; transferase activity; signaling; cell differentiation; protein catabolic process; extracellular matrix organization; cell junction organization; wound healing; organelle; anatomical structure development; cell motility; protein-containing complex assembly; carbohydrate derivative metabolic process
OG_01897,1.954625368961878,FUN_007904-T1,Peve_00040656,Pocillopora_meandrina_HIv1___RNAseq.g30059.t1,three_way,60.9685,FUN_007904-T1,P06582,,,,,37.0,100.0,1.1e-11,72.0,sp|P06582|HSP12_CAEEL Heat shock protein hsp-16.2 OS=Caenorhabditis elegans OX=6239 GN=hsp-16.2 PE=2 SV=1,,,,,,
OG_03269,1.953637750269145,FUN_013138-T1,Peve_00042391,Pocillopora_meandrina_HIv1___TS.g15900.t1,three_way,81.306,FUN_013138-T1,Q7RTY7,OVCH1_HUMAN,,Ovochymase-1 (EC 3.4.21.-),Homo sapiens (Human),39.4,251.0,5.999999999999999e-44,179.5,sp|Q7RTY7|OVCH1_HUMAN Ovochymase-1 OS=Homo sapiens OX=9606 GN=OVCH1 PE=1 SV=3,GO:0004252; GO:0005576; GO:0006508; GO:0046872,proteolysis [GO:0006508],extracellular region [GO:0005576],metal ion binding [GO:0046872]; serine-type endopeptidase activity [GO:0004252],GO:0003824; GO:0005576; GO:0016787; GO:0140096,"catalytic activity; extracellular region; hydrolase activity; catalytic activity, acting on a protein"
OG_00938,1.9487826342209296,FUN_004288-T1,Peve_00029197,Pocillopora_meandrina_HIv1___RNAseq.g11767.t1,three_way,35.059,,,,,,,,,,,,,,,,,
OG_05183,1.922114273100043,FUN_023529-T1,Peve_00044316,Pocillopora_meandrina_HIv1___TS.g7657.t1,three_way,73.594,,,,,,,,,,,,,,,,,
OG_02537,1.9020257755105383,FUN_010620-T1,Peve_00031460,Pocillopora_meandrina_HIv1___TS.g26115.t1,three_way,50.77283333333333,FUN_010620-T1,O14514,AGRB1_HUMAN,,Adhesion G protein-coupled receptor B1 (Brain-specific angiogenesis inhibitor 1) [Cleaved into: Vasculostatin-40 (Vstat40); Vasculostatin-120 (Vstat120)],Homo sapiens (Human),29.6,659.0,1.9999999999999999e-63,246.9,sp|O14514|AGRB1_HUMAN Adhesion G protein-coupled receptor B1 OS=Homo sapiens OX=9606 GN=ADGRB1 PE=1 SV=2,GO:0001530; GO:0001786; GO:0001891; GO:0004930; GO:0005615; GO:0005886; GO:0005911; GO:0005925; GO:0006910; GO:0007155; GO:0007165; GO:0007166; GO:0007186; GO:0007189; GO:0007409; GO:0007422; GO:0007517; GO:0008285; GO:0010596; GO:0014069; GO:0016020; GO:0016525; GO:0030165; GO:0030425; GO:0031397; GO:0042177; GO:0043197; GO:0043277; GO:0043652; GO:0045087; GO:0048167; GO:0048471; GO:0050829; GO:0051965; GO:1901741; GO:1903428,"adenylate cyclase-activating G protein-coupled receptor signaling pathway [GO:0007189]; apoptotic cell clearance [GO:0043277]; axonogenesis [GO:0007409]; cell adhesion [GO:0007155]; cell surface receptor signaling pathway [GO:0007166]; defense response to Gram-negative bacterium [GO:0050829]; engulfment of apoptotic cell [GO:0043652]; G protein-coupled receptor signaling pathway [GO:0007186]; innate immune response [GO:0045087]; muscle organ development [GO:0007517]; negative regulation of angiogenesis [GO:0016525]; negative regulation of cell population proliferation [GO:0008285]; negative regulation of endothelial cell migration [GO:0010596]; negative regulation of protein catabolic process [GO:0042177]; negative regulation of protein ubiquitination [GO:0031397]; peripheral nervous system development [GO:0007422]; phagocytosis, recognition [GO:0006910]; positive regulation of myoblast fusion [GO:1901741]; positive regulation of reactive oxygen species biosynthetic process [GO:1903428]; positive regulation of synapse assembly [GO:0051965]; regulation of synaptic plasticity [GO:0048167]; signal transduction [GO:0007165]",cell-cell junction [GO:0005911]; dendrite [GO:0030425]; dendritic spine [GO:0043197]; extracellular space [GO:0005615]; focal adhesion [GO:0005925]; membrane [GO:0016020]; perinuclear region of cytoplasm [GO:0048471]; phagocytic cup [GO:0001891]; plasma membrane [GO:0005886]; postsynaptic density [GO:0014069],G protein-coupled receptor activity [GO:0004930]; lipopolysaccharide binding [GO:0001530]; PDZ domain binding [GO:0030165]; phosphatidylserine binding [GO:0001786],GO:0002376; GO:0005615; GO:0005886; GO:0007155; GO:0008289; GO:0016192; GO:0043226; GO:0048856; GO:0060089; GO:0061024; GO:0098542,immune system process; extracellular space; plasma membrane; cell adhesion; lipid binding; vesicle-mediated transport; organelle; anatomical structure development; molecular transducer activity; membrane organization; defense response to other organism
OG_02929,1.898544555599999,FUN_012028-T1,Peve_00030379,Pocillopora_meandrina_HIv1___RNAseq.g24047.t2,three_way,77.09433333333334,FUN_012028-T1,Q14192,FHL2_HUMAN,,Four and a half LIM domains protein 2 (FHL-2) (LIM domain protein DRAL) (Skeletal muscle LIM-protein 3) (SLIM-3),Homo sapiens (Human),42.1,273.0,1.7000000000000002e-74,282.0,sp|Q14192|FHL2_HUMAN Four and a half LIM domains protein 2 OS=Homo sapiens OX=9606 GN=FHL2 PE=1 SV=3,GO:0000122; GO:0001649; GO:0003714; GO:0005634; GO:0005654; GO:0005925; GO:0008134; GO:0008270; GO:0009725; GO:0030018; GO:0042802; GO:0043066; GO:0043425; GO:0055014; GO:0055015; GO:0060347; GO:0070885,atrial cardiac muscle cell development [GO:0055014]; heart trabecula formation [GO:0060347]; negative regulation of apoptotic process [GO:0043066]; negative regulation of calcineurin-NFAT signaling cascade [GO:0070885]; negative regulation of transcription by RNA polymerase II [GO:0000122]; osteoblast differentiation [GO:0001649]; response to hormone [GO:0009725]; ventricular cardiac muscle cell development [GO:0055015],focal adhesion [GO:0005925]; nucleoplasm [GO:0005654]; nucleus [GO:0005634]; Z disc [GO:0030018],bHLH transcription factor binding [GO:0043425]; identical protein binding [GO:0042802]; transcription corepressor activity [GO:0003714]; transcription factor binding [GO:0008134]; zinc ion binding [GO:0008270],GO:0005634; GO:0005654; GO:0006355; GO:0030154; GO:0043226; GO:0048856; GO:0060090; GO:0140110,nucleus; nucleoplasm; regulation of DNA-templated transcription; cell differentiation; organelle; anatomical structure development; molecular adaptor activity; transcription regulator activity
OG_03743,1.8773211202166964,FUN_015050-T1,Peve_00001172,Pocillopora_meandrina_HIv1___RNAseq.g21265.t1,three_way,70.01583333333333,FUN_015050-T1,Q8CHW5,,,,,38.3,120.0,7.4e-10,67.4,sp|Q8CHW5|BICL2_MOUSE BICD family-like cargo adapter 2 OS=Mus musculus OX=10090 GN=Bicdl2 PE=1 SV=1,,,,,,
OG_01636,1.8768963759430888,FUN_006769-T1,Peve_00027411,Pocillopora_meandrina_HIv1___RNAseq.g20028.t1,three_way,57.7305,FUN_006769-T1,Q9Y2U8,MAN1_HUMAN,,Inner nuclear membrane protein Man1 (LEM domain-containing protein 3),Homo sapiens (Human),42.9,317.0,7.4e-55,216.9,sp|Q9Y2U8|MAN1_HUMAN Inner nuclear membrane protein Man1 OS=Homo sapiens OX=9606 GN=LEMD3 PE=1 SV=2,GO:0003677; GO:0005637; GO:0016020; GO:0030512; GO:0030514; GO:0031965; GO:0032926; GO:1990446,negative regulation of activin receptor signaling pathway [GO:0032926]; negative regulation of BMP signaling pathway [GO:0030514]; negative regulation of transforming growth factor beta receptor signaling pathway [GO:0030512],membrane [GO:0016020]; nuclear inner membrane [GO:0005637]; nuclear membrane [GO:0031965],DNA binding [GO:0003677]; U1 snRNP binding [GO:1990446],GO:0003677,DNA binding
OG_05809,1.842382383180195,FUN_025809-T2,Peve_00017944,Pocillopora_meandrina_HIv1___TS.g19642.t2,three_way,56.2395,FUN_025809-T2,Q08EN7,,,,,29.7,286.0,1.6e-26,122.5,sp|Q08EN7|ZCPW2_MOUSE Zinc finger CW-type PWWP domain protein 2 homolog OS=Mus musculus OX=10090 GN=Zcwpw2 PE=2 SV=2,,,,,,
OG_02341,1.822607164045998,FUN_008940-T1,Peve_00007194,Pocillopora_meandrina_HIv1___TS.g30103.t1,three_way,71.29533333333333,FUN_008940-T1,P31422,GRM3_RAT,,Metabotropic glutamate receptor 3 (mGluR3),Rattus norvegicus (Rat),41.0,808.0,1.2999999999999998e-173,611.7,sp|P31422|GRM3_RAT Metabotropic glutamate receptor 3 OS=Rattus norvegicus OX=10116 GN=Grm3 PE=1 SV=1,GO:0001641; GO:0005246; GO:0005886; GO:0007216; GO:0010467; GO:0014069; GO:0019233; GO:0030424; GO:0033554; GO:0042734; GO:0043005; GO:0043197; GO:0045211; GO:0050804; GO:0051966; GO:0097110; GO:0097449; GO:0098978; GO:0099170,"cellular response to stress [GO:0033554]; G protein-coupled glutamate receptor signaling pathway [GO:0007216]; gene expression [GO:0010467]; modulation of chemical synaptic transmission [GO:0050804]; postsynaptic modulation of chemical synaptic transmission [GO:0099170]; regulation of synaptic transmission, glutamatergic [GO:0051966]; sensory perception of pain [GO:0019233]",astrocyte projection [GO:0097449]; axon [GO:0030424]; dendritic spine [GO:0043197]; glutamatergic synapse [GO:0098978]; neuron projection [GO:0043005]; plasma membrane [GO:0005886]; postsynaptic density [GO:0014069]; postsynaptic membrane [GO:0045211]; presynaptic membrane [GO:0042734],calcium channel regulator activity [GO:0005246]; group II metabotropic glutamate receptor activity [GO:0001641]; scaffold protein binding [GO:0097110],GO:0005886; GO:0043226; GO:0050877; GO:0060089; GO:0098772,plasma membrane; organelle; nervous system process; molecular transducer activity; molecular function regulator activity
OG_05902,1.8103291334182283,FUN_026081-T1,Peve_00004132,Pocillopora_meandrina_HIv1___RNAseq.g10570.t1,three_way,97.37833333333332,FUN_026081-T1,Q96KC2,,,,,79.0,176.0,5.6e-79,295.0,sp|Q96KC2|ARL5B_HUMAN ADP-ribosylation factor-like protein 5B OS=Homo sapiens OX=9606 GN=ARL5B PE=1 SV=1,,,,,,
OG_08959,1.792293681627974,FUN_038437-T2,Peve_00029447,Pocillopora_meandrina_HIv1___RNAseq.25797_t,three_way,40.388666666666666,,,,,,,,,,,,,,,,,
OG_02699,1.7722214206488345,FUN_010968-T1,Peve_00035956,Pocillopora_meandrina_HIv1___RNAseq.g21969.t2,three_way,64.66499999999999,FUN_010968-T1,Q98TZ8,,,,,34.2,161.0,1.2e-22,107.8,sp|Q98TZ8|FLOT2_DANRE Flotillin-2a OS=Danio rerio OX=7955 GN=flot2a PE=2 SV=2,,,,,,
OG_07344,1.7565431734319183,FUN_033751-T1,Peve_00004933,Pocillopora_meandrina_HIv1___TS.g8542.t1,three_way,79.90966666666667,FUN_033751-T1,O95461,,,,,60.2,689.0,6.4e-254,878.2,sp|O95461|LARG1_HUMAN Xylosyl- and glucuronyltransferase LARGE1 OS=Homo sapiens OX=9606 GN=LARGE1 PE=1 SV=1,,,,,,
OG_09693,1.7563265701275337,FUN_041922-T1,Peve_00007867,Pocillopora_meandrina_HIv1___RNAseq.g15626.t1,three_way,82.96933333333334,FUN_041922-T1,Q5I0R4,,,,,53.6,222.0,4.2e-63,242.7,sp|Q5I0R4|CF300_XENTR Cilia- and flagella-associated protein 300 OS=Xenopus tropicalis OX=8364 GN=cfap300 PE=2 SV=1,,,,,,
OG_07044,1.7469416745303494,FUN_032246-T1,Peve_00036312,Pocillopora_meandrina_HIv1___RNAseq.g24842.t1,three_way,59.7065,,,,,,,,,,,,,,,,,
OG_00916,1.7421504114909694,FUN_004253-T1,Peve_00001928,Pocillopora_meandrina_HIv1___RNAseq.g11418.t1,three_way,75.71549999999999,FUN_004253-T1,Q9MA55,,,,,30.2,364.0,6e-33,143.7,sp|Q9MA55|ACBP4_ARATH Acyl-CoA-binding domain-containing protein 4 OS=Arabidopsis thaliana OX=3702 GN=ACBP4 PE=1 SV=1,,,,,,
OG_00246,1.7405271177400063,FUN_001009-T1,Peve_00041033,Pocillopora_meandrina_HIv1___TS.g6384.t1,three_way,55.748666666666665,FUN_001009-T1,P97739,,,,,36.8,749.0,9.2e-134,479.2,sp|P97739|ECE1_CAVPO Endothelin-converting enzyme 1 OS=Cavia porcellus OX=10141 GN=ECE1 PE=2 SV=1,,,,,,
OG_07929,1.7368587433371496,FUN_035418-T1,Peve_00039851,Pocillopora_meandrina_HIv1___RNAseq.g27566.t1,three_way,69.55066666666667,FUN_035418-T1,B8AJ09,,,,,28.2,312.0,1.7e-16,88.6,"sp|B8AJ09|BASS4_ORYSI Probable sodium/metabolite cotransporter BASS4, chloroplastic OS=Oryza sativa subsp. indica OX=39946 GN=BASS4 PE=3 SV=1",,,,,,
OG_00622,1.7367408771997035,FUN_001793-T1,Peve_00008718,Pocillopora_meandrina_HIv1___RNAseq.g2635.t1a,three_way,54.11416666666666,FUN_001793-T1,Q60997,DMBT1_MOUSE,,Scavenger receptor cysteine-rich domain-containing protein DMBT1 (Apactin) (CRP-ductin) (Deleted in malignant brain tumors 1 protein) (Glycoprotein 300) (gp300) (Hensin) (Mucin-like glycoprotein) (Muclin) (Vomeroglandin) (p80),Mus musculus (Mouse),40.2,112.0,1.9e-13,79.3,sp|Q60997|DMBT1_MOUSE Scavenger receptor cysteine-rich domain-containing protein DMBT1 OS=Mus musculus OX=10090 GN=Dmbt1 PE=1 SV=2,GO:0001824; GO:0001833; GO:0002065; GO:0005576; GO:0009617; GO:0015031; GO:0030658; GO:0030858; GO:0031012; GO:0035375; GO:0042589; GO:0050829; GO:0050830; GO:0062023,blastocyst development [GO:0001824]; columnar/cuboidal epithelial cell differentiation [GO:0002065]; defense response to Gram-negative bacterium [GO:0050829]; defense response to Gram-positive bacterium [GO:0050830]; inner cell mass cell proliferation [GO:0001833]; positive regulation of epithelial cell differentiation [GO:0030858]; protein transport [GO:0015031]; response to bacterium [GO:0009617],collagen-containing extracellular matrix [GO:0062023]; extracellular matrix [GO:0031012]; extracellular region [GO:0005576]; transport vesicle membrane [GO:0030658]; zymogen granule membrane [GO:0042589],zymogen binding [GO:0035375],GO:0005576; GO:0030154; GO:0030312; GO:0031012; GO:0048856,extracellular region; cell differentiation; external encapsulating structure; extracellular matrix; anatomical structure development
OG_08337,1.7344926388305453,FUN_036850-T1,Peve_00036530,Pocillopora_meandrina_HIv1___RNAseq.g10652.t1,three_way,46.763666666666666,,,,,,,,,,,,,,,,,
OG_08952,1.7293808605608645,FUN_038426-T1,Peve_00000114,Pocillopora_meandrina_HIv1___RNAseq.g1178.t1,three_way,77.04633333333334,FUN_038426-T1,F1R8Z9,FXJ1B_DANRE,,Forkhead box protein J1-B,Danio rerio (Zebrafish) (Brachydanio rerio),45.4,282.0,2.2e-51,204.5,sp|F1R8Z9|FXJ1B_DANRE Forkhead box protein J1-B OS=Danio rerio OX=7955 GN=foxj1b PE=2 SV=1,GO:0000978; GO:0000981; GO:0001947; GO:0003146; GO:0005634; GO:0006357; GO:0007368; GO:0044458; GO:0060088; GO:0060271,auditory receptor cell stereocilium organization [GO:0060088]; cilium assembly [GO:0060271]; determination of left/right symmetry [GO:0007368]; heart jogging [GO:0003146]; heart looping [GO:0001947]; motile cilium assembly [GO:0044458]; regulation of transcription by RNA polymerase II [GO:0006357],nucleus [GO:0005634],"DNA-binding transcription factor activity, RNA polymerase II-specific [GO:0000981]; RNA polymerase II cis-regulatory region sequence-specific DNA binding [GO:0000978]",GO:0003677; GO:0005634; GO:0006355; GO:0043226; GO:0044782; GO:0140110,DNA binding; nucleus; regulation of DNA-templated transcription; organelle; cilium organization; transcription regulator activity
OG_08311,1.7268191520712568,FUN_036338-T1,Peve_00031393,Pocillopora_meandrina_HIv1___RNAseq.g12116.t1,three_way,98.718,FUN_036338-T1,Q6PBJ2,CFA20_DANRE,,Cilia- and flagella-associated protein 20,Danio rerio (Zebrafish) (Brachydanio rerio),98.1,156.0,3e-84,312.4,sp|Q6PBJ2|CFA20_DANRE Cilia- and flagella-associated protein 20 OS=Danio rerio OX=7955 GN=cfap20 PE=2 SV=1,GO:0001895; GO:0005634; GO:0005814; GO:0005879; GO:0005929; GO:0014807; GO:0018095; GO:0031514; GO:0036064; GO:0048570; GO:0060271; GO:0060296; GO:0061371; GO:0065001; GO:1901207; GO:2000147; GO:2000253,cilium assembly [GO:0060271]; determination of heart left/right asymmetry [GO:0061371]; notochord morphogenesis [GO:0048570]; positive regulation of cell motility [GO:2000147]; positive regulation of feeding behavior [GO:2000253]; protein polyglutamylation [GO:0018095]; regulation of cilium beat frequency involved in ciliary motility [GO:0060296]; regulation of heart looping [GO:1901207]; regulation of somitogenesis [GO:0014807]; retina homeostasis [GO:0001895]; specification of axis polarity [GO:0065001],axonemal microtubule [GO:0005879]; centriole [GO:0005814]; ciliary basal body [GO:0036064]; cilium [GO:0005929]; motile cilium [GO:0031514]; nucleus [GO:0005634],,GO:0005634; GO:0005815; GO:0005929; GO:0043226; GO:0044782,nucleus; microtubule organizing center; cilium; organelle; cilium organization
OG_04516,1.724437409260006,FUN_022049-T1,Peve_00032394,Pocillopora_meandrina_HIv1___RNAseq.g4599.t1,three_way,67.69266666666667,FUN_022049-T1,Q9C098,DCLK3_HUMAN,,Serine/threonine-protein kinase DCLK3 (EC 2.7.11.1) (Doublecortin domain-containing protein 3C) (Doublecortin-like and CAM kinase-like 3) (Doublecortin-like kinase 3),Homo sapiens (Human),59.1,269.0,2e-91,338.6,sp|Q9C098|DCLK3_HUMAN Serine/threonine-protein kinase DCLK3 OS=Homo sapiens OX=9606 GN=DCLK3 PE=1 SV=2,GO:0004674; GO:0005524; GO:0005634; GO:0005737; GO:0034504; GO:0106310,protein localization to nucleus [GO:0034504],cytoplasm [GO:0005737]; nucleus [GO:0005634],ATP binding [GO:0005524]; protein serine kinase activity [GO:0106310]; protein serine/threonine kinase activity [GO:0004674],GO:0003824; GO:0005634; GO:0016740; GO:0043226; GO:0140096,"catalytic activity; nucleus; transferase activity; organelle; catalytic activity, acting on a protein"
OG_08222,1.704087150844773,FUN_036093-T1,Peve_00032189,Pocillopora_meandrina_HIv1___RNAseq.g27441.t1,three_way,76.63133333333333,FUN_036093-T1,Q68DA7,FMN1_HUMAN,,Formin-1 (Limb deformity protein homolog),Homo sapiens (Human),33.3,471.0,1.5e-63,246.1,sp|Q68DA7|FMN1_HUMAN Formin-1 OS=Homo sapiens OX=9606 GN=FMN1 PE=1 SV=3,GO:0003779; GO:0005634; GO:0005789; GO:0005884; GO:0005886; GO:0005912; GO:0008017; GO:0030036; GO:0045010,actin cytoskeleton organization [GO:0030036]; actin nucleation [GO:0045010],actin filament [GO:0005884]; adherens junction [GO:0005912]; endoplasmic reticulum membrane [GO:0005789]; nucleus [GO:0005634]; plasma membrane [GO:0005886],actin binding [GO:0003779]; microtubule binding [GO:0008017],GO:0005634; GO:0005886; GO:0007010; GO:0008092; GO:0043226,nucleus; plasma membrane; cytoskeleton organization; cytoskeletal protein binding; organelle
OG_02583,1.6923406980420073,FUN_010702-T1,Peve_00022610,Pocillopora_meandrina_HIv1___RNAseq.g20975.t1,three_way,89.09666666666666,FUN_010702-T1,Q922G7,,,,,52.3,354.0,2e-96,354.4,sp|Q922G7|TEKT2_MOUSE Tektin-2 OS=Mus musculus OX=10090 GN=Tekt2 PE=1 SV=1,,,,,,
OG_06757,1.6893072209874445,FUN_031570-T1,Peve_00021507,Pocillopora_meandrina_HIv1___RNAseq.g5065.t1,three_way,57.521,FUN_031570-T1,D4A218,,,,,32.0,303.0,1.1e-26,122.5,sp|D4A218|DMRT3_RAT Doublesex and mab-3 related transcription factor 3 OS=Rattus norvegicus OX=10116 GN=Dmrt3 PE=3 SV=1,,,,,,
OG_08928,1.6716199610696298,FUN_038386-T1,Peve_00000061,Pocillopora_meandrina_HIv1___RNAseq.g28288.t1,three_way,58.09316666666667,FUN_038386-T1,P16065,,,,,37.9,1080.0,5.1e-181,636.7,sp|P16065|GCY_STRPU Speract receptor OS=Strongylocentrotus purpuratus OX=7668 PE=2 SV=1,,,,,,
OG_01919,1.6620272419606343,FUN_007948-T1,Peve_00044442,Pocillopora_meandrina_HIv1___RNAseq.g18135.t1,three_way,64.81733333333334,FUN_007948-T1,Q3TTY0,PLB1_MOUSE,,"Phospholipase B1, membrane-associated (Phospholipase B) (Lysophospholipase) (EC 3.1.1.5) (Phospholipase A2) (EC 3.1.1.4) (Phospholipase B/lipase) (PLB/LIP) (Triacylglycerol lipase) (EC 3.1.1.3)",Mus musculus (Mouse),39.7,345.0,6.200000000000003e-66,253.4,"sp|Q3TTY0|PLB1_MOUSE Phospholipase B1, membrane-associated OS=Mus musculus OX=10090 GN=Plb1 PE=1 SV=2",GO:0004622; GO:0004806; GO:0016324; GO:0019433; GO:0031526; GO:0034478; GO:0034638; GO:0046338; GO:0046340; GO:0047499; GO:0050253; GO:2000344,diacylglycerol catabolic process [GO:0046340]; phosphatidylcholine catabolic process [GO:0034638]; phosphatidylethanolamine catabolic process [GO:0046338]; phosphatidylglycerol catabolic process [GO:0034478]; positive regulation of acrosome reaction [GO:2000344]; triglyceride catabolic process [GO:0019433],apical plasma membrane [GO:0016324]; brush border membrane [GO:0031526],calcium-independent phospholipase A2 activity [GO:0047499]; lysophospholipase activity [GO:0004622]; retinyl-palmitate esterase activity [GO:0050253]; triacylglycerol lipase activity [GO:0004806],GO:0003824; GO:0006629; GO:0016787,catalytic activity; lipid metabolic process; hydrolase activity
