group_id,Component_7,apul,peve,ptua,type,avg_identity,query,accession,id,reviewed,protein_name,organism,pident,length,evalue,bitscore,title,go_ids,go_bp,go_cc,go_mf,goslim_ids,goslim_names
OG_06132,2.9021897878375795,FUN_027938-T2,Peve_00032459,Pocillopora_meandrina_HIv1___RNAseq.g14030.t1,three_way,71.97066666666667,,,,,,,,,,,,,,,,,
OG_09472,2.761304230185315,FUN_041498-T1,Peve_00007700,Pocillopora_meandrina_HIv1___TS.g10682.t1,three_way,80.48866666666666,FUN_041498-T1,Q6Q2B2,,,,,39.5,253.0,1.1e-33,145.6,sp|Q6Q2B2|MBN2A_TAKRU Muscleblind-like protein 2a OS=Takifugu rubripes OX=31033 GN=mbnl2a PE=2 SV=1,,,,,,
OG_01486,2.715548940214972,FUN_006162-T1,Peve_00024180,Pocillopora_meandrina_HIv1___RNAseq.g20422.t1,three_way,46.14,FUN_006162-T1,Q90827,,,,,30.2,129.0,2.5e-09,65.1,sp|Q90827|NEL_CHICK Protein NEL OS=Gallus gallus OX=9031 GN=NEL PE=2 SV=1,,,,,,
OG_05071,2.478721013202571,FUN_023293-T1,Peve_00003652,Pocillopora_meandrina_HIv1___RNAseq.g23035.t1,three_way,68.382,,,,,,,,,,,,,,,,,
OG_06956,2.445559963996241,FUN_032081-T1,Peve_00039910,Pocillopora_meandrina_HIv1___RNAseq.g5227.t1,three_way,79.99466666666666,FUN_032081-T1,Q5RE98,AOFB_PONAB,,Amine oxidase [flavin-containing] B (EC 1.4.3.21) (EC 1.4.3.4) (Monoamine oxidase type B) (MAO-B),Pongo abelii (Sumatran orangutan) (Pongo pygmaeus abelii),47.7,486.0,1.1000000000000001e-130,468.4,sp|Q5RE98|AOFB_PONAB Amine oxidase [flavin-containing] B OS=Pongo abelii OX=9601 GN=MAOB PE=2 SV=3,GO:0005739; GO:0005741; GO:0008131; GO:0050660; GO:0097621,,mitochondrial outer membrane [GO:0005741]; mitochondrion [GO:0005739],flavin adenine dinucleotide binding [GO:0050660]; monoamine oxidase activity [GO:0097621]; primary methylamine oxidase activity [GO:0008131],GO:0003824; GO:0005739; GO:0016491; GO:0043226,catalytic activity; mitochondrion; oxidoreductase activity; organelle
OG_08098,2.429949490288636,FUN_035840-T1,Peve_00032502,Pocillopora_meandrina_HIv1___RNAseq.g11957.t1,three_way,76.54033333333332,FUN_035840-T1,P38532,HSF1_MOUSE,,Heat shock factor protein 1 (HSF 1) (Heat shock transcription factor 1) (HSTF 1),Mus musculus (Mouse),55.7,176.0,1.1e-44,182.6,sp|P38532|HSF1_MOUSE Heat shock factor protein 1 OS=Mus musculus OX=10090 GN=Hsf1 PE=1 SV=2,GO:0000122; GO:0000165; GO:0000776; GO:0000791; GO:0000792; GO:0000978; GO:0001162; GO:0001227; GO:0001228; GO:0001701; GO:0001892; GO:0003677; GO:0003682; GO:0005634; GO:0005654; GO:0005737; GO:0005813; GO:0005829; GO:0006281; GO:0006397; GO:0006952; GO:0007143; GO:0007283; GO:0007584; GO:0008283; GO:0009408; GO:0010628; GO:0010667; GO:0014823; GO:0016605; GO:0019901; GO:0031072; GO:0031333; GO:0031490; GO:0032496; GO:0032720; GO:0032991; GO:0033574; GO:0034605; GO:0034620; GO:0035865; GO:0040018; GO:0042802; GO:0043565; GO:0045120; GO:0045651; GO:0045931; GO:0045944; GO:0046982; GO:0048471; GO:0050673; GO:0050680; GO:0051028; GO:0051879; GO:0060136; GO:0061770; GO:0062029; GO:0065003; GO:0070301; GO:0071222; GO:0071276; GO:0071280; GO:0071392; GO:0071466; GO:0071480; GO:0072738; GO:0090084; GO:0090261; GO:0097165; GO:0097431; GO:0097677; GO:0098847; GO:0101031; GO:0120162; GO:0140296; GO:1900034; GO:1901652; GO:1902512; GO:1903936; GO:1904385; GO:1904843; GO:1904845; GO:1990841; GO:1990904; GO:1990910; GO:1990911; GO:2001033; GO:2001235,cell population proliferation [GO:0008283]; cellular response to angiotensin [GO:1904385]; cellular response to cadmium ion [GO:0071276]; cellular response to copper ion [GO:0071280]; cellular response to diamide [GO:0072738]; cellular response to estradiol stimulus [GO:0071392]; cellular response to gamma radiation [GO:0071480]; cellular response to heat [GO:0034605]; cellular response to hydrogen peroxide [GO:0070301]; cellular response to L-glutamine [GO:1904845]; cellular response to lipopolysaccharide [GO:0071222]; cellular response to nitroglycerin [GO:1904843]; cellular response to potassium ion [GO:0035865]; cellular response to sodium arsenite [GO:1903936]; cellular response to unfolded protein [GO:0034620]; cellular response to xenobiotic stimulus [GO:0071466]; defense response [GO:0006952]; DNA repair [GO:0006281]; embryonic placenta development [GO:0001892]; embryonic process involved in female pregnancy [GO:0060136]; epithelial cell proliferation [GO:0050673]; female meiotic nuclear division [GO:0007143]; in utero embryonic development [GO:0001701]; MAPK cascade [GO:0000165]; mRNA processing [GO:0006397]; mRNA transport [GO:0051028]; negative regulation of cardiac muscle cell apoptotic process [GO:0010667]; negative regulation of double-strand break repair via nonhomologous end joining [GO:2001033]; negative regulation of epithelial cell proliferation [GO:0050680]; negative regulation of inclusion body assembly [GO:0090084]; negative regulation of protein-containing complex assembly [GO:0031333]; negative regulation of transcription by RNA polymerase II [GO:0000122]; negative regulation of tumor necrosis factor production [GO:0032720]; positive regulation of apoptotic DNA fragmentation [GO:1902512]; positive regulation of apoptotic signaling pathway [GO:2001235]; positive regulation of cold-induced thermogenesis [GO:0120162]; positive regulation of gene expression [GO:0010628]; positive regulation of inclusion body assembly [GO:0090261]; positive regulation of macrophage differentiation [GO:0045651]; positive regulation of mitotic cell cycle [GO:0045931]; positive regulation of multicellular organism growth [GO:0040018]; positive regulation of stress granule assembly [GO:0062029]; positive regulation of transcription by RNA polymerase II [GO:0045944]; protein-containing complex assembly [GO:0065003]; regulation of cellular response to heat [GO:1900034]; response to activity [GO:0014823]; response to heat [GO:0009408]; response to hypobaric hypoxia [GO:1990910]; response to lipopolysaccharide [GO:0032496]; response to nutrient [GO:0007584]; response to peptide [GO:1901652]; response to psychosocial stress [GO:1990911]; response to testosterone [GO:0033574]; spermatogenesis [GO:0007283],centrosome [GO:0005813]; cytoplasm [GO:0005737]; cytosol [GO:0005829]; euchromatin [GO:0000791]; heterochromatin [GO:0000792]; kinetochore [GO:0000776]; mitotic spindle pole [GO:0097431]; nuclear stress granule [GO:0097165]; nucleoplasm [GO:0005654]; nucleus [GO:0005634]; perinuclear region of cytoplasm [GO:0048471]; PML body [GO:0016605]; pronucleus [GO:0045120]; protein folding chaperone complex [GO:0101031]; protein-containing complex [GO:0032991]; ribonucleoprotein complex [GO:1990904],"chromatin binding [GO:0003682]; chromatin DNA binding [GO:0031490]; DNA binding [GO:0003677]; DNA-binding transcription activator activity, RNA polymerase II-specific [GO:0001228]; DNA-binding transcription repressor activity, RNA polymerase II-specific [GO:0001227]; general transcription initiation factor binding [GO:0140296]; heat shock protein binding [GO:0031072]; Hsp90 protein binding [GO:0051879]; identical protein binding [GO:0042802]; promoter-specific chromatin binding [GO:1990841]; protein heterodimerization activity [GO:0046982]; protein kinase binding [GO:0019901]; RNA polymerase II cis-regulatory region sequence-specific DNA binding [GO:0000978]; RNA polymerase II intronic transcription regulatory region sequence-specific DNA binding [GO:0001162]; sequence-specific DNA binding [GO:0043565]; sequence-specific single stranded DNA binding [GO:0098847]; STAT family protein binding [GO:0097677]; translation elongation factor binding [GO:0061770]",GO:0003677; GO:0005634; GO:0005654; GO:0005815; GO:0005829; GO:0006281; GO:0006355; GO:0016071; GO:0022414; GO:0043226; GO:0048856; GO:0065003; GO:0140013; GO:0140110,DNA binding; nucleus; nucleoplasm; microtubule organizing center; cytosol; DNA repair; regulation of DNA-templated transcription; mRNA metabolic process; reproductive process; organelle; anatomical structure development; protein-containing complex assembly; meiotic nuclear division; transcription regulator activity
OG_01620,2.428861160243793,FUN_006729-T1,Peve_00039560,Pocillopora_meandrina_HIv1___RNAseq.g20015.t1,three_way,68.16666666666667,FUN_006729-T1,O55240,RDH5_MOUSE,,Retinol dehydrogenase 5 (EC 1.1.1.209) (EC 1.1.1.315) (EC 1.1.1.53) (11-cis retinol dehydrogenase) (11-cis RDH) (11-cis RoDH) (9-cis retinol dehydrogenase) (Cis-retinol dehydrogenase),Mus musculus (Mouse),44.6,285.0,1.7999999999999994e-68,261.2,sp|O55240|RDH5_MOUSE Retinol dehydrogenase 5 OS=Mus musculus OX=10090 GN=Rdh5 PE=1 SV=1,GO:0001523; GO:0004745; GO:0005788; GO:0005789; GO:0007601; GO:0008202; GO:0042572; GO:0042803; GO:0044297; GO:0047023; GO:0047044; GO:0106429,retinoid metabolic process [GO:0001523]; retinol metabolic process [GO:0042572]; steroid metabolic process [GO:0008202]; visual perception [GO:0007601],cell body [GO:0044297]; endoplasmic reticulum lumen [GO:0005788]; endoplasmic reticulum membrane [GO:0005789],"11-cis-retinol dehydrogenase [GO:0106429]; all-trans-retinol dehydrogenase (NAD+) activity [GO:0004745]; androstan-3-alpha,17-beta-diol dehydrogenase (NAD+) activity [GO:0047044]; androsterone dehydrogenase [NAD(P)+] activity [GO:0047023]; protein homodimerization activity [GO:0042803]",GO:0003824; GO:0006629; GO:0016491; GO:0050877,catalytic activity; lipid metabolic process; oxidoreductase activity; nervous system process
OG_01645,2.414118615135872,FUN_006796-T1,Peve_00019185,Pocillopora_meandrina_HIv1___RNAseq.g20496.t1,three_way,33.34466666666667,FUN_006796-T1,Q96RW7,HMCN1_HUMAN,,Hemicentin-1 (Fibulin-6) (FIBL-6),Homo sapiens (Human),28.9,287.0,1.3e-17,92.4,sp|Q96RW7|HMCN1_HUMAN Hemicentin-1 OS=Homo sapiens OX=9606 GN=HMCN1 PE=1 SV=2,GO:0005201; GO:0005509; GO:0005604; GO:0005737; GO:0005912; GO:0005927; GO:0005938; GO:0007156; GO:0007157; GO:0007601; GO:0009617; GO:0030036; GO:0032154; GO:0051301; GO:0062023; GO:0070062; GO:0071711,actin cytoskeleton organization [GO:0030036]; basement membrane organization [GO:0071711]; cell division [GO:0051301]; heterophilic cell-cell adhesion via plasma membrane cell adhesion molecules [GO:0007157]; homophilic cell adhesion via plasma membrane adhesion molecules [GO:0007156]; response to bacterium [GO:0009617]; visual perception [GO:0007601],adherens junction [GO:0005912]; basement membrane [GO:0005604]; cell cortex [GO:0005938]; cleavage furrow [GO:0032154]; collagen-containing extracellular matrix [GO:0062023]; cytoplasm [GO:0005737]; extracellular exosome [GO:0070062]; muscle tendon junction [GO:0005927],calcium ion binding [GO:0005509]; extracellular matrix structural constituent [GO:0005201],GO:0005198; GO:0007010; GO:0007155; GO:0030198; GO:0030312; GO:0031012; GO:0043226; GO:0050877,structural molecule activity; cytoskeleton organization; cell adhesion; extracellular matrix organization; external encapsulating structure; extracellular matrix; organelle; nervous system process
OG_08557,2.3871162618368342,FUN_037545-T1,Peve_00032229,Pocillopora_meandrina_HIv1___RNAseq.g1633.t2,three_way,65.51433333333333,FUN_037545-T1,P60483,,,,,47.9,382.0,1.2e-98,361.7,"sp|P60483|PTEN_CANLF Phosphatidylinositol 3,4,5-trisphosphate 3-phosphatase and dual-specificity protein phosphatase PTEN OS=Canis lupus familiaris OX=9615 GN=PTEN PE=2 SV=1",,,,,,
OG_02927,2.347343559185514,FUN_012020-T1,Peve_00030377,Pocillopora_meandrina_HIv1___RNAseq.g24050.t1,three_way,58.77833333333333,FUN_012020-T1,Q5UAW9,GP157_HUMAN,,G-protein coupled receptor 157,Homo sapiens (Human),34.6,289.0,1.7e-39,164.9,sp|Q5UAW9|GP157_HUMAN G-protein coupled receptor 157 OS=Homo sapiens OX=9606 GN=GPR157 PE=1 SV=2,GO:0004930; GO:0005886; GO:0007166; GO:0007189; GO:0007200; GO:0048512; GO:0060019; GO:0060170,adenylate cyclase-activating G protein-coupled receptor signaling pathway [GO:0007189]; cell surface receptor signaling pathway [GO:0007166]; circadian behavior [GO:0048512]; phospholipase C-activating G protein-coupled receptor signaling pathway [GO:0007200]; radial glial cell differentiation [GO:0060019],ciliary membrane [GO:0060170]; plasma membrane [GO:0005886],G protein-coupled receptor activity [GO:0004930],GO:0005886; GO:0030154; GO:0060089,plasma membrane; cell differentiation; molecular transducer activity
OG_02226,2.270647493454076,FUN_008631-T1,Peve_00012388,Pocillopora_meandrina_HIv1___RNAseq.g14912.t1,three_way,62.56166666666666,,,,,,,,,,,,,,,,,
OG_01642,2.2209062835280315,FUN_006790-T1,Peve_00028070,Pocillopora_meandrina_HIv1___RNAseq.g20501.t1,three_way,54.868,FUN_006790-T1,P35918,,,,,31.5,961.0,9.8e-99,363.6,sp|P35918|VGFR2_MOUSE Vascular endothelial growth factor receptor 2 OS=Mus musculus OX=10090 GN=Kdr PE=1 SV=2,,,,,,
OG_09443,2.2128885706626185,FUN_041432-T2,Peve_00027845,Pocillopora_meandrina_HIv1___RNAseq.g15740.t1,three_way,86.71633333333334,FUN_041432-T2,Q90837,,,,,41.4,459.0,1.8000000000000002e-81,304.7,sp|Q90837|ERG_CHICK Transcriptional regulator Erg OS=Gallus gallus OX=9031 GN=ERG PE=2 SV=1,,,,,,
OG_02998,2.210372620946018,FUN_012177-T1,Peve_00040996,Pocillopora_meandrina_HIv1___RNAseq.g23859.t1,three_way,91.90766666666669,FUN_012177-T1,P18654,KS6A3_MOUSE,,Ribosomal protein S6 kinase alpha-3 (S6K-alpha-3) (EC 2.7.11.1) (90 kDa ribosomal protein S6 kinase 3) (p90-RSK 3) (p90RSK3) (MAP kinase-activated protein kinase 1b) (MAPK-activated protein kinase 1b) (MAPKAP kinase 1b) (MAPKAPK-1b) (Ribosomal S6 kinase 2) (RSK-2) (pp90RSK2),Mus musculus (Mouse),67.4,742.0,1e-291,1003.8,sp|P18654|KS6A3_MOUSE Ribosomal protein S6 kinase alpha-3 OS=Mus musculus OX=10090 GN=Rps6ka3 PE=1 SV=2,GO:0000287; GO:0002224; GO:0004674; GO:0005524; GO:0005654; GO:0005730; GO:0005829; GO:0019901; GO:0032496; GO:0035556; GO:0043066; GO:0045944; GO:0106310,intracellular signal transduction [GO:0035556]; negative regulation of apoptotic process [GO:0043066]; positive regulation of transcription by RNA polymerase II [GO:0045944]; response to lipopolysaccharide [GO:0032496]; toll-like receptor signaling pathway [GO:0002224],cytosol [GO:0005829]; nucleolus [GO:0005730]; nucleoplasm [GO:0005654],ATP binding [GO:0005524]; magnesium ion binding [GO:0000287]; protein kinase binding [GO:0019901]; protein serine kinase activity [GO:0106310]; protein serine/threonine kinase activity [GO:0004674],GO:0002376; GO:0003824; GO:0005654; GO:0005730; GO:0005829; GO:0006355; GO:0016740; GO:0043226; GO:0140096,"immune system process; catalytic activity; nucleoplasm; nucleolus; cytosol; regulation of DNA-templated transcription; transferase activity; organelle; catalytic activity, acting on a protein"
OG_02090,2.210089233325687,FUN_008328-T1,Peve_00040489,Pocillopora_meandrina_HIv1___TS.g24166.t1,three_way,48.269666666666666,FUN_008328-T1,B3EWY9,,,,,39.3,990.0,2.1999999999999998e-166,589.3,sp|B3EWY9|MLP_ACRMI Mucin-like protein (Fragment) OS=Acropora millepora OX=45264 PE=1 SV=1,,,,,,
OG_08937,2.2086236725812607,FUN_038401-T1,Peve_00000033,Pocillopora_meandrina_HIv1___RNAseq.g28276.t1,three_way,76.06083333333333,FUN_038401-T1,Q9BG91,,,,,65.5,148.0,5e-50,200.3,sp|Q9BG91|SOX9_CALJA Transcription factor SOX-9 OS=Callithrix jacchus OX=9483 GN=SOX9 PE=2 SV=1,,,,,,
OG_08097,2.2035042403458105,FUN_035839-T1,Peve_00032500,Pocillopora_meandrina_HIv1___RNAseq.g11958.t2,three_way,68.27866666666667,,,,,,,,,,,,,,,,,
OG_09233,2.2031119831494235,FUN_039977-T1,Peve_00029897,Pocillopora_meandrina_HIv1___RNAseq.g7542.t1,three_way,56.55166666666666,FUN_039977-T1,Q9ULJ7,,,,,25.1,427.0,1.1e-26,124.8,sp|Q9ULJ7|ANR50_HUMAN Ankyrin repeat domain-containing protein 50 OS=Homo sapiens OX=9606 GN=ANKRD50 PE=1 SV=4,,,,,,
OG_08355,2.1388943497340307,FUN_036899-T1,Peve_00018371,Pocillopora_meandrina_HIv1___RNAseq.g26703.t1,three_way,78.23133333333332,FUN_036899-T1,Q8VZ42,,,,,40.3,129.0,1.3e-25,117.5,sp|Q8VZ42|SAP11_ARATH Zinc finger AN1 and C2H2 domain-containing stress-associated protein 11 OS=Arabidopsis thaliana OX=3702 GN=SAP11 PE=2 SV=1,,,,,,
OG_07121,2.1053692550312304,FUN_032420-T1,Peve_00041753,Pocillopora_meandrina_HIv1___RNAseq.g24395.t1,three_way,71.22583333333333,,,,,,,,,,,,,,,,,
OG_06663,2.089766180036352,FUN_031054-T1,Peve_00028185,Pocillopora_meandrina_HIv1___RNAseq.g30322.t1,three_way,84.973,FUN_031054-T1,Q8CIB5,FERM2_MOUSE,,Fermitin family homolog 2 (Kindlin-2) (Pleckstrin homology domain-containing family C member 1),Mus musculus (Mouse),47.4,694.0,4.1000000000000004e-170,599.7,sp|Q8CIB5|FERM2_MOUSE Fermitin family homolog 2 OS=Mus musculus OX=10090 GN=Fermt2 PE=1 SV=1,GO:0001725; GO:0005547; GO:0005634; GO:0005654; GO:0005737; GO:0005829; GO:0005912; GO:0005925; GO:0005938; GO:0007160; GO:0007179; GO:0007229; GO:0008360; GO:0009898; GO:0009986; GO:0010718; GO:0016055; GO:0031258; GO:0031674; GO:0033622; GO:0033625; GO:0034334; GO:0034446; GO:0034713; GO:0035025; GO:0043116; GO:0043539; GO:0045599; GO:0045669; GO:0046332; GO:0048041; GO:0051015; GO:0051496; GO:0051894; GO:0051897; GO:0060173; GO:0070374; GO:0072657; GO:0120283; GO:1900026; GO:1900182; GO:1902414; GO:1902462; GO:1903691,"adherens junction maintenance [GO:0034334]; cell-matrix adhesion [GO:0007160]; focal adhesion assembly [GO:0048041]; integrin activation [GO:0033622]; integrin-mediated signaling pathway [GO:0007229]; limb development [GO:0060173]; negative regulation of fat cell differentiation [GO:0045599]; negative regulation of vascular permeability [GO:0043116]; positive regulation of epithelial to mesenchymal transition [GO:0010718]; positive regulation of ERK1 and ERK2 cascade [GO:0070374]; positive regulation of focal adhesion assembly [GO:0051894]; positive regulation of integrin activation [GO:0033625]; positive regulation of mesenchymal stem cell proliferation [GO:1902462]; positive regulation of osteoblast differentiation [GO:0045669]; positive regulation of phosphatidylinositol 3-kinase/protein kinase B signal transduction [GO:0051897]; positive regulation of protein localization to nucleus [GO:1900182]; positive regulation of Rho protein signal transduction [GO:0035025]; positive regulation of stress fiber assembly [GO:0051496]; positive regulation of substrate adhesion-dependent cell spreading [GO:1900026]; positive regulation of wound healing, spreading of epidermal cells [GO:1903691]; protein localization to cell junction [GO:1902414]; protein localization to membrane [GO:0072657]; regulation of cell shape [GO:0008360]; substrate adhesion-dependent cell spreading [GO:0034446]; transforming growth factor beta receptor signaling pathway [GO:0007179]; Wnt signaling pathway [GO:0016055]",adherens junction [GO:0005912]; cell cortex [GO:0005938]; cell surface [GO:0009986]; cytoplasm [GO:0005737]; cytoplasmic side of plasma membrane [GO:0009898]; cytosol [GO:0005829]; focal adhesion [GO:0005925]; I band [GO:0031674]; lamellipodium membrane [GO:0031258]; nucleoplasm [GO:0005654]; nucleus [GO:0005634]; stress fiber [GO:0001725],"actin filament binding [GO:0051015]; phosphatidylinositol-3,4,5-trisphosphate binding [GO:0005547]; protein serine/threonine kinase activator activity [GO:0043539]; protein serine/threonine kinase binding [GO:0120283]; SMAD binding [GO:0046332]; type I transforming growth factor beta receptor binding [GO:0034713]",GO:0003013; GO:0005634; GO:0005654; GO:0005829; GO:0007155; GO:0008092; GO:0008289; GO:0034330; GO:0043226; GO:0048856; GO:0065003; GO:0098772,circulatory system process; nucleus; nucleoplasm; cytosol; cell adhesion; cytoskeletal protein binding; lipid binding; cell junction organization; organelle; anatomical structure development; protein-containing complex assembly; molecular function regulator activity
OG_00264,2.086414801779014,FUN_001041-T1,Peve_00028475,Pocillopora_meandrina_HIv1___TS.g6804.t1,three_way,83.21833333333333,FUN_001041-T1,Q7Z5V6,SAXO4_HUMAN,,Stabilizer of axonemal microtubules 4 (Protein phosphatase 1 regulatory subunit 32),Homo sapiens (Human),33.2,455.0,1.0999999999999999e-62,242.3,sp|Q7Z5V6|SAXO4_HUMAN Stabilizer of axonemal microtubules 4 OS=Homo sapiens OX=9606 GN=SAXO4 PE=1 SV=1,GO:0005737; GO:0019902; GO:0030317; GO:0036064; GO:0036126; GO:0160111,flagellated sperm motility [GO:0030317],axonemal A tubule inner sheath [GO:0160111]; ciliary basal body [GO:0036064]; cytoplasm [GO:0005737]; sperm flagellum [GO:0036126],phosphatase binding [GO:0019902],GO:0005815; GO:0005929; GO:0007018; GO:0022414; GO:0043226; GO:0048870,microtubule organizing center; cilium; microtubule-based movement; reproductive process; organelle; cell motility
OG_03068,2.070421213720924,FUN_012338-T1,Peve_00021550,Pocillopora_meandrina_HIv1___RNAseq.g24073.t1,three_way,51.0305,,,,,,,,,,,,,,,,,
OG_03335,2.04600007389224,FUN_013556-T1,Peve_00038569,Pocillopora_meandrina_HIv1___RNAseq.g22960.t1,three_way,59.44166666666667,FUN_013556-T1,Q6NR09,EGRAP_DROME,,EGFR adapter protein,Drosophila melanogaster (Fruit fly),34.3,137.0,7.7e-13,77.0,sp|Q6NR09|EGRAP_DROME EGFR adapter protein OS=Drosophila melanogaster OX=7227 GN=Egfrap PE=1 SV=1,GO:0005925; GO:0030971; GO:0042059; GO:0045179,negative regulation of epidermal growth factor receptor signaling pathway [GO:0042059],apical cortex [GO:0045179]; focal adhesion [GO:0005925],receptor tyrosine kinase binding [GO:0030971],,
OG_07731,2.0438795633032867,FUN_034892-T1,Peve_00037338,Pocillopora_meandrina_HIv1___TS.g15150.t1,three_way,61.52,,,,,,,,,,,,,,,,,
OG_06850,2.030277952987642,FUN_031791-T1,Peve_00019321,Pocillopora_meandrina_HIv1___RNAseq.g5572.t1,three_way,73.44166666666666,FUN_031791-T1,K7VCB9,,,,,43.1,232.0,1e-38,161.8,sp|K7VCB9|THIM_MAIZE Hydroxyethylthiazole kinase OS=Zea mays OX=4577 GN=THIM PE=1 SV=1,,,,,,
OG_03845,2.028030485543735,FUN_015318-T1,Peve_00023982,Pocillopora_meandrina_HIv1___RNAseq.g21728.t1,three_way,82.93366666666667,FUN_015318-T1,Q5QNI2,,,,,31.0,532.0,4.7999999999999997e-54,213.8,sp|Q5QNI2|NCL1_ORYSJ Sodium/calcium exchanger NCL1 OS=Oryza sativa subsp. japonica OX=39947 GN=NCL1 PE=2 SV=1,,,,,,
OG_07134,1.997177300466186,FUN_032459-T1,Peve_00009149,Pocillopora_meandrina_HIv1___RNAseq.g24151.t1,three_way,75.24633333333333,,,,,,,,,,,,,,,,,
OG_04693,1.99389213186244,FUN_022485-T1,Peve_00002925,Pocillopora_meandrina_HIv1___RNAseq.g4293.t1,three_way,88.12733333333333,,,,,,,,,,,,,,,,,
OG_01450,1.975654249521952,FUN_005904-T1,Peve_00035815,Pocillopora_meandrina_HIv1___RNAseq.2460_t,three_way,73.63866666666667,FUN_005904-T1,P55115,,,,,42.3,239.0,1e-48,195.3,sp|P55115|NAS15_CAEEL Zinc metalloproteinase nas-15 OS=Caenorhabditis elegans OX=6239 GN=nas-15 PE=2 SV=2,,,,,,
