group_id,max_val,apul,peve,ptua,type,avg_identity,query,accession,id,reviewed,protein_name,organism,pident,length,evalue,bitscore,title,go_ids,go_bp,go_cc,go_mf,goslim_ids,goslim_names
OG_01576,1.054237217958551,FUN_006581-T1,Peve_00015613,Pocillopora_meandrina_HIv1___RNAseq.g20271.t1,three_way,58.029,FUN_006581-T1,P18460,,,,,34.3,769.0,1.3e-91,339.3,sp|P18460|FGFR3_CHICK Fibroblast growth factor receptor 3 OS=Gallus gallus OX=9031 GN=FGFR3 PE=2 SV=1,,,,,,
OG_01645,1.038521139147323,FUN_006796-T1,Peve_00019185,Pocillopora_meandrina_HIv1___RNAseq.g20496.t1,three_way,33.34466666666667,FUN_006796-T1,Q96RW7,HMCN1_HUMAN,,Hemicentin-1 (Fibulin-6) (FIBL-6),Homo sapiens (Human),28.9,287.0,1.3e-17,92.4,sp|Q96RW7|HMCN1_HUMAN Hemicentin-1 OS=Homo sapiens OX=9606 GN=HMCN1 PE=1 SV=2,GO:0005201; GO:0005509; GO:0005604; GO:0005737; GO:0005912; GO:0005927; GO:0005938; GO:0007156; GO:0007157; GO:0007601; GO:0009617; GO:0030036; GO:0032154; GO:0051301; GO:0062023; GO:0070062; GO:0071711,actin cytoskeleton organization [GO:0030036]; basement membrane organization [GO:0071711]; cell division [GO:0051301]; heterophilic cell-cell adhesion via plasma membrane cell adhesion molecules [GO:0007157]; homophilic cell adhesion via plasma membrane adhesion molecules [GO:0007156]; response to bacterium [GO:0009617]; visual perception [GO:0007601],adherens junction [GO:0005912]; basement membrane [GO:0005604]; cell cortex [GO:0005938]; cleavage furrow [GO:0032154]; collagen-containing extracellular matrix [GO:0062023]; cytoplasm [GO:0005737]; extracellular exosome [GO:0070062]; muscle tendon junction [GO:0005927],calcium ion binding [GO:0005509]; extracellular matrix structural constituent [GO:0005201],GO:0005198; GO:0007010; GO:0007155; GO:0030198; GO:0030312; GO:0031012; GO:0043226; GO:0050877,structural molecule activity; cytoskeleton organization; cell adhesion; extracellular matrix organization; external encapsulating structure; extracellular matrix; organelle; nervous system process
OG_01897,1.1490870207432828,FUN_007904-T1,Peve_00040656,Pocillopora_meandrina_HIv1___RNAseq.g30059.t1,three_way,60.9685,FUN_007904-T1,P06582,,,,,37.0,100.0,1.1e-11,72.0,sp|P06582|HSP12_CAEEL Heat shock protein hsp-16.2 OS=Caenorhabditis elegans OX=6239 GN=hsp-16.2 PE=2 SV=1,,,,,,
OG_02805,1.1772624657373374,FUN_011776-T1,Peve_00006118,Pocillopora_meandrina_HIv1___RNAseq.g23292.t1,three_way,81.48183333333333,FUN_011776-T1,Q01196,RUNX1_HUMAN,,Runt-related transcription factor 1 (Acute myeloid leukemia 1 protein) (Core-binding factor subunit alpha-2) (CBF-alpha-2) (Oncogene AML-1) (Polyomavirus enhancer-binding protein 2 alpha B subunit) (PEA2-alpha B) (PEBP2-alpha B) (SL3-3 enhancer factor 1 alpha B subunit) (SL3/AKV core-binding factor alpha B subunit),Homo sapiens (Human),48.8,320.0,7.1e-71,269.6,sp|Q01196|RUNX1_HUMAN Runt-related transcription factor 1 OS=Homo sapiens OX=9606 GN=RUNX1 PE=1 SV=3,GO:0000122; GO:0000785; GO:0000976; GO:0000977; GO:0000978; GO:0000981; GO:0001222; GO:0001223; GO:0001228; GO:0001503; GO:0002062; GO:0002573; GO:0003677; GO:0003700; GO:0005509; GO:0005524; GO:0005634; GO:0005654; GO:0006357; GO:0010755; GO:0016513; GO:0030097; GO:0030099; GO:0030182; GO:0030853; GO:0030854; GO:0032743; GO:0032967; GO:0042803; GO:0043231; GO:0043371; GO:0043378; GO:0045595; GO:0045766; GO:0045893; GO:0045944; GO:0046982; GO:0048935; GO:0060043; GO:0061026; GO:0071425; GO:0140297; GO:1903055; GO:1905203,"cardiac muscle tissue regeneration [GO:0061026]; chondrocyte differentiation [GO:0002062]; hematopoietic stem cell proliferation [GO:0071425]; hemopoiesis [GO:0030097]; myeloid cell differentiation [GO:0030099]; myeloid leukocyte differentiation [GO:0002573]; negative regulation of CD4-positive, alpha-beta T cell differentiation [GO:0043371]; negative regulation of granulocyte differentiation [GO:0030853]; negative regulation of transcription by RNA polymerase II [GO:0000122]; neuron differentiation [GO:0030182]; ossification [GO:0001503]; peripheral nervous system neuron development [GO:0048935]; positive regulation of angiogenesis [GO:0045766]; positive regulation of CD8-positive, alpha-beta T cell differentiation [GO:0043378]; positive regulation of collagen biosynthetic process [GO:0032967]; positive regulation of DNA-templated transcription [GO:0045893]; positive regulation of extracellular matrix organization [GO:1903055]; positive regulation of granulocyte differentiation [GO:0030854]; positive regulation of interleukin-2 production [GO:0032743]; positive regulation of transcription by RNA polymerase II [GO:0045944]; regulation of cardiac muscle cell proliferation [GO:0060043]; regulation of cell differentiation [GO:0045595]; regulation of connective tissue replacement [GO:1905203]; regulation of plasminogen activation [GO:0010755]; regulation of transcription by RNA polymerase II [GO:0006357]",chromatin [GO:0000785]; core-binding factor complex [GO:0016513]; intracellular membrane-bounded organelle [GO:0043231]; nucleoplasm [GO:0005654]; nucleus [GO:0005634],"ATP binding [GO:0005524]; calcium ion binding [GO:0005509]; DNA binding [GO:0003677]; DNA-binding transcription activator activity, RNA polymerase II-specific [GO:0001228]; DNA-binding transcription factor activity [GO:0003700]; DNA-binding transcription factor activity, RNA polymerase II-specific [GO:0000981]; DNA-binding transcription factor binding [GO:0140297]; protein heterodimerization activity [GO:0046982]; protein homodimerization activity [GO:0042803]; RNA polymerase II cis-regulatory region sequence-specific DNA binding [GO:0000978]; RNA polymerase II transcription regulatory region sequence-specific DNA binding [GO:0000977]; transcription cis-regulatory region binding [GO:0000976]; transcription coactivator binding [GO:0001223]; transcription corepressor binding [GO:0001222]",GO:0003677; GO:0005634; GO:0005654; GO:0006355; GO:0030154; GO:0043226; GO:0048856; GO:0140110,DNA binding; nucleus; nucleoplasm; regulation of DNA-templated transcription; cell differentiation; organelle; anatomical structure development; transcription regulator activity
OG_02998,1.098917453467866,FUN_012177-T1,Peve_00040996,Pocillopora_meandrina_HIv1___RNAseq.g23859.t1,three_way,91.90766666666669,FUN_012177-T1,P18654,KS6A3_MOUSE,,Ribosomal protein S6 kinase alpha-3 (S6K-alpha-3) (EC 2.7.11.1) (90 kDa ribosomal protein S6 kinase 3) (p90-RSK 3) (p90RSK3) (MAP kinase-activated protein kinase 1b) (MAPK-activated protein kinase 1b) (MAPKAP kinase 1b) (MAPKAPK-1b) (Ribosomal S6 kinase 2) (RSK-2) (pp90RSK2),Mus musculus (Mouse),67.4,742.0,1e-291,1003.8,sp|P18654|KS6A3_MOUSE Ribosomal protein S6 kinase alpha-3 OS=Mus musculus OX=10090 GN=Rps6ka3 PE=1 SV=2,GO:0000287; GO:0002224; GO:0004674; GO:0005524; GO:0005654; GO:0005730; GO:0005829; GO:0019901; GO:0032496; GO:0035556; GO:0043066; GO:0045944; GO:0106310,intracellular signal transduction [GO:0035556]; negative regulation of apoptotic process [GO:0043066]; positive regulation of transcription by RNA polymerase II [GO:0045944]; response to lipopolysaccharide [GO:0032496]; toll-like receptor signaling pathway [GO:0002224],cytosol [GO:0005829]; nucleolus [GO:0005730]; nucleoplasm [GO:0005654],ATP binding [GO:0005524]; magnesium ion binding [GO:0000287]; protein kinase binding [GO:0019901]; protein serine kinase activity [GO:0106310]; protein serine/threonine kinase activity [GO:0004674],GO:0002376; GO:0003824; GO:0005654; GO:0005730; GO:0005829; GO:0006355; GO:0016740; GO:0043226; GO:0140096,"immune system process; catalytic activity; nucleoplasm; nucleolus; cytosol; regulation of DNA-templated transcription; transferase activity; organelle; catalytic activity, acting on a protein"
OG_03558,1.002004442710411,FUN_014704-T1,Peve_00021212,Pocillopora_meandrina_HIv1___RNAseq.g22535.t1,three_way,50.87083333333333,,,,,,,,,,,,,,,,,
OG_06132,1.1738075426674242,FUN_027938-T2,Peve_00032459,Pocillopora_meandrina_HIv1___RNAseq.g14030.t1,three_way,71.97066666666667,,,,,,,,,,,,,,,,,
OG_06998,1.025844857286215,FUN_032147-T1,Peve_00007908,Pocillopora_meandrina_HIv1___RNAseq.g5342.t1,three_way,65.17866666666666,FUN_032147-T1,Q3U435,MMP25_MOUSE,,Matrix metalloproteinase-25 (MMP-25) (EC 3.4.24.-),Mus musculus (Mouse),37.3,566.0,7.6e-77,289.7,sp|Q3U435|MMP25_MOUSE Matrix metalloproteinase-25 OS=Mus musculus OX=10090 GN=Mmp25 PE=2 SV=1,GO:0004222; GO:0005886; GO:0006508; GO:0008270; GO:0009986; GO:0016504; GO:0031012; GO:0060022; GO:0098552,hard palate development [GO:0060022]; proteolysis [GO:0006508],cell surface [GO:0009986]; extracellular matrix [GO:0031012]; plasma membrane [GO:0005886]; side of membrane [GO:0098552],metalloendopeptidase activity [GO:0004222]; peptidase activator activity [GO:0016504]; zinc ion binding [GO:0008270],GO:0003824; GO:0005886; GO:0016787; GO:0030312; GO:0031012; GO:0048856; GO:0098772; GO:0140096,"catalytic activity; plasma membrane; hydrolase activity; external encapsulating structure; extracellular matrix; anatomical structure development; molecular function regulator activity; catalytic activity, acting on a protein"
OG_08098,1.4034946110317943,FUN_035840-T1,Peve_00032502,Pocillopora_meandrina_HIv1___RNAseq.g11957.t1,three_way,76.54033333333332,FUN_035840-T1,P38532,HSF1_MOUSE,,Heat shock factor protein 1 (HSF 1) (Heat shock transcription factor 1) (HSTF 1),Mus musculus (Mouse),55.7,176.0,1.1e-44,182.6,sp|P38532|HSF1_MOUSE Heat shock factor protein 1 OS=Mus musculus OX=10090 GN=Hsf1 PE=1 SV=2,GO:0000122; GO:0000165; GO:0000776; GO:0000791; GO:0000792; GO:0000978; GO:0001162; GO:0001227; GO:0001228; GO:0001701; GO:0001892; GO:0003677; GO:0003682; GO:0005634; GO:0005654; GO:0005737; GO:0005813; GO:0005829; GO:0006281; GO:0006397; GO:0006952; GO:0007143; GO:0007283; GO:0007584; GO:0008283; GO:0009408; GO:0010628; GO:0010667; GO:0014823; GO:0016605; GO:0019901; GO:0031072; GO:0031333; GO:0031490; GO:0032496; GO:0032720; GO:0032991; GO:0033574; GO:0034605; GO:0034620; GO:0035865; GO:0040018; GO:0042802; GO:0043565; GO:0045120; GO:0045651; GO:0045931; GO:0045944; GO:0046982; GO:0048471; GO:0050673; GO:0050680; GO:0051028; GO:0051879; GO:0060136; GO:0061770; GO:0062029; GO:0065003; GO:0070301; GO:0071222; GO:0071276; GO:0071280; GO:0071392; GO:0071466; GO:0071480; GO:0072738; GO:0090084; GO:0090261; GO:0097165; GO:0097431; GO:0097677; GO:0098847; GO:0101031; GO:0120162; GO:0140296; GO:1900034; GO:1901652; GO:1902512; GO:1903936; GO:1904385; GO:1904843; GO:1904845; GO:1990841; GO:1990904; GO:1990910; GO:1990911; GO:2001033; GO:2001235,cell population proliferation [GO:0008283]; cellular response to angiotensin [GO:1904385]; cellular response to cadmium ion [GO:0071276]; cellular response to copper ion [GO:0071280]; cellular response to diamide [GO:0072738]; cellular response to estradiol stimulus [GO:0071392]; cellular response to gamma radiation [GO:0071480]; cellular response to heat [GO:0034605]; cellular response to hydrogen peroxide [GO:0070301]; cellular response to L-glutamine [GO:1904845]; cellular response to lipopolysaccharide [GO:0071222]; cellular response to nitroglycerin [GO:1904843]; cellular response to potassium ion [GO:0035865]; cellular response to sodium arsenite [GO:1903936]; cellular response to unfolded protein [GO:0034620]; cellular response to xenobiotic stimulus [GO:0071466]; defense response [GO:0006952]; DNA repair [GO:0006281]; embryonic placenta development [GO:0001892]; embryonic process involved in female pregnancy [GO:0060136]; epithelial cell proliferation [GO:0050673]; female meiotic nuclear division [GO:0007143]; in utero embryonic development [GO:0001701]; MAPK cascade [GO:0000165]; mRNA processing [GO:0006397]; mRNA transport [GO:0051028]; negative regulation of cardiac muscle cell apoptotic process [GO:0010667]; negative regulation of double-strand break repair via nonhomologous end joining [GO:2001033]; negative regulation of epithelial cell proliferation [GO:0050680]; negative regulation of inclusion body assembly [GO:0090084]; negative regulation of protein-containing complex assembly [GO:0031333]; negative regulation of transcription by RNA polymerase II [GO:0000122]; negative regulation of tumor necrosis factor production [GO:0032720]; positive regulation of apoptotic DNA fragmentation [GO:1902512]; positive regulation of apoptotic signaling pathway [GO:2001235]; positive regulation of cold-induced thermogenesis [GO:0120162]; positive regulation of gene expression [GO:0010628]; positive regulation of inclusion body assembly [GO:0090261]; positive regulation of macrophage differentiation [GO:0045651]; positive regulation of mitotic cell cycle [GO:0045931]; positive regulation of multicellular organism growth [GO:0040018]; positive regulation of stress granule assembly [GO:0062029]; positive regulation of transcription by RNA polymerase II [GO:0045944]; protein-containing complex assembly [GO:0065003]; regulation of cellular response to heat [GO:1900034]; response to activity [GO:0014823]; response to heat [GO:0009408]; response to hypobaric hypoxia [GO:1990910]; response to lipopolysaccharide [GO:0032496]; response to nutrient [GO:0007584]; response to peptide [GO:1901652]; response to psychosocial stress [GO:1990911]; response to testosterone [GO:0033574]; spermatogenesis [GO:0007283],centrosome [GO:0005813]; cytoplasm [GO:0005737]; cytosol [GO:0005829]; euchromatin [GO:0000791]; heterochromatin [GO:0000792]; kinetochore [GO:0000776]; mitotic spindle pole [GO:0097431]; nuclear stress granule [GO:0097165]; nucleoplasm [GO:0005654]; nucleus [GO:0005634]; perinuclear region of cytoplasm [GO:0048471]; PML body [GO:0016605]; pronucleus [GO:0045120]; protein folding chaperone complex [GO:0101031]; protein-containing complex [GO:0032991]; ribonucleoprotein complex [GO:1990904],"chromatin binding [GO:0003682]; chromatin DNA binding [GO:0031490]; DNA binding [GO:0003677]; DNA-binding transcription activator activity, RNA polymerase II-specific [GO:0001228]; DNA-binding transcription repressor activity, RNA polymerase II-specific [GO:0001227]; general transcription initiation factor binding [GO:0140296]; heat shock protein binding [GO:0031072]; Hsp90 protein binding [GO:0051879]; identical protein binding [GO:0042802]; promoter-specific chromatin binding [GO:1990841]; protein heterodimerization activity [GO:0046982]; protein kinase binding [GO:0019901]; RNA polymerase II cis-regulatory region sequence-specific DNA binding [GO:0000978]; RNA polymerase II intronic transcription regulatory region sequence-specific DNA binding [GO:0001162]; sequence-specific DNA binding [GO:0043565]; sequence-specific single stranded DNA binding [GO:0098847]; STAT family protein binding [GO:0097677]; translation elongation factor binding [GO:0061770]",GO:0003677; GO:0005634; GO:0005654; GO:0005815; GO:0005829; GO:0006281; GO:0006355; GO:0016071; GO:0022414; GO:0043226; GO:0048856; GO:0065003; GO:0140013; GO:0140110,DNA binding; nucleus; nucleoplasm; microtubule organizing center; cytosol; DNA repair; regulation of DNA-templated transcription; mRNA metabolic process; reproductive process; organelle; anatomical structure development; protein-containing complex assembly; meiotic nuclear division; transcription regulator activity
OG_08355,1.1814882286721695,FUN_036899-T1,Peve_00018371,Pocillopora_meandrina_HIv1___RNAseq.g26703.t1,three_way,78.23133333333332,FUN_036899-T1,Q8VZ42,,,,,40.3,129.0,1.3e-25,117.5,sp|Q8VZ42|SAP11_ARATH Zinc finger AN1 and C2H2 domain-containing stress-associated protein 11 OS=Arabidopsis thaliana OX=3702 GN=SAP11 PE=2 SV=1,,,,,,
OG_08984,1.091539177610362,FUN_038503-T1,Peve_00041694,Pocillopora_meandrina_HIv1___RNAseq.g28159.t1,three_way,62.70366666666667,,,,,,,,,,,,,,,,,
OG_09472,1.201364721927228,FUN_041498-T1,Peve_00007700,Pocillopora_meandrina_HIv1___TS.g10682.t1,three_way,80.48866666666666,FUN_041498-T1,Q6Q2B2,,,,,39.5,253.0,1.1e-33,145.6,sp|Q6Q2B2|MBN2A_TAKRU Muscleblind-like protein 2a OS=Takifugu rubripes OX=31033 GN=mbnl2a PE=2 SV=1,,,,,,
