group_id,Component_3,apul,peve,ptua,type,avg_identity,query,accession,id,reviewed,protein_name,organism,pident,length,evalue,bitscore,title,go_ids,go_bp,go_cc,go_mf,goslim_ids,goslim_names
OG_02666,2.0783128322503623,FUN_010885-T1,Peve_00035837,Pocillopora_meandrina_HIv1___RNAseq.g21004.t1,three_way,46.05866666666667,FUN_010885-T1,Q5VXM1,,,,,36.7,109.0,4e-09,64.7,sp|Q5VXM1|CDCP2_HUMAN CUB domain-containing protein 2 OS=Homo sapiens OX=9606 GN=CDCP2 PE=2 SV=2,,,,,,
OG_01941,2.077916874790985,FUN_007993-T1,Peve_00018053,Pocillopora_meandrina_HIv1___RNAseq.g5090.t1,three_way,42.72566666666666,FUN_007993-T1,Q96RW7,HMCN1_HUMAN,,Hemicentin-1 (Fibulin-6) (FIBL-6),Homo sapiens (Human),25.9,587.0,7.1e-39,163.7,sp|Q96RW7|HMCN1_HUMAN Hemicentin-1 OS=Homo sapiens OX=9606 GN=HMCN1 PE=1 SV=2,GO:0005201; GO:0005509; GO:0005604; GO:0005737; GO:0005912; GO:0005927; GO:0005938; GO:0007156; GO:0007157; GO:0007601; GO:0009617; GO:0030036; GO:0032154; GO:0051301; GO:0062023; GO:0070062; GO:0071711,actin cytoskeleton organization [GO:0030036]; basement membrane organization [GO:0071711]; cell division [GO:0051301]; heterophilic cell-cell adhesion via plasma membrane cell adhesion molecules [GO:0007157]; homophilic cell adhesion via plasma membrane adhesion molecules [GO:0007156]; response to bacterium [GO:0009617]; visual perception [GO:0007601],adherens junction [GO:0005912]; basement membrane [GO:0005604]; cell cortex [GO:0005938]; cleavage furrow [GO:0032154]; collagen-containing extracellular matrix [GO:0062023]; cytoplasm [GO:0005737]; extracellular exosome [GO:0070062]; muscle tendon junction [GO:0005927],calcium ion binding [GO:0005509]; extracellular matrix structural constituent [GO:0005201],GO:0005198; GO:0007010; GO:0007155; GO:0030198; GO:0030312; GO:0031012; GO:0043226; GO:0050877,structural molecule activity; cytoskeleton organization; cell adhesion; extracellular matrix organization; external encapsulating structure; extracellular matrix; organelle; nervous system process
OG_04635,2.0749629155933813,FUN_022357-T1,Peve_00021682,Pocillopora_meandrina_HIv1___RNAseq.g4585.t1,three_way,74.13533333333334,FUN_022357-T1,P55011,S12A2_HUMAN,,Solute carrier family 12 member 2 (Basolateral Na-K-Cl symporter) (Bumetanide-sensitive sodium-(potassium)-chloride cotransporter 2) (BSC2) (Na-K-2Cl cotransporter 1) (hNKCC1),Homo sapiens (Human),45.9,1014.0,4e-238,826.2,sp|P55011|S12A2_HUMAN Solute carrier family 12 member 2 OS=Homo sapiens OX=9606 GN=SLC12A2 PE=1 SV=1,GO:0005886; GO:0006811; GO:0006883; GO:0006884; GO:0006972; GO:0007214; GO:0008511; GO:0008519; GO:0009925; GO:0010818; GO:0015079; GO:0015377; GO:0016020; GO:0016323; GO:0016324; GO:0016328; GO:0019901; GO:0030007; GO:0030321; GO:0030644; GO:0030659; GO:0031253; GO:0035633; GO:0035725; GO:0035865; GO:0042995; GO:0043005; GO:0043025; GO:0044297; GO:0044298; GO:0045795; GO:0046873; GO:0051087; GO:0051879; GO:0055064; GO:0055075; GO:0055078; GO:0061044; GO:0070062; GO:0070634; GO:0071944; GO:0072488; GO:0098658; GO:0098659; GO:0098719; GO:0150003; GO:0150104; GO:1902476; GO:1903561; GO:1904450; GO:1904464; GO:1990573; GO:1990869,ammonium transmembrane transport [GO:0072488]; cell volume homeostasis [GO:0006884]; cellular response to chemokine [GO:1990869]; cellular response to potassium ion [GO:0035865]; chloride ion homeostasis [GO:0055064]; chloride transmembrane transport [GO:1902476]; gamma-aminobutyric acid signaling pathway [GO:0007214]; hyperosmotic response [GO:0006972]; inorganic anion import across plasma membrane [GO:0098658]; inorganic cation import across plasma membrane [GO:0098659]; intracellular chloride ion homeostasis [GO:0030644]; intracellular potassium ion homeostasis [GO:0030007]; intracellular sodium ion homeostasis [GO:0006883]; maintenance of blood-brain barrier [GO:0035633]; monoatomic ion transport [GO:0006811]; negative regulation of vascular wound healing [GO:0061044]; positive regulation of aspartate secretion [GO:1904450]; positive regulation of cell volume [GO:0045795]; potassium ion homeostasis [GO:0055075]; potassium ion import across plasma membrane [GO:1990573]; regulation of matrix metallopeptidase secretion [GO:1904464]; regulation of spontaneous synaptic transmission [GO:0150003]; sodium ion homeostasis [GO:0055078]; sodium ion import across plasma membrane [GO:0098719]; sodium ion transmembrane transport [GO:0035725]; T cell chemotaxis [GO:0010818]; transepithelial ammonium transport [GO:0070634]; transepithelial chloride transport [GO:0030321]; transport across blood-brain barrier [GO:0150104],apical plasma membrane [GO:0016324]; basal plasma membrane [GO:0009925]; basolateral plasma membrane [GO:0016323]; cell body [GO:0044297]; cell body membrane [GO:0044298]; cell periphery [GO:0071944]; cell projection [GO:0042995]; cell projection membrane [GO:0031253]; cytoplasmic vesicle membrane [GO:0030659]; extracellular exosome [GO:0070062]; extracellular vesicle [GO:1903561]; lateral plasma membrane [GO:0016328]; membrane [GO:0016020]; neuron projection [GO:0043005]; neuronal cell body [GO:0043025]; plasma membrane [GO:0005886],ammonium channel activity [GO:0008519]; chloride:monoatomic cation symporter activity [GO:0015377]; Hsp90 protein binding [GO:0051879]; metal ion transmembrane transporter activity [GO:0046873]; potassium ion transmembrane transporter activity [GO:0015079]; protein kinase binding [GO:0019901]; protein-folding chaperone binding [GO:0051087]; sodium:potassium:chloride symporter activity [GO:0008511],GO:0002376; GO:0003013; GO:0005215; GO:0005886; GO:0023052; GO:0043226; GO:0048870; GO:0055085,immune system process; circulatory system process; transporter activity; plasma membrane; signaling; organelle; cell motility; transmembrane transport
OG_10099,2.072943761595952,FUN_043435-T1,Peve_00028842,Pocillopora_meandrina_HIv1___RNAseq.g7834.t1,three_way,66.19233333333334,FUN_043435-T1,Q9WU63,,,,,37.7,151.0,4.9e-23,110.5,sp|Q9WU63|HEBP2_MOUSE Heme-binding protein 2 OS=Mus musculus OX=10090 GN=Hebp2 PE=1 SV=1,,,,,,
OG_05457,2.0718094418063946,FUN_024418-T1,Peve_00029260,Pocillopora_meandrina_HIv1___RNAseq.g18720.t1,three_way,74.32566666666666,FUN_024418-T1,Q98SN7,,,,,55.1,345.0,5e-110,399.4,sp|Q98SN7|WNT2B_CHICK Protein Wnt-2b OS=Gallus gallus OX=9031 GN=WNT2B PE=1 SV=1,,,,,,
OG_09120,2.068427582744821,FUN_039266-T1,Peve_00002772,Pocillopora_meandrina_HIv1___RNAseq.g13577.t1,three_way,76.14266666666667,FUN_039266-T1,P12394,,,,,43.7,462.0,3.8999999999999998e-109,396.7,"sp|P12394|CP17A_CHICK Steroid 17-alpha-hydroxylase/17,20 lyase OS=Gallus gallus OX=9031 GN=CYP17A1 PE=2 SV=1",,,,,,
OG_07286,2.0663185266524517,FUN_033666-T1,Peve_00006805,Pocillopora_meandrina_HIv1___RNAseq.g28824.t1,three_way,56.083,,,,,,,,,,,,,,,,,
OG_03558,2.059610596444023,FUN_014704-T1,Peve_00021212,Pocillopora_meandrina_HIv1___RNAseq.g22535.t1,three_way,50.87083333333333,,,,,,,,,,,,,,,,,
OG_04336,2.0589007432912987,FUN_017948-T1,Peve_00000381,Pocillopora_meandrina_HIv1___RNAseq.g25232.t1,three_way,82.87233333333333,,,,,,,,,,,,,,,,,
OG_08903,2.056064515996815,FUN_038332-T1,Peve_00023107,Pocillopora_meandrina_HIv1___RNAseq.g1118.t1,three_way,64.6005,FUN_038332-T1,Q6ZPJ0,,,,,28.1,720.0,3.7e-42,175.3,sp|Q6ZPJ0|TEX2_MOUSE Testis-expressed protein 2 OS=Mus musculus OX=10090 GN=Tex2 PE=1 SV=2,,,,,,
OG_08392,2.050694237212291,FUN_037004-T1,Peve_00002158,Pocillopora_meandrina_HIv1___RNAseq.g26681.t1,three_way,58.53766666666667,FUN_037004-T1,P98063,BMP1_MOUSE,,Bone morphogenetic protein 1 (BMP-1) (EC 3.4.24.19) (Mammalian tolloid protein) (mTld) (Procollagen C-proteinase) (PCP),Mus musculus (Mouse),35.2,267.0,1.5999999999999998e-41,172.9,sp|P98063|BMP1_MOUSE Bone morphogenetic protein 1 OS=Mus musculus OX=10090 GN=Bmp1 PE=1 SV=2,GO:0001503; GO:0004222; GO:0005125; GO:0005509; GO:0005615; GO:0005794; GO:0006508; GO:0008083; GO:0008233; GO:0008270; GO:0030154; GO:0031982; GO:0042802; GO:0051216; GO:0061036; GO:0062023,cartilage development [GO:0051216]; cell differentiation [GO:0030154]; ossification [GO:0001503]; positive regulation of cartilage development [GO:0061036]; proteolysis [GO:0006508],collagen-containing extracellular matrix [GO:0062023]; extracellular space [GO:0005615]; Golgi apparatus [GO:0005794]; vesicle [GO:0031982],calcium ion binding [GO:0005509]; cytokine activity [GO:0005125]; growth factor activity [GO:0008083]; identical protein binding [GO:0042802]; metalloendopeptidase activity [GO:0004222]; peptidase activity [GO:0008233]; zinc ion binding [GO:0008270],GO:0003824; GO:0005615; GO:0005794; GO:0016787; GO:0030154; GO:0043226; GO:0048018; GO:0048856; GO:0098772; GO:0140096,"catalytic activity; extracellular space; Golgi apparatus; hydrolase activity; cell differentiation; organelle; receptor ligand activity; anatomical structure development; molecular function regulator activity; catalytic activity, acting on a protein"
OG_01092,2.046653287827615,FUN_004588-T1,Peve_00012396,Pocillopora_meandrina_HIv1___RNAseq.g6598.t1,three_way,60.343833333333336,,,,,,,,,,,,,,,,,
OG_03061,2.03947367780898,FUN_012325-T1,Peve_00022885,Pocillopora_meandrina_HIv1___RNAseq.g23751.t1,three_way,82.00566666666667,FUN_012325-T1,Q8R3S2,TSN33_MOUSE,,Tetraspanin-33 (Tspan-33) (Penumbra) (mPen) (Proerythroblast new membrane),Mus musculus (Mouse),45.7,258.0,7.699999999999999e-56,218.8,sp|Q8R3S2|TSN33_MOUSE Tetraspanin-33 OS=Mus musculus OX=10090 GN=Tspan33 PE=1 SV=1,GO:0005737; GO:0005912; GO:0009986; GO:0019899; GO:0046930; GO:0046931; GO:0051604; GO:0072659; GO:0097197,pore complex assembly [GO:0046931]; protein localization to plasma membrane [GO:0072659]; protein maturation [GO:0051604],adherens junction [GO:0005912]; cell surface [GO:0009986]; cytoplasm [GO:0005737]; pore complex [GO:0046930]; tetraspanin-enriched microdomain [GO:0097197],enzyme binding [GO:0019899],GO:0051604; GO:0065003; GO:0072659,protein maturation; protein-containing complex assembly; protein localization to plasma membrane
OG_03845,2.035336794405181,FUN_015318-T1,Peve_00023982,Pocillopora_meandrina_HIv1___RNAseq.g21728.t1,three_way,82.93366666666667,FUN_015318-T1,Q5QNI2,,,,,31.0,532.0,4.7999999999999997e-54,213.8,sp|Q5QNI2|NCL1_ORYSJ Sodium/calcium exchanger NCL1 OS=Oryza sativa subsp. japonica OX=39947 GN=NCL1 PE=2 SV=1,,,,,,
OG_04170,2.0273048873817148,FUN_016651-T1,Peve_00042780,Pocillopora_meandrina_HIv1___TS.g6961.t1,three_way,81.653,FUN_016651-T1,Q6TMK4,POXA_DICDI,,Peroxinectin A (EC 1.11.1.7),Dictyostelium discoideum (Social amoeba),34.7,521.0,3.3e-86,322.0,sp|Q6TMK4|POXA_DICDI Peroxinectin A OS=Dictyostelium discoideum OX=44689 GN=poxA PE=1 SV=1,GO:0004447; GO:0004601; GO:0005576; GO:0005783; GO:0006955; GO:0006979; GO:0020037; GO:0036393; GO:0042742; GO:0042744; GO:0140825,defense response to bacterium [GO:0042742]; hydrogen peroxide catabolic process [GO:0042744]; immune response [GO:0006955]; response to oxidative stress [GO:0006979],endoplasmic reticulum [GO:0005783]; extracellular region [GO:0005576],heme binding [GO:0020037]; iodide peroxidase activity [GO:0004447]; lactoperoxidase activity [GO:0140825]; peroxidase activity [GO:0004601]; thiocyanate peroxidase activity [GO:0036393],GO:0002376; GO:0003824; GO:0005576; GO:0005783; GO:0016209; GO:0016491; GO:0043226,immune system process; catalytic activity; extracellular region; endoplasmic reticulum; antioxidant activity; oxidoreductase activity; organelle
OG_10157,2.023556291778309,FUN_043552-T1,Peve_00009534,Pocillopora_meandrina_HIv1___RNAseq.g8003.t1,three_way,72.05633333333333,,,,,,,,,,,,,,,,,
OG_07470,2.015404917393857,FUN_033980-T1,Peve_00004847,Pocillopora_meandrina_HIv1___RNAseq.g26110.t1,three_way,64.06066666666666,FUN_033980-T1,Q1EHB4,SC5AC_HUMAN,,Sodium-coupled monocarboxylate transporter 2 (Electroneutral sodium monocarboxylate cotransporter) (Low-affinity sodium-lactate cotransporter) (Solute carrier family 5 member 12),Homo sapiens (Human),34.5,560.0,3.3e-86,320.9,sp|Q1EHB4|SC5AC_HUMAN Sodium-coupled monocarboxylate transporter 2 OS=Homo sapiens OX=9606 GN=SLC5A12 PE=1 SV=2,GO:0005343; GO:0005654; GO:0005886; GO:0006811; GO:0006814; GO:0015129; GO:0015293; GO:0015718; GO:0016324; GO:0070062; GO:0140161,monoatomic ion transport [GO:0006811]; monocarboxylic acid transport [GO:0015718]; sodium ion transport [GO:0006814],apical plasma membrane [GO:0016324]; extracellular exosome [GO:0070062]; nucleoplasm [GO:0005654]; plasma membrane [GO:0005886],lactate transmembrane transporter activity [GO:0015129]; monocarboxylate:sodium symporter activity [GO:0140161]; organic acid:sodium symporter activity [GO:0005343]; symporter activity [GO:0015293],GO:0005215; GO:0005654; GO:0005886; GO:0043226,transporter activity; nucleoplasm; plasma membrane; organelle
OG_02602,2.0140083646426,FUN_010728-T1,Peve_00038973,Pocillopora_meandrina_HIv1___RNAseq.g20945.t1,three_way,73.28566666666667,FUN_010728-T1,Q503V9,,,,,57.0,186.0,2.6e-54,213.4,sp|Q503V9|ENDUB_DANRE Uridylate-specific endoribonuclease B OS=Danio rerio OX=7955 GN=endoub PE=2 SV=1,,,,,,
OG_04747,2.0130174610700826,FUN_022630-T1,Peve_00012283,Pocillopora_meandrina_HIv1___RNAseq.g2910.t1,three_way,68.43933333333334,FUN_022630-T1,P07228,,,,,38.2,815.0,1.2e-144,515.4,sp|P07228|ITB1_CHICK Integrin beta-1 OS=Gallus gallus OX=9031 GN=ITGB1 PE=1 SV=1,,,,,,
OG_05854,2.008573760611009,FUN_025929-T1,Peve_00027749,Pocillopora_meandrina_HIv1___RNAseq.g10531.t1,three_way,67.36683333333333,FUN_025929-T1,Q6NUT3,MFS12_HUMAN,,Major facilitator superfamily domain-containing protein 12,Homo sapiens (Human),33.6,529.0,5.6e-76,287.0,sp|Q6NUT3|MFS12_HUMAN Major facilitator superfamily domain-containing protein 12 OS=Homo sapiens OX=9606 GN=MFSD12 PE=1 SV=2,GO:0005764; GO:0005765; GO:0005770; GO:0005886; GO:0008643; GO:0015293; GO:0033162; GO:0033229; GO:0042438; GO:0042470; GO:0043474; GO:0048021; GO:0048022; GO:1903712,carbohydrate transport [GO:0008643]; cysteine transmembrane transport [GO:1903712]; melanin biosynthetic process [GO:0042438]; negative regulation of melanin biosynthetic process [GO:0048022]; pigment metabolic process involved in pigmentation [GO:0043474]; regulation of melanin biosynthetic process [GO:0048021],late endosome [GO:0005770]; lysosomal membrane [GO:0005765]; lysosome [GO:0005764]; melanosome [GO:0042470]; melanosome membrane [GO:0033162]; plasma membrane [GO:0005886],cysteine transmembrane transporter activity [GO:0033229]; symporter activity [GO:0015293],GO:0005215; GO:0005764; GO:0005768; GO:0005773; GO:0005886; GO:0031410; GO:0043226; GO:0055085,transporter activity; lysosome; endosome; vacuole; plasma membrane; cytoplasmic vesicle; organelle; transmembrane transport
OG_07344,2.0078214835796038,FUN_033751-T1,Peve_00004933,Pocillopora_meandrina_HIv1___TS.g8542.t1,three_way,79.90966666666667,FUN_033751-T1,O95461,,,,,60.2,689.0,6.4e-254,878.2,sp|O95461|LARG1_HUMAN Xylosyl- and glucuronyltransferase LARGE1 OS=Homo sapiens OX=9606 GN=LARGE1 PE=1 SV=1,,,,,,
OG_00252,2.0073347950353635,FUN_001016-T1,Peve_00041043,Pocillopora_meandrina_HIv1___RNAseq.g29160.t1,three_way,48.55133333333333,FUN_001016-T1,Q0IHU9,,,,,42.9,203.0,7.6e-44,180.6,sp|Q0IHU9|PRUN2_XENTR Protein prune homolog 2 OS=Xenopus tropicalis OX=8364 GN=Prune2 PE=2 SV=1,,,,,,
OG_05731,2.005667385055843,FUN_025657-T1,Peve_00042176,Pocillopora_meandrina_HIv1___RNAseq.g23075.t1,three_way,71.07683333333333,FUN_025657-T1,P17863,,,,,33.1,341.0,1.1e-45,186.4,sp|P17863|SKI_AVIES Transforming protein Ski OS=Avian erythroblastosis virus (strain Sloan-Kettering) OX=11862 GN=V-SKI PE=1 SV=1,,,,,,
OG_04610,2.0017355671652317,FUN_022307-T1,Peve_00021671,Pocillopora_meandrina_HIv1___RNAseq.g4623.t1,three_way,86.57633333333334,FUN_022307-T1,Q8VEE0,,,,,65.1,212.0,1e-75,284.6,sp|Q8VEE0|RPE_MOUSE Ribulose-phosphate 3-epimerase OS=Mus musculus OX=10090 GN=Rpe PE=1 SV=1,,,,,,
OG_03147,1.99924405923186,FUN_012533-T1,Peve_00034230,Pocillopora_meandrina_HIv1___RNAseq.g23954.t1,three_way,57.28066666666667,,,,,,,,,,,,,,,,,
OG_05757,1.9985969280682947,FUN_025692-T1,Peve_00005578,Pocillopora_meandrina_HIv1___RNAseq.g13161.t2,three_way,54.39333333333333,,,,,,,,,,,,,,,,,
OG_09789,1.995773740163322,FUN_042591-T1,Peve_00012673,Pocillopora_meandrina_HIv1___RNAseq.g16869.t1,three_way,79.75733333333334,FUN_042591-T1,Q87PP5,,,,,36.3,535.0,8.499999999999999e-92,339.7,sp|Q87PP5|BCCT1_VIBPA Glycine betaine/proline/choline/ectoine transporter VP1456 OS=Vibrio parahaemolyticus serotype O3:K6 (strain RIMD 2210633) OX=223926 GN=VP1456 PE=1 SV=1,,,,,,
OG_10067,1.9926696568935505,FUN_043371-T1,Peve_00004903,Pocillopora_meandrina_HIv1___RNAseq.g8976.t1,three_way,72.36966666666666,FUN_043371-T1,Q8VHQ9,ACO11_MOUSE,,Acyl-coenzyme A thioesterase 11 (Acyl-CoA thioesterase 11) (EC 3.1.2.-) (Acyl-CoA thioester hydrolase 11) (Adipose-associated thioesterase) (Brown fat-inducible thioesterase) (BFIT) (Palmitoyl-coenzyme A thioesterase) (EC 3.1.2.2),Mus musculus (Mouse),44.0,550.0,4.4e-114,413.3,sp|Q8VHQ9|ACO11_MOUSE Acyl-coenzyme A thioesterase 11 OS=Mus musculus OX=10090 GN=Acot11 PE=1 SV=1,GO:0005737; GO:0005759; GO:0005829; GO:0006631; GO:0008289; GO:0009266; GO:0009409; GO:0035556; GO:0047617; GO:0052689; GO:0052816; GO:0120163,fatty acid metabolic process [GO:0006631]; intracellular signal transduction [GO:0035556]; negative regulation of cold-induced thermogenesis [GO:0120163]; response to cold [GO:0009409]; response to temperature stimulus [GO:0009266],cytoplasm [GO:0005737]; cytosol [GO:0005829]; mitochondrial matrix [GO:0005759],carboxylic ester hydrolase activity [GO:0052689]; fatty acyl-CoA hydrolase activity [GO:0047617]; lipid binding [GO:0008289]; long-chain fatty acyl-CoA hydrolase activity [GO:0052816],GO:0003824; GO:0005829; GO:0006629; GO:0008289; GO:0016787,catalytic activity; cytosol; lipid metabolic process; lipid binding; hydrolase activity
OG_08614,1.991271540175359,FUN_037761-T1,Peve_00014333,Pocillopora_meandrina_HIv1___RNAseq.g1495.t2a,three_way,37.405,,,,,,,,,,,,,,,,,
OG_07103,1.9889248700783548,FUN_032365-T1,Peve_00020147,Pocillopora_meandrina_HIv1___RNAseq.g29821.t1,three_way,68.24633333333333,FUN_032365-T1,Q2KIA4,SCD5_BOVIN,,Stearoyl-CoA desaturase 5 (EC 1.14.19.1) (Acyl-CoA-desaturase 4) (Stearoyl-CoA 9-desaturase),Bos taurus (Bovine),56.5,283.0,1.6e-100,367.5,sp|Q2KIA4|SCD5_BOVIN Stearoyl-CoA desaturase 5 OS=Bos taurus OX=9913 GN=SCD5 PE=2 SV=1,GO:0004768; GO:0005506; GO:0005789; GO:0006636; GO:0016491,unsaturated fatty acid biosynthetic process [GO:0006636],endoplasmic reticulum membrane [GO:0005789],iron ion binding [GO:0005506]; oxidoreductase activity [GO:0016491]; stearoyl-CoA 9-desaturase activity [GO:0004768],GO:0003824; GO:0006629; GO:0016491,catalytic activity; lipid metabolic process; oxidoreductase activity
OG_00403,1.9840086688731533,FUN_001290-T1,Peve_00037014,Pocillopora_meandrina_HIv1___TS.g4708.t1b,three_way,90.79066666666668,FUN_001290-T1,P10860,DHE3_RAT,,"Glutamate dehydrogenase 1, mitochondrial (GDH 1) (EC 1.4.1.3) (Memory-related gene 2 protein) (MRG-2)",Rattus norvegicus (Rat),65.2,500.0,6.2e-198,691.8,"sp|P10860|DHE3_RAT Glutamate dehydrogenase 1, mitochondrial OS=Rattus norvegicus OX=10116 GN=Glud1 PE=1 SV=2",GO:0004352; GO:0004353; GO:0004354; GO:0005524; GO:0005525; GO:0005737; GO:0005739; GO:0005759; GO:0005783; GO:0006537; GO:0006538; GO:0006541; GO:0007616; GO:0010044; GO:0019899; GO:0021549; GO:0032024; GO:0042803; GO:0043531; GO:0070403; GO:0070728; GO:0072350,cerebellum development [GO:0021549]; glutamate biosynthetic process [GO:0006537]; glutamate catabolic process [GO:0006538]; glutamine metabolic process [GO:0006541]; long-term memory [GO:0007616]; positive regulation of insulin secretion [GO:0032024]; response to aluminum ion [GO:0010044]; tricarboxylic acid metabolic process [GO:0072350],cytoplasm [GO:0005737]; endoplasmic reticulum [GO:0005783]; mitochondrial matrix [GO:0005759]; mitochondrion [GO:0005739],ADP binding [GO:0043531]; ATP binding [GO:0005524]; enzyme binding [GO:0019899]; glutamate dehydrogenase (NAD+) activity [GO:0004352]; glutamate dehydrogenase (NADP+) activity [GO:0004354]; glutamate dehydrogenase [NAD(P)+] activity [GO:0004353]; GTP binding [GO:0005525]; L-leucine binding [GO:0070728]; NAD+ binding [GO:0070403]; protein homodimerization activity [GO:0042803],GO:0003824; GO:0005739; GO:0005783; GO:0006520; GO:0016491; GO:0043226; GO:0048856; GO:0050877,catalytic activity; mitochondrion; endoplasmic reticulum; amino acid metabolic process; oxidoreductase activity; organelle; anatomical structure development; nervous system process
OG_05400,1.9793793300684663,FUN_024330-T1,Peve_00016319,Pocillopora_meandrina_HIv1___RNAseq.g18926.t1,three_way,76.277,FUN_024330-T1,O89023,TPP1_MOUSE,,Tripeptidyl-peptidase 1 (TPP-1) (EC 3.4.14.9) (Lysosomal pepstatin-insensitive protease) (LPIC) (Tripeptidyl aminopeptidase) (Tripeptidyl-peptidase I) (TPP-I),Mus musculus (Mouse),50.2,562.0,2.3e-155,550.4,sp|O89023|TPP1_MOUSE Tripeptidyl-peptidase 1 OS=Mus musculus OX=10090 GN=Tpp1 PE=1 SV=2,GO:0004175; GO:0004252; GO:0005739; GO:0005764; GO:0005794; GO:0006508; GO:0007040; GO:0007399; GO:0008233; GO:0008236; GO:0008240; GO:0030855; GO:0035727; GO:0042470; GO:0043171; GO:0045121; GO:0045453; GO:0046872; GO:0050885; GO:0055037; GO:0070198; GO:0120146; GO:1905146,"bone resorption [GO:0045453]; epithelial cell differentiation [GO:0030855]; lysosomal protein catabolic process [GO:1905146]; lysosome organization [GO:0007040]; nervous system development [GO:0007399]; neuromuscular process controlling balance [GO:0050885]; peptide catabolic process [GO:0043171]; protein localization to chromosome, telomeric region [GO:0070198]; proteolysis [GO:0006508]",Golgi apparatus [GO:0005794]; lysosome [GO:0005764]; melanosome [GO:0042470]; membrane raft [GO:0045121]; mitochondrion [GO:0005739]; recycling endosome [GO:0055037],endopeptidase activity [GO:0004175]; lysophosphatidic acid binding [GO:0035727]; metal ion binding [GO:0046872]; peptidase activity [GO:0008233]; serine-type endopeptidase activity [GO:0004252]; serine-type peptidase activity [GO:0008236]; sulfatide binding [GO:0120146]; tripeptidyl-peptidase activity [GO:0008240],GO:0003824; GO:0005739; GO:0005764; GO:0005768; GO:0005773; GO:0005794; GO:0007040; GO:0008289; GO:0016787; GO:0030154; GO:0030163; GO:0031410; GO:0043226; GO:0048856; GO:0050877; GO:0140096,"catalytic activity; mitochondrion; lysosome; endosome; vacuole; Golgi apparatus; lysosome organization; lipid binding; hydrolase activity; cell differentiation; protein catabolic process; cytoplasmic vesicle; organelle; anatomical structure development; nervous system process; catalytic activity, acting on a protein"
OG_06154,1.9774276582993933,FUN_027987-T1,Peve_00023127,Pocillopora_meandrina_HIv1___RNAseq.g14022.t1,three_way,64.95433333333334,,,,,,,,,,,,,,,,,
OG_05874,1.977200590713448,FUN_026023-T1,Peve_00026728,Pocillopora_meandrina_HIv1___RNAseq.g10495.t1,three_way,61.43916666666667,FUN_026023-T1,Q91717,,,,,31.0,277.0,2.3e-26,123.6,sp|Q91717|CO2A1_XENLA Collagen alpha-1(II) chain OS=Xenopus laevis OX=8355 GN=col2a1 PE=2 SV=2,,,,,,
OG_08937,1.9743566690139005,FUN_038401-T1,Peve_00000033,Pocillopora_meandrina_HIv1___RNAseq.g28276.t1,three_way,76.06083333333333,FUN_038401-T1,Q9BG91,,,,,65.5,148.0,5e-50,200.3,sp|Q9BG91|SOX9_CALJA Transcription factor SOX-9 OS=Callithrix jacchus OX=9483 GN=SOX9 PE=2 SV=1,,,,,,
OG_01437,1.974123696141945,FUN_005873-T1,Peve_00015756,Pocillopora_meandrina_HIv1___RNAseq.g19664.t1,three_way,58.21833333333333,,,,,,,,,,,,,,,,,
