group_id,Component_3,apul,peve,ptua,type,avg_identity,query,accession,id,reviewed,protein_name,organism,pident,length,evalue,bitscore,title,go_ids,go_bp,go_cc,go_mf,goslim_ids,goslim_names
OG_05809,3.4999793852197176,FUN_025809-T2,Peve_00017944,Pocillopora_meandrina_HIv1___TS.g19642.t2,three_way,56.2395,FUN_025809-T2,Q08EN7,,,,,29.7,286.0,1.6e-26,122.5,sp|Q08EN7|ZCPW2_MOUSE Zinc finger CW-type PWWP domain protein 2 homolog OS=Mus musculus OX=10090 GN=Zcwpw2 PE=2 SV=2,,,,,,
OG_02929,3.3291470715894533,FUN_012028-T1,Peve_00030379,Pocillopora_meandrina_HIv1___RNAseq.g24047.t2,three_way,77.09433333333334,FUN_012028-T1,Q14192,FHL2_HUMAN,,Four and a half LIM domains protein 2 (FHL-2) (LIM domain protein DRAL) (Skeletal muscle LIM-protein 3) (SLIM-3),Homo sapiens (Human),42.1,273.0,1.7000000000000002e-74,282.0,sp|Q14192|FHL2_HUMAN Four and a half LIM domains protein 2 OS=Homo sapiens OX=9606 GN=FHL2 PE=1 SV=3,GO:0000122; GO:0001649; GO:0003714; GO:0005634; GO:0005654; GO:0005925; GO:0008134; GO:0008270; GO:0009725; GO:0030018; GO:0042802; GO:0043066; GO:0043425; GO:0055014; GO:0055015; GO:0060347; GO:0070885,atrial cardiac muscle cell development [GO:0055014]; heart trabecula formation [GO:0060347]; negative regulation of apoptotic process [GO:0043066]; negative regulation of calcineurin-NFAT signaling cascade [GO:0070885]; negative regulation of transcription by RNA polymerase II [GO:0000122]; osteoblast differentiation [GO:0001649]; response to hormone [GO:0009725]; ventricular cardiac muscle cell development [GO:0055015],focal adhesion [GO:0005925]; nucleoplasm [GO:0005654]; nucleus [GO:0005634]; Z disc [GO:0030018],bHLH transcription factor binding [GO:0043425]; identical protein binding [GO:0042802]; transcription corepressor activity [GO:0003714]; transcription factor binding [GO:0008134]; zinc ion binding [GO:0008270],GO:0005634; GO:0005654; GO:0006355; GO:0030154; GO:0043226; GO:0048856; GO:0060090; GO:0140110,nucleus; nucleoplasm; regulation of DNA-templated transcription; cell differentiation; organelle; anatomical structure development; molecular adaptor activity; transcription regulator activity
OG_02090,3.1438316092331005,FUN_008328-T1,Peve_00040489,Pocillopora_meandrina_HIv1___TS.g24166.t1,three_way,48.269666666666666,FUN_008328-T1,B3EWY9,,,,,39.3,990.0,2.1999999999999998e-166,589.3,sp|B3EWY9|MLP_ACRMI Mucin-like protein (Fragment) OS=Acropora millepora OX=45264 PE=1 SV=1,,,,,,
OG_01177,2.984158261486495,FUN_004816-T1,Peve_00023831,Pocillopora_meandrina_HIv1___RNAseq.g8574.t1,three_way,59.54533333333333,FUN_004816-T1,Q25490,,,,,22.5,1034.0,1.1999999999999999e-35,155.2,sp|Q25490|APLP_MANSE Apolipophorins OS=Manduca sexta OX=7130 PE=2 SV=1,,,,,,
OG_03671,2.8798959977777803,FUN_014916-T1,Peve_00003523,Pocillopora_meandrina_HIv1___RNAseq.g21079.t1,three_way,45.37166666666666,FUN_014916-T1,P00919,,,,,41.5,253.0,1.2e-44,183.0,sp|P00919|CAH2_RABIT Carbonic anhydrase 2 OS=Oryctolagus cuniculus OX=9986 GN=CA2 PE=1 SV=3,,,,,,
OG_09806,2.859341841409678,FUN_042624-T1,Peve_00016197,Pocillopora_meandrina_HIv1___RNAseq.g11511.t1,three_way,48.837833333333336,FUN_042624-T1,E9Q414,APOB_MOUSE,,Apolipoprotein B-100 (Apo B-100) [Cleaved into: Apolipoprotein B-48 (Apo B-48)],Mus musculus (Mouse),24.7,1102.0,3e-65,254.6,sp|E9Q414|APOB_MOUSE Apolipoprotein B-100 OS=Mus musculus OX=10090 GN=Apob PE=1 SV=1,GO:0001701; GO:0005543; GO:0005576; GO:0005783; GO:0005811; GO:0005829; GO:0006629; GO:0006642; GO:0007283; GO:0007399; GO:0008201; GO:0008203; GO:0009566; GO:0009615; GO:0009791; GO:0010628; GO:0010744; GO:0010886; GO:0016042; GO:0019433; GO:0030301; GO:0030317; GO:0033344; GO:0034359; GO:0034361; GO:0034362; GO:0034363; GO:0034374; GO:0034383; GO:0035473; GO:0042157; GO:0042158; GO:0042159; GO:0042632; GO:0042953; GO:0043025; GO:0045540; GO:0048018; GO:0048844; GO:0050750; GO:0051649; GO:0070971; GO:0071402; GO:0120020,artery morphogenesis [GO:0048844]; cellular response to lipoprotein particle stimulus [GO:0071402]; cholesterol efflux [GO:0033344]; cholesterol homeostasis [GO:0042632]; cholesterol metabolic process [GO:0008203]; cholesterol transport [GO:0030301]; establishment of localization in cell [GO:0051649]; fertilization [GO:0009566]; flagellated sperm motility [GO:0030317]; in utero embryonic development [GO:0001701]; lipid catabolic process [GO:0016042]; lipid metabolic process [GO:0006629]; lipoprotein biosynthetic process [GO:0042158]; lipoprotein catabolic process [GO:0042159]; lipoprotein metabolic process [GO:0042157]; lipoprotein transport [GO:0042953]; low-density lipoprotein particle clearance [GO:0034383]; low-density lipoprotein particle remodeling [GO:0034374]; nervous system development [GO:0007399]; positive regulation of cholesterol storage [GO:0010886]; positive regulation of gene expression [GO:0010628]; positive regulation of macrophage derived foam cell differentiation [GO:0010744]; post-embryonic development [GO:0009791]; regulation of cholesterol biosynthetic process [GO:0045540]; response to virus [GO:0009615]; spermatogenesis [GO:0007283]; triglyceride catabolic process [GO:0019433]; triglyceride mobilization [GO:0006642],cytosol [GO:0005829]; endoplasmic reticulum [GO:0005783]; endoplasmic reticulum exit site [GO:0070971]; extracellular region [GO:0005576]; intermediate-density lipoprotein particle [GO:0034363]; lipid droplet [GO:0005811]; low-density lipoprotein particle [GO:0034362]; mature chylomicron [GO:0034359]; neuronal cell body [GO:0043025]; very-low-density lipoprotein particle [GO:0034361],cholesterol transfer activity [GO:0120020]; heparin binding [GO:0008201]; lipase binding [GO:0035473]; low-density lipoprotein particle receptor binding [GO:0050750]; phospholipid binding [GO:0005543]; receptor ligand activity [GO:0048018],GO:0005215; GO:0005576; GO:0005783; GO:0005811; GO:0005829; GO:0006629; GO:0007018; GO:0008289; GO:0022414; GO:0030163; GO:0043226; GO:0048018; GO:0048856; GO:0048870; GO:0098772,transporter activity; extracellular region; endoplasmic reticulum; lipid droplet; cytosol; lipid metabolic process; microtubule-based movement; lipid binding; reproductive process; protein catabolic process; organelle; receptor ligand activity; anatomical structure development; cell motility; molecular function regulator activity
OG_08842,2.8404100900720306,FUN_038187-T1,Peve_00006347,Pocillopora_meandrina_HIv1___RNAseq.g945.t1,three_way,61.87833333333334,FUN_038187-T1,Q80ZA4,PKHL1_MOUSE,,Fibrocystin-L (Polycystic kidney and hepatic disease 1-like protein 1) (PKHD1-like protein 1) (Protein D86),Mus musculus (Mouse),34.3,4297.0,0.0,2329.7,sp|Q80ZA4|PKHL1_MOUSE Fibrocystin-L OS=Mus musculus OX=10090 GN=Pkhd1l1 PE=1 SV=1,GO:0007605; GO:0032426; GO:0060171; GO:0120234,sensory perception of sound [GO:0007605],stereocilium coat [GO:0120234]; stereocilium membrane [GO:0060171]; stereocilium tip [GO:0032426],,GO:0030312; GO:0050877,external encapsulating structure; nervous system process
OG_08097,2.804384754153629,FUN_035839-T1,Peve_00032500,Pocillopora_meandrina_HIv1___RNAseq.g11958.t2,three_way,68.27866666666667,,,,,,,,,,,,,,,,,
OG_09472,2.799982224954274,FUN_041498-T1,Peve_00007700,Pocillopora_meandrina_HIv1___TS.g10682.t1,three_way,80.48866666666666,FUN_041498-T1,Q6Q2B2,,,,,39.5,253.0,1.1e-33,145.6,sp|Q6Q2B2|MBN2A_TAKRU Muscleblind-like protein 2a OS=Takifugu rubripes OX=31033 GN=mbnl2a PE=2 SV=1,,,,,,
OG_07730,2.76109658865008,FUN_034891-T1,Peve_00037339,Pocillopora_meandrina_HIv1___TS.g15151.t2,three_way,94.67133333333334,FUN_034891-T1,Q13951,,,,,57.1,170.0,1.1e-48,194.5,sp|Q13951|PEBB_HUMAN Core-binding factor subunit beta OS=Homo sapiens OX=9606 GN=CBFB PE=1 SV=2,,,,,,
OG_07731,2.745596518963457,FUN_034892-T1,Peve_00037338,Pocillopora_meandrina_HIv1___TS.g15150.t1,three_way,61.52,,,,,,,,,,,,,,,,,
OG_06998,2.743962625750892,FUN_032147-T1,Peve_00007908,Pocillopora_meandrina_HIv1___RNAseq.g5342.t1,three_way,65.17866666666666,FUN_032147-T1,Q3U435,MMP25_MOUSE,,Matrix metalloproteinase-25 (MMP-25) (EC 3.4.24.-),Mus musculus (Mouse),37.3,566.0,7.6e-77,289.7,sp|Q3U435|MMP25_MOUSE Matrix metalloproteinase-25 OS=Mus musculus OX=10090 GN=Mmp25 PE=2 SV=1,GO:0004222; GO:0005886; GO:0006508; GO:0008270; GO:0009986; GO:0016504; GO:0031012; GO:0060022; GO:0098552,hard palate development [GO:0060022]; proteolysis [GO:0006508],cell surface [GO:0009986]; extracellular matrix [GO:0031012]; plasma membrane [GO:0005886]; side of membrane [GO:0098552],metalloendopeptidase activity [GO:0004222]; peptidase activator activity [GO:0016504]; zinc ion binding [GO:0008270],GO:0003824; GO:0005886; GO:0016787; GO:0030312; GO:0031012; GO:0048856; GO:0098772; GO:0140096,"catalytic activity; plasma membrane; hydrolase activity; external encapsulating structure; extracellular matrix; anatomical structure development; molecular function regulator activity; catalytic activity, acting on a protein"
OG_01645,2.7138814981440547,FUN_006796-T1,Peve_00019185,Pocillopora_meandrina_HIv1___RNAseq.g20496.t1,three_way,33.34466666666667,FUN_006796-T1,Q96RW7,HMCN1_HUMAN,,Hemicentin-1 (Fibulin-6) (FIBL-6),Homo sapiens (Human),28.9,287.0,1.3e-17,92.4,sp|Q96RW7|HMCN1_HUMAN Hemicentin-1 OS=Homo sapiens OX=9606 GN=HMCN1 PE=1 SV=2,GO:0005201; GO:0005509; GO:0005604; GO:0005737; GO:0005912; GO:0005927; GO:0005938; GO:0007156; GO:0007157; GO:0007601; GO:0009617; GO:0030036; GO:0032154; GO:0051301; GO:0062023; GO:0070062; GO:0071711,actin cytoskeleton organization [GO:0030036]; basement membrane organization [GO:0071711]; cell division [GO:0051301]; heterophilic cell-cell adhesion via plasma membrane cell adhesion molecules [GO:0007157]; homophilic cell adhesion via plasma membrane adhesion molecules [GO:0007156]; response to bacterium [GO:0009617]; visual perception [GO:0007601],adherens junction [GO:0005912]; basement membrane [GO:0005604]; cell cortex [GO:0005938]; cleavage furrow [GO:0032154]; collagen-containing extracellular matrix [GO:0062023]; cytoplasm [GO:0005737]; extracellular exosome [GO:0070062]; muscle tendon junction [GO:0005927],calcium ion binding [GO:0005509]; extracellular matrix structural constituent [GO:0005201],GO:0005198; GO:0007010; GO:0007155; GO:0030198; GO:0030312; GO:0031012; GO:0043226; GO:0050877,structural molecule activity; cytoskeleton organization; cell adhesion; extracellular matrix organization; external encapsulating structure; extracellular matrix; organelle; nervous system process
OG_01261,2.694809320437454,FUN_005023-T1,Peve_00028649,Pocillopora_meandrina_HIv1___RNAseq.g8329.t1,three_way,83.2865,FUN_005023-T1,A2BEA6,,,,,62.1,195.0,1.3e-58,228.8,sp|A2BEA6|ARI3A_DANRE AT-rich interactive domain-containing protein 3A OS=Danio rerio OX=7955 GN=arid3a PE=1 SV=1,,,,,,
OG_06132,2.686163359241021,FUN_027938-T2,Peve_00032459,Pocillopora_meandrina_HIv1___RNAseq.g14030.t1,three_way,71.97066666666667,,,,,,,,,,,,,,,,,
OG_08098,2.6719832138473216,FUN_035840-T1,Peve_00032502,Pocillopora_meandrina_HIv1___RNAseq.g11957.t1,three_way,76.54033333333332,FUN_035840-T1,P38532,HSF1_MOUSE,,Heat shock factor protein 1 (HSF 1) (Heat shock transcription factor 1) (HSTF 1),Mus musculus (Mouse),55.7,176.0,1.1e-44,182.6,sp|P38532|HSF1_MOUSE Heat shock factor protein 1 OS=Mus musculus OX=10090 GN=Hsf1 PE=1 SV=2,GO:0000122; GO:0000165; GO:0000776; GO:0000791; GO:0000792; GO:0000978; GO:0001162; GO:0001227; GO:0001228; GO:0001701; GO:0001892; GO:0003677; GO:0003682; GO:0005634; GO:0005654; GO:0005737; GO:0005813; GO:0005829; GO:0006281; GO:0006397; GO:0006952; GO:0007143; GO:0007283; GO:0007584; GO:0008283; GO:0009408; GO:0010628; GO:0010667; GO:0014823; GO:0016605; GO:0019901; GO:0031072; GO:0031333; GO:0031490; GO:0032496; GO:0032720; GO:0032991; GO:0033574; GO:0034605; GO:0034620; GO:0035865; GO:0040018; GO:0042802; GO:0043565; GO:0045120; GO:0045651; GO:0045931; GO:0045944; GO:0046982; GO:0048471; GO:0050673; GO:0050680; GO:0051028; GO:0051879; GO:0060136; GO:0061770; GO:0062029; GO:0065003; GO:0070301; GO:0071222; GO:0071276; GO:0071280; GO:0071392; GO:0071466; GO:0071480; GO:0072738; GO:0090084; GO:0090261; GO:0097165; GO:0097431; GO:0097677; GO:0098847; GO:0101031; GO:0120162; GO:0140296; GO:1900034; GO:1901652; GO:1902512; GO:1903936; GO:1904385; GO:1904843; GO:1904845; GO:1990841; GO:1990904; GO:1990910; GO:1990911; GO:2001033; GO:2001235,cell population proliferation [GO:0008283]; cellular response to angiotensin [GO:1904385]; cellular response to cadmium ion [GO:0071276]; cellular response to copper ion [GO:0071280]; cellular response to diamide [GO:0072738]; cellular response to estradiol stimulus [GO:0071392]; cellular response to gamma radiation [GO:0071480]; cellular response to heat [GO:0034605]; cellular response to hydrogen peroxide [GO:0070301]; cellular response to L-glutamine [GO:1904845]; cellular response to lipopolysaccharide [GO:0071222]; cellular response to nitroglycerin [GO:1904843]; cellular response to potassium ion [GO:0035865]; cellular response to sodium arsenite [GO:1903936]; cellular response to unfolded protein [GO:0034620]; cellular response to xenobiotic stimulus [GO:0071466]; defense response [GO:0006952]; DNA repair [GO:0006281]; embryonic placenta development [GO:0001892]; embryonic process involved in female pregnancy [GO:0060136]; epithelial cell proliferation [GO:0050673]; female meiotic nuclear division [GO:0007143]; in utero embryonic development [GO:0001701]; MAPK cascade [GO:0000165]; mRNA processing [GO:0006397]; mRNA transport [GO:0051028]; negative regulation of cardiac muscle cell apoptotic process [GO:0010667]; negative regulation of double-strand break repair via nonhomologous end joining [GO:2001033]; negative regulation of epithelial cell proliferation [GO:0050680]; negative regulation of inclusion body assembly [GO:0090084]; negative regulation of protein-containing complex assembly [GO:0031333]; negative regulation of transcription by RNA polymerase II [GO:0000122]; negative regulation of tumor necrosis factor production [GO:0032720]; positive regulation of apoptotic DNA fragmentation [GO:1902512]; positive regulation of apoptotic signaling pathway [GO:2001235]; positive regulation of cold-induced thermogenesis [GO:0120162]; positive regulation of gene expression [GO:0010628]; positive regulation of inclusion body assembly [GO:0090261]; positive regulation of macrophage differentiation [GO:0045651]; positive regulation of mitotic cell cycle [GO:0045931]; positive regulation of multicellular organism growth [GO:0040018]; positive regulation of stress granule assembly [GO:0062029]; positive regulation of transcription by RNA polymerase II [GO:0045944]; protein-containing complex assembly [GO:0065003]; regulation of cellular response to heat [GO:1900034]; response to activity [GO:0014823]; response to heat [GO:0009408]; response to hypobaric hypoxia [GO:1990910]; response to lipopolysaccharide [GO:0032496]; response to nutrient [GO:0007584]; response to peptide [GO:1901652]; response to psychosocial stress [GO:1990911]; response to testosterone [GO:0033574]; spermatogenesis [GO:0007283],centrosome [GO:0005813]; cytoplasm [GO:0005737]; cytosol [GO:0005829]; euchromatin [GO:0000791]; heterochromatin [GO:0000792]; kinetochore [GO:0000776]; mitotic spindle pole [GO:0097431]; nuclear stress granule [GO:0097165]; nucleoplasm [GO:0005654]; nucleus [GO:0005634]; perinuclear region of cytoplasm [GO:0048471]; PML body [GO:0016605]; pronucleus [GO:0045120]; protein folding chaperone complex [GO:0101031]; protein-containing complex [GO:0032991]; ribonucleoprotein complex [GO:1990904],"chromatin binding [GO:0003682]; chromatin DNA binding [GO:0031490]; DNA binding [GO:0003677]; DNA-binding transcription activator activity, RNA polymerase II-specific [GO:0001228]; DNA-binding transcription repressor activity, RNA polymerase II-specific [GO:0001227]; general transcription initiation factor binding [GO:0140296]; heat shock protein binding [GO:0031072]; Hsp90 protein binding [GO:0051879]; identical protein binding [GO:0042802]; promoter-specific chromatin binding [GO:1990841]; protein heterodimerization activity [GO:0046982]; protein kinase binding [GO:0019901]; RNA polymerase II cis-regulatory region sequence-specific DNA binding [GO:0000978]; RNA polymerase II intronic transcription regulatory region sequence-specific DNA binding [GO:0001162]; sequence-specific DNA binding [GO:0043565]; sequence-specific single stranded DNA binding [GO:0098847]; STAT family protein binding [GO:0097677]; translation elongation factor binding [GO:0061770]",GO:0003677; GO:0005634; GO:0005654; GO:0005815; GO:0005829; GO:0006281; GO:0006355; GO:0016071; GO:0022414; GO:0043226; GO:0048856; GO:0065003; GO:0140013; GO:0140110,DNA binding; nucleus; nucleoplasm; microtubule organizing center; cytosol; DNA repair; regulation of DNA-templated transcription; mRNA metabolic process; reproductive process; organelle; anatomical structure development; protein-containing complex assembly; meiotic nuclear division; transcription regulator activity
OG_08928,2.661331425565648,FUN_038386-T1,Peve_00000061,Pocillopora_meandrina_HIv1___RNAseq.g28288.t1,three_way,58.09316666666667,FUN_038386-T1,P16065,,,,,37.9,1080.0,5.1e-181,636.7,sp|P16065|GCY_STRPU Speract receptor OS=Strongylocentrotus purpuratus OX=7668 PE=2 SV=1,,,,,,
OG_08355,2.654640325287071,FUN_036899-T1,Peve_00018371,Pocillopora_meandrina_HIv1___RNAseq.g26703.t1,three_way,78.23133333333332,FUN_036899-T1,Q8VZ42,,,,,40.3,129.0,1.3e-25,117.5,sp|Q8VZ42|SAP11_ARATH Zinc finger AN1 and C2H2 domain-containing stress-associated protein 11 OS=Arabidopsis thaliana OX=3702 GN=SAP11 PE=2 SV=1,,,,,,
OG_02226,2.611584796470264,FUN_008631-T1,Peve_00012388,Pocillopora_meandrina_HIv1___RNAseq.g14912.t1,three_way,62.56166666666666,,,,,,,,,,,,,,,,,
OG_04439,2.5776430317613266,FUN_018835-T2,Peve_00035787,Pocillopora_meandrina_HIv1___RNAseq.g9856.t1,three_way,77.22033333333333,FUN_018835-T2,Q9C0G6,DYH6_HUMAN,,Dynein axonemal heavy chain 6 (Axonemal beta dynein heavy chain 6) (Ciliary dynein heavy chain 6),Homo sapiens (Human),37.1,4337.0,0.0,2654.0,sp|Q9C0G6|DYH6_HUMAN Dynein axonemal heavy chain 6 OS=Homo sapiens OX=9606 GN=DNAH6 PE=1 SV=3,GO:0005524; GO:0005874; GO:0005930; GO:0008569; GO:0016887; GO:0030286; GO:0045505; GO:0051959; GO:0060294; GO:0097729,cilium movement involved in cell motility [GO:0060294],9+2 motile cilium [GO:0097729]; axoneme [GO:0005930]; dynein complex [GO:0030286]; microtubule [GO:0005874],ATP binding [GO:0005524]; ATP hydrolysis activity [GO:0016887]; dynein intermediate chain binding [GO:0045505]; dynein light intermediate chain binding [GO:0051959]; minus-end-directed microtubule motor activity [GO:0008569],GO:0003774; GO:0003824; GO:0005929; GO:0007018; GO:0016787; GO:0016853; GO:0043226; GO:0140657,cytoskeletal motor activity; catalytic activity; cilium; microtubule-based movement; hydrolase activity; isomerase activity; organelle; ATP-dependent activity
OG_02998,2.5661085915160062,FUN_012177-T1,Peve_00040996,Pocillopora_meandrina_HIv1___RNAseq.g23859.t1,three_way,91.90766666666669,FUN_012177-T1,P18654,KS6A3_MOUSE,,Ribosomal protein S6 kinase alpha-3 (S6K-alpha-3) (EC 2.7.11.1) (90 kDa ribosomal protein S6 kinase 3) (p90-RSK 3) (p90RSK3) (MAP kinase-activated protein kinase 1b) (MAPK-activated protein kinase 1b) (MAPKAP kinase 1b) (MAPKAPK-1b) (Ribosomal S6 kinase 2) (RSK-2) (pp90RSK2),Mus musculus (Mouse),67.4,742.0,1e-291,1003.8,sp|P18654|KS6A3_MOUSE Ribosomal protein S6 kinase alpha-3 OS=Mus musculus OX=10090 GN=Rps6ka3 PE=1 SV=2,GO:0000287; GO:0002224; GO:0004674; GO:0005524; GO:0005654; GO:0005730; GO:0005829; GO:0019901; GO:0032496; GO:0035556; GO:0043066; GO:0045944; GO:0106310,intracellular signal transduction [GO:0035556]; negative regulation of apoptotic process [GO:0043066]; positive regulation of transcription by RNA polymerase II [GO:0045944]; response to lipopolysaccharide [GO:0032496]; toll-like receptor signaling pathway [GO:0002224],cytosol [GO:0005829]; nucleolus [GO:0005730]; nucleoplasm [GO:0005654],ATP binding [GO:0005524]; magnesium ion binding [GO:0000287]; protein kinase binding [GO:0019901]; protein serine kinase activity [GO:0106310]; protein serine/threonine kinase activity [GO:0004674],GO:0002376; GO:0003824; GO:0005654; GO:0005730; GO:0005829; GO:0006355; GO:0016740; GO:0043226; GO:0140096,"immune system process; catalytic activity; nucleoplasm; nucleolus; cytosol; regulation of DNA-templated transcription; transferase activity; organelle; catalytic activity, acting on a protein"
OG_02805,2.550478475208503,FUN_011776-T1,Peve_00006118,Pocillopora_meandrina_HIv1___RNAseq.g23292.t1,three_way,81.48183333333333,FUN_011776-T1,Q01196,RUNX1_HUMAN,,Runt-related transcription factor 1 (Acute myeloid leukemia 1 protein) (Core-binding factor subunit alpha-2) (CBF-alpha-2) (Oncogene AML-1) (Polyomavirus enhancer-binding protein 2 alpha B subunit) (PEA2-alpha B) (PEBP2-alpha B) (SL3-3 enhancer factor 1 alpha B subunit) (SL3/AKV core-binding factor alpha B subunit),Homo sapiens (Human),48.8,320.0,7.1e-71,269.6,sp|Q01196|RUNX1_HUMAN Runt-related transcription factor 1 OS=Homo sapiens OX=9606 GN=RUNX1 PE=1 SV=3,GO:0000122; GO:0000785; GO:0000976; GO:0000977; GO:0000978; GO:0000981; GO:0001222; GO:0001223; GO:0001228; GO:0001503; GO:0002062; GO:0002573; GO:0003677; GO:0003700; GO:0005509; GO:0005524; GO:0005634; GO:0005654; GO:0006357; GO:0010755; GO:0016513; GO:0030097; GO:0030099; GO:0030182; GO:0030853; GO:0030854; GO:0032743; GO:0032967; GO:0042803; GO:0043231; GO:0043371; GO:0043378; GO:0045595; GO:0045766; GO:0045893; GO:0045944; GO:0046982; GO:0048935; GO:0060043; GO:0061026; GO:0071425; GO:0140297; GO:1903055; GO:1905203,"cardiac muscle tissue regeneration [GO:0061026]; chondrocyte differentiation [GO:0002062]; hematopoietic stem cell proliferation [GO:0071425]; hemopoiesis [GO:0030097]; myeloid cell differentiation [GO:0030099]; myeloid leukocyte differentiation [GO:0002573]; negative regulation of CD4-positive, alpha-beta T cell differentiation [GO:0043371]; negative regulation of granulocyte differentiation [GO:0030853]; negative regulation of transcription by RNA polymerase II [GO:0000122]; neuron differentiation [GO:0030182]; ossification [GO:0001503]; peripheral nervous system neuron development [GO:0048935]; positive regulation of angiogenesis [GO:0045766]; positive regulation of CD8-positive, alpha-beta T cell differentiation [GO:0043378]; positive regulation of collagen biosynthetic process [GO:0032967]; positive regulation of DNA-templated transcription [GO:0045893]; positive regulation of extracellular matrix organization [GO:1903055]; positive regulation of granulocyte differentiation [GO:0030854]; positive regulation of interleukin-2 production [GO:0032743]; positive regulation of transcription by RNA polymerase II [GO:0045944]; regulation of cardiac muscle cell proliferation [GO:0060043]; regulation of cell differentiation [GO:0045595]; regulation of connective tissue replacement [GO:1905203]; regulation of plasminogen activation [GO:0010755]; regulation of transcription by RNA polymerase II [GO:0006357]",chromatin [GO:0000785]; core-binding factor complex [GO:0016513]; intracellular membrane-bounded organelle [GO:0043231]; nucleoplasm [GO:0005654]; nucleus [GO:0005634],"ATP binding [GO:0005524]; calcium ion binding [GO:0005509]; DNA binding [GO:0003677]; DNA-binding transcription activator activity, RNA polymerase II-specific [GO:0001228]; DNA-binding transcription factor activity [GO:0003700]; DNA-binding transcription factor activity, RNA polymerase II-specific [GO:0000981]; DNA-binding transcription factor binding [GO:0140297]; protein heterodimerization activity [GO:0046982]; protein homodimerization activity [GO:0042803]; RNA polymerase II cis-regulatory region sequence-specific DNA binding [GO:0000978]; RNA polymerase II transcription regulatory region sequence-specific DNA binding [GO:0000977]; transcription cis-regulatory region binding [GO:0000976]; transcription coactivator binding [GO:0001223]; transcription corepressor binding [GO:0001222]",GO:0003677; GO:0005634; GO:0005654; GO:0006355; GO:0030154; GO:0043226; GO:0048856; GO:0140110,DNA binding; nucleus; nucleoplasm; regulation of DNA-templated transcription; cell differentiation; organelle; anatomical structure development; transcription regulator activity
OG_07956,2.538629197396664,FUN_035500-T1,Peve_00033958,Pocillopora_meandrina_HIv1___RNAseq.g26993.t1,three_way,59.97516666666667,FUN_035500-T1,Q5R2J4,,,,,34.4,430.0,2.7999999999999997e-68,261.2,sp|Q5R2J4|APCD1_PELSI Protein APCDD1 OS=Pelodiscus sinensis OX=13735 GN=APCDD1 PE=2 SV=1,,,,,,
OG_01576,2.5306092036580594,FUN_006581-T1,Peve_00015613,Pocillopora_meandrina_HIv1___RNAseq.g20271.t1,three_way,58.029,FUN_006581-T1,P18460,,,,,34.3,769.0,1.3e-91,339.3,sp|P18460|FGFR3_CHICK Fibroblast growth factor receptor 3 OS=Gallus gallus OX=9031 GN=FGFR3 PE=2 SV=1,,,,,,
