group_id,Component_3,apul,peve,ptua,type,avg_identity,query,accession,id,reviewed,protein_name,organism,pident,length,evalue,bitscore,title,go_ids,go_bp,go_cc,go_mf,goslim_ids,goslim_names
OG_04195,2.1792557601959257,FUN_016720-T1,Peve_00014673,Pocillopora_meandrina_HIv1___RNAseq.g230.t1,three_way,61.32066666666666,FUN_016720-T1,Q64729,TGFR1_MOUSE,,TGF-beta receptor type-1 (TGFR-1) (EC 2.7.11.30) (ESK2) (Transforming growth factor-beta receptor type I) (TGF-beta receptor type I) (TbetaR-I),Mus musculus (Mouse),38.4,487.0,5.7e-74,280.0,sp|Q64729|TGFR1_MOUSE TGF-beta receptor type-1 OS=Mus musculus OX=10090 GN=Tgfbr1 PE=1 SV=1,GO:0001501; GO:0001525; GO:0001701; GO:0001822; GO:0001824; GO:0001935; GO:0001937; GO:0001938; GO:0002088; GO:0003222; GO:0003223; GO:0005024; GO:0005025; GO:0005102; GO:0005114; GO:0005524; GO:0005634; GO:0005654; GO:0005768; GO:0005886; GO:0005901; GO:0005923; GO:0005929; GO:0006915; GO:0007179; GO:0007507; GO:0008354; GO:0008584; GO:0009791; GO:0009952; GO:0009986; GO:0010468; GO:0010628; GO:0010717; GO:0010718; GO:0016020; GO:0030199; GO:0030307; GO:0030335; GO:0030336; GO:0031396; GO:0031625; GO:0032331; GO:0032924; GO:0035556; GO:0036446; GO:0042118; GO:0043065; GO:0043066; GO:0043542; GO:0045121; GO:0045893; GO:0046332; GO:0046847; GO:0046872; GO:0048538; GO:0048663; GO:0048701; GO:0048705; GO:0048762; GO:0048844; GO:0050431; GO:0051491; GO:0051496; GO:0051897; GO:0060017; GO:0060021; GO:0060037; GO:0060043; GO:0060317; GO:0060391; GO:0060395; GO:0060412; GO:0060978; GO:0060982; GO:0061450; GO:0070021; GO:0070411; GO:0070723; GO:0071560; GO:1901203; GO:1902462; GO:1904018; GO:1905007; GO:1905075; GO:1905223; GO:2001235; GO:2001237,activin receptor signaling pathway [GO:0032924]; angiogenesis [GO:0001525]; angiogenesis involved in coronary vascular morphogenesis [GO:0060978]; anterior/posterior pattern specification [GO:0009952]; apoptotic process [GO:0006915]; artery morphogenesis [GO:0048844]; blastocyst development [GO:0001824]; cardiac epithelial to mesenchymal transition [GO:0060317]; cellular response to transforming growth factor beta stimulus [GO:0071560]; collagen fibril organization [GO:0030199]; coronary artery morphogenesis [GO:0060982]; embryonic cranial skeleton morphogenesis [GO:0048701]; endothelial cell activation [GO:0042118]; endothelial cell migration [GO:0043542]; endothelial cell proliferation [GO:0001935]; epicardium morphogenesis [GO:1905223]; filopodium assembly [GO:0046847]; germ cell migration [GO:0008354]; heart development [GO:0007507]; in utero embryonic development [GO:0001701]; intracellular signal transduction [GO:0035556]; kidney development [GO:0001822]; lens development in camera-type eye [GO:0002088]; male gonad development [GO:0008584]; mesenchymal cell differentiation [GO:0048762]; myofibroblast differentiation [GO:0036446]; negative regulation of apoptotic process [GO:0043066]; negative regulation of cell migration [GO:0030336]; negative regulation of chondrocyte differentiation [GO:0032331]; negative regulation of endothelial cell proliferation [GO:0001937]; negative regulation of extrinsic apoptotic signaling pathway [GO:2001237]; neuron fate commitment [GO:0048663]; parathyroid gland development [GO:0060017]; pharyngeal system development [GO:0060037]; positive regulation of apoptotic process [GO:0043065]; positive regulation of apoptotic signaling pathway [GO:2001235]; positive regulation of cell growth [GO:0030307]; positive regulation of cell migration [GO:0030335]; positive regulation of DNA-templated transcription [GO:0045893]; positive regulation of endothelial cell proliferation [GO:0001938]; positive regulation of epithelial to mesenchymal transition [GO:0010718]; positive regulation of epithelial to mesenchymal transition involved in endocardial cushion formation [GO:1905007]; positive regulation of extracellular matrix assembly [GO:1901203]; positive regulation of filopodium assembly [GO:0051491]; positive regulation of gene expression [GO:0010628]; positive regulation of mesenchymal stem cell proliferation [GO:1902462]; positive regulation of phosphatidylinositol 3-kinase/protein kinase B signal transduction [GO:0051897]; positive regulation of SMAD protein signal transduction [GO:0060391]; positive regulation of stress fiber assembly [GO:0051496]; positive regulation of tight junction disassembly [GO:1905075]; positive regulation of vasculature development [GO:1904018]; post-embryonic development [GO:0009791]; regulation of cardiac muscle cell proliferation [GO:0060043]; regulation of epithelial to mesenchymal transition [GO:0010717]; regulation of gene expression [GO:0010468]; regulation of protein ubiquitination [GO:0031396]; response to cholesterol [GO:0070723]; roof of mouth development [GO:0060021]; skeletal system development [GO:0001501]; skeletal system morphogenesis [GO:0048705]; SMAD protein signal transduction [GO:0060395]; thymus development [GO:0048538]; transforming growth factor beta receptor signaling pathway [GO:0007179]; trophoblast cell migration [GO:0061450]; ventricular compact myocardium morphogenesis [GO:0003223]; ventricular septum morphogenesis [GO:0060412]; ventricular trabecula myocardium morphogenesis [GO:0003222],bicellular tight junction [GO:0005923]; caveola [GO:0005901]; cell surface [GO:0009986]; cilium [GO:0005929]; endosome [GO:0005768]; membrane [GO:0016020]; membrane raft [GO:0045121]; nucleoplasm [GO:0005654]; nucleus [GO:0005634]; plasma membrane [GO:0005886]; transforming growth factor beta ligand-receptor complex [GO:0070021],"ATP binding [GO:0005524]; I-SMAD binding [GO:0070411]; metal ion binding [GO:0046872]; signaling receptor binding [GO:0005102]; SMAD binding [GO:0046332]; transforming growth factor beta binding [GO:0050431]; transforming growth factor beta receptor activity [GO:0005024]; transforming growth factor beta receptor activity, type I [GO:0005025]; type II transforming growth factor beta receptor binding [GO:0005114]; ubiquitin protein ligase binding [GO:0031625]",GO:0003824; GO:0005634; GO:0005654; GO:0005768; GO:0005886; GO:0005929; GO:0006355; GO:0012501; GO:0016740; GO:0022414; GO:0030154; GO:0030198; GO:0031410; GO:0043226; GO:0048856; GO:0048870; GO:0060089; GO:0140096,"catalytic activity; nucleus; nucleoplasm; endosome; plasma membrane; cilium; regulation of DNA-templated transcription; programmed cell death; transferase activity; reproductive process; cell differentiation; extracellular matrix organization; cytoplasmic vesicle; organelle; anatomical structure development; cell motility; molecular transducer activity; catalytic activity, acting on a protein"
OG_04624,2.1744910122658285,FUN_022332-T1,Peve_00028602,Pocillopora_meandrina_HIv1___RNAseq.g4651.t2,three_way,52.3965,FUN_022332-T1,P26008,,,,,27.8,994.0,3.3000000000000003e-81,305.1,sp|P26008|ITAV_CHICK Integrin alpha-V OS=Gallus gallus OX=9031 GN=ITGAV PE=2 SV=1,,,,,,
OG_03500,2.1718236184309228,FUN_014610-T1,Peve_00027567,Pocillopora_meandrina_HIv1___TS.g27529.t1,three_way,75.49566666666666,FUN_014610-T1,P27465,,,,,48.5,361.0,3.7e-97,356.7,"sp|P27465|PISD_CRIGR Phosphatidylserine decarboxylase proenzyme, mitochondrial OS=Cricetulus griseus OX=10029 GN=Pisd PE=1 SV=2",,,,,,
OG_09007,2.155667553181435,FUN_038557-T1,Peve_00020191,Pocillopora_meandrina_HIv1___RNAseq.g1024.t1,three_way,38.4565,,,,,,,,,,,,,,,,,
OG_03309,2.150695705411916,FUN_013385-T1,Peve_00015992,Pocillopora_meandrina_HIv1___RNAseq.g22980.t2,three_way,65.83083333333333,FUN_013385-T1,Q24180,DEAF1_DROME,,Deformed epidermal autoregulatory factor 1 (Protein DEAF-1),Drosophila melanogaster (Fruit fly),45.2,84.0,2.6e-16,87.8,sp|Q24180|DEAF1_DROME Deformed epidermal autoregulatory factor 1 OS=Drosophila melanogaster OX=7227 GN=Deaf1 PE=1 SV=1,GO:0000981; GO:0003700; GO:0005634; GO:0005700; GO:0006357; GO:0008270; GO:0009792; GO:0043565; GO:0045893; GO:0050776,embryo development ending in birth or egg hatching [GO:0009792]; positive regulation of DNA-templated transcription [GO:0045893]; regulation of immune response [GO:0050776]; regulation of transcription by RNA polymerase II [GO:0006357],nucleus [GO:0005634]; polytene chromosome [GO:0005700],"DNA-binding transcription factor activity [GO:0003700]; DNA-binding transcription factor activity, RNA polymerase II-specific [GO:0000981]; sequence-specific DNA binding [GO:0043565]; zinc ion binding [GO:0008270]",GO:0003677; GO:0005634; GO:0005694; GO:0006355; GO:0043226; GO:0048856; GO:0140110,DNA binding; nucleus; chromosome; regulation of DNA-templated transcription; organelle; anatomical structure development; transcription regulator activity
OG_09808,2.140151731207627,FUN_042630-T1,Peve_00033746,Pocillopora_meandrina_HIv1___RNAseq.g11507.t1,three_way,66.90383333333334,FUN_042630-T1,Q8TEK3,DOT1L_HUMAN,,"Histone-lysine N-methyltransferase, H3 lysine-79 specific (EC 2.1.1.360) (DOT1-like protein) (Histone H3-K79 methyltransferase) (H3-K79-HMTase) (Lysine N-methyltransferase 4)",Homo sapiens (Human),42.8,636.0,2.0999999999999998e-129,465.7,"sp|Q8TEK3|DOT1L_HUMAN Histone-lysine N-methyltransferase, H3 lysine-79 specific OS=Homo sapiens OX=9606 GN=DOT1L PE=1 SV=3",GO:0000077; GO:0000781; GO:0003676; GO:0003677; GO:0003713; GO:0005634; GO:0005654; GO:0005737; GO:0006281; GO:0010467; GO:0031151; GO:0031509; GO:0032200; GO:0032259; GO:0032991; GO:0042054; GO:0043231; GO:0045944; GO:0046425; GO:0061629; GO:0140938; GO:0140956; GO:2000677,DNA damage checkpoint signaling [GO:0000077]; DNA repair [GO:0006281]; gene expression [GO:0010467]; methylation [GO:0032259]; positive regulation of transcription by RNA polymerase II [GO:0045944]; regulation of receptor signaling pathway via JAK-STAT [GO:0046425]; regulation of transcription regulatory region DNA binding [GO:2000677]; subtelomeric heterochromatin formation [GO:0031509]; telomere organization [GO:0032200],"chromosome, telomeric region [GO:0000781]; cytoplasm [GO:0005737]; intracellular membrane-bounded organelle [GO:0043231]; nucleoplasm [GO:0005654]; nucleus [GO:0005634]; protein-containing complex [GO:0032991]",DNA binding [GO:0003677]; histone H3 methyltransferase activity [GO:0140938]; histone H3K79 methyltransferase activity [GO:0031151]; histone H3K79 trimethyltransferase activity [GO:0140956]; histone methyltransferase activity [GO:0042054]; nucleic acid binding [GO:0003676]; RNA polymerase II-specific DNA-binding transcription factor binding [GO:0061629]; transcription coactivator activity [GO:0003713],GO:0003677; GO:0003824; GO:0005634; GO:0005654; GO:0006281; GO:0006325; GO:0006355; GO:0016740; GO:0032200; GO:0043226; GO:0060090; GO:0140096; GO:0140110,"DNA binding; catalytic activity; nucleus; nucleoplasm; DNA repair; chromatin organization; regulation of DNA-templated transcription; transferase activity; telomere organization; organelle; molecular adaptor activity; catalytic activity, acting on a protein; transcription regulator activity"
OG_04811,2.13940424388768,FUN_022775-T1,Peve_00043390,Pocillopora_meandrina_HIv1___RNAseq.g4768.t1,three_way,88.94066666666666,FUN_022775-T1,F1R4U0,TXTPB_DANRE,,"Tricarboxylate transport protein B, mitochondrial (Citrate transport protein B) (Solute carrier family 25 member 1b)",Danio rerio (Zebrafish) (Brachydanio rerio),64.8,307.0,8.1e-116,418.3,"sp|F1R4U0|TXTPB_DANRE Tricarboxylate transport protein B, mitochondrial OS=Danio rerio OX=7955 GN=slc25a1b PE=3 SV=2",GO:0005739; GO:0005743; GO:0006843; GO:0007528; GO:0015142; GO:0015297; GO:0071913,mitochondrial citrate transmembrane transport [GO:0006843]; neuromuscular junction development [GO:0007528],mitochondrial inner membrane [GO:0005743]; mitochondrion [GO:0005739],antiporter activity [GO:0015297]; citrate secondary active transmembrane transporter activity [GO:0071913]; tricarboxylic acid transmembrane transporter activity [GO:0015142],GO:0005215; GO:0005739; GO:0034330; GO:0043226; GO:0055085,transporter activity; mitochondrion; cell junction organization; organelle; transmembrane transport
OG_07351,2.121259432412252,FUN_033759-T1,Peve_00009253,Pocillopora_meandrina_HIv1___RNAseq.g28744.t1,three_way,61.443,FUN_033759-T1,Q28005,LSHR_BOVIN,,Lutropin-choriogonadotropic hormone receptor (LH/CG-R) (Luteinizing hormone receptor) (LSH-R),Bos taurus (Bovine),36.1,498.0,3.2000000000000003e-80,301.6,sp|Q28005|LSHR_BOVIN Lutropin-choriogonadotropic hormone receptor OS=Bos taurus OX=9913 GN=LHCGR PE=2 SV=1,GO:0001541; GO:0004964; GO:0005886; GO:0007189; GO:0007200; GO:0008528; GO:0008584; GO:0009755; GO:0022602; GO:0042700; GO:0071373,adenylate cyclase-activating G protein-coupled receptor signaling pathway [GO:0007189]; cellular response to luteinizing hormone stimulus [GO:0071373]; hormone-mediated signaling pathway [GO:0009755]; luteinizing hormone signaling pathway [GO:0042700]; male gonad development [GO:0008584]; ovarian follicle development [GO:0001541]; ovulation cycle process [GO:0022602]; phospholipase C-activating G protein-coupled receptor signaling pathway [GO:0007200],plasma membrane [GO:0005886],G protein-coupled peptide receptor activity [GO:0008528]; luteinizing hormone receptor activity [GO:0004964],GO:0005886; GO:0022414; GO:0048856; GO:0060089,plasma membrane; reproductive process; anatomical structure development; molecular transducer activity
OG_06109,2.118568265127344,FUN_027814-T1,Peve_00036499,Pocillopora_meandrina_HIv1___RNAseq.g13890.t1,three_way,84.264,FUN_027814-T1,O00571,DDX3X_HUMAN,,"ATP-dependent RNA helicase DDX3X (EC 3.6.4.13) (CAP-Rf) (DEAD box protein 3, X-chromosomal) (DEAD box, X isoform) (DBX) (Helicase-like protein 2) (HLP2)",Homo sapiens (Human),71.5,425.0,1.6999999999999996e-177,623.6,sp|O00571|DDX3X_HUMAN ATP-dependent RNA helicase DDX3X OS=Homo sapiens OX=9606 GN=DDX3X PE=1 SV=3,GO:0002753; GO:0003677; GO:0003678; GO:0003723; GO:0003724; GO:0003729; GO:0003924; GO:0005524; GO:0005576; GO:0005634; GO:0005737; GO:0005739; GO:0005813; GO:0005829; GO:0005886; GO:0006413; GO:0007059; GO:0007276; GO:0008134; GO:0008143; GO:0008190; GO:0008625; GO:0009615; GO:0010494; GO:0010628; GO:0010629; GO:0016055; GO:0016887; GO:0017111; GO:0017148; GO:0030027; GO:0030154; GO:0030307; GO:0030308; GO:0031252; GO:0031333; GO:0031369; GO:0032481; GO:0032727; GO:0032728; GO:0033592; GO:0034063; GO:0034157; GO:0034161; GO:0034774; GO:0035556; GO:0035591; GO:0035613; GO:0036493; GO:0042256; GO:0043015; GO:0043024; GO:0043065; GO:0043066; GO:0043186; GO:0043273; GO:0043539; GO:0045070; GO:0045087; GO:0045296; GO:0045727; GO:0045944; GO:0045948; GO:0048027; GO:0055088; GO:0070062; GO:0070131; GO:0071243; GO:0071470; GO:0071651; GO:0072559; GO:0090263; GO:0097193; GO:0098586; GO:1900087; GO:1900227; GO:1901223; GO:1901224; GO:1902042; GO:1902523; GO:1903608; GO:1904813; GO:2001243,cell differentiation [GO:0030154]; cellular response to arsenic-containing substance [GO:0071243]; cellular response to osmotic stress [GO:0071470]; cellular response to virus [GO:0098586]; chromosome segregation [GO:0007059]; cytoplasmic pattern recognition receptor signaling pathway [GO:0002753]; cytosolic ribosome assembly [GO:0042256]; extrinsic apoptotic signaling pathway via death domain receptors [GO:0008625]; gamete generation [GO:0007276]; innate immune response [GO:0045087]; intracellular signal transduction [GO:0035556]; intrinsic apoptotic signaling pathway [GO:0097193]; lipid homeostasis [GO:0055088]; negative regulation of apoptotic process [GO:0043066]; negative regulation of cell growth [GO:0030308]; negative regulation of extrinsic apoptotic signaling pathway via death domain receptors [GO:1902042]; negative regulation of gene expression [GO:0010629]; negative regulation of intrinsic apoptotic signaling pathway [GO:2001243]; negative regulation of non-canonical NF-kappaB signal transduction [GO:1901223]; negative regulation of protein-containing complex assembly [GO:0031333]; negative regulation of translation [GO:0017148]; positive regulation of apoptotic process [GO:0043065]; positive regulation of canonical Wnt signaling pathway [GO:0090263]; positive regulation of cell growth [GO:0030307]; positive regulation of chemokine (C-C motif) ligand 5 production [GO:0071651]; positive regulation of G1/S transition of mitotic cell cycle [GO:1900087]; positive regulation of gene expression [GO:0010628]; positive regulation of interferon-alpha production [GO:0032727]; positive regulation of interferon-beta production [GO:0032728]; positive regulation of mitochondrial translation [GO:0070131]; positive regulation of NLRP3 inflammasome complex assembly [GO:1900227]; positive regulation of non-canonical NF-kappaB signal transduction [GO:1901224]; positive regulation of protein K63-linked ubiquitination [GO:1902523]; positive regulation of toll-like receptor 7 signaling pathway [GO:0034157]; positive regulation of toll-like receptor 8 signaling pathway [GO:0034161]; positive regulation of transcription by RNA polymerase II [GO:0045944]; positive regulation of translation [GO:0045727]; positive regulation of translation in response to endoplasmic reticulum stress [GO:0036493]; positive regulation of translational initiation [GO:0045948]; positive regulation of type I interferon production [GO:0032481]; positive regulation of viral genome replication [GO:0045070]; protein localization to cytoplasmic stress granule [GO:1903608]; response to virus [GO:0009615]; stress granule assembly [GO:0034063]; translational initiation [GO:0006413]; Wnt signaling pathway [GO:0016055],cell leading edge [GO:0031252]; centrosome [GO:0005813]; cytoplasm [GO:0005737]; cytoplasmic stress granule [GO:0010494]; cytosol [GO:0005829]; extracellular exosome [GO:0070062]; extracellular region [GO:0005576]; ficolin-1-rich granule lumen [GO:1904813]; lamellipodium [GO:0030027]; mitochondrion [GO:0005739]; NLRP3 inflammasome complex [GO:0072559]; nucleus [GO:0005634]; P granule [GO:0043186]; plasma membrane [GO:0005886]; secretory granule lumen [GO:0034774],ATP binding [GO:0005524]; ATP hydrolysis activity [GO:0016887]; cadherin binding [GO:0045296]; CTPase activity [GO:0043273]; DNA binding [GO:0003677]; DNA helicase activity [GO:0003678]; eukaryotic initiation factor 4E binding [GO:0008190]; gamma-tubulin binding [GO:0043015]; GTPase activity [GO:0003924]; mRNA 5'-UTR binding [GO:0048027]; mRNA binding [GO:0003729]; poly(A) binding [GO:0008143]; protein serine/threonine kinase activator activity [GO:0043539]; ribonucleoside triphosphate phosphatase activity [GO:0017111]; ribosomal small subunit binding [GO:0043024]; RNA binding [GO:0003723]; RNA helicase activity [GO:0003724]; RNA stem-loop binding [GO:0035613]; RNA strand annealing activity [GO:0033592]; signaling adaptor activity [GO:0035591]; transcription factor binding [GO:0008134]; translation initiation factor binding [GO:0031369],GO:0002376; GO:0003677; GO:0003723; GO:0003824; GO:0003924; GO:0005576; GO:0005634; GO:0005739; GO:0005815; GO:0005829; GO:0005886; GO:0006355; GO:0007059; GO:0008092; GO:0016787; GO:0016853; GO:0022414; GO:0030154; GO:0043226; GO:0060090; GO:0098542; GO:0098772; GO:0140097; GO:0140098; GO:0140657,"immune system process; DNA binding; RNA binding; catalytic activity; GTPase activity; extracellular region; nucleus; mitochondrion; microtubule organizing center; cytosol; plasma membrane; regulation of DNA-templated transcription; chromosome segregation; cytoskeletal protein binding; hydrolase activity; isomerase activity; reproductive process; cell differentiation; organelle; molecular adaptor activity; defense response to other organism; molecular function regulator activity; catalytic activity, acting on DNA; catalytic activity, acting on RNA; ATP-dependent activity"
OG_05226,2.111033870408768,FUN_023639-T1,Peve_00027828,Pocillopora_meandrina_HIv1___RNAseq.g17814.t1c,three_way,45.796,,,,,,,,,,,,,,,,,
OG_06522,2.108090981079156,FUN_029339-T1,Peve_00023361,Pocillopora_meandrina_HIv1___RNAseq.g17301.t1,three_way,61.434333333333335,FUN_029339-T1,Q01973,ROR1_HUMAN,,"Inactive tyrosine-protein kinase transmembrane receptor ROR1 (Neurotrophic tyrosine kinase, receptor-related 1)",Homo sapiens (Human),31.6,773.0,1.1000000000000001e-118,429.1,sp|Q01973|ROR1_HUMAN Inactive tyrosine-protein kinase transmembrane receptor ROR1 OS=Homo sapiens OX=9606 GN=ROR1 PE=1 SV=2,GO:0001725; GO:0004714; GO:0005524; GO:0005737; GO:0005886; GO:0007169; GO:0007605; GO:0008283; GO:0009986; GO:0014002; GO:0015026; GO:0017147; GO:0030424; GO:0038023; GO:0042813; GO:0043123; GO:0043235; GO:0043679; GO:0048839; GO:0051092,astrocyte development [GO:0014002]; cell population proliferation [GO:0008283]; cell surface receptor protein tyrosine kinase signaling pathway [GO:0007169]; inner ear development [GO:0048839]; positive regulation of canonical NF-kappaB signal transduction [GO:0043123]; positive regulation of NF-kappaB transcription factor activity [GO:0051092]; sensory perception of sound [GO:0007605],axon [GO:0030424]; axon terminus [GO:0043679]; cell surface [GO:0009986]; cytoplasm [GO:0005737]; plasma membrane [GO:0005886]; receptor complex [GO:0043235]; stress fiber [GO:0001725],ATP binding [GO:0005524]; coreceptor activity [GO:0015026]; signaling receptor activity [GO:0038023]; transmembrane receptor protein tyrosine kinase activity [GO:0004714]; Wnt receptor activity [GO:0042813]; Wnt-protein binding [GO:0017147],GO:0003824; GO:0005886; GO:0006355; GO:0016740; GO:0048856; GO:0050877; GO:0060089; GO:0140096,"catalytic activity; plasma membrane; regulation of DNA-templated transcription; transferase activity; anatomical structure development; nervous system process; molecular transducer activity; catalytic activity, acting on a protein"
OG_00957,2.1021974766865585,FUN_004321-T1,Peve_00016506,Pocillopora_meandrina_HIv1___RNAseq.g11786.t1,three_way,75.91266666666667,FUN_004321-T1,P54357,,,,,42.0,143.0,3.7e-23,109.4,sp|P54357|MLC2_DROME Myosin-2 essential light chain OS=Drosophila melanogaster OX=7227 GN=Mlc-c PE=1 SV=1,,,,,,
OG_06281,2.1013326690550844,FUN_028450-T1,Peve_00002378,Pocillopora_meandrina_HIv1___RNAseq.g16191.t1,three_way,41.13883333333333,FUN_028450-T1,A4IGL7,PXDN_XENTR,,Peroxidasin (EC 1.11.2.-) [Cleaved into: PXDN active fragment],Xenopus tropicalis (Western clawed frog) (Silurana tropicalis),28.0,168.0,1.3e-08,62.8,sp|A4IGL7|PXDN_XENTR Peroxidasin OS=Xenopus tropicalis OX=8364 GN=pxdn PE=2 SV=1,GO:0001525; GO:0005576; GO:0005604; GO:0005783; GO:0006979; GO:0007155; GO:0009986; GO:0016684; GO:0020037; GO:0031012; GO:0042744; GO:0046872; GO:0051260; GO:0070207; GO:0070831; GO:0071711; GO:0140825,angiogenesis [GO:0001525]; basement membrane assembly [GO:0070831]; basement membrane organization [GO:0071711]; cell adhesion [GO:0007155]; hydrogen peroxide catabolic process [GO:0042744]; protein homooligomerization [GO:0051260]; protein homotrimerization [GO:0070207]; response to oxidative stress [GO:0006979],basement membrane [GO:0005604]; cell surface [GO:0009986]; endoplasmic reticulum [GO:0005783]; extracellular matrix [GO:0031012]; extracellular region [GO:0005576],"heme binding [GO:0020037]; lactoperoxidase activity [GO:0140825]; metal ion binding [GO:0046872]; oxidoreductase activity, acting on peroxide as acceptor [GO:0016684]",GO:0003824; GO:0005576; GO:0005783; GO:0007155; GO:0016209; GO:0016491; GO:0030198; GO:0030312; GO:0031012; GO:0043226; GO:0065003,catalytic activity; extracellular region; endoplasmic reticulum; cell adhesion; antioxidant activity; oxidoreductase activity; extracellular matrix organization; external encapsulating structure; extracellular matrix; organelle; protein-containing complex assembly
OG_08222,2.089258126856554,FUN_036093-T1,Peve_00032189,Pocillopora_meandrina_HIv1___RNAseq.g27441.t1,three_way,76.63133333333333,FUN_036093-T1,Q68DA7,FMN1_HUMAN,,Formin-1 (Limb deformity protein homolog),Homo sapiens (Human),33.3,471.0,1.5e-63,246.1,sp|Q68DA7|FMN1_HUMAN Formin-1 OS=Homo sapiens OX=9606 GN=FMN1 PE=1 SV=3,GO:0003779; GO:0005634; GO:0005789; GO:0005884; GO:0005886; GO:0005912; GO:0008017; GO:0030036; GO:0045010,actin cytoskeleton organization [GO:0030036]; actin nucleation [GO:0045010],actin filament [GO:0005884]; adherens junction [GO:0005912]; endoplasmic reticulum membrane [GO:0005789]; nucleus [GO:0005634]; plasma membrane [GO:0005886],actin binding [GO:0003779]; microtubule binding [GO:0008017],GO:0005634; GO:0005886; GO:0007010; GO:0008092; GO:0043226,nucleus; plasma membrane; cytoskeleton organization; cytoskeletal protein binding; organelle
OG_07947,2.083790589417779,FUN_035468-T1,Peve_00012132,Pocillopora_meandrina_HIv1___TS.g14397.t1,three_way,83.6845,FUN_035468-T1,Q8BH04,PCKGM_MOUSE,,"Phosphoenolpyruvate carboxykinase [GTP], mitochondrial (PEPCK-M) (EC 4.1.1.32)",Mus musculus (Mouse),65.5,611.0,6.100000000000001e-248,858.2,"sp|Q8BH04|PCKGM_MOUSE Phosphoenolpyruvate carboxykinase [GTP], mitochondrial OS=Mus musculus OX=10090 GN=Pck2 PE=1 SV=1",GO:0004613; GO:0005525; GO:0005739; GO:0005759; GO:0006090; GO:0006094; GO:0006107; GO:0030145; GO:0032024; GO:0032496; GO:0071333; GO:0071356; GO:0071548,cellular response to glucose stimulus [GO:0071333]; cellular response to tumor necrosis factor [GO:0071356]; gluconeogenesis [GO:0006094]; oxaloacetate metabolic process [GO:0006107]; positive regulation of insulin secretion [GO:0032024]; pyruvate metabolic process [GO:0006090]; response to dexamethasone [GO:0071548]; response to lipopolysaccharide [GO:0032496],mitochondrial matrix [GO:0005759]; mitochondrion [GO:0005739],GTP binding [GO:0005525]; manganese ion binding [GO:0030145]; phosphoenolpyruvate carboxykinase (GTP) activity [GO:0004613],GO:0003824; GO:0005739; GO:0005975; GO:0016829; GO:0043226,catalytic activity; mitochondrion; carbohydrate metabolic process; lyase activity; organelle
OG_06046,2.0818936284890337,FUN_026714-T1,Peve_00018519,Pocillopora_meandrina_HIv1___RNAseq.g9373.t1,three_way,56.48,FUN_026714-T1,Q96EW2,,,,,42.0,138.0,4.4e-20,99.4,sp|Q96EW2|HBAP1_HUMAN HSPB1-associated protein 1 OS=Homo sapiens OX=9606 GN=HSPBAP1 PE=1 SV=1,,,,,,
