group_id,Component_3,apul,peve,ptua,type,avg_identity,query,accession,id,reviewed,protein_name,organism,pident,length,evalue,bitscore,title,go_ids,go_bp,go_cc,go_mf,goslim_ids,goslim_names
OG_07441,3.74177517909902,FUN_033933-T1,Peve_00020980,Pocillopora_meandrina_HIv1___RNAseq.g26583.t1,three_way,86.51866666666666,FUN_033933-T1,Q15915,ZIC1_HUMAN,,Zinc finger protein ZIC 1 (Zinc finger protein 201) (Zinc finger protein of the cerebellum 1),Homo sapiens (Human),37.8,249.0,1.7e-36,155.2,sp|Q15915|ZIC1_HUMAN Zinc finger protein ZIC 1 OS=Homo sapiens OX=9606 GN=ZIC1 PE=1 SV=2,GO:0000978; GO:0000981; GO:0001228; GO:0003700; GO:0005634; GO:0005654; GO:0005737; GO:0006357; GO:0007389; GO:0007417; GO:0007420; GO:0007628; GO:0008270; GO:0008589; GO:0010467; GO:0021510; GO:0021766; GO:0021772; GO:0030154; GO:0042307; GO:0042472; GO:0045893; GO:0098727; GO:1990837,adult walking behavior [GO:0007628]; brain development [GO:0007420]; cell differentiation [GO:0030154]; central nervous system development [GO:0007417]; gene expression [GO:0010467]; hippocampus development [GO:0021766]; inner ear morphogenesis [GO:0042472]; maintenance of cell number [GO:0098727]; olfactory bulb development [GO:0021772]; pattern specification process [GO:0007389]; positive regulation of DNA-templated transcription [GO:0045893]; positive regulation of protein import into nucleus [GO:0042307]; regulation of smoothened signaling pathway [GO:0008589]; regulation of transcription by RNA polymerase II [GO:0006357]; spinal cord development [GO:0021510],cytoplasm [GO:0005737]; nucleoplasm [GO:0005654]; nucleus [GO:0005634],"DNA-binding transcription activator activity, RNA polymerase II-specific [GO:0001228]; DNA-binding transcription factor activity [GO:0003700]; DNA-binding transcription factor activity, RNA polymerase II-specific [GO:0000981]; RNA polymerase II cis-regulatory region sequence-specific DNA binding [GO:0000978]; sequence-specific double-stranded DNA binding [GO:1990837]; zinc ion binding [GO:0008270]",GO:0003677; GO:0005634; GO:0005654; GO:0006355; GO:0030154; GO:0043226; GO:0048856; GO:0140110,DNA binding; nucleus; nucleoplasm; regulation of DNA-templated transcription; cell differentiation; organelle; anatomical structure development; transcription regulator activity
OG_03926,3.7119023472136594,FUN_016038-T1,Peve_00011807,Pocillopora_meandrina_HIv1___RNAseq.g21648.t2,three_way,64.21833333333333,FUN_016038-T1,Q8TDN4,CABL1_HUMAN,,CDK5 and ABL1 enzyme substrate 1 (Interactor with CDK3 1) (Ik3-1),Homo sapiens (Human),43.4,295.0,2.7e-61,237.7,sp|Q8TDN4|CABL1_HUMAN CDK5 and ABL1 enzyme substrate 1 OS=Homo sapiens OX=9606 GN=CABLES1 PE=1 SV=2,GO:0005634; GO:0005829; GO:0007399; GO:0051301; GO:0051726,cell division [GO:0051301]; nervous system development [GO:0007399]; regulation of cell cycle [GO:0051726],cytosol [GO:0005829]; nucleus [GO:0005634],,GO:0005634; GO:0005829; GO:0043226; GO:0048856,nucleus; cytosol; organelle; anatomical structure development
OG_08396,3.7110935812981434,FUN_037010-T1,Peve_00032338,Pocillopora_meandrina_HIv1___RNAseq.g26698.t1,three_way,85.58966666666667,FUN_037010-T1,Q8N2G6,,,,,56.0,234.0,5.3e-63,242.7,sp|Q8N2G6|ZCH24_HUMAN Zinc finger CCHC domain-containing protein 24 OS=Homo sapiens OX=9606 GN=ZCCHC24 PE=1 SV=1,,,,,,
OG_03671,3.695714071949679,FUN_014916-T1,Peve_00003523,Pocillopora_meandrina_HIv1___RNAseq.g21079.t1,three_way,45.37166666666666,FUN_014916-T1,P00919,,,,,41.5,253.0,1.2e-44,183.0,sp|P00919|CAH2_RABIT Carbonic anhydrase 2 OS=Oryctolagus cuniculus OX=9986 GN=CA2 PE=1 SV=3,,,,,,
OG_01740,3.686421552450944,FUN_007062-T1,Peve_00025326,Pocillopora_meandrina_HIv1___RNAseq.g20109.t1,three_way,70.79983333333334,FUN_007062-T1,Q8IX03,KIBRA_HUMAN,,Protein KIBRA (HBeAg-binding protein 3) (Kidney and brain protein) (KIBRA) (WW domain-containing protein 1),Homo sapiens (Human),29.0,1136.0,8.3e-51,204.1,sp|Q8IX03|KIBRA_HUMAN Protein KIBRA OS=Homo sapiens OX=9606 GN=WWC1 PE=1 SV=1,GO:0000122; GO:0003713; GO:0005634; GO:0005737; GO:0005829; GO:0006355; GO:0008285; GO:0016477; GO:0019900; GO:0030010; GO:0032386; GO:0032587; GO:0035329; GO:0035330; GO:0035331; GO:0035591; GO:0043410; GO:0046621; GO:0048471; GO:0060090,cell migration [GO:0016477]; establishment of cell polarity [GO:0030010]; hippo signaling [GO:0035329]; negative regulation of cell population proliferation [GO:0008285]; negative regulation of hippo signaling [GO:0035331]; negative regulation of organ growth [GO:0046621]; negative regulation of transcription by RNA polymerase II [GO:0000122]; positive regulation of MAPK cascade [GO:0043410]; regulation of DNA-templated transcription [GO:0006355]; regulation of hippo signaling [GO:0035330]; regulation of intracellular transport [GO:0032386],cytoplasm [GO:0005737]; cytosol [GO:0005829]; nucleus [GO:0005634]; perinuclear region of cytoplasm [GO:0048471]; ruffle membrane [GO:0032587],kinase binding [GO:0019900]; molecular adaptor activity [GO:0060090]; signaling adaptor activity [GO:0035591]; transcription coactivator activity [GO:0003713],GO:0005634; GO:0005829; GO:0006355; GO:0007163; GO:0043226; GO:0048870; GO:0060090; GO:0140110,nucleus; cytosol; regulation of DNA-templated transcription; establishment or maintenance of cell polarity; organelle; cell motility; molecular adaptor activity; transcription regulator activity
OG_07861,3.6822220880909513,FUN_035216-T2,Peve_00035892,Pocillopora_meandrina_HIv1___RNAseq.g27615.t1,three_way,70.04816666666666,FUN_035216-T2,Q503Z8,IRX6A_DANRE,,Iroquois homeobox protein 6a,Danio rerio (Zebrafish) (Brachydanio rerio),47.6,233.0,1.9e-40,168.3,sp|Q503Z8|IRX6A_DANRE Iroquois homeobox protein 6a OS=Danio rerio OX=7955 GN=irx6a PE=2 SV=1,GO:0000978; GO:0000981; GO:0005634; GO:0006357; GO:0030182; GO:0048468,cell development [GO:0048468]; neuron differentiation [GO:0030182]; regulation of transcription by RNA polymerase II [GO:0006357],nucleus [GO:0005634],"DNA-binding transcription factor activity, RNA polymerase II-specific [GO:0000981]; RNA polymerase II cis-regulatory region sequence-specific DNA binding [GO:0000978]",GO:0003677; GO:0005634; GO:0006355; GO:0030154; GO:0043226; GO:0048856; GO:0140110,DNA binding; nucleus; regulation of DNA-templated transcription; cell differentiation; organelle; anatomical structure development; transcription regulator activity
OG_01002,3.667735436636662,FUN_004421-T1,Peve_00026932,Pocillopora_meandrina_HIv1___RNAseq.g16665.t1,three_way,58.136,FUN_004421-T1,F1NWE3,,,,,29.1,1542.0,2.5e-170,601.7,sp|F1NWE3|PTPRS_CHICK Receptor-type tyrosine-protein phosphatase S OS=Gallus gallus OX=9031 GN=PTPRS PE=1 SV=3,,,,,,
OG_03061,3.6498085265070346,FUN_012325-T1,Peve_00022885,Pocillopora_meandrina_HIv1___RNAseq.g23751.t1,three_way,82.00566666666667,FUN_012325-T1,Q8R3S2,TSN33_MOUSE,,Tetraspanin-33 (Tspan-33) (Penumbra) (mPen) (Proerythroblast new membrane),Mus musculus (Mouse),45.7,258.0,7.699999999999999e-56,218.8,sp|Q8R3S2|TSN33_MOUSE Tetraspanin-33 OS=Mus musculus OX=10090 GN=Tspan33 PE=1 SV=1,GO:0005737; GO:0005912; GO:0009986; GO:0019899; GO:0046930; GO:0046931; GO:0051604; GO:0072659; GO:0097197,pore complex assembly [GO:0046931]; protein localization to plasma membrane [GO:0072659]; protein maturation [GO:0051604],adherens junction [GO:0005912]; cell surface [GO:0009986]; cytoplasm [GO:0005737]; pore complex [GO:0046930]; tetraspanin-enriched microdomain [GO:0097197],enzyme binding [GO:0019899],GO:0051604; GO:0065003; GO:0072659,protein maturation; protein-containing complex assembly; protein localization to plasma membrane
OG_05437,3.644894159109916,FUN_024390-T2,Peve_00018042,Pocillopora_meandrina_HIv1___RNAseq.g18621.t1,three_way,74.62266666666667,FUN_024390-T2,Q80VL3,,,,,50.8,413.0,3e-126,454.1,sp|Q80VL3|PRIC3_MOUSE Prickle planar cell polarity protein 3 OS=Mus musculus OX=10090 GN=Prickle3 PE=1 SV=1,,,,,,
OG_08170,3.6384177009983616,FUN_035976-T1,Peve_00006611,Pocillopora_meandrina_HIv1___RNAseq.g12335.t1,three_way,78.89066666666666,FUN_035976-T1,Q8BVR6,,,,,56.2,489.0,3e-152,540.0,sp|Q8BVR6|RSPRY_MOUSE RING finger and SPRY domain-containing protein 1 OS=Mus musculus OX=10090 GN=Rspry1 PE=1 SV=1,,,,,,
OG_06778,3.6360936494878526,FUN_031644-T1,Peve_00043582,Pocillopora_meandrina_HIv1___RNAseq.g5685.t1,three_way,76.86,FUN_031644-T1,Q3EBF7,SLD2_ARATH,,Delta(8)-fatty-acid desaturase 2 (EC 1.14.19.29) (Delta(8)-sphingolipid desaturase 2) (Sphingoid long-chain base desaturase 2) (Sphingoid LCB desaturase 2) (Sphingolipid 8-(E/Z)-desaturase 2),Arabidopsis thaliana (Mouse-ear cress),41.9,451.0,8.5e-100,365.5,sp|Q3EBF7|SLD2_ARATH Delta(8)-fatty-acid desaturase 2 OS=Arabidopsis thaliana OX=3702 GN=SLD2 PE=1 SV=1,GO:0005783; GO:0005789; GO:0030148; GO:0046872; GO:0052631; GO:0070417,cellular response to cold [GO:0070417]; sphingolipid biosynthetic process [GO:0030148],endoplasmic reticulum [GO:0005783]; endoplasmic reticulum membrane [GO:0005789],metal ion binding [GO:0046872]; sphingolipid 8-(E/Z)-desaturase activity [GO:0052631],GO:0003824; GO:0005783; GO:0006629; GO:0016491; GO:0043226,catalytic activity; endoplasmic reticulum; lipid metabolic process; oxidoreductase activity; organelle
OG_08091,3.633309394188648,FUN_035824-T1,Peve_00037802,Pocillopora_meandrina_HIv1___RNAseq.g11933.t1,three_way,90.67833333333334,FUN_035824-T1,P08239,,,,,72.6,354.0,3e-148,526.2,sp|P08239|GNAO_BOVIN Guanine nucleotide-binding protein G(o) subunit alpha OS=Bos taurus OX=9913 GN=GNAO1 PE=1 SV=4,,,,,,
OG_05473,3.627607567665341,FUN_024456-T1,Peve_00010312,Pocillopora_meandrina_HIv1___RNAseq.g18574.t1,three_way,77.98883333333333,FUN_024456-T1,A7S6A1,,,,,59.2,903.0,2.2000000000000002e-272,939.9,sp|A7S6A1|U518_NEMVE FHIP family protein v1g243165 OS=Nematostella vectensis OX=45351 GN=v1g243165 PE=3 SV=1,,,,,,
OG_00308,3.6275000263513055,FUN_001110-T1,Peve_00029335,Pocillopora_meandrina_HIv1___RNAseq.g29363.t1,three_way,71.534,FUN_001110-T1,P15384,,,,,49.9,407.0,2.3e-84,314.7,sp|P15384|KCNA3_RAT Potassium voltage-gated channel subfamily A member 3 OS=Rattus norvegicus OX=10116 GN=Kcna3 PE=1 SV=2,,,,,,
OG_06310,3.5909138194301664,FUN_028549-T1,Peve_00000746,Pocillopora_meandrina_HIv1___RNAseq.g6218.t1,three_way,56.03633333333333,FUN_028549-T1,Q9Y6N7,ROBO1_HUMAN,,Roundabout homolog 1 (Deleted in U twenty twenty) (H-Robo-1),Homo sapiens (Human),30.5,285.0,4.8e-29,131.7,sp|Q9Y6N7|ROBO1_HUMAN Roundabout homolog 1 OS=Homo sapiens OX=9606 GN=ROBO1 PE=1 SV=1,GO:0002042; GO:0003129; GO:0003148; GO:0003180; GO:0003184; GO:0003272; GO:0005737; GO:0005829; GO:0005886; GO:0005929; GO:0007155; GO:0007156; GO:0007399; GO:0008046; GO:0009986; GO:0010628; GO:0010629; GO:0016199; GO:0021836; GO:0030275; GO:0030336; GO:0030424; GO:0030949; GO:0033116; GO:0033600; GO:0035025; GO:0035385; GO:0035904; GO:0042802; GO:0043410; GO:0045747; GO:0050772; GO:0050925; GO:0060412; GO:0070100; GO:1900748,aorta development [GO:0035904]; aortic valve morphogenesis [GO:0003180]; axon midline choice point recognition [GO:0016199]; cell adhesion [GO:0007155]; cell migration involved in sprouting angiogenesis [GO:0002042]; chemorepulsion involved in postnatal olfactory bulb interneuron migration [GO:0021836]; endocardial cushion formation [GO:0003272]; heart induction [GO:0003129]; homophilic cell adhesion via plasma membrane adhesion molecules [GO:0007156]; negative regulation of cell migration [GO:0030336]; negative regulation of chemokine-mediated signaling pathway [GO:0070100]; negative regulation of gene expression [GO:0010629]; negative regulation of mammary gland epithelial cell proliferation [GO:0033600]; negative regulation of negative chemotaxis [GO:0050925]; nervous system development [GO:0007399]; outflow tract septum morphogenesis [GO:0003148]; positive regulation of axonogenesis [GO:0050772]; positive regulation of gene expression [GO:0010628]; positive regulation of MAPK cascade [GO:0043410]; positive regulation of Notch signaling pathway [GO:0045747]; positive regulation of Rho protein signal transduction [GO:0035025]; positive regulation of vascular endothelial growth factor receptor signaling pathway [GO:0030949]; positive regulation of vascular endothelial growth factor signaling pathway [GO:1900748]; pulmonary valve morphogenesis [GO:0003184]; Roundabout signaling pathway [GO:0035385]; ventricular septum morphogenesis [GO:0060412],axon [GO:0030424]; cell surface [GO:0009986]; cilium [GO:0005929]; cytoplasm [GO:0005737]; cytosol [GO:0005829]; endoplasmic reticulum-Golgi intermediate compartment membrane [GO:0033116]; plasma membrane [GO:0005886],axon guidance receptor activity [GO:0008046]; identical protein binding [GO:0042802]; LRR domain binding [GO:0030275],GO:0005829; GO:0005886; GO:0005929; GO:0007155; GO:0043226; GO:0048856; GO:0048870; GO:0060089,cytosol; plasma membrane; cilium; cell adhesion; organelle; anatomical structure development; cell motility; molecular transducer activity
OG_10087,3.588992147948726,FUN_043414-T1,Peve_00045005,Pocillopora_meandrina_HIv1___RNAseq.g7825.t1,three_way,56.5365,FUN_043414-T1,Q69Z28,ATS16_MOUSE,,A disintegrin and metalloproteinase with thrombospondin motifs 16 (ADAM-TS 16) (ADAM-TS16) (ADAMTS-16) (EC 3.4.24.-),Mus musculus (Mouse),30.5,1138.0,9.8e-129,463.0,sp|Q69Z28|ATS16_MOUSE A disintegrin and metalloproteinase with thrombospondin motifs 16 OS=Mus musculus OX=10090 GN=Adamts16 PE=2 SV=2,GO:0001658; GO:0003073; GO:0004222; GO:0005576; GO:0006508; GO:0030198; GO:0046872; GO:0048232; GO:1902017,branching involved in ureteric bud morphogenesis [GO:0001658]; extracellular matrix organization [GO:0030198]; male gamete generation [GO:0048232]; proteolysis [GO:0006508]; regulation of cilium assembly [GO:1902017]; regulation of systemic arterial blood pressure [GO:0003073],extracellular region [GO:0005576],metal ion binding [GO:0046872]; metalloendopeptidase activity [GO:0004222],GO:0003824; GO:0005576; GO:0016787; GO:0022414; GO:0030198; GO:0140096,"catalytic activity; extracellular region; hydrolase activity; reproductive process; extracellular matrix organization; catalytic activity, acting on a protein"
OG_05557,3.5871696547631062,FUN_024775-T1,Peve_00033053,Pocillopora_meandrina_HIv1___RNAseq.g18815.t1,three_way,70.15433333333333,FUN_024775-T1,Q92629,,,,,40.8,265.0,5.6999999999999996e-49,196.1,sp|Q92629|SGCD_HUMAN Delta-sarcoglycan OS=Homo sapiens OX=9606 GN=SGCD PE=1 SV=2,,,,,,
OG_06680,3.577125304942252,FUN_031176-T1,Peve_00016087,Pocillopora_meandrina_HIv1___TS.g23938.t1b,three_way,56.30883333333333,,,,,,,,,,,,,,,,,
OG_01503,3.5747917641340297,FUN_006230-T1,Peve_00002942,Pocillopora_meandrina_HIv1___RNAseq.g20449.t1,three_way,69.12416666666667,FUN_006230-T1,Q5SZK8,FREM2_HUMAN,,FRAS1-related extracellular matrix protein 2 (ECM3 homolog),Homo sapiens (Human),41.5,1242.0,4.8e-265,916.0,sp|Q5SZK8|FREM2_HUMAN FRAS1-related extracellular matrix protein 2 OS=Homo sapiens OX=9606 GN=FREM2 PE=1 SV=3,GO:0001654; GO:0001822; GO:0002009; GO:0005604; GO:0005886; GO:0007154; GO:0007155; GO:0007507; GO:0009653; GO:0042733; GO:0046872; GO:0048839; GO:0062023; GO:0070062,anatomical structure morphogenesis [GO:0009653]; cell adhesion [GO:0007155]; cell communication [GO:0007154]; embryonic digit morphogenesis [GO:0042733]; eye development [GO:0001654]; heart development [GO:0007507]; inner ear development [GO:0048839]; kidney development [GO:0001822]; morphogenesis of an epithelium [GO:0002009],basement membrane [GO:0005604]; collagen-containing extracellular matrix [GO:0062023]; extracellular exosome [GO:0070062]; plasma membrane [GO:0005886],metal ion binding [GO:0046872],GO:0005886; GO:0007155; GO:0030312; GO:0031012; GO:0043226; GO:0048856,plasma membrane; cell adhesion; external encapsulating structure; extracellular matrix; organelle; anatomical structure development
OG_05445,3.569144573947636,FUN_024401-T1,Peve_00033232,Pocillopora_meandrina_HIv1___RNAseq.g18633.t1,three_way,75.52233333333334,FUN_024401-T1,P20595,GCYB1_RAT,,Guanylate cyclase soluble subunit beta-1 (GCS-beta-1) (EC 4.6.1.2) (Guanylate cyclase soluble subunit beta-3) (GCS-beta-3) (Soluble guanylate cyclase small subunit),Rattus norvegicus (Rat),46.0,620.0,2.1e-138,494.6,sp|P20595|GCYB1_RAT Guanylate cyclase soluble subunit beta-1 OS=Rattus norvegicus OX=10116 GN=Gucy1b1 PE=1 SV=2,GO:0004383; GO:0005525; GO:0005829; GO:0006182; GO:0008074; GO:0019934; GO:0020037; GO:0032991; GO:0038060; GO:0044877; GO:0046872; GO:0051879; GO:0070026; GO:0070482; GO:0071732; GO:0098831; GO:0098978,cellular response to nitric oxide [GO:0071732]; cGMP biosynthetic process [GO:0006182]; cGMP-mediated signaling [GO:0019934]; nitric oxide-cGMP-mediated signaling [GO:0038060]; response to oxygen levels [GO:0070482],"cytosol [GO:0005829]; glutamatergic synapse [GO:0098978]; guanylate cyclase complex, soluble [GO:0008074]; presynaptic active zone cytoplasmic component [GO:0098831]; protein-containing complex [GO:0032991]",GTP binding [GO:0005525]; guanylate cyclase activity [GO:0004383]; heme binding [GO:0020037]; Hsp90 protein binding [GO:0051879]; metal ion binding [GO:0046872]; nitric oxide binding [GO:0070026]; protein-containing complex binding [GO:0044877],GO:0003824; GO:0005829; GO:0009975; GO:0016829; GO:0055086; GO:1901135,catalytic activity; cytosol; cyclase activity; lyase activity; nucleobase-containing small molecule metabolic process; carbohydrate derivative metabolic process
OG_01475,3.5528383083740604,FUN_006038-T1,Peve_00023433,Pocillopora_meandrina_HIv1___RNAseq.g20251.t1,three_way,65.71133333333333,FUN_006038-T1,Q7T2C4,S26A5_DANRE,,Prestin (Solute carrier family 26 member 5),Danio rerio (Zebrafish) (Brachydanio rerio),37.0,686.0,1.8e-115,418.3,sp|Q7T2C4|S26A5_DANRE Prestin OS=Danio rerio OX=7955 GN=slc26a5 PE=2 SV=1,GO:0005737; GO:0005886; GO:0006821; GO:0008271; GO:0015075; GO:0015106; GO:0015108; GO:0015116; GO:0015499; GO:0016020; GO:0019531; GO:0019532; GO:0042391; GO:0160044; GO:0160046; GO:1902358; GO:1902476,chloride transmembrane transport [GO:1902476]; chloride transport [GO:0006821]; oxalate transport [GO:0019532]; regulation of membrane potential [GO:0042391]; sulfate transmembrane transport [GO:1902358],cytoplasm [GO:0005737]; membrane [GO:0016020]; plasma membrane [GO:0005886],bicarbonate transmembrane transporter activity [GO:0015106]; chloride transmembrane transporter activity [GO:0015108]; formate transmembrane transporter activity [GO:0015499]; monoatomic ion transmembrane transporter activity [GO:0015075]; oxalate transmembrane transporter activity [GO:0019531]; oxalate:chloride antiporter activity [GO:0160046]; secondary active sulfate transmembrane transporter activity [GO:0008271]; sulfate transmembrane transporter activity [GO:0015116]; sulfate:chloride antiporter activity [GO:0160044],GO:0005215; GO:0005886; GO:0055085,transporter activity; plasma membrane; transmembrane transport
OG_04041,3.544483426667301,FUN_016350-T1,Peve_00004331,Pocillopora_meandrina_HIv1___RNAseq.16312_t,three_way,70.639,FUN_016350-T1,Q90WR8,SP3_CHICK,,Transcription factor Sp3,Gallus gallus (Chicken),48.7,117.0,7.9e-20,100.1,sp|Q90WR8|SP3_CHICK Transcription factor Sp3 OS=Gallus gallus OX=9031 GN=SP3 PE=1 SV=1,GO:0000978; GO:0000981; GO:0001227; GO:0001503; GO:0001779; GO:0001889; GO:0002318; GO:0003682; GO:0005829; GO:0006357; GO:0008270; GO:0016605; GO:0017053; GO:0030183; GO:0030217; GO:0030219; GO:0030224; GO:0030324; GO:0030851; GO:0043353; GO:0045944; GO:0048596; GO:0048706; GO:0060216; GO:0061629,B cell differentiation [GO:0030183]; definitive hemopoiesis [GO:0060216]; embryonic camera-type eye morphogenesis [GO:0048596]; embryonic skeletal system development [GO:0048706]; enucleate erythrocyte differentiation [GO:0043353]; granulocyte differentiation [GO:0030851]; liver development [GO:0001889]; lung development [GO:0030324]; megakaryocyte differentiation [GO:0030219]; monocyte differentiation [GO:0030224]; myeloid progenitor cell differentiation [GO:0002318]; natural killer cell differentiation [GO:0001779]; ossification [GO:0001503]; positive regulation of transcription by RNA polymerase II [GO:0045944]; regulation of transcription by RNA polymerase II [GO:0006357]; T cell differentiation [GO:0030217],cytosol [GO:0005829]; PML body [GO:0016605]; transcription repressor complex [GO:0017053],"chromatin binding [GO:0003682]; DNA-binding transcription factor activity, RNA polymerase II-specific [GO:0000981]; DNA-binding transcription repressor activity, RNA polymerase II-specific [GO:0001227]; RNA polymerase II cis-regulatory region sequence-specific DNA binding [GO:0000978]; RNA polymerase II-specific DNA-binding transcription factor binding [GO:0061629]; zinc ion binding [GO:0008270]",GO:0002376; GO:0003677; GO:0005829; GO:0006355; GO:0030154; GO:0043226; GO:0048856; GO:0140110,immune system process; DNA binding; cytosol; regulation of DNA-templated transcription; cell differentiation; organelle; anatomical structure development; transcription regulator activity
OG_07349,3.541346165663446,FUN_033756-T1,Peve_00004915,Pocillopora_meandrina_HIv1___RNAseq.g28747.t1,three_way,85.5945,FUN_033756-T1,Q13136,LIPA1_HUMAN,,Liprin-alpha-1 (LAR-interacting protein 1) (LIP-1) (Protein tyrosine phosphatase receptor type f polypeptide-interacting protein alpha-1) (PTPRF-interacting protein alpha-1),Homo sapiens (Human),45.4,1218.0,1.3e-187,658.7,sp|Q13136|LIPA1_HUMAN Liprin-alpha-1 OS=Homo sapiens OX=9606 GN=PPFIA1 PE=1 SV=1,GO:0005737; GO:0005829; GO:0005925; GO:0005938; GO:0007160; GO:0007165; GO:0030424; GO:0032991; GO:0043622; GO:0048786; GO:0050808; GO:0051497; GO:0097444; GO:0098685; GO:0099072; GO:1903077,cell-matrix adhesion [GO:0007160]; cortical microtubule organization [GO:0043622]; negative regulation of protein localization to plasma membrane [GO:1903077]; negative regulation of stress fiber assembly [GO:0051497]; regulation of postsynaptic membrane neurotransmitter receptor levels [GO:0099072]; signal transduction [GO:0007165]; synapse organization [GO:0050808],axon [GO:0030424]; cell cortex [GO:0005938]; cytoplasm [GO:0005737]; cytosol [GO:0005829]; focal adhesion [GO:0005925]; presynaptic active zone [GO:0048786]; protein-containing complex [GO:0032991]; Schaffer collateral - CA1 synapse [GO:0098685]; spine apparatus [GO:0097444],,GO:0005829; GO:0007010; GO:0007155; GO:0034330; GO:0043226,cytosol; cytoskeleton organization; cell adhesion; cell junction organization; organelle
OG_10039,3.5205967292110447,FUN_043309-T1,Peve_00007495,Pocillopora_meandrina_HIv1___RNAseq.g8924.t1,three_way,66.18766666666667,FUN_043309-T1,P33450,FAT_DROME,,Cadherin-related tumor suppressor (Protein fat) [Cleaved into: Ft-mito],Drosophila melanogaster (Fruit fly),27.1,816.0,1.3e-70,270.0,sp|P33450|FAT_DROME Cadherin-related tumor suppressor OS=Drosophila melanogaster OX=7227 GN=ft PE=1 SV=3,GO:0001736; GO:0001737; GO:0005509; GO:0005739; GO:0005886; GO:0007156; GO:0007157; GO:0007164; GO:0007446; GO:0007447; GO:0007476; GO:0008285; GO:0009888; GO:0010629; GO:0016324; GO:0016327; GO:0016336; GO:0016339; GO:0032880; GO:0035159; GO:0035209; GO:0035220; GO:0035332; GO:0040008; GO:0042067; GO:0043065; GO:0044331; GO:0045296; GO:0045317; GO:0045570; GO:0045571; GO:0045926; GO:0046621; GO:0048105; GO:0090175; GO:0090176; GO:0090251; GO:0098609,"calcium-dependent cell-cell adhesion via plasma membrane cell adhesion molecules [GO:0016339]; cell-cell adhesion [GO:0098609]; cell-cell adhesion mediated by cadherin [GO:0044331]; equator specification [GO:0045317]; establishment of body hair planar orientation [GO:0048105]; establishment of imaginal disc-derived wing hair orientation [GO:0001737]; establishment of ommatidial planar polarity [GO:0042067]; establishment of planar polarity [GO:0001736]; establishment of tissue polarity [GO:0007164]; establishment or maintenance of polarity of larval imaginal disc epithelium [GO:0016336]; heterophilic cell-cell adhesion via plasma membrane cell adhesion molecules [GO:0007157]; homophilic cell adhesion via plasma membrane adhesion molecules [GO:0007156]; imaginal disc growth [GO:0007446]; imaginal disc pattern formation [GO:0007447]; imaginal disc-derived wing morphogenesis [GO:0007476]; microtubule cytoskeleton organization involved in establishment of planar polarity [GO:0090176]; negative regulation of cell population proliferation [GO:0008285]; negative regulation of gene expression [GO:0010629]; negative regulation of growth [GO:0045926]; negative regulation of imaginal disc growth [GO:0045571]; negative regulation of organ growth [GO:0046621]; positive regulation of apoptotic process [GO:0043065]; positive regulation of hippo signaling [GO:0035332]; protein localization involved in establishment of planar polarity [GO:0090251]; pupal development [GO:0035209]; regulation of establishment of planar polarity [GO:0090175]; regulation of growth [GO:0040008]; regulation of imaginal disc growth [GO:0045570]; regulation of protein localization [GO:0032880]; regulation of tube length, open tracheal system [GO:0035159]; tissue development [GO:0009888]; wing disc development [GO:0035220]",apical plasma membrane [GO:0016324]; apicolateral plasma membrane [GO:0016327]; mitochondrion [GO:0005739]; plasma membrane [GO:0005886],cadherin binding [GO:0045296]; calcium ion binding [GO:0005509],GO:0005739; GO:0005886; GO:0007010; GO:0007155; GO:0007163; GO:0043226; GO:0048856,mitochondrion; plasma membrane; cytoskeleton organization; cell adhesion; establishment or maintenance of cell polarity; organelle; anatomical structure development
OG_02227,3.519921975101703,FUN_008633-T1,Peve_00012386,Pocillopora_meandrina_HIv1___RNAseq.g14915.t1,three_way,74.2705,FUN_008633-T1,Q8VDT1,,,,,45.9,573.0,4.5e-140,500.0,sp|Q8VDT1|SC5A9_MOUSE Sodium/glucose cotransporter 4 OS=Mus musculus OX=10090 GN=Slc5a9 PE=1 SV=3,,,,,,
