group_id,Component_1,apul,peve,ptua,type,avg_identity,query,accession,id,reviewed,protein_name,organism,pident,length,evalue,bitscore,title,go_ids,go_bp,go_cc,go_mf,goslim_ids,goslim_names
OG_01228,3.147510873027728,FUN_004910-T1,Peve_00028228,Pocillopora_meandrina_HIv1___TS.g20086.t1,three_way,85.51783333333333,FUN_004910-T1,Q16959,,,,,63.3,654.0,2.4999999999999998e-231,803.1,"sp|Q16959|DYI2_HELCR Dynein intermediate chain 2, ciliary OS=Heliocidaris crassispina OX=1043166 PE=2 SV=1",,,,,,
OG_08222,3.14534437496564,FUN_036093-T1,Peve_00032189,Pocillopora_meandrina_HIv1___RNAseq.g27441.t1,three_way,76.63133333333333,FUN_036093-T1,Q68DA7,FMN1_HUMAN,,Formin-1 (Limb deformity protein homolog),Homo sapiens (Human),33.3,471.0,1.5e-63,246.1,sp|Q68DA7|FMN1_HUMAN Formin-1 OS=Homo sapiens OX=9606 GN=FMN1 PE=1 SV=3,GO:0003779; GO:0005634; GO:0005789; GO:0005884; GO:0005886; GO:0005912; GO:0008017; GO:0030036; GO:0045010,actin cytoskeleton organization [GO:0030036]; actin nucleation [GO:0045010],actin filament [GO:0005884]; adherens junction [GO:0005912]; endoplasmic reticulum membrane [GO:0005789]; nucleus [GO:0005634]; plasma membrane [GO:0005886],actin binding [GO:0003779]; microtubule binding [GO:0008017],GO:0005634; GO:0005886; GO:0007010; GO:0008092; GO:0043226,nucleus; plasma membrane; cytoskeleton organization; cytoskeletal protein binding; organelle
OG_05726,3.136946068253132,FUN_025649-T1,Peve_00039652,Pocillopora_meandrina_HIv1___RNAseq.g23087.t2c,three_way,52.45816666666667,,,,,,,,,,,,,,,,,
OG_09693,3.1302085453553823,FUN_041922-T1,Peve_00007867,Pocillopora_meandrina_HIv1___RNAseq.g15626.t1,three_way,82.96933333333334,FUN_041922-T1,Q5I0R4,,,,,53.6,222.0,4.2e-63,242.7,sp|Q5I0R4|CF300_XENTR Cilia- and flagella-associated protein 300 OS=Xenopus tropicalis OX=8364 GN=cfap300 PE=2 SV=1,,,,,,
OG_01924,3.1234710636420124,FUN_007960-T1,Peve_00039187,Pocillopora_meandrina_HIv1___RNAseq.g30071.t1,three_way,67.50933333333333,,,,,,,,,,,,,,,,,
OG_07044,3.121211012264665,FUN_032246-T1,Peve_00036312,Pocillopora_meandrina_HIv1___RNAseq.g24842.t1,three_way,59.7065,,,,,,,,,,,,,,,,,
OG_06353,3.1136913057564186,FUN_028946-T1,Peve_00026868,Pocillopora_meandrina_HIv1___RNAseq.g25583.t1,three_way,40.32216666666666,,,,,,,,,,,,,,,,,
OG_01324,3.113493830380703,FUN_005194-T1,Peve_00001277,Pocillopora_meandrina_HIv1___RNAseq.g15136.t1,three_way,66.81283333333333,,,,,,,,,,,,,,,,,
OG_07129,3.1081832342512485,FUN_032429-T1,Peve_00027369,Pocillopora_meandrina_HIv1___RNAseq.g24121.t1,three_way,86.55766666666666,FUN_032429-T1,O95847,UCP4_HUMAN,,Mitochondrial uncoupling protein 4 (UCP 4) (Solute carrier family 25 member 27),Homo sapiens (Human),60.4,303.0,4.3e-103,375.9,sp|O95847|UCP4_HUMAN Mitochondrial uncoupling protein 4 OS=Homo sapiens OX=9606 GN=SLC25A27 PE=1 SV=1,GO:0005739; GO:0005743; GO:0008284; GO:0009409; GO:0010917; GO:0015078; GO:0015108; GO:0022857; GO:0031966; GO:0035356; GO:0042803; GO:0043025; GO:0043524; GO:0045177; GO:0046324; GO:0048839; GO:0051562,inner ear development [GO:0048839]; intracellular triglyceride homeostasis [GO:0035356]; negative regulation of mitochondrial calcium ion concentration [GO:0051562]; negative regulation of mitochondrial membrane potential [GO:0010917]; negative regulation of neuron apoptotic process [GO:0043524]; positive regulation of cell population proliferation [GO:0008284]; regulation of D-glucose import [GO:0046324]; response to cold [GO:0009409],apical part of cell [GO:0045177]; mitochondrial inner membrane [GO:0005743]; mitochondrial membrane [GO:0031966]; mitochondrion [GO:0005739]; neuronal cell body [GO:0043025],chloride transmembrane transporter activity [GO:0015108]; protein homodimerization activity [GO:0042803]; proton transmembrane transporter activity [GO:0015078]; transmembrane transporter activity [GO:0022857],GO:0005215; GO:0005739; GO:0043226; GO:0048856,transporter activity; mitochondrion; organelle; anatomical structure development
OG_03773,3.1059128059813186,FUN_015102-T1,Peve_00036873,Pocillopora_meandrina_HIv1___RNAseq.g22122.t1,three_way,57.66816666666666,,,,,,,,,,,,,,,,,
OG_00643,3.105745268631956,FUN_001887-T1,Peve_00030489,Pocillopora_meandrina_HIv1___RNAseq.g29129.t1,three_way,64.38266666666667,FUN_001887-T1,Q7RTY7,OVCH1_HUMAN,,Ovochymase-1 (EC 3.4.21.-),Homo sapiens (Human),40.6,286.0,1.8000000000000002e-44,181.8,sp|Q7RTY7|OVCH1_HUMAN Ovochymase-1 OS=Homo sapiens OX=9606 GN=OVCH1 PE=1 SV=3,GO:0004252; GO:0005576; GO:0006508; GO:0046872,proteolysis [GO:0006508],extracellular region [GO:0005576],metal ion binding [GO:0046872]; serine-type endopeptidase activity [GO:0004252],GO:0003824; GO:0005576; GO:0016787; GO:0140096,"catalytic activity; extracellular region; hydrolase activity; catalytic activity, acting on a protein"
OG_02699,3.0986490259966537,FUN_010968-T1,Peve_00035956,Pocillopora_meandrina_HIv1___RNAseq.g21969.t2,three_way,64.66499999999999,FUN_010968-T1,Q98TZ8,,,,,34.2,161.0,1.2e-22,107.8,sp|Q98TZ8|FLOT2_DANRE Flotillin-2a OS=Danio rerio OX=7955 GN=flot2a PE=2 SV=2,,,,,,
OG_06909,3.0721669188321403,FUN_031967-T1,Peve_00013260,Pocillopora_meandrina_HIv1___RNAseq.g17806.t1,three_way,83.551,FUN_031967-T1,Q95M17,CHIA_BOVIN,,Acidic mammalian chitinase (AMCase) (EC 3.2.1.14) (Chitin-binding protein b04) (CBPb04),Bos taurus (Bovine),46.4,390.0,4.3999999999999996e-91,336.7,sp|Q95M17|CHIA_BOVIN Acidic mammalian chitinase OS=Bos taurus OX=9913 GN=CHIA PE=1 SV=1,GO:0000272; GO:0002376; GO:0002532; GO:0004568; GO:0005576; GO:0005615; GO:0005737; GO:0006032; GO:0006915; GO:0008061; GO:0008843; GO:0032722,apoptotic process [GO:0006915]; chitin catabolic process [GO:0006032]; immune system process [GO:0002376]; polysaccharide catabolic process [GO:0000272]; positive regulation of chemokine production [GO:0032722]; production of molecular mediator involved in inflammatory response [GO:0002532],cytoplasm [GO:0005737]; extracellular region [GO:0005576]; extracellular space [GO:0005615],chitin binding [GO:0008061]; chitinase activity [GO:0004568]; endochitinase activity [GO:0008843],GO:0002376; GO:0003824; GO:0005576; GO:0005615; GO:0005975; GO:0012501; GO:0016787; GO:1901135,immune system process; catalytic activity; extracellular region; extracellular space; carbohydrate metabolic process; programmed cell death; hydrolase activity; carbohydrate derivative metabolic process
OG_06279,3.064245225777888,FUN_028447-T1,Peve_00026233,Pocillopora_meandrina_HIv1___RNAseq.g16195.t1,three_way,59.692,FUN_028447-T1,Q60997,DMBT1_MOUSE,,Scavenger receptor cysteine-rich domain-containing protein DMBT1 (Apactin) (CRP-ductin) (Deleted in malignant brain tumors 1 protein) (Glycoprotein 300) (gp300) (Hensin) (Mucin-like glycoprotein) (Muclin) (Vomeroglandin) (p80),Mus musculus (Mouse),40.3,573.0,9.700000000000001e-117,423.7,sp|Q60997|DMBT1_MOUSE Scavenger receptor cysteine-rich domain-containing protein DMBT1 OS=Mus musculus OX=10090 GN=Dmbt1 PE=1 SV=2,GO:0001824; GO:0001833; GO:0002065; GO:0005576; GO:0009617; GO:0015031; GO:0030658; GO:0030858; GO:0031012; GO:0035375; GO:0042589; GO:0050829; GO:0050830; GO:0062023,blastocyst development [GO:0001824]; columnar/cuboidal epithelial cell differentiation [GO:0002065]; defense response to Gram-negative bacterium [GO:0050829]; defense response to Gram-positive bacterium [GO:0050830]; inner cell mass cell proliferation [GO:0001833]; positive regulation of epithelial cell differentiation [GO:0030858]; protein transport [GO:0015031]; response to bacterium [GO:0009617],collagen-containing extracellular matrix [GO:0062023]; extracellular matrix [GO:0031012]; extracellular region [GO:0005576]; transport vesicle membrane [GO:0030658]; zymogen granule membrane [GO:0042589],zymogen binding [GO:0035375],GO:0005576; GO:0030154; GO:0030312; GO:0031012; GO:0048856,extracellular region; cell differentiation; external encapsulating structure; extracellular matrix; anatomical structure development
OG_04119,3.058623568152405,FUN_016495-T1,Peve_00042759,Pocillopora_meandrina_HIv1___RNAseq.g176.t1,three_way,53.5725,,,,,,,,,,,,,,,,,
OG_10113,3.058025161921903,FUN_043483-T1,Peve_00021710,Pocillopora_meandrina_HIv1___RNAseq.g7933.t1,three_way,81.26899999999999,FUN_043483-T1,Q96E35,,,,,48.1,241.0,4.4e-58,226.1,sp|Q96E35|ZMY19_HUMAN Zinc finger MYND domain-containing protein 19 OS=Homo sapiens OX=9606 GN=ZMYND19 PE=1 SV=1,,,,,,
OG_00702,3.05497080764128,FUN_002452-T1,Peve_00043792,Pocillopora_meandrina_HIv1___RNAseq.g14890.t1,three_way,76.96466666666667,FUN_002452-T1,B9EJX3,,,,,37.0,154.0,4.3e-13,76.3,sp|B9EJX3|SMIP1_MOUSE Protein SPMIP1 OS=Mus musculus OX=10090 GN=Spmip1 PE=2 SV=1,,,,,,
OG_02349,3.0531655102844124,FUN_008950-T1,Peve_00004875,Pocillopora_meandrina_HIv1___RNAseq.g4053.t1,three_way,83.50966666666666,FUN_008950-T1,Q7T0Y4,,,,,44.0,753.0,1.2000000000000001e-122,442.2,sp|Q7T0Y4|DRC1_XENLA Dynein regulatory complex protein 1 OS=Xenopus laevis OX=8355 GN=drc1 PE=2 SV=1,,,,,,
OG_05452,3.0518846237442,FUN_024410-T1,Peve_00015480,Pocillopora_meandrina_HIv1___TS.g28029.t1a,three_way,83.57366666666667,,,,,,,,,,,,,,,,,
OG_04620,3.051071870100776,FUN_022322-T1,Peve_00021644,Pocillopora_meandrina_HIv1___RNAseq.g4643.t1,three_way,86.02233333333332,,,,,,,,,,,,,,,,,
OG_08639,3.04406134329152,FUN_037812-T1,Peve_00007681,Pocillopora_meandrina_HIv1___RNAseq.g1463.t1,three_way,71.19466666666666,FUN_037812-T1,B3EWZ6,,,,,97.5,7299.0,0.0,14917.2,sp|B3EWZ6|MLRP2_ACRMI MAM and LDL-receptor class A domain-containing protein 2 (Fragment) OS=Acropora millepora OX=45264 PE=1 SV=1,,,,,,
OG_00622,3.04070039802388,FUN_001793-T1,Peve_00008718,Pocillopora_meandrina_HIv1___RNAseq.g2635.t1a,three_way,54.11416666666666,FUN_001793-T1,Q60997,DMBT1_MOUSE,,Scavenger receptor cysteine-rich domain-containing protein DMBT1 (Apactin) (CRP-ductin) (Deleted in malignant brain tumors 1 protein) (Glycoprotein 300) (gp300) (Hensin) (Mucin-like glycoprotein) (Muclin) (Vomeroglandin) (p80),Mus musculus (Mouse),40.2,112.0,1.9e-13,79.3,sp|Q60997|DMBT1_MOUSE Scavenger receptor cysteine-rich domain-containing protein DMBT1 OS=Mus musculus OX=10090 GN=Dmbt1 PE=1 SV=2,GO:0001824; GO:0001833; GO:0002065; GO:0005576; GO:0009617; GO:0015031; GO:0030658; GO:0030858; GO:0031012; GO:0035375; GO:0042589; GO:0050829; GO:0050830; GO:0062023,blastocyst development [GO:0001824]; columnar/cuboidal epithelial cell differentiation [GO:0002065]; defense response to Gram-negative bacterium [GO:0050829]; defense response to Gram-positive bacterium [GO:0050830]; inner cell mass cell proliferation [GO:0001833]; positive regulation of epithelial cell differentiation [GO:0030858]; protein transport [GO:0015031]; response to bacterium [GO:0009617],collagen-containing extracellular matrix [GO:0062023]; extracellular matrix [GO:0031012]; extracellular region [GO:0005576]; transport vesicle membrane [GO:0030658]; zymogen granule membrane [GO:0042589],zymogen binding [GO:0035375],GO:0005576; GO:0030154; GO:0030312; GO:0031012; GO:0048856,extracellular region; cell differentiation; external encapsulating structure; extracellular matrix; anatomical structure development
OG_05636,3.0403293455104228,FUN_025335-T1,Peve_00027053,Pocillopora_meandrina_HIv1___RNAseq.g13400.t1,three_way,76.48966666666666,FUN_025335-T1,Q5ZK62,ACAP2_CHICK,,"Arf-GAP with coiled-coil, ANK repeat and PH domain-containing protein 2 (Centaurin-beta-2) (Cnt-b2)",Gallus gallus (Chicken),42.7,858.0,2.3000000000000002e-170,600.9,"sp|Q5ZK62|ACAP2_CHICK Arf-GAP with coiled-coil, ANK repeat and PH domain-containing protein 2 OS=Gallus gallus OX=9031 GN=ACAP2 PE=2 SV=1",GO:0005096; GO:0005886; GO:0008270; GO:0010008; GO:0032456; GO:1990090,cellular response to nerve growth factor stimulus [GO:1990090]; endocytic recycling [GO:0032456],endosome membrane [GO:0010008]; plasma membrane [GO:0005886],GTPase activator activity [GO:0005096]; zinc ion binding [GO:0008270],GO:0005886; GO:0016192; GO:0098772,plasma membrane; vesicle-mediated transport; molecular function regulator activity
OG_02303,3.039852835799128,FUN_008882-T1,Peve_00032041,Pocillopora_meandrina_HIv1___RNAseq.g14468.t1,three_way,62.712,FUN_008882-T1,Q32KN7,,,,,41.7,192.0,3.3e-26,120.9,sp|Q32KN7|ZC21B_BOVIN Zinc finger C2HC domain-containing protein 1B OS=Bos taurus OX=9913 GN=ZC2HC1B PE=2 SV=1,,,,,,
OG_04392,3.039755285968628,FUN_018392-T1,Peve_00031705,Pocillopora_meandrina_HIv1___RNAseq.g10095.t1,three_way,82.48366666666666,FUN_018392-T1,F1MMV1,,,,,46.6,573.0,3.8999999999999996e-142,506.5,sp|F1MMV1|EFHB_BOVIN EF-hand domain-containing family member B OS=Bos taurus OX=9913 GN=EFHB PE=1 SV=3,,,,,,
OG_01994,3.0392014708017183,FUN_008103-T1,Peve_00017193,Pocillopora_meandrina_HIv1___RNAseq.g17899.t1,three_way,61.52516666666666,FUN_008103-T1,Q3T1I9,,,,,33.8,1354.0,5.6000000000000005e-182,640.2,sp|Q3T1I9|RPAP1_RAT RNA polymerase II-associated protein 1 OS=Rattus norvegicus OX=10116 GN=Rpap1 PE=1 SV=1,,,,,,
OG_10207,3.037816403600177,FUN_043642-T1,Peve_00041942,Pocillopora_meandrina_HIv1___RNAseq.g7410.t1,three_way,83.61566666666667,,,,,,,,,,,,,,,,,
OG_03759,3.03602782384252,FUN_015068-T1,Peve_00022389,Pocillopora_meandrina_HIv1___RNAseq.g21285.t1,three_way,87.73183333333334,FUN_015068-T1,Q969V4,TEKT1_HUMAN,,Tektin-1,Homo sapiens (Human),52.9,397.0,1.9e-111,404.1,sp|Q969V4|TEKT1_HUMAN Tektin-1 OS=Homo sapiens OX=9606 GN=TEKT1 PE=1 SV=1,GO:0005634; GO:0005879; GO:0015630; GO:0030317; GO:0036126; GO:0060271; GO:0060294; GO:0160111,cilium assembly [GO:0060271]; cilium movement involved in cell motility [GO:0060294]; flagellated sperm motility [GO:0030317],axonemal A tubule inner sheath [GO:0160111]; axonemal microtubule [GO:0005879]; microtubule cytoskeleton [GO:0015630]; nucleus [GO:0005634]; sperm flagellum [GO:0036126],,GO:0005634; GO:0005856; GO:0005929; GO:0007018; GO:0022414; GO:0043226; GO:0044782; GO:0048870,nucleus; cytoskeleton; cilium; microtubule-based movement; reproductive process; organelle; cilium organization; cell motility
OG_03107,3.0312633690774136,FUN_012403-T1,Peve_00023468,Pocillopora_meandrina_HIv1___RNAseq.g23671.t1,three_way,40.333,,,,,,,,,,,,,,,,,
OG_02929,3.0308779436625444,FUN_012028-T1,Peve_00030379,Pocillopora_meandrina_HIv1___RNAseq.g24047.t2,three_way,77.09433333333334,FUN_012028-T1,Q14192,FHL2_HUMAN,,Four and a half LIM domains protein 2 (FHL-2) (LIM domain protein DRAL) (Skeletal muscle LIM-protein 3) (SLIM-3),Homo sapiens (Human),42.1,273.0,1.7000000000000002e-74,282.0,sp|Q14192|FHL2_HUMAN Four and a half LIM domains protein 2 OS=Homo sapiens OX=9606 GN=FHL2 PE=1 SV=3,GO:0000122; GO:0001649; GO:0003714; GO:0005634; GO:0005654; GO:0005925; GO:0008134; GO:0008270; GO:0009725; GO:0030018; GO:0042802; GO:0043066; GO:0043425; GO:0055014; GO:0055015; GO:0060347; GO:0070885,atrial cardiac muscle cell development [GO:0055014]; heart trabecula formation [GO:0060347]; negative regulation of apoptotic process [GO:0043066]; negative regulation of calcineurin-NFAT signaling cascade [GO:0070885]; negative regulation of transcription by RNA polymerase II [GO:0000122]; osteoblast differentiation [GO:0001649]; response to hormone [GO:0009725]; ventricular cardiac muscle cell development [GO:0055015],focal adhesion [GO:0005925]; nucleoplasm [GO:0005654]; nucleus [GO:0005634]; Z disc [GO:0030018],bHLH transcription factor binding [GO:0043425]; identical protein binding [GO:0042802]; transcription corepressor activity [GO:0003714]; transcription factor binding [GO:0008134]; zinc ion binding [GO:0008270],GO:0005634; GO:0005654; GO:0006355; GO:0030154; GO:0043226; GO:0048856; GO:0060090; GO:0140110,nucleus; nucleoplasm; regulation of DNA-templated transcription; cell differentiation; organelle; anatomical structure development; molecular adaptor activity; transcription regulator activity
