group_id,Component_8,apul,peve,ptua,type,avg_identity,query,accession,id,reviewed,protein_name,organism,pident,length,evalue,bitscore,title,go_ids,go_bp,go_cc,go_mf,goslim_ids,goslim_names
OG_07103,2.131596848708256,FUN_032365-T1,Peve_00020147,Pocillopora_meandrina_HIv1___RNAseq.g29821.t1,three_way,68.24633333333333,FUN_032365-T1,Q2KIA4,SCD5_BOVIN,,Stearoyl-CoA desaturase 5 (EC 1.14.19.1) (Acyl-CoA-desaturase 4) (Stearoyl-CoA 9-desaturase),Bos taurus (Bovine),56.5,283.0,1.6e-100,367.5,sp|Q2KIA4|SCD5_BOVIN Stearoyl-CoA desaturase 5 OS=Bos taurus OX=9913 GN=SCD5 PE=2 SV=1,GO:0004768; GO:0005506; GO:0005789; GO:0006636; GO:0016491,unsaturated fatty acid biosynthetic process [GO:0006636],endoplasmic reticulum membrane [GO:0005789],iron ion binding [GO:0005506]; oxidoreductase activity [GO:0016491]; stearoyl-CoA 9-desaturase activity [GO:0004768],GO:0003824; GO:0006629; GO:0016491,catalytic activity; lipid metabolic process; oxidoreductase activity
OG_08594,2.122967854779275,FUN_037709-T1,Peve_00027437,Pocillopora_meandrina_HIv1___RNAseq.g1402.t1,three_way,58.09033333333333,FUN_037709-T1,E7F1U2,DNMBP_DANRE,,Dynamin-binding protein (Scaffold protein Tuba),Danio rerio (Zebrafish) (Brachydanio rerio),32.4,728.0,7.8e-103,377.5,sp|E7F1U2|DNMBP_DANRE Dynamin-binding protein OS=Danio rerio OX=7955 GN=dnmbp PE=2 SV=1,GO:0001822; GO:0005085; GO:0005737; GO:0005794; GO:0005795; GO:0005856; GO:0005911; GO:0035556; GO:0045202; GO:0060271; GO:0098793,cilium assembly [GO:0060271]; intracellular signal transduction [GO:0035556]; kidney development [GO:0001822],cell-cell junction [GO:0005911]; cytoplasm [GO:0005737]; cytoskeleton [GO:0005856]; Golgi apparatus [GO:0005794]; Golgi stack [GO:0005795]; presynapse [GO:0098793]; synapse [GO:0045202],guanyl-nucleotide exchange factor activity [GO:0005085],GO:0005794; GO:0005856; GO:0043226; GO:0044782; GO:0048856; GO:0098772,Golgi apparatus; cytoskeleton; organelle; cilium organization; anatomical structure development; molecular function regulator activity
OG_08928,2.1122682973683404,FUN_038386-T1,Peve_00000061,Pocillopora_meandrina_HIv1___RNAseq.g28288.t1,three_way,58.09316666666667,FUN_038386-T1,P16065,,,,,37.9,1080.0,5.1e-181,636.7,sp|P16065|GCY_STRPU Speract receptor OS=Strongylocentrotus purpuratus OX=7668 PE=2 SV=1,,,,,,
OG_03540,2.102109258689041,FUN_014660-T1,Peve_00032454,Pocillopora_meandrina_HIv1___RNAseq.g22661.t1,three_way,97.681,FUN_014660-T1,Q2YDI3,,,,,92.9,113.0,1.6e-58,226.5,sp|Q2YDI3|YPEL2_BOVIN Protein yippee-like 2 OS=Bos taurus OX=9913 GN=YPEL2 PE=3 SV=1,,,,,,
OG_00252,2.1006595949748577,FUN_001016-T1,Peve_00041043,Pocillopora_meandrina_HIv1___RNAseq.g29160.t1,three_way,48.55133333333333,FUN_001016-T1,Q0IHU9,,,,,42.9,203.0,7.6e-44,180.6,sp|Q0IHU9|PRUN2_XENTR Protein prune homolog 2 OS=Xenopus tropicalis OX=8364 GN=Prune2 PE=2 SV=1,,,,,,
OG_06124,2.0824933321283217,FUN_027902-T1,Peve_00020105,Pocillopora_meandrina_HIv1___RNAseq.g13882.t1,three_way,48.062,,,,,,,,,,,,,,,,,
OG_03779,2.0792854096411286,FUN_015109-T1,Peve_00024001,Pocillopora_meandrina_HIv1___RNAseq.g21738.t1,three_way,67.93483333333333,FUN_015109-T1,Q9QXZ0,MACF1_MOUSE,,"Microtubule-actin cross-linking factor 1, isoforms 1/2/3/4 (Actin cross-linking family 7)",Mus musculus (Mouse),25.3,2944.0,1.6e-256,890.6,"sp|Q9QXZ0|MACF1_MOUSE Microtubule-actin cross-linking factor 1, isoforms 1/2/3/4 OS=Mus musculus OX=10090 GN=Macf1 PE=1 SV=2",GO:0001707; GO:0003779; GO:0005509; GO:0005737; GO:0005794; GO:0005874; GO:0005938; GO:0006620; GO:0007163; GO:0008017; GO:0008104; GO:0010632; GO:0014069; GO:0015629; GO:0015630; GO:0016020; GO:0016055; GO:0016477; GO:0016887; GO:0030177; GO:0030334; GO:0032587; GO:0032886; GO:0042060; GO:0043001; GO:0045104; GO:0051011; GO:0051015; GO:0051893; GO:0150011,cell migration [GO:0016477]; establishment or maintenance of cell polarity [GO:0007163]; Golgi to plasma membrane protein transport [GO:0043001]; intermediate filament cytoskeleton organization [GO:0045104]; mesoderm formation [GO:0001707]; positive regulation of Wnt signaling pathway [GO:0030177]; post-translational protein targeting to endoplasmic reticulum membrane [GO:0006620]; protein localization [GO:0008104]; regulation of cell migration [GO:0030334]; regulation of epithelial cell migration [GO:0010632]; regulation of focal adhesion assembly [GO:0051893]; regulation of microtubule-based process [GO:0032886]; regulation of neuron projection arborization [GO:0150011]; Wnt signaling pathway [GO:0016055]; wound healing [GO:0042060],actin cytoskeleton [GO:0015629]; cell cortex [GO:0005938]; cytoplasm [GO:0005737]; Golgi apparatus [GO:0005794]; membrane [GO:0016020]; microtubule [GO:0005874]; microtubule cytoskeleton [GO:0015630]; postsynaptic density [GO:0014069]; ruffle membrane [GO:0032587],actin binding [GO:0003779]; actin filament binding [GO:0051015]; ATP hydrolysis activity [GO:0016887]; calcium ion binding [GO:0005509]; microtubule binding [GO:0008017]; microtubule minus-end binding [GO:0051011],GO:0003824; GO:0005794; GO:0005856; GO:0007010; GO:0007163; GO:0008092; GO:0016192; GO:0016787; GO:0042060; GO:0043226; GO:0048870; GO:0072659,catalytic activity; Golgi apparatus; cytoskeleton; cytoskeleton organization; establishment or maintenance of cell polarity; cytoskeletal protein binding; vesicle-mediated transport; hydrolase activity; wound healing; organelle; cell motility; protein localization to plasma membrane
OG_06556,2.078896887204928,FUN_029438-T1,Peve_00028188,Pocillopora_meandrina_HIv1___RNAseq.g17152.t1,three_way,76.8055,FUN_029438-T1,Q8IZF0,NALCN_HUMAN,,Sodium leak channel NALCN (CanIon) (Sodium leak channel non-selective protein) (Voltage gated channel-like protein 1),Homo sapiens (Human),41.8,1604.0,0.0,1137.9,sp|Q8IZF0|NALCN_HUMAN Sodium leak channel NALCN OS=Homo sapiens OX=9606 GN=NALCN PE=1 SV=1,GO:0005248; GO:0005261; GO:0005272; GO:0005886; GO:0022840; GO:0032224; GO:0032230; GO:0034220; GO:0034702; GO:0035725; GO:0060075; GO:0070588; GO:0071805,"calcium ion transmembrane transport [GO:0070588]; monoatomic ion transmembrane transport [GO:0034220]; positive regulation of synaptic transmission, cholinergic [GO:0032224]; positive regulation of synaptic transmission, GABAergic [GO:0032230]; potassium ion transmembrane transport [GO:0071805]; regulation of resting membrane potential [GO:0060075]; sodium ion transmembrane transport [GO:0035725]",monoatomic ion channel complex [GO:0034702]; plasma membrane [GO:0005886],leak channel activity [GO:0022840]; monoatomic cation channel activity [GO:0005261]; sodium channel activity [GO:0005272]; voltage-gated sodium channel activity [GO:0005248],GO:0005215; GO:0005886; GO:0055085,transporter activity; plasma membrane; transmembrane transport
OG_09336,2.076802610286699,FUN_040299-T1,Peve_00038649,Pocillopora_meandrina_HIv1___TS.g20792.t1,three_way,42.627833333333335,FUN_040299-T1,Q96RW7,HMCN1_HUMAN,,Hemicentin-1 (Fibulin-6) (FIBL-6),Homo sapiens (Human),24.5,4769.0,0.0,1096.6,sp|Q96RW7|HMCN1_HUMAN Hemicentin-1 OS=Homo sapiens OX=9606 GN=HMCN1 PE=1 SV=2,GO:0005201; GO:0005509; GO:0005604; GO:0005737; GO:0005912; GO:0005927; GO:0005938; GO:0007156; GO:0007157; GO:0007601; GO:0009617; GO:0030036; GO:0032154; GO:0051301; GO:0062023; GO:0070062; GO:0071711,actin cytoskeleton organization [GO:0030036]; basement membrane organization [GO:0071711]; cell division [GO:0051301]; heterophilic cell-cell adhesion via plasma membrane cell adhesion molecules [GO:0007157]; homophilic cell adhesion via plasma membrane adhesion molecules [GO:0007156]; response to bacterium [GO:0009617]; visual perception [GO:0007601],adherens junction [GO:0005912]; basement membrane [GO:0005604]; cell cortex [GO:0005938]; cleavage furrow [GO:0032154]; collagen-containing extracellular matrix [GO:0062023]; cytoplasm [GO:0005737]; extracellular exosome [GO:0070062]; muscle tendon junction [GO:0005927],calcium ion binding [GO:0005509]; extracellular matrix structural constituent [GO:0005201],GO:0005198; GO:0007010; GO:0007155; GO:0030198; GO:0030312; GO:0031012; GO:0043226; GO:0050877,structural molecule activity; cytoskeleton organization; cell adhesion; extracellular matrix organization; external encapsulating structure; extracellular matrix; organelle; nervous system process
OG_01287,2.0760923511299345,FUN_005108-T1,Peve_00007468,Pocillopora_meandrina_HIv1___RNAseq.g8270.t1,three_way,63.20066666666666,FUN_005108-T1,Q96B86,,,,,35.5,361.0,3.8e-52,207.2,sp|Q96B86|RGMA_HUMAN Repulsive guidance molecule A OS=Homo sapiens OX=9606 GN=RGMA PE=1 SV=4,,,,,,
OG_04006,2.067295463577951,FUN_016305-T1,Peve_00032293,Pocillopora_meandrina_HIv1___RNAseq.g10040.t1,three_way,94.53566666666669,FUN_016305-T1,Q6NZ04,SIX1B_DANRE,,Homeobox protein six1b (Homeobox protein six1a) (Sine oculis homeobox homolog 1a) (Sine oculis homeobox homolog 1b),Danio rerio (Zebrafish) (Brachydanio rerio),61.8,285.0,6.9e-92,338.6,sp|Q6NZ04|SIX1B_DANRE Homeobox protein six1b OS=Danio rerio OX=7955 GN=six1b PE=1 SV=1,GO:0000978; GO:0000981; GO:0002074; GO:0005634; GO:0005667; GO:0005737; GO:0006357; GO:0006915; GO:0014857; GO:0021984; GO:0043282; GO:0048741; GO:0048839; GO:0048935; GO:0051146,adenohypophysis development [GO:0021984]; apoptotic process [GO:0006915]; chordate pharyngeal muscle development [GO:0043282]; extraocular skeletal muscle development [GO:0002074]; inner ear development [GO:0048839]; peripheral nervous system neuron development [GO:0048935]; regulation of skeletal muscle cell proliferation [GO:0014857]; regulation of transcription by RNA polymerase II [GO:0006357]; skeletal muscle fiber development [GO:0048741]; striated muscle cell differentiation [GO:0051146],cytoplasm [GO:0005737]; nucleus [GO:0005634]; transcription regulator complex [GO:0005667],"DNA-binding transcription factor activity, RNA polymerase II-specific [GO:0000981]; RNA polymerase II cis-regulatory region sequence-specific DNA binding [GO:0000978]",GO:0003677; GO:0005634; GO:0006355; GO:0012501; GO:0030154; GO:0043226; GO:0048856; GO:0140110,DNA binding; nucleus; regulation of DNA-templated transcription; programmed cell death; cell differentiation; organelle; anatomical structure development; transcription regulator activity
OG_08903,2.063406926802046,FUN_038332-T1,Peve_00023107,Pocillopora_meandrina_HIv1___RNAseq.g1118.t1,three_way,64.6005,FUN_038332-T1,Q6ZPJ0,,,,,28.1,720.0,3.7e-42,175.3,sp|Q6ZPJ0|TEX2_MOUSE Testis-expressed protein 2 OS=Mus musculus OX=10090 GN=Tex2 PE=1 SV=2,,,,,,
OG_08046,2.0627898311611386,FUN_035734-T1,Peve_00044083,Pocillopora_meandrina_HIv1___RNAseq.g11861.t1,three_way,58.831,FUN_035734-T1,Q8C080,,,,,51.9,162.0,2.9e-41,171.0,sp|Q8C080|SNX16_MOUSE Sorting nexin-16 OS=Mus musculus OX=10090 GN=Snx16 PE=1 SV=2,,,,,,
OG_08930,2.0611933276763077,FUN_038392-T1,Peve_00000048,Pocillopora_meandrina_HIv1___RNAseq.g28264.t1,three_way,76.04899999999999,FUN_038392-T1,P16065,,,,,36.6,998.0,4.3999999999999996e-160,567.0,sp|P16065|GCY_STRPU Speract receptor OS=Strongylocentrotus purpuratus OX=7668 PE=2 SV=1,,,,,,
OG_07956,2.053311777471372,FUN_035500-T1,Peve_00033958,Pocillopora_meandrina_HIv1___RNAseq.g26993.t1,three_way,59.97516666666667,FUN_035500-T1,Q5R2J4,,,,,34.4,430.0,2.7999999999999997e-68,261.2,sp|Q5R2J4|APCD1_PELSI Protein APCDD1 OS=Pelodiscus sinensis OX=13735 GN=APCDD1 PE=2 SV=1,,,,,,
OG_01366,2.0515721794801403,FUN_005313-T1,Peve_00003312,Pocillopora_meandrina_HIv1___RNAseq.g8174.t1,three_way,94.14516666666668,FUN_005313-T1,Q04727,TLE4_HUMAN,,Transducin-like enhancer protein 4 (Grg-4) (Groucho-related protein 4),Homo sapiens (Human),84.8,356.0,3.9e-180,632.1,sp|Q04727|TLE4_HUMAN Transducin-like enhancer protein 4 OS=Homo sapiens OX=9606 GN=TLE4 PE=1 SV=3,GO:0000122; GO:0003682; GO:0003714; GO:0005634; GO:0005654; GO:0005667; GO:0016055; GO:0090090; GO:0140297; GO:1990830; GO:1990907,cellular response to leukemia inhibitory factor [GO:1990830]; negative regulation of canonical Wnt signaling pathway [GO:0090090]; negative regulation of transcription by RNA polymerase II [GO:0000122]; Wnt signaling pathway [GO:0016055],beta-catenin-TCF complex [GO:1990907]; nucleoplasm [GO:0005654]; nucleus [GO:0005634]; transcription regulator complex [GO:0005667],chromatin binding [GO:0003682]; DNA-binding transcription factor binding [GO:0140297]; transcription corepressor activity [GO:0003714],GO:0005634; GO:0005654; GO:0006355; GO:0043226; GO:0060090; GO:0140110,nucleus; nucleoplasm; regulation of DNA-templated transcription; organelle; molecular adaptor activity; transcription regulator activity
OG_08704,2.050733998312994,FUN_037953-T1,Peve_00040733,Pocillopora_meandrina_HIv1___RNAseq.g26512.t1,three_way,50.168,FUN_037953-T1,Q91905,,,,,68.3,60.0,4.7e-18,92.8,sp|Q91905|FXI1B_XENLA Forkhead box protein I1-B OS=Xenopus laevis OX=8355 GN=foxi1-b PE=2 SV=1,,,,,,
OG_03209,2.048135074935205,FUN_012701-T1,Peve_00016835,Pocillopora_meandrina_HIv1___RNAseq.g12828.t1,three_way,66.00966666666667,,,,,,,,,,,,,,,,,
OG_00081,2.047622917826391,FUN_000409-T1,Peve_00033505,Pocillopora_meandrina_HIv1___RNAseq.g2517.t1,three_way,55.74733333333334,FUN_000409-T1,Q6A044,,,,,26.9,312.0,9.8e-18,93.2,sp|Q6A044|EREP2_MOUSE Protein ENTREP2 OS=Mus musculus OX=10090 GN=Entrep2 PE=2 SV=3,,,,,,
OG_02741,2.045801567328306,FUN_011284-T1,Peve_00033625,Pocillopora_meandrina_HIv1___RNAseq.g22145.t2,three_way,53.47266666666667,FUN_011284-T1,Q5M775,CYTSB_HUMAN,,Cytospin-B (Nuclear structure protein 5) (NSP5) (Sperm antigen HCMOGT-1) (Sperm antigen with calponin homology and coiled-coil domains 1),Homo sapiens (Human),46.2,106.0,1.9e-21,106.3,sp|Q5M775|CYTSB_HUMAN Cytospin-B OS=Homo sapiens OX=9606 GN=SPECC1 PE=1 SV=1,GO:0001650; GO:0001824; GO:0005654; GO:0005815; GO:0005829; GO:0008306; GO:0016020; GO:0030036; GO:0031941; GO:0043231; GO:0045177,actin cytoskeleton organization [GO:0030036]; associative learning [GO:0008306]; blastocyst development [GO:0001824],apical part of cell [GO:0045177]; cytosol [GO:0005829]; fibrillar center [GO:0001650]; filamentous actin [GO:0031941]; intracellular membrane-bounded organelle [GO:0043231]; membrane [GO:0016020]; microtubule organizing center [GO:0005815]; nucleoplasm [GO:0005654],,GO:0005654; GO:0005815; GO:0005829; GO:0007010; GO:0043226; GO:0048856; GO:0050877,nucleoplasm; microtubule organizing center; cytosol; cytoskeleton organization; organelle; anatomical structure development; nervous system process
OG_06118,2.042435465142631,FUN_027849-T2,Peve_00024334,Pocillopora_meandrina_HIv1___RNAseq.g13871.t1,three_way,64.28016666666666,FUN_027849-T2,Q9QZS7,,,,,24.7,522.0,3.9e-26,122.5,sp|Q9QZS7|NPHN_MOUSE Nephrin OS=Mus musculus OX=10090 GN=Nphs1 PE=1 SV=2,,,,,,
OG_00986,2.034019545355096,FUN_004373-T2,Peve_00007253,Pocillopora_meandrina_HIv1___TS.g17451.t1,three_way,60.50866666666667,FUN_004373-T2,P16621,,,,,38.6,2020.0,0.0,1295.0,sp|P16621|LAR_DROME Tyrosine-protein phosphatase Lar OS=Drosophila melanogaster OX=7227 GN=Lar PE=1 SV=2,,,,,,
OG_03500,2.0338985168356856,FUN_014610-T1,Peve_00027567,Pocillopora_meandrina_HIv1___TS.g27529.t1,three_way,75.49566666666666,FUN_014610-T1,P27465,,,,,48.5,361.0,3.7e-97,356.7,"sp|P27465|PISD_CRIGR Phosphatidylserine decarboxylase proenzyme, mitochondrial OS=Cricetulus griseus OX=10029 GN=Pisd PE=1 SV=2",,,,,,
OG_07679,2.0330285851549417,FUN_034797-T1,Peve_00007517,Pocillopora_meandrina_HIv1___RNAseq.g12297.t1,three_way,79.21333333333334,FUN_034797-T1,D3ZDI6,MYLIP_RAT,,E3 ubiquitin-protein ligase MYLIP (EC 2.3.2.27) (Inducible degrader of the LDL-receptor) (Idol) (Myosin regulatory light chain interacting protein) (MIR) (RING-type E3 ubiquitin transferase MYLIP),Rattus norvegicus (Rat),43.0,440.0,5.1e-96,353.2,sp|D3ZDI6|MYLIP_RAT E3 ubiquitin-protein ligase MYLIP OS=Rattus norvegicus OX=10116 GN=Mylip PE=2 SV=1,GO:0004842; GO:0005737; GO:0005856; GO:0005886; GO:0006511; GO:0007399; GO:0008092; GO:0008270; GO:0010977; GO:0010989; GO:0016567; GO:0031648; GO:0032803; GO:0042632; GO:0045732; GO:0061630,cholesterol homeostasis [GO:0042632]; negative regulation of low-density lipoprotein particle clearance [GO:0010989]; negative regulation of neuron projection development [GO:0010977]; nervous system development [GO:0007399]; positive regulation of protein catabolic process [GO:0045732]; protein destabilization [GO:0031648]; protein ubiquitination [GO:0016567]; regulation of low-density lipoprotein particle receptor catabolic process [GO:0032803]; ubiquitin-dependent protein catabolic process [GO:0006511],cytoplasm [GO:0005737]; cytoskeleton [GO:0005856]; plasma membrane [GO:0005886],cytoskeletal protein binding [GO:0008092]; ubiquitin protein ligase activity [GO:0061630]; ubiquitin-protein transferase activity [GO:0004842]; zinc ion binding [GO:0008270],GO:0003824; GO:0005856; GO:0005886; GO:0008092; GO:0016740; GO:0043226; GO:0048856; GO:0140096,"catalytic activity; cytoskeleton; plasma membrane; cytoskeletal protein binding; transferase activity; organelle; anatomical structure development; catalytic activity, acting on a protein"
OG_01261,2.0298872243628305,FUN_005023-T1,Peve_00028649,Pocillopora_meandrina_HIv1___RNAseq.g8329.t1,three_way,83.2865,FUN_005023-T1,A2BEA6,,,,,62.1,195.0,1.3e-58,228.8,sp|A2BEA6|ARI3A_DANRE AT-rich interactive domain-containing protein 3A OS=Danio rerio OX=7955 GN=arid3a PE=1 SV=1,,,,,,
OG_06110,2.027287294104557,FUN_027815-T1,Peve_00036487,Pocillopora_meandrina_HIv1___RNAseq.g13889.t2,three_way,90.976,FUN_027815-T1,Q23356,MIG15_CAEEL,,Serine/threonine-protein kinase mig-15 (EC 2.7.11.1) (Abnormal cell migration protein 15),Caenorhabditis elegans,44.9,1094.0,1.7e-240,833.9,sp|Q23356|MIG15_CAEEL Serine/threonine-protein kinase mig-15 OS=Caenorhabditis elegans OX=6239 GN=mig-15 PE=2 SV=3,GO:0000165; GO:0002119; GO:0004674; GO:0005524; GO:0005737; GO:0010171; GO:0022414; GO:0030334; GO:0032228; GO:0033563; GO:0043408; GO:0048812; GO:0106310,"body morphogenesis [GO:0010171]; dorsal/ventral axon guidance [GO:0033563]; MAPK cascade [GO:0000165]; nematode larval development [GO:0002119]; neuron projection morphogenesis [GO:0048812]; regulation of cell migration [GO:0030334]; regulation of MAPK cascade [GO:0043408]; regulation of synaptic transmission, GABAergic [GO:0032228]; reproductive process [GO:0022414]",cytoplasm [GO:0005737],ATP binding [GO:0005524]; protein serine kinase activity [GO:0106310]; protein serine/threonine kinase activity [GO:0004674],GO:0003824; GO:0016740; GO:0022414; GO:0048856; GO:0140096,"catalytic activity; transferase activity; reproductive process; anatomical structure development; catalytic activity, acting on a protein"
OG_06188,2.0256920288981526,FUN_028103-T1,Peve_00032588,Pocillopora_meandrina_HIv1___RNAseq.g15573.t1,three_way,47.289,,,,,,,,,,,,,,,,,
OG_06310,2.0228292958436045,FUN_028549-T1,Peve_00000746,Pocillopora_meandrina_HIv1___RNAseq.g6218.t1,three_way,56.03633333333333,FUN_028549-T1,Q9Y6N7,ROBO1_HUMAN,,Roundabout homolog 1 (Deleted in U twenty twenty) (H-Robo-1),Homo sapiens (Human),30.5,285.0,4.8e-29,131.7,sp|Q9Y6N7|ROBO1_HUMAN Roundabout homolog 1 OS=Homo sapiens OX=9606 GN=ROBO1 PE=1 SV=1,GO:0002042; GO:0003129; GO:0003148; GO:0003180; GO:0003184; GO:0003272; GO:0005737; GO:0005829; GO:0005886; GO:0005929; GO:0007155; GO:0007156; GO:0007399; GO:0008046; GO:0009986; GO:0010628; GO:0010629; GO:0016199; GO:0021836; GO:0030275; GO:0030336; GO:0030424; GO:0030949; GO:0033116; GO:0033600; GO:0035025; GO:0035385; GO:0035904; GO:0042802; GO:0043410; GO:0045747; GO:0050772; GO:0050925; GO:0060412; GO:0070100; GO:1900748,aorta development [GO:0035904]; aortic valve morphogenesis [GO:0003180]; axon midline choice point recognition [GO:0016199]; cell adhesion [GO:0007155]; cell migration involved in sprouting angiogenesis [GO:0002042]; chemorepulsion involved in postnatal olfactory bulb interneuron migration [GO:0021836]; endocardial cushion formation [GO:0003272]; heart induction [GO:0003129]; homophilic cell adhesion via plasma membrane adhesion molecules [GO:0007156]; negative regulation of cell migration [GO:0030336]; negative regulation of chemokine-mediated signaling pathway [GO:0070100]; negative regulation of gene expression [GO:0010629]; negative regulation of mammary gland epithelial cell proliferation [GO:0033600]; negative regulation of negative chemotaxis [GO:0050925]; nervous system development [GO:0007399]; outflow tract septum morphogenesis [GO:0003148]; positive regulation of axonogenesis [GO:0050772]; positive regulation of gene expression [GO:0010628]; positive regulation of MAPK cascade [GO:0043410]; positive regulation of Notch signaling pathway [GO:0045747]; positive regulation of Rho protein signal transduction [GO:0035025]; positive regulation of vascular endothelial growth factor receptor signaling pathway [GO:0030949]; positive regulation of vascular endothelial growth factor signaling pathway [GO:1900748]; pulmonary valve morphogenesis [GO:0003184]; Roundabout signaling pathway [GO:0035385]; ventricular septum morphogenesis [GO:0060412],axon [GO:0030424]; cell surface [GO:0009986]; cilium [GO:0005929]; cytoplasm [GO:0005737]; cytosol [GO:0005829]; endoplasmic reticulum-Golgi intermediate compartment membrane [GO:0033116]; plasma membrane [GO:0005886],axon guidance receptor activity [GO:0008046]; identical protein binding [GO:0042802]; LRR domain binding [GO:0030275],GO:0005829; GO:0005886; GO:0005929; GO:0007155; GO:0043226; GO:0048856; GO:0048870; GO:0060089,cytosol; plasma membrane; cilium; cell adhesion; organelle; anatomical structure development; cell motility; molecular transducer activity
OG_08520,2.02020241670853,FUN_037452-T1,Peve_00044119,Pocillopora_meandrina_HIv1___RNAseq.g1368.t1,three_way,59.91483333333333,FUN_037452-T1,Q9IA95,,,,,32.7,266.0,2.4e-45,184.1,sp|Q9IA95|SFRP3_CHICK Secreted frizzled-related protein 3 OS=Gallus gallus OX=9031 GN=FRZB PE=2 SV=1,,,,,,
OG_08299,2.0175003315207647,FUN_036248-T1,Peve_00045282,Pocillopora_meandrina_HIv1___TS.g14942.t1,three_way,59.625,,,,,,,,,,,,,,,,,
OG_08639,2.014669643337281,FUN_037812-T1,Peve_00007681,Pocillopora_meandrina_HIv1___RNAseq.g1463.t1,three_way,71.19466666666666,FUN_037812-T1,B3EWZ6,,,,,97.5,7299.0,0.0,14917.2,sp|B3EWZ6|MLRP2_ACRMI MAM and LDL-receptor class A domain-containing protein 2 (Fragment) OS=Acropora millepora OX=45264 PE=1 SV=1,,,,,,
OG_05147,2.0142351709991315,FUN_023426-T1,Peve_00019216,Pocillopora_meandrina_HIv1___RNAseq.g584.t1,three_way,75.90066666666667,FUN_023426-T1,Q6P4Q7,CNNM4_HUMAN,,Metal transporter CNNM4 (Ancient conserved domain-containing protein 4) (Cyclin-M4),Homo sapiens (Human),52.5,537.0,1.7e-155,550.8,sp|Q6P4Q7|CNNM4_HUMAN Metal transporter CNNM4 OS=Homo sapiens OX=9606 GN=CNNM4 PE=1 SV=3,GO:0005886; GO:0007601; GO:0010960; GO:0015081; GO:0015095; GO:0015693; GO:0016323; GO:0030003; GO:0032991; GO:0070166,enamel mineralization [GO:0070166]; intracellular monoatomic cation homeostasis [GO:0030003]; magnesium ion homeostasis [GO:0010960]; magnesium ion transport [GO:0015693]; visual perception [GO:0007601],basolateral plasma membrane [GO:0016323]; plasma membrane [GO:0005886]; protein-containing complex [GO:0032991],magnesium ion transmembrane transporter activity [GO:0015095]; sodium ion transmembrane transporter activity [GO:0015081],GO:0005215; GO:0005886; GO:0048856; GO:0050877,transporter activity; plasma membrane; anatomical structure development; nervous system process
OG_06197,2.013431872897894,FUN_028122-T1,Peve_00004261,Pocillopora_meandrina_HIv1___RNAseq.g15557.t2,three_way,43.58133333333333,FUN_028122-T1,P36335,,,,,26.3,598.0,1.3e-35,152.9,sp|P36335|NCA12_XENLA Neural cell adhesion molecule 1-B OS=Xenopus laevis OX=8355 GN=ncam1-b PE=2 SV=1,,,,,,
OG_01709,2.0131327879220344,FUN_006982-T1,Peve_00045260,Pocillopora_meandrina_HIv1___TS.g29608.t2b,three_way,78.57366666666667,FUN_006982-T1,O42412,IOD3_CHICK,,Thyroxine 5-deiodinase (EC 1.21.99.3) (5DIII) (DIOIII) (Type 3 DI) (Type III iodothyronine deiodinase),Gallus gallus (Chicken),44.9,187.0,1.9e-40,167.5,sp|O42412|IOD3_CHICK Thyroxine 5-deiodinase (Fragment) OS=Gallus gallus OX=9031 GN=DIO3 PE=1 SV=3,GO:0004800; GO:0005886; GO:0010008; GO:0033798; GO:0042403; GO:0042404; GO:0042446,hormone biosynthetic process [GO:0042446]; thyroid hormone catabolic process [GO:0042404]; thyroid hormone metabolic process [GO:0042403],endosome membrane [GO:0010008]; plasma membrane [GO:0005886],thyroxine 5'-deiodinase activity [GO:0004800]; thyroxine 5-deiodinase activity [GO:0033798],GO:0003824; GO:0005886; GO:0006575; GO:0016491,catalytic activity; plasma membrane; modified amino acid metabolic process; oxidoreductase activity
OG_01942,2.0064640123095185,FUN_007995-T1,Peve_00018055,Pocillopora_meandrina_HIv1___RNAseq.g18162.t1,three_way,60.7,FUN_007995-T1,Q13308,,,,,32.5,1058.0,5.8e-147,523.5,sp|Q13308|PTK7_HUMAN Inactive tyrosine-protein kinase 7 OS=Homo sapiens OX=9606 GN=PTK7 PE=1 SV=2,,,,,,
