group_id,Component_3,apul,peve,ptua,type,avg_identity,query,accession,id,reviewed,protein_name,organism,pident,length,evalue,bitscore,title,go_ids,go_bp,go_cc,go_mf,goslim_ids,goslim_names
OG_01656,4.377767388289668,FUN_006826-T1,Peve_00023770,Pocillopora_meandrina_HIv1___RNAseq.g20475.t1,three_way,76.18166666666667,,,,,,,,,,,,,,,,,
OG_07052,4.286610318358015,FUN_032274-T1,Peve_00011763,Pocillopora_meandrina_HIv1___RNAseq.g24974.t1,three_way,68.399,FUN_032274-T1,A8E7N9,,,,,31.6,370.0,2.9e-44,181.0,sp|A8E7N9|GDF6B_DANRE Growth/differentiation factor 6-B OS=Danio rerio OX=7955 GN=gdf6b PE=2 SV=1,,,,,,
OG_01489,4.265751844769319,FUN_006165-T1,Peve_00023607,Pocillopora_meandrina_HIv1___RNAseq.g20426.t1,three_way,60.60533333333333,FUN_006165-T1,Q2PZL6,FAT4_MOUSE,,Protocadherin Fat 4 (FAT tumor suppressor homolog 4) (Fat-like cadherin protein FAT-J),Mus musculus (Mouse),33.7,5014.0,0.0,2299.2,sp|Q2PZL6|FAT4_MOUSE Protocadherin Fat 4 OS=Mus musculus OX=10090 GN=Fat4 PE=1 SV=2,GO:0001658; GO:0001736; GO:0001822; GO:0003007; GO:0005509; GO:0005886; GO:0007009; GO:0007156; GO:0007157; GO:0007219; GO:0008543; GO:0021987; GO:0022008; GO:0035329; GO:0043931; GO:0045177; GO:0048565; GO:0060122; GO:0072006; GO:0072137; GO:0072307,branching involved in ureteric bud morphogenesis [GO:0001658]; cerebral cortex development [GO:0021987]; condensed mesenchymal cell proliferation [GO:0072137]; digestive tract development [GO:0048565]; establishment of planar polarity [GO:0001736]; fibroblast growth factor receptor signaling pathway [GO:0008543]; heart morphogenesis [GO:0003007]; heterophilic cell-cell adhesion via plasma membrane cell adhesion molecules [GO:0007157]; hippo signaling [GO:0035329]; homophilic cell adhesion via plasma membrane adhesion molecules [GO:0007156]; inner ear receptor cell stereocilium organization [GO:0060122]; kidney development [GO:0001822]; nephron development [GO:0072006]; neurogenesis [GO:0022008]; Notch signaling pathway [GO:0007219]; ossification involved in bone maturation [GO:0043931]; plasma membrane organization [GO:0007009]; regulation of metanephric nephron tubule epithelial cell differentiation [GO:0072307],apical part of cell [GO:0045177]; plasma membrane [GO:0005886],calcium ion binding [GO:0005509],GO:0005886; GO:0007155; GO:0030154; GO:0048856; GO:0061024,plasma membrane; cell adhesion; cell differentiation; anatomical structure development; membrane organization
OG_01330,4.25903466466078,FUN_005220-T1,Peve_00035492,Pocillopora_meandrina_HIv1___TS.g19865.t1,three_way,97.09066666666666,FUN_005220-T1,Q9TTR8,,,,,73.7,266.0,5e-111,402.1,sp|Q9TTR8|COT1_BOVIN COUP transcription factor 1 OS=Bos taurus OX=9913 GN=NR2F1 PE=2 SV=1,,,,,,
OG_03911,4.238348842409342,FUN_015990-T1,Peve_00023998,Pocillopora_meandrina_HIv1___RNAseq.g21387.t1,three_way,69.50233333333334,FUN_015990-T1,Q5BIM1,,,,,25.3,490.0,3.2e-30,135.2,sp|Q5BIM1|TRI45_BOVIN E3 ubiquitin-protein ligase TRIM45 OS=Bos taurus OX=9913 GN=TRIM45 PE=2 SV=1,,,,,,
OG_08930,4.200385500795434,FUN_038392-T1,Peve_00000048,Pocillopora_meandrina_HIv1___RNAseq.g28264.t1,three_way,76.04899999999999,FUN_038392-T1,P16065,,,,,36.6,998.0,4.3999999999999996e-160,567.0,sp|P16065|GCY_STRPU Speract receptor OS=Strongylocentrotus purpuratus OX=7668 PE=2 SV=1,,,,,,
OG_01407,4.198897857971303,FUN_005476-T1,Peve_00041489,Pocillopora_meandrina_HIv1___RNAseq.g6630.t1,three_way,45.82566666666667,,,,,,,,,,,,,,,,,
OG_04170,4.190446115296695,FUN_016651-T1,Peve_00042780,Pocillopora_meandrina_HIv1___TS.g6961.t1,three_way,81.653,FUN_016651-T1,Q6TMK4,POXA_DICDI,,Peroxinectin A (EC 1.11.1.7),Dictyostelium discoideum (Social amoeba),34.7,521.0,3.3e-86,322.0,sp|Q6TMK4|POXA_DICDI Peroxinectin A OS=Dictyostelium discoideum OX=44689 GN=poxA PE=1 SV=1,GO:0004447; GO:0004601; GO:0005576; GO:0005783; GO:0006955; GO:0006979; GO:0020037; GO:0036393; GO:0042742; GO:0042744; GO:0140825,defense response to bacterium [GO:0042742]; hydrogen peroxide catabolic process [GO:0042744]; immune response [GO:0006955]; response to oxidative stress [GO:0006979],endoplasmic reticulum [GO:0005783]; extracellular region [GO:0005576],heme binding [GO:0020037]; iodide peroxidase activity [GO:0004447]; lactoperoxidase activity [GO:0140825]; peroxidase activity [GO:0004601]; thiocyanate peroxidase activity [GO:0036393],GO:0002376; GO:0003824; GO:0005576; GO:0005783; GO:0016209; GO:0016491; GO:0043226,immune system process; catalytic activity; extracellular region; endoplasmic reticulum; antioxidant activity; oxidoreductase activity; organelle
OG_05757,4.167857882085311,FUN_025692-T1,Peve_00005578,Pocillopora_meandrina_HIv1___RNAseq.g13161.t2,three_way,54.39333333333333,,,,,,,,,,,,,,,,,
OG_08520,4.141812535263495,FUN_037452-T1,Peve_00044119,Pocillopora_meandrina_HIv1___RNAseq.g1368.t1,three_way,59.91483333333333,FUN_037452-T1,Q9IA95,,,,,32.7,266.0,2.4e-45,184.1,sp|Q9IA95|SFRP3_CHICK Secreted frizzled-related protein 3 OS=Gallus gallus OX=9031 GN=FRZB PE=2 SV=1,,,,,,
OG_04336,4.103198328862897,FUN_017948-T1,Peve_00000381,Pocillopora_meandrina_HIv1___RNAseq.g25232.t1,three_way,82.87233333333333,,,,,,,,,,,,,,,,,
OG_01447,4.087021171913431,FUN_005896-T1,Peve_00035817,Pocillopora_meandrina_HIv1___RNAseq.3177_t,three_way,67.3925,FUN_005896-T1,Q8K2Y0,,,,,39.0,141.0,1.2e-15,86.3,sp|Q8K2Y0|OBI1_MOUSE ORC ubiquitin ligase 1 OS=Mus musculus OX=10090 GN=Obi1 PE=1 SV=2,,,,,,
OG_08633,4.075959728409686,FUN_037802-T1,Peve_00026129,Pocillopora_meandrina_HIv1___RNAseq.g1562.t1,three_way,59.398,,,,,,,,,,,,,,,,,
OG_10198,4.070252832160911,FUN_043622-T1,Peve_00008234,Pocillopora_meandrina_HIv1___RNAseq.g6927.t1,three_way,76.94266666666667,FUN_043622-T1,Q9VUX3,NOTUM_DROME,,Palmitoleoyl-protein carboxylesterase NOTUM (EC 3.1.1.98) (Protein Notum) (Protein wingful) (dNOTUM),Drosophila melanogaster (Fruit fly),28.2,347.0,8.8e-26,119.8,sp|Q9VUX3|NOTUM_DROME Palmitoleoyl-protein carboxylesterase NOTUM OS=Drosophila melanogaster OX=7227 GN=Notum PE=1 SV=3,GO:0005615; GO:0007419; GO:0009986; GO:0016055; GO:0035220; GO:0035222; GO:0045880; GO:0048076; GO:0048190; GO:0048546; GO:0090090; GO:1990697; GO:1990699,digestive tract morphogenesis [GO:0048546]; negative regulation of canonical Wnt signaling pathway [GO:0090090]; positive regulation of smoothened signaling pathway [GO:0045880]; protein depalmitoleylation [GO:1990697]; regulation of compound eye pigmentation [GO:0048076]; ventral cord development [GO:0007419]; wing disc development [GO:0035220]; wing disc dorsal/ventral pattern formation [GO:0048190]; wing disc pattern formation [GO:0035222]; Wnt signaling pathway [GO:0016055],cell surface [GO:0009986]; extracellular space [GO:0005615],palmitoleyl hydrolase activity [GO:1990699],GO:0003824; GO:0005615; GO:0016787; GO:0030163; GO:0048856,catalytic activity; extracellular space; hydrolase activity; protein catabolic process; anatomical structure development
OG_07554,4.060062103857247,FUN_034149-T1,Peve_00026010,Pocillopora_meandrina_HIv1___TS.g23718.t1b,three_way,50.663833333333336,,,,,,,,,,,,,,,,,
OG_03658,4.037746463824801,FUN_014895-T1,Peve_00003547,Pocillopora_meandrina_HIv1___RNAseq.g21105.t1,three_way,67.7525,FUN_014895-T1,Q0VH32,,,,,50.8,122.0,6.3999999999999975e-25,116.3,sp|Q0VH32|MNT_XENLA Max-binding protein MNT OS=Xenopus laevis OX=8355 GN=mnt PE=2 SV=1,,,,,,
OG_00953,3.987039489713115,FUN_004313-T1,Peve_00033929,Pocillopora_meandrina_HIv1___RNAseq.g16987.t1,three_way,67.48483333333334,FUN_004313-T1,Q90693,,,,,37.8,1339.0,2e-235,817.8,sp|Q90693|PTC1_CHICK Protein patched homolog 1 OS=Gallus gallus OX=9031 GN=PTCH1 PE=1 SV=1,,,,,,
OG_09611,3.977033430932575,FUN_041769-T1,Peve_00041575,Pocillopora_meandrina_HIv1___RNAseq.g15246.t1,three_way,89.10266666666666,,,,,,,,,,,,,,,,,
OG_07351,3.965876590858541,FUN_033759-T1,Peve_00009253,Pocillopora_meandrina_HIv1___RNAseq.g28744.t1,three_way,61.443,FUN_033759-T1,Q28005,LSHR_BOVIN,,Lutropin-choriogonadotropic hormone receptor (LH/CG-R) (Luteinizing hormone receptor) (LSH-R),Bos taurus (Bovine),36.1,498.0,3.2000000000000003e-80,301.6,sp|Q28005|LSHR_BOVIN Lutropin-choriogonadotropic hormone receptor OS=Bos taurus OX=9913 GN=LHCGR PE=2 SV=1,GO:0001541; GO:0004964; GO:0005886; GO:0007189; GO:0007200; GO:0008528; GO:0008584; GO:0009755; GO:0022602; GO:0042700; GO:0071373,adenylate cyclase-activating G protein-coupled receptor signaling pathway [GO:0007189]; cellular response to luteinizing hormone stimulus [GO:0071373]; hormone-mediated signaling pathway [GO:0009755]; luteinizing hormone signaling pathway [GO:0042700]; male gonad development [GO:0008584]; ovarian follicle development [GO:0001541]; ovulation cycle process [GO:0022602]; phospholipase C-activating G protein-coupled receptor signaling pathway [GO:0007200],plasma membrane [GO:0005886],G protein-coupled peptide receptor activity [GO:0008528]; luteinizing hormone receptor activity [GO:0004964],GO:0005886; GO:0022414; GO:0048856; GO:0060089,plasma membrane; reproductive process; anatomical structure development; molecular transducer activity
OG_07066,3.964764415712326,FUN_032299-T1,Peve_00020128,Pocillopora_meandrina_HIv1___RNAseq.g24900.t1,three_way,50.632333333333335,FUN_032299-T1,Q3ZT31,SNX25_MOUSE,,Sorting nexin-25,Mus musculus (Mouse),27.2,125.0,1.3e-07,60.8,sp|Q3ZT31|SNX25_MOUSE Sorting nexin-25 OS=Mus musculus OX=10090 GN=Snx25 PE=1 SV=3,GO:0005768; GO:0010008; GO:0015031; GO:0030512; GO:0032801; GO:0034713; GO:0035091,negative regulation of transforming growth factor beta receptor signaling pathway [GO:0030512]; protein transport [GO:0015031]; receptor catabolic process [GO:0032801],endosome [GO:0005768]; endosome membrane [GO:0010008],phosphatidylinositol binding [GO:0035091]; type I transforming growth factor beta receptor binding [GO:0034713],GO:0005768; GO:0008289; GO:0031410; GO:0043226,endosome; lipid binding; cytoplasmic vesicle; organelle
OG_02853,3.963499589186296,FUN_011890-T1,Peve_00042786,Pocillopora_meandrina_HIv1___RNAseq.g13675.t1,three_way,73.18133333333333,FUN_011890-T1,Q9ULI1,,,,,28.0,898.0,2.4e-78,296.2,sp|Q9ULI1|NWD2_HUMAN NACHT and WD repeat domain-containing protein 2 OS=Homo sapiens OX=9606 GN=NWD2 PE=1 SV=3,,,,,,
OG_07519,3.9545142698446254,FUN_034088-T1,Peve_00037071,Pocillopora_meandrina_HIv1___RNAseq.g26059.t1,three_way,77.17566666666667,FUN_034088-T1,Q4V920,PACN1_DANRE,,Protein kinase C and casein kinase substrate in neurons protein 1 (Syndapin-1),Danio rerio (Zebrafish) (Brachydanio rerio),36.1,449.0,4.1e-70,266.9,sp|Q4V920|PACN1_DANRE Protein kinase C and casein kinase substrate in neurons protein 1 OS=Danio rerio OX=7955 GN=pacsin1b PE=1 SV=1,GO:0005543; GO:0005737; GO:0005768; GO:0005829; GO:0006897; GO:0007010; GO:0007015; GO:0030100; GO:0030659; GO:0032587; GO:0043005; GO:0045202; GO:0048812; GO:0060088; GO:0060271; GO:0097320; GO:1900006,actin filament organization [GO:0007015]; auditory receptor cell stereocilium organization [GO:0060088]; cilium assembly [GO:0060271]; cytoskeleton organization [GO:0007010]; endocytosis [GO:0006897]; neuron projection morphogenesis [GO:0048812]; plasma membrane tubulation [GO:0097320]; positive regulation of dendrite development [GO:1900006]; regulation of endocytosis [GO:0030100],cytoplasm [GO:0005737]; cytoplasmic vesicle membrane [GO:0030659]; cytosol [GO:0005829]; endosome [GO:0005768]; neuron projection [GO:0043005]; ruffle membrane [GO:0032587]; synapse [GO:0045202],phospholipid binding [GO:0005543],GO:0005768; GO:0005829; GO:0007010; GO:0008289; GO:0016192; GO:0031410; GO:0043226; GO:0044782; GO:0061024,endosome; cytosol; cytoskeleton organization; lipid binding; vesicle-mediated transport; cytoplasmic vesicle; organelle; cilium organization; membrane organization
OG_08095,3.94375288782606,FUN_035833-T1,Peve_00002593,Pocillopora_meandrina_HIv1___RNAseq.g11963.t1,three_way,82.79166666666667,FUN_035833-T1,O74212,,,,,49.9,443.0,1.9999999999999999e-128,460.7,sp|O74212|D5FAD_MORAP Acyl-lipid (8-3)-desaturase OS=Mortierella alpina OX=64518 GN=DES1 PE=1 SV=1,,,,,,
OG_04285,3.910791549948601,FUN_017848-T2,Peve_00013267,Pocillopora_meandrina_HIv1___RNAseq.g9584.t1a,three_way,68.80566666666667,FUN_017848-T2,Q09328,MGT5A_HUMAN,,"Alpha-1,6-mannosylglycoprotein 6-beta-N-acetylglucosaminyltransferase A (EC 2.4.1.155) (Alpha-mannoside beta-1,6-N-acetylglucosaminyltransferase V) (GlcNAc-T V) (GNT-V) (Mannoside acetylglucosaminyltransferase 5) (N-acetylglucosaminyl-transferase V) [Cleaved into: Secreted alpha-1,6-mannosylglycoprotein 6-beta-N-acetylglucosaminyltransferase A (Secreted beta-1,6-N-acetylglucosaminyltransferase V) (Secreted GNT-V)]",Homo sapiens (Human),37.0,873.0,6.1e-166,586.3,"sp|Q09328|MGT5A_HUMAN Alpha-1,6-mannosylglycoprotein 6-beta-N-acetylglucosaminyltransferase A OS=Homo sapiens OX=9606 GN=MGAT5 PE=1 SV=1",GO:0000139; GO:0004864; GO:0005794; GO:0006487; GO:0016020; GO:0018279; GO:0019082; GO:0030144; GO:0030145; GO:0030335; GO:0070062; GO:1904894,positive regulation of cell migration [GO:0030335]; positive regulation of receptor signaling pathway via STAT [GO:1904894]; protein N-linked glycosylation [GO:0006487]; protein N-linked glycosylation via asparagine [GO:0018279]; viral protein processing [GO:0019082],extracellular exosome [GO:0070062]; Golgi apparatus [GO:0005794]; Golgi membrane [GO:0000139]; membrane [GO:0016020],"alpha-1,6-mannosylglycoprotein 6-beta-N-acetylglucosaminyltransferase activity [GO:0030144]; manganese ion binding [GO:0030145]; protein phosphatase inhibitor activity [GO:0004864]",GO:0003824; GO:0005794; GO:0009101; GO:0016740; GO:0043226; GO:0098772; GO:0140096; GO:1901135,"catalytic activity; Golgi apparatus; glycoprotein biosynthetic process; transferase activity; organelle; molecular function regulator activity; catalytic activity, acting on a protein; carbohydrate derivative metabolic process"
OG_00679,3.893863194098615,FUN_002102-T1,Peve_00004294,Pocillopora_meandrina_HIv1___RNAseq.g1737.t1,three_way,59.12716666666666,FUN_002102-T1,P18461,,,,,37.9,833.0,3.8e-141,503.8,sp|P18461|FGFR2_CHICK Fibroblast growth factor receptor 2 OS=Gallus gallus OX=9031 GN=FGFR2 PE=2 SV=1,,,,,,
OG_00986,3.828504404515993,FUN_004373-T2,Peve_00007253,Pocillopora_meandrina_HIv1___TS.g17451.t1,three_way,60.50866666666667,FUN_004373-T2,P16621,,,,,38.6,2020.0,0.0,1295.0,sp|P16621|LAR_DROME Tyrosine-protein phosphatase Lar OS=Drosophila melanogaster OX=7227 GN=Lar PE=1 SV=2,,,,,,
OG_07679,3.820487034592067,FUN_034797-T1,Peve_00007517,Pocillopora_meandrina_HIv1___RNAseq.g12297.t1,three_way,79.21333333333334,FUN_034797-T1,D3ZDI6,MYLIP_RAT,,E3 ubiquitin-protein ligase MYLIP (EC 2.3.2.27) (Inducible degrader of the LDL-receptor) (Idol) (Myosin regulatory light chain interacting protein) (MIR) (RING-type E3 ubiquitin transferase MYLIP),Rattus norvegicus (Rat),43.0,440.0,5.1e-96,353.2,sp|D3ZDI6|MYLIP_RAT E3 ubiquitin-protein ligase MYLIP OS=Rattus norvegicus OX=10116 GN=Mylip PE=2 SV=1,GO:0004842; GO:0005737; GO:0005856; GO:0005886; GO:0006511; GO:0007399; GO:0008092; GO:0008270; GO:0010977; GO:0010989; GO:0016567; GO:0031648; GO:0032803; GO:0042632; GO:0045732; GO:0061630,cholesterol homeostasis [GO:0042632]; negative regulation of low-density lipoprotein particle clearance [GO:0010989]; negative regulation of neuron projection development [GO:0010977]; nervous system development [GO:0007399]; positive regulation of protein catabolic process [GO:0045732]; protein destabilization [GO:0031648]; protein ubiquitination [GO:0016567]; regulation of low-density lipoprotein particle receptor catabolic process [GO:0032803]; ubiquitin-dependent protein catabolic process [GO:0006511],cytoplasm [GO:0005737]; cytoskeleton [GO:0005856]; plasma membrane [GO:0005886],cytoskeletal protein binding [GO:0008092]; ubiquitin protein ligase activity [GO:0061630]; ubiquitin-protein transferase activity [GO:0004842]; zinc ion binding [GO:0008270],GO:0003824; GO:0005856; GO:0005886; GO:0008092; GO:0016740; GO:0043226; GO:0048856; GO:0140096,"catalytic activity; cytoskeleton; plasma membrane; cytoskeletal protein binding; transferase activity; organelle; anatomical structure development; catalytic activity, acting on a protein"
OG_08856,3.790933983555039,FUN_038241-T1,Peve_00029455,Pocillopora_meandrina_HIv1___RNAseq.g907.t1,three_way,65.7855,FUN_038241-T1,Q8AV58,SDK1_CHICK,,Protein sidekick-1,Gallus gallus (Chicken),30.8,1999.0,6.3e-250,866.7,sp|Q8AV58|SDK1_CHICK Protein sidekick-1 OS=Gallus gallus OX=9031 GN=SDK1 PE=1 SV=1,GO:0005886; GO:0007156; GO:0007416; GO:0010842; GO:0042802; GO:0045202,homophilic cell adhesion via plasma membrane adhesion molecules [GO:0007156]; retina layer formation [GO:0010842]; synapse assembly [GO:0007416],plasma membrane [GO:0005886]; synapse [GO:0045202],identical protein binding [GO:0042802],GO:0005886; GO:0007155; GO:0034330,plasma membrane; cell adhesion; cell junction organization
OG_06973,3.7896302507538207,FUN_032108-T1,Peve_00030224,Pocillopora_meandrina_HIv1___RNAseq.g5393.t1,three_way,58.33233333333333,FUN_032108-T1,Q8IWX5,SGPP2_HUMAN,,Sphingosine-1-phosphate phosphatase 2 (SPPase2) (Spp2) (hSPP2) (EC 3.1.3.-) (Sphingosine-1-phosphatase 2),Homo sapiens (Human),34.5,403.0,2.3e-56,221.1,sp|Q8IWX5|SGPP2_HUMAN Sphingosine-1-phosphate phosphatase 2 OS=Homo sapiens OX=9606 GN=SGPP2 PE=1 SV=1,GO:0005783; GO:0005789; GO:0006670; GO:0030149; GO:0042392; GO:0046839; GO:0061469; GO:0070780,phospholipid dephosphorylation [GO:0046839]; regulation of type B pancreatic cell proliferation [GO:0061469]; sphingolipid catabolic process [GO:0030149]; sphingosine metabolic process [GO:0006670],endoplasmic reticulum [GO:0005783]; endoplasmic reticulum membrane [GO:0005789],dihydrosphingosine-1-phosphate phosphatase activity [GO:0070780]; sphingosine-1-phosphate phosphatase activity [GO:0042392],GO:0003824; GO:0005783; GO:0006629; GO:0016787; GO:0043226,catalytic activity; endoplasmic reticulum; lipid metabolic process; hydrolase activity; organelle
OG_02049,3.784839589930883,FUN_008259-T1,Peve_00042075,Pocillopora_meandrina_HIv1___RNAseq.g17963.t1,three_way,74.48566666666667,FUN_008259-T1,O88559,MEN1_MOUSE,,Menin,Mus musculus (Mouse),42.6,599.0,3.6e-116,420.2,sp|O88559|MEN1_MOUSE Menin OS=Mus musculus OX=10090 GN=Men1 PE=1 SV=2,GO:0000122; GO:0000781; GO:0000976; GO:0001216; GO:0001503; GO:0001776; GO:0002051; GO:0002076; GO:0003677; GO:0003682; GO:0005634; GO:0005737; GO:0006338; GO:0008283; GO:0008285; GO:0010468; GO:0010628; GO:0017053; GO:0030097; GO:0035097; GO:0035265; GO:0043565; GO:0044342; GO:0044346; GO:0045668; GO:0045669; GO:0045815; GO:0045893; GO:0045944; GO:0046621; GO:0048144; GO:0048147; GO:0048704; GO:0048863; GO:0051301; GO:0051781; GO:0060021; GO:0060135; GO:0072089; GO:1904691; GO:2000045; GO:2000271; GO:2000647; GO:2000738,cell division [GO:0051301]; cell population proliferation [GO:0008283]; chromatin remodeling [GO:0006338]; embryonic skeletal system morphogenesis [GO:0048704]; fibroblast apoptotic process [GO:0044346]; fibroblast proliferation [GO:0048144]; hemopoiesis [GO:0030097]; leukocyte homeostasis [GO:0001776]; maternal process involved in female pregnancy [GO:0060135]; negative regulation of cell population proliferation [GO:0008285]; negative regulation of fibroblast proliferation [GO:0048147]; negative regulation of organ growth [GO:0046621]; negative regulation of osteoblast differentiation [GO:0045668]; negative regulation of stem cell proliferation [GO:2000647]; negative regulation of transcription by RNA polymerase II [GO:0000122]; negative regulation of type B pancreatic cell proliferation [GO:1904691]; organ growth [GO:0035265]; ossification [GO:0001503]; osteoblast development [GO:0002076]; osteoblast fate commitment [GO:0002051]; positive regulation of cell division [GO:0051781]; positive regulation of DNA-templated transcription [GO:0045893]; positive regulation of fibroblast apoptotic process [GO:2000271]; positive regulation of gene expression [GO:0010628]; positive regulation of osteoblast differentiation [GO:0045669]; positive regulation of stem cell differentiation [GO:2000738]; positive regulation of transcription by RNA polymerase II [GO:0045944]; regulation of G1/S transition of mitotic cell cycle [GO:2000045]; regulation of gene expression [GO:0010468]; roof of mouth development [GO:0060021]; stem cell differentiation [GO:0048863]; stem cell proliferation [GO:0072089]; transcription initiation-coupled chromatin remodeling [GO:0045815]; type B pancreatic cell proliferation [GO:0044342],"chromosome, telomeric region [GO:0000781]; cytoplasm [GO:0005737]; histone methyltransferase complex [GO:0035097]; nucleus [GO:0005634]; transcription repressor complex [GO:0017053]",chromatin binding [GO:0003682]; DNA binding [GO:0003677]; DNA-binding transcription activator activity [GO:0001216]; sequence-specific DNA binding [GO:0043565]; transcription cis-regulatory region binding [GO:0000976],GO:0002376; GO:0003677; GO:0005634; GO:0006325; GO:0006355; GO:0012501; GO:0022414; GO:0030154; GO:0043226; GO:0048856; GO:0140110,immune system process; DNA binding; nucleus; chromatin organization; regulation of DNA-templated transcription; programmed cell death; reproductive process; cell differentiation; organelle; anatomical structure development; transcription regulator activity
OG_07088,3.782628315483881,FUN_032345-T1,Peve_00021405,Pocillopora_meandrina_HIv1___RNAseq.g29797.t2,three_way,70.41966666666667,FUN_032345-T1,Q9V3L1,NDST_DROME,,Bifunctional heparan sulfate N-deacetylase/N-sulfotransferase (EC 2.8.2.8) (Glucosaminyl N-deacetylase/N-sulfotransferase) (Sulfateless) [Includes: Heparan sulfate N-deacetylase (EC 3.-.-.-); Heparan sulfate N-sulfotransferase (EC 2.8.2.-)],Drosophila melanogaster (Fruit fly),46.3,901.0,9.6e-236,818.1,sp|Q9V3L1|NDST_DROME Bifunctional heparan sulfate N-deacetylase/N-sulfotransferase OS=Drosophila melanogaster OX=7227 GN=sfl PE=1 SV=1,GO:0000137; GO:0000139; GO:0005783; GO:0005794; GO:0006024; GO:0006790; GO:0007283; GO:0007367; GO:0007427; GO:0007474; GO:0007509; GO:0008543; GO:0008587; GO:0015012; GO:0015016; GO:0016055; GO:0019213; GO:0030210; GO:0045570; GO:0102140,"epithelial cell migration, open tracheal system [GO:0007427]; fibroblast growth factor receptor signaling pathway [GO:0008543]; glycosaminoglycan biosynthetic process [GO:0006024]; heparan sulfate proteoglycan biosynthetic process [GO:0015012]; heparin proteoglycan biosynthetic process [GO:0030210]; imaginal disc-derived wing margin morphogenesis [GO:0008587]; imaginal disc-derived wing vein specification [GO:0007474]; mesoderm migration involved in gastrulation [GO:0007509]; regulation of imaginal disc growth [GO:0045570]; segment polarity determination [GO:0007367]; spermatogenesis [GO:0007283]; sulfur compound metabolic process [GO:0006790]; Wnt signaling pathway [GO:0016055]",endoplasmic reticulum [GO:0005783]; Golgi apparatus [GO:0005794]; Golgi cis cisterna [GO:0000137]; Golgi membrane [GO:0000139],deacetylase activity [GO:0019213]; heparan sulfate N-deacetylase activity [GO:0102140]; heparan sulfate N-sulfotransferase activity [GO:0015016],GO:0003824; GO:0005783; GO:0005794; GO:0006790; GO:0009101; GO:0016740; GO:0016787; GO:0022414; GO:0043226; GO:0048870; GO:1901135,catalytic activity; endoplasmic reticulum; Golgi apparatus; sulfur compound metabolic process; glycoprotein biosynthetic process; transferase activity; hydrolase activity; reproductive process; organelle; cell motility; carbohydrate derivative metabolic process
OG_03546,3.78065725149231,FUN_014673-T1,Peve_00013033,Pocillopora_meandrina_HIv1___RNAseq.g22680.t1,three_way,77.56683333333334,FUN_014673-T1,Q96AY4,TTC28_HUMAN,,Tetratricopeptide repeat protein 28 (TPR repeat protein 28) (TPR repeat-containing big gene cloned at Keio),Homo sapiens (Human),44.3,828.0,5.7e-171,604.4,sp|Q96AY4|TTC28_HUMAN Tetratricopeptide repeat protein 28 OS=Homo sapiens OX=9606 GN=TTC28 PE=1 SV=4,GO:0000922; GO:0005737; GO:0005813; GO:0007346; GO:0019900; GO:0030496; GO:0051301,cell division [GO:0051301]; regulation of mitotic cell cycle [GO:0007346],centrosome [GO:0005813]; cytoplasm [GO:0005737]; midbody [GO:0030496]; spindle pole [GO:0000922],kinase binding [GO:0019900],GO:0005815,microtubule organizing center
OG_06993,3.779693126789386,FUN_032139-T1,Peve_00007913,Pocillopora_meandrina_HIv1___TS.g24062.t1,three_way,49.26766666666666,,,,,,,,,,,,,,,,,
OG_08046,3.760588342953662,FUN_035734-T1,Peve_00044083,Pocillopora_meandrina_HIv1___RNAseq.g11861.t1,three_way,58.831,FUN_035734-T1,Q8C080,,,,,51.9,162.0,2.9e-41,171.0,sp|Q8C080|SNX16_MOUSE Sorting nexin-16 OS=Mus musculus OX=10090 GN=Snx16 PE=1 SV=2,,,,,,
OG_00234,3.750307729728021,FUN_000988-T1,Peve_00022149,Pocillopora_meandrina_HIv1___RNAseq.g29209.t1,three_way,82.41166666666666,FUN_000988-T1,Q92828,,,,,47.6,401.0,3.4e-101,370.5,sp|Q92828|COR2A_HUMAN Coronin-2A OS=Homo sapiens OX=9606 GN=CORO2A PE=1 SV=2,,,,,,
OG_03792,3.746226976634648,FUN_015158-T1,Peve_00001862,Pocillopora_meandrina_HIv1___RNAseq.g21765.t1,three_way,81.74516666666666,FUN_015158-T1,Q96DH6,,,,,47.2,335.0,2.3e-67,257.7,sp|Q96DH6|MSI2H_HUMAN RNA-binding protein Musashi homolog 2 OS=Homo sapiens OX=9606 GN=MSI2 PE=1 SV=1,,,,,,
