group_id,Component_1,apul,peve,ptua,type,avg_identity,query,accession,id,reviewed,protein_name,organism,pident,length,evalue,bitscore,title,go_ids,go_bp,go_cc,go_mf,goslim_ids,goslim_names
OG_06132,5.600908441596944,FUN_027938-T2,Peve_00032459,Pocillopora_meandrina_HIv1___RNAseq.g14030.t1,three_way,71.97066666666667,,,,,,,,,,,,,,,,,
OG_02090,5.324530012920092,FUN_008328-T1,Peve_00040489,Pocillopora_meandrina_HIv1___TS.g24166.t1,three_way,48.269666666666666,FUN_008328-T1,B3EWY9,,,,,39.3,990.0,2.1999999999999998e-166,589.3,sp|B3EWY9|MLP_ACRMI Mucin-like protein (Fragment) OS=Acropora millepora OX=45264 PE=1 SV=1,,,,,,
OG_06956,4.819524192917149,FUN_032081-T1,Peve_00039910,Pocillopora_meandrina_HIv1___RNAseq.g5227.t1,three_way,79.99466666666666,FUN_032081-T1,Q5RE98,AOFB_PONAB,,Amine oxidase [flavin-containing] B (EC 1.4.3.21) (EC 1.4.3.4) (Monoamine oxidase type B) (MAO-B),Pongo abelii (Sumatran orangutan) (Pongo pygmaeus abelii),47.7,486.0,1.1000000000000001e-130,468.4,sp|Q5RE98|AOFB_PONAB Amine oxidase [flavin-containing] B OS=Pongo abelii OX=9601 GN=MAOB PE=2 SV=3,GO:0005739; GO:0005741; GO:0008131; GO:0050660; GO:0097621,,mitochondrial outer membrane [GO:0005741]; mitochondrion [GO:0005739],flavin adenine dinucleotide binding [GO:0050660]; monoamine oxidase activity [GO:0097621]; primary methylamine oxidase activity [GO:0008131],GO:0003824; GO:0005739; GO:0016491; GO:0043226,catalytic activity; mitochondrion; oxidoreductase activity; organelle
OG_01486,4.80641336575467,FUN_006162-T1,Peve_00024180,Pocillopora_meandrina_HIv1___RNAseq.g20422.t1,three_way,46.14,FUN_006162-T1,Q90827,,,,,30.2,129.0,2.5e-09,65.1,sp|Q90827|NEL_CHICK Protein NEL OS=Gallus gallus OX=9031 GN=NEL PE=2 SV=1,,,,,,
OG_01620,4.6774347398165705,FUN_006729-T1,Peve_00039560,Pocillopora_meandrina_HIv1___RNAseq.g20015.t1,three_way,68.16666666666667,FUN_006729-T1,O55240,RDH5_MOUSE,,Retinol dehydrogenase 5 (EC 1.1.1.209) (EC 1.1.1.315) (EC 1.1.1.53) (11-cis retinol dehydrogenase) (11-cis RDH) (11-cis RoDH) (9-cis retinol dehydrogenase) (Cis-retinol dehydrogenase),Mus musculus (Mouse),44.6,285.0,1.7999999999999994e-68,261.2,sp|O55240|RDH5_MOUSE Retinol dehydrogenase 5 OS=Mus musculus OX=10090 GN=Rdh5 PE=1 SV=1,GO:0001523; GO:0004745; GO:0005788; GO:0005789; GO:0007601; GO:0008202; GO:0042572; GO:0042803; GO:0044297; GO:0047023; GO:0047044; GO:0106429,retinoid metabolic process [GO:0001523]; retinol metabolic process [GO:0042572]; steroid metabolic process [GO:0008202]; visual perception [GO:0007601],cell body [GO:0044297]; endoplasmic reticulum lumen [GO:0005788]; endoplasmic reticulum membrane [GO:0005789],"11-cis-retinol dehydrogenase [GO:0106429]; all-trans-retinol dehydrogenase (NAD+) activity [GO:0004745]; androstan-3-alpha,17-beta-diol dehydrogenase (NAD+) activity [GO:0047044]; androsterone dehydrogenase [NAD(P)+] activity [GO:0047023]; protein homodimerization activity [GO:0042803]",GO:0003824; GO:0006629; GO:0016491; GO:0050877,catalytic activity; lipid metabolic process; oxidoreductase activity; nervous system process
OG_05071,4.554286296852815,FUN_023293-T1,Peve_00003652,Pocillopora_meandrina_HIv1___RNAseq.g23035.t1,three_way,68.382,,,,,,,,,,,,,,,,,
OG_09233,4.519350279314697,FUN_039977-T1,Peve_00029897,Pocillopora_meandrina_HIv1___RNAseq.g7542.t1,three_way,56.55166666666666,FUN_039977-T1,Q9ULJ7,,,,,25.1,427.0,1.1e-26,124.8,sp|Q9ULJ7|ANR50_HUMAN Ankyrin repeat domain-containing protein 50 OS=Homo sapiens OX=9606 GN=ANKRD50 PE=1 SV=4,,,,,,
OG_08557,4.495657210822903,FUN_037545-T1,Peve_00032229,Pocillopora_meandrina_HIv1___RNAseq.g1633.t2,three_way,65.51433333333333,FUN_037545-T1,P60483,,,,,47.9,382.0,1.2e-98,361.7,"sp|P60483|PTEN_CANLF Phosphatidylinositol 3,4,5-trisphosphate 3-phosphatase and dual-specificity protein phosphatase PTEN OS=Canis lupus familiaris OX=9615 GN=PTEN PE=2 SV=1",,,,,,
OG_08937,4.473343274179811,FUN_038401-T1,Peve_00000033,Pocillopora_meandrina_HIv1___RNAseq.g28276.t1,three_way,76.06083333333333,FUN_038401-T1,Q9BG91,,,,,65.5,148.0,5e-50,200.3,sp|Q9BG91|SOX9_CALJA Transcription factor SOX-9 OS=Callithrix jacchus OX=9483 GN=SOX9 PE=2 SV=1,,,,,,
OG_02226,4.429917895250044,FUN_008631-T1,Peve_00012388,Pocillopora_meandrina_HIv1___RNAseq.g14912.t1,three_way,62.56166666666666,,,,,,,,,,,,,,,,,
OG_00264,4.300177730656773,FUN_001041-T1,Peve_00028475,Pocillopora_meandrina_HIv1___TS.g6804.t1,three_way,83.21833333333333,FUN_001041-T1,Q7Z5V6,SAXO4_HUMAN,,Stabilizer of axonemal microtubules 4 (Protein phosphatase 1 regulatory subunit 32),Homo sapiens (Human),33.2,455.0,1.0999999999999999e-62,242.3,sp|Q7Z5V6|SAXO4_HUMAN Stabilizer of axonemal microtubules 4 OS=Homo sapiens OX=9606 GN=SAXO4 PE=1 SV=1,GO:0005737; GO:0019902; GO:0030317; GO:0036064; GO:0036126; GO:0160111,flagellated sperm motility [GO:0030317],axonemal A tubule inner sheath [GO:0160111]; ciliary basal body [GO:0036064]; cytoplasm [GO:0005737]; sperm flagellum [GO:0036126],phosphatase binding [GO:0019902],GO:0005815; GO:0005929; GO:0007018; GO:0022414; GO:0043226; GO:0048870,microtubule organizing center; cilium; microtubule-based movement; reproductive process; organelle; cell motility
OG_06850,4.264663234541113,FUN_031791-T1,Peve_00019321,Pocillopora_meandrina_HIv1___RNAseq.g5572.t1,three_way,73.44166666666666,FUN_031791-T1,K7VCB9,,,,,43.1,232.0,1e-38,161.8,sp|K7VCB9|THIM_MAIZE Hydroxyethylthiazole kinase OS=Zea mays OX=4577 GN=THIM PE=1 SV=1,,,,,,
OG_02537,4.222295507434187,FUN_010620-T1,Peve_00031460,Pocillopora_meandrina_HIv1___TS.g26115.t1,three_way,50.77283333333333,FUN_010620-T1,O14514,AGRB1_HUMAN,,Adhesion G protein-coupled receptor B1 (Brain-specific angiogenesis inhibitor 1) [Cleaved into: Vasculostatin-40 (Vstat40); Vasculostatin-120 (Vstat120)],Homo sapiens (Human),29.6,659.0,1.9999999999999999e-63,246.9,sp|O14514|AGRB1_HUMAN Adhesion G protein-coupled receptor B1 OS=Homo sapiens OX=9606 GN=ADGRB1 PE=1 SV=2,GO:0001530; GO:0001786; GO:0001891; GO:0004930; GO:0005615; GO:0005886; GO:0005911; GO:0005925; GO:0006910; GO:0007155; GO:0007165; GO:0007166; GO:0007186; GO:0007189; GO:0007409; GO:0007422; GO:0007517; GO:0008285; GO:0010596; GO:0014069; GO:0016020; GO:0016525; GO:0030165; GO:0030425; GO:0031397; GO:0042177; GO:0043197; GO:0043277; GO:0043652; GO:0045087; GO:0048167; GO:0048471; GO:0050829; GO:0051965; GO:1901741; GO:1903428,"adenylate cyclase-activating G protein-coupled receptor signaling pathway [GO:0007189]; apoptotic cell clearance [GO:0043277]; axonogenesis [GO:0007409]; cell adhesion [GO:0007155]; cell surface receptor signaling pathway [GO:0007166]; defense response to Gram-negative bacterium [GO:0050829]; engulfment of apoptotic cell [GO:0043652]; G protein-coupled receptor signaling pathway [GO:0007186]; innate immune response [GO:0045087]; muscle organ development [GO:0007517]; negative regulation of angiogenesis [GO:0016525]; negative regulation of cell population proliferation [GO:0008285]; negative regulation of endothelial cell migration [GO:0010596]; negative regulation of protein catabolic process [GO:0042177]; negative regulation of protein ubiquitination [GO:0031397]; peripheral nervous system development [GO:0007422]; phagocytosis, recognition [GO:0006910]; positive regulation of myoblast fusion [GO:1901741]; positive regulation of reactive oxygen species biosynthetic process [GO:1903428]; positive regulation of synapse assembly [GO:0051965]; regulation of synaptic plasticity [GO:0048167]; signal transduction [GO:0007165]",cell-cell junction [GO:0005911]; dendrite [GO:0030425]; dendritic spine [GO:0043197]; extracellular space [GO:0005615]; focal adhesion [GO:0005925]; membrane [GO:0016020]; perinuclear region of cytoplasm [GO:0048471]; phagocytic cup [GO:0001891]; plasma membrane [GO:0005886]; postsynaptic density [GO:0014069],G protein-coupled receptor activity [GO:0004930]; lipopolysaccharide binding [GO:0001530]; PDZ domain binding [GO:0030165]; phosphatidylserine binding [GO:0001786],GO:0002376; GO:0005615; GO:0005886; GO:0007155; GO:0008289; GO:0016192; GO:0043226; GO:0048856; GO:0060089; GO:0061024; GO:0098542,immune system process; extracellular space; plasma membrane; cell adhesion; lipid binding; vesicle-mediated transport; organelle; anatomical structure development; molecular transducer activity; membrane organization; defense response to other organism
OG_09472,4.22102177981766,FUN_041498-T1,Peve_00007700,Pocillopora_meandrina_HIv1___TS.g10682.t1,three_way,80.48866666666666,FUN_041498-T1,Q6Q2B2,,,,,39.5,253.0,1.1e-33,145.6,sp|Q6Q2B2|MBN2A_TAKRU Muscleblind-like protein 2a OS=Takifugu rubripes OX=31033 GN=mbnl2a PE=2 SV=1,,,,,,
OG_08097,4.190271042520462,FUN_035839-T1,Peve_00032500,Pocillopora_meandrina_HIv1___RNAseq.g11958.t2,three_way,68.27866666666667,,,,,,,,,,,,,,,,,
OG_01642,4.104974998325989,FUN_006790-T1,Peve_00028070,Pocillopora_meandrina_HIv1___RNAseq.g20501.t1,three_way,54.868,FUN_006790-T1,P35918,,,,,31.5,961.0,9.8e-99,363.6,sp|P35918|VGFR2_MOUSE Vascular endothelial growth factor receptor 2 OS=Mus musculus OX=10090 GN=Kdr PE=1 SV=2,,,,,,
OG_05183,3.9999464210546014,FUN_023529-T1,Peve_00044316,Pocillopora_meandrina_HIv1___TS.g7657.t1,three_way,73.594,,,,,,,,,,,,,,,,,
OG_01645,3.927999519548742,FUN_006796-T1,Peve_00019185,Pocillopora_meandrina_HIv1___RNAseq.g20496.t1,three_way,33.34466666666667,FUN_006796-T1,Q96RW7,HMCN1_HUMAN,,Hemicentin-1 (Fibulin-6) (FIBL-6),Homo sapiens (Human),28.9,287.0,1.3e-17,92.4,sp|Q96RW7|HMCN1_HUMAN Hemicentin-1 OS=Homo sapiens OX=9606 GN=HMCN1 PE=1 SV=2,GO:0005201; GO:0005509; GO:0005604; GO:0005737; GO:0005912; GO:0005927; GO:0005938; GO:0007156; GO:0007157; GO:0007601; GO:0009617; GO:0030036; GO:0032154; GO:0051301; GO:0062023; GO:0070062; GO:0071711,actin cytoskeleton organization [GO:0030036]; basement membrane organization [GO:0071711]; cell division [GO:0051301]; heterophilic cell-cell adhesion via plasma membrane cell adhesion molecules [GO:0007157]; homophilic cell adhesion via plasma membrane adhesion molecules [GO:0007156]; response to bacterium [GO:0009617]; visual perception [GO:0007601],adherens junction [GO:0005912]; basement membrane [GO:0005604]; cell cortex [GO:0005938]; cleavage furrow [GO:0032154]; collagen-containing extracellular matrix [GO:0062023]; cytoplasm [GO:0005737]; extracellular exosome [GO:0070062]; muscle tendon junction [GO:0005927],calcium ion binding [GO:0005509]; extracellular matrix structural constituent [GO:0005201],GO:0005198; GO:0007010; GO:0007155; GO:0030198; GO:0030312; GO:0031012; GO:0043226; GO:0050877,structural molecule activity; cytoskeleton organization; cell adhesion; extracellular matrix organization; external encapsulating structure; extracellular matrix; organelle; nervous system process
OG_06757,3.9228069321233168,FUN_031570-T1,Peve_00021507,Pocillopora_meandrina_HIv1___RNAseq.g5065.t1,three_way,57.521,FUN_031570-T1,D4A218,,,,,32.0,303.0,1.1e-26,122.5,sp|D4A218|DMRT3_RAT Doublesex and mab-3 related transcription factor 3 OS=Rattus norvegicus OX=10116 GN=Dmrt3 PE=3 SV=1,,,,,,
OG_07121,3.91638718220444,FUN_032420-T1,Peve_00041753,Pocillopora_meandrina_HIv1___RNAseq.g24395.t1,three_way,71.22583333333333,,,,,,,,,,,,,,,,,
OG_00916,3.897709909545268,FUN_004253-T1,Peve_00001928,Pocillopora_meandrina_HIv1___RNAseq.g11418.t1,three_way,75.71549999999999,FUN_004253-T1,Q9MA55,,,,,30.2,364.0,6e-33,143.7,sp|Q9MA55|ACBP4_ARATH Acyl-CoA-binding domain-containing protein 4 OS=Arabidopsis thaliana OX=3702 GN=ACBP4 PE=1 SV=1,,,,,,
OG_08098,3.878929030392545,FUN_035840-T1,Peve_00032502,Pocillopora_meandrina_HIv1___RNAseq.g11957.t1,three_way,76.54033333333332,FUN_035840-T1,P38532,HSF1_MOUSE,,Heat shock factor protein 1 (HSF 1) (Heat shock transcription factor 1) (HSTF 1),Mus musculus (Mouse),55.7,176.0,1.1e-44,182.6,sp|P38532|HSF1_MOUSE Heat shock factor protein 1 OS=Mus musculus OX=10090 GN=Hsf1 PE=1 SV=2,GO:0000122; GO:0000165; GO:0000776; GO:0000791; GO:0000792; GO:0000978; GO:0001162; GO:0001227; GO:0001228; GO:0001701; GO:0001892; GO:0003677; GO:0003682; GO:0005634; GO:0005654; GO:0005737; GO:0005813; GO:0005829; GO:0006281; GO:0006397; GO:0006952; GO:0007143; GO:0007283; GO:0007584; GO:0008283; GO:0009408; GO:0010628; GO:0010667; GO:0014823; GO:0016605; GO:0019901; GO:0031072; GO:0031333; GO:0031490; GO:0032496; GO:0032720; GO:0032991; GO:0033574; GO:0034605; GO:0034620; GO:0035865; GO:0040018; GO:0042802; GO:0043565; GO:0045120; GO:0045651; GO:0045931; GO:0045944; GO:0046982; GO:0048471; GO:0050673; GO:0050680; GO:0051028; GO:0051879; GO:0060136; GO:0061770; GO:0062029; GO:0065003; GO:0070301; GO:0071222; GO:0071276; GO:0071280; GO:0071392; GO:0071466; GO:0071480; GO:0072738; GO:0090084; GO:0090261; GO:0097165; GO:0097431; GO:0097677; GO:0098847; GO:0101031; GO:0120162; GO:0140296; GO:1900034; GO:1901652; GO:1902512; GO:1903936; GO:1904385; GO:1904843; GO:1904845; GO:1990841; GO:1990904; GO:1990910; GO:1990911; GO:2001033; GO:2001235,cell population proliferation [GO:0008283]; cellular response to angiotensin [GO:1904385]; cellular response to cadmium ion [GO:0071276]; cellular response to copper ion [GO:0071280]; cellular response to diamide [GO:0072738]; cellular response to estradiol stimulus [GO:0071392]; cellular response to gamma radiation [GO:0071480]; cellular response to heat [GO:0034605]; cellular response to hydrogen peroxide [GO:0070301]; cellular response to L-glutamine [GO:1904845]; cellular response to lipopolysaccharide [GO:0071222]; cellular response to nitroglycerin [GO:1904843]; cellular response to potassium ion [GO:0035865]; cellular response to sodium arsenite [GO:1903936]; cellular response to unfolded protein [GO:0034620]; cellular response to xenobiotic stimulus [GO:0071466]; defense response [GO:0006952]; DNA repair [GO:0006281]; embryonic placenta development [GO:0001892]; embryonic process involved in female pregnancy [GO:0060136]; epithelial cell proliferation [GO:0050673]; female meiotic nuclear division [GO:0007143]; in utero embryonic development [GO:0001701]; MAPK cascade [GO:0000165]; mRNA processing [GO:0006397]; mRNA transport [GO:0051028]; negative regulation of cardiac muscle cell apoptotic process [GO:0010667]; negative regulation of double-strand break repair via nonhomologous end joining [GO:2001033]; negative regulation of epithelial cell proliferation [GO:0050680]; negative regulation of inclusion body assembly [GO:0090084]; negative regulation of protein-containing complex assembly [GO:0031333]; negative regulation of transcription by RNA polymerase II [GO:0000122]; negative regulation of tumor necrosis factor production [GO:0032720]; positive regulation of apoptotic DNA fragmentation [GO:1902512]; positive regulation of apoptotic signaling pathway [GO:2001235]; positive regulation of cold-induced thermogenesis [GO:0120162]; positive regulation of gene expression [GO:0010628]; positive regulation of inclusion body assembly [GO:0090261]; positive regulation of macrophage differentiation [GO:0045651]; positive regulation of mitotic cell cycle [GO:0045931]; positive regulation of multicellular organism growth [GO:0040018]; positive regulation of stress granule assembly [GO:0062029]; positive regulation of transcription by RNA polymerase II [GO:0045944]; protein-containing complex assembly [GO:0065003]; regulation of cellular response to heat [GO:1900034]; response to activity [GO:0014823]; response to heat [GO:0009408]; response to hypobaric hypoxia [GO:1990910]; response to lipopolysaccharide [GO:0032496]; response to nutrient [GO:0007584]; response to peptide [GO:1901652]; response to psychosocial stress [GO:1990911]; response to testosterone [GO:0033574]; spermatogenesis [GO:0007283],centrosome [GO:0005813]; cytoplasm [GO:0005737]; cytosol [GO:0005829]; euchromatin [GO:0000791]; heterochromatin [GO:0000792]; kinetochore [GO:0000776]; mitotic spindle pole [GO:0097431]; nuclear stress granule [GO:0097165]; nucleoplasm [GO:0005654]; nucleus [GO:0005634]; perinuclear region of cytoplasm [GO:0048471]; PML body [GO:0016605]; pronucleus [GO:0045120]; protein folding chaperone complex [GO:0101031]; protein-containing complex [GO:0032991]; ribonucleoprotein complex [GO:1990904],"chromatin binding [GO:0003682]; chromatin DNA binding [GO:0031490]; DNA binding [GO:0003677]; DNA-binding transcription activator activity, RNA polymerase II-specific [GO:0001228]; DNA-binding transcription repressor activity, RNA polymerase II-specific [GO:0001227]; general transcription initiation factor binding [GO:0140296]; heat shock protein binding [GO:0031072]; Hsp90 protein binding [GO:0051879]; identical protein binding [GO:0042802]; promoter-specific chromatin binding [GO:1990841]; protein heterodimerization activity [GO:0046982]; protein kinase binding [GO:0019901]; RNA polymerase II cis-regulatory region sequence-specific DNA binding [GO:0000978]; RNA polymerase II intronic transcription regulatory region sequence-specific DNA binding [GO:0001162]; sequence-specific DNA binding [GO:0043565]; sequence-specific single stranded DNA binding [GO:0098847]; STAT family protein binding [GO:0097677]; translation elongation factor binding [GO:0061770]",GO:0003677; GO:0005634; GO:0005654; GO:0005815; GO:0005829; GO:0006281; GO:0006355; GO:0016071; GO:0022414; GO:0043226; GO:0048856; GO:0065003; GO:0140013; GO:0140110,DNA binding; nucleus; nucleoplasm; microtubule organizing center; cytosol; DNA repair; regulation of DNA-templated transcription; mRNA metabolic process; reproductive process; organelle; anatomical structure development; protein-containing complex assembly; meiotic nuclear division; transcription regulator activity
OG_01450,3.864908796202738,FUN_005904-T1,Peve_00035815,Pocillopora_meandrina_HIv1___RNAseq.2460_t,three_way,73.63866666666667,FUN_005904-T1,P55115,,,,,42.3,239.0,1e-48,195.3,sp|P55115|NAS15_CAEEL Zinc metalloproteinase nas-15 OS=Caenorhabditis elegans OX=6239 GN=nas-15 PE=2 SV=2,,,,,,
OG_07134,3.8624857041160414,FUN_032459-T1,Peve_00009149,Pocillopora_meandrina_HIv1___RNAseq.g24151.t1,three_way,75.24633333333333,,,,,,,,,,,,,,,,,
OG_03845,3.85465733512481,FUN_015318-T1,Peve_00023982,Pocillopora_meandrina_HIv1___RNAseq.g21728.t1,three_way,82.93366666666667,FUN_015318-T1,Q5QNI2,,,,,31.0,532.0,4.7999999999999997e-54,213.8,sp|Q5QNI2|NCL1_ORYSJ Sodium/calcium exchanger NCL1 OS=Oryza sativa subsp. japonica OX=39947 GN=NCL1 PE=2 SV=1,,,,,,
OG_01636,3.850956510183853,FUN_006769-T1,Peve_00027411,Pocillopora_meandrina_HIv1___RNAseq.g20028.t1,three_way,57.7305,FUN_006769-T1,Q9Y2U8,MAN1_HUMAN,,Inner nuclear membrane protein Man1 (LEM domain-containing protein 3),Homo sapiens (Human),42.9,317.0,7.4e-55,216.9,sp|Q9Y2U8|MAN1_HUMAN Inner nuclear membrane protein Man1 OS=Homo sapiens OX=9606 GN=LEMD3 PE=1 SV=2,GO:0003677; GO:0005637; GO:0016020; GO:0030512; GO:0030514; GO:0031965; GO:0032926; GO:1990446,negative regulation of activin receptor signaling pathway [GO:0032926]; negative regulation of BMP signaling pathway [GO:0030514]; negative regulation of transforming growth factor beta receptor signaling pathway [GO:0030512],membrane [GO:0016020]; nuclear inner membrane [GO:0005637]; nuclear membrane [GO:0031965],DNA binding [GO:0003677]; U1 snRNP binding [GO:1990446],GO:0003677,DNA binding
OG_02927,3.8263053933632447,FUN_012020-T1,Peve_00030377,Pocillopora_meandrina_HIv1___RNAseq.g24050.t1,three_way,58.77833333333333,FUN_012020-T1,Q5UAW9,GP157_HUMAN,,G-protein coupled receptor 157,Homo sapiens (Human),34.6,289.0,1.7e-39,164.9,sp|Q5UAW9|GP157_HUMAN G-protein coupled receptor 157 OS=Homo sapiens OX=9606 GN=GPR157 PE=1 SV=2,GO:0004930; GO:0005886; GO:0007166; GO:0007189; GO:0007200; GO:0048512; GO:0060019; GO:0060170,adenylate cyclase-activating G protein-coupled receptor signaling pathway [GO:0007189]; cell surface receptor signaling pathway [GO:0007166]; circadian behavior [GO:0048512]; phospholipase C-activating G protein-coupled receptor signaling pathway [GO:0007200]; radial glial cell differentiation [GO:0060019],ciliary membrane [GO:0060170]; plasma membrane [GO:0005886],G protein-coupled receptor activity [GO:0004930],GO:0005886; GO:0030154; GO:0060089,plasma membrane; cell differentiation; molecular transducer activity
OG_00938,3.773817919290861,FUN_004288-T1,Peve_00029197,Pocillopora_meandrina_HIv1___RNAseq.g11767.t1,three_way,35.059,,,,,,,,,,,,,,,,,
OG_02341,3.766494024181639,FUN_008940-T1,Peve_00007194,Pocillopora_meandrina_HIv1___TS.g30103.t1,three_way,71.29533333333333,FUN_008940-T1,P31422,GRM3_RAT,,Metabotropic glutamate receptor 3 (mGluR3),Rattus norvegicus (Rat),41.0,808.0,1.2999999999999998e-173,611.7,sp|P31422|GRM3_RAT Metabotropic glutamate receptor 3 OS=Rattus norvegicus OX=10116 GN=Grm3 PE=1 SV=1,GO:0001641; GO:0005246; GO:0005886; GO:0007216; GO:0010467; GO:0014069; GO:0019233; GO:0030424; GO:0033554; GO:0042734; GO:0043005; GO:0043197; GO:0045211; GO:0050804; GO:0051966; GO:0097110; GO:0097449; GO:0098978; GO:0099170,"cellular response to stress [GO:0033554]; G protein-coupled glutamate receptor signaling pathway [GO:0007216]; gene expression [GO:0010467]; modulation of chemical synaptic transmission [GO:0050804]; postsynaptic modulation of chemical synaptic transmission [GO:0099170]; regulation of synaptic transmission, glutamatergic [GO:0051966]; sensory perception of pain [GO:0019233]",astrocyte projection [GO:0097449]; axon [GO:0030424]; dendritic spine [GO:0043197]; glutamatergic synapse [GO:0098978]; neuron projection [GO:0043005]; plasma membrane [GO:0005886]; postsynaptic density [GO:0014069]; postsynaptic membrane [GO:0045211]; presynaptic membrane [GO:0042734],calcium channel regulator activity [GO:0005246]; group II metabotropic glutamate receptor activity [GO:0001641]; scaffold protein binding [GO:0097110],GO:0005886; GO:0043226; GO:0050877; GO:0060089; GO:0098772,plasma membrane; organelle; nervous system process; molecular transducer activity; molecular function regulator activity
OG_01919,3.7324336668603606,FUN_007948-T1,Peve_00044442,Pocillopora_meandrina_HIv1___RNAseq.g18135.t1,three_way,64.81733333333334,FUN_007948-T1,Q3TTY0,PLB1_MOUSE,,"Phospholipase B1, membrane-associated (Phospholipase B) (Lysophospholipase) (EC 3.1.1.5) (Phospholipase A2) (EC 3.1.1.4) (Phospholipase B/lipase) (PLB/LIP) (Triacylglycerol lipase) (EC 3.1.1.3)",Mus musculus (Mouse),39.7,345.0,6.200000000000003e-66,253.4,"sp|Q3TTY0|PLB1_MOUSE Phospholipase B1, membrane-associated OS=Mus musculus OX=10090 GN=Plb1 PE=1 SV=2",GO:0004622; GO:0004806; GO:0016324; GO:0019433; GO:0031526; GO:0034478; GO:0034638; GO:0046338; GO:0046340; GO:0047499; GO:0050253; GO:2000344,diacylglycerol catabolic process [GO:0046340]; phosphatidylcholine catabolic process [GO:0034638]; phosphatidylethanolamine catabolic process [GO:0046338]; phosphatidylglycerol catabolic process [GO:0034478]; positive regulation of acrosome reaction [GO:2000344]; triglyceride catabolic process [GO:0019433],apical plasma membrane [GO:0016324]; brush border membrane [GO:0031526],calcium-independent phospholipase A2 activity [GO:0047499]; lysophospholipase activity [GO:0004622]; retinyl-palmitate esterase activity [GO:0050253]; triacylglycerol lipase activity [GO:0004806],GO:0003824; GO:0006629; GO:0016787,catalytic activity; lipid metabolic process; hydrolase activity
OG_03269,3.727457171500987,FUN_013138-T1,Peve_00042391,Pocillopora_meandrina_HIv1___TS.g15900.t1,three_way,81.306,FUN_013138-T1,Q7RTY7,OVCH1_HUMAN,,Ovochymase-1 (EC 3.4.21.-),Homo sapiens (Human),39.4,251.0,5.999999999999999e-44,179.5,sp|Q7RTY7|OVCH1_HUMAN Ovochymase-1 OS=Homo sapiens OX=9606 GN=OVCH1 PE=1 SV=3,GO:0004252; GO:0005576; GO:0006508; GO:0046872,proteolysis [GO:0006508],extracellular region [GO:0005576],metal ion binding [GO:0046872]; serine-type endopeptidase activity [GO:0004252],GO:0003824; GO:0005576; GO:0016787; GO:0140096,"catalytic activity; extracellular region; hydrolase activity; catalytic activity, acting on a protein"
OG_09443,3.707225207359372,FUN_041432-T2,Peve_00027845,Pocillopora_meandrina_HIv1___RNAseq.g15740.t1,three_way,86.71633333333334,FUN_041432-T2,Q90837,,,,,41.4,459.0,1.8000000000000002e-81,304.7,sp|Q90837|ERG_CHICK Transcriptional regulator Erg OS=Gallus gallus OX=9031 GN=ERG PE=2 SV=1,,,,,,
OG_07178,3.683537720694211,FUN_032629-T1,Peve_00033684,Pocillopora_meandrina_HIv1___RNAseq.g24118.t1,three_way,65.04233333333333,FUN_032629-T1,Q91175,,,,,32.9,316.0,2.3000000000000002e-33,144.4,sp|Q91175|ADA1A_ORYLA Alpha-1A adrenergic receptor OS=Oryzias latipes OX=8090 GN=adra1a PE=3 SV=1,,,,,,
OG_03696,3.647559512265365,FUN_014965-T1,Peve_00006259,Pocillopora_meandrina_HIv1___RNAseq.g21129.t1,three_way,85.602,FUN_014965-T1,Q8TBY9,,,,,45.2,938.0,2.5999999999999998e-244,846.7,sp|Q8TBY9|CF251_HUMAN Cilia- and flagella-associated protein 251 OS=Homo sapiens OX=9606 GN=CFAP251 PE=1 SV=2,,,,,,
OG_03335,3.638859457194074,FUN_013556-T1,Peve_00038569,Pocillopora_meandrina_HIv1___RNAseq.g22960.t1,three_way,59.44166666666667,FUN_013556-T1,Q6NR09,EGRAP_DROME,,EGFR adapter protein,Drosophila melanogaster (Fruit fly),34.3,137.0,7.7e-13,77.0,sp|Q6NR09|EGRAP_DROME EGFR adapter protein OS=Drosophila melanogaster OX=7227 GN=Egfrap PE=1 SV=1,GO:0005925; GO:0030971; GO:0042059; GO:0045179,negative regulation of epidermal growth factor receptor signaling pathway [GO:0042059],apical cortex [GO:0045179]; focal adhesion [GO:0005925],receptor tyrosine kinase binding [GO:0030971],,
OG_00246,3.603321538898802,FUN_001009-T1,Peve_00041033,Pocillopora_meandrina_HIv1___TS.g6384.t1,three_way,55.748666666666665,FUN_001009-T1,P97739,,,,,36.8,749.0,9.2e-134,479.2,sp|P97739|ECE1_CAVPO Endothelin-converting enzyme 1 OS=Cavia porcellus OX=10141 GN=ECE1 PE=2 SV=1,,,,,,
OG_07929,3.576616290359879,FUN_035418-T1,Peve_00039851,Pocillopora_meandrina_HIv1___RNAseq.g27566.t1,three_way,69.55066666666667,FUN_035418-T1,B8AJ09,,,,,28.2,312.0,1.7e-16,88.6,"sp|B8AJ09|BASS4_ORYSI Probable sodium/metabolite cotransporter BASS4, chloroplastic OS=Oryza sativa subsp. indica OX=39946 GN=BASS4 PE=3 SV=1",,,,,,
