group_id,Component_10,apul,peve,ptua,type,avg_identity,query,accession,id,reviewed,protein_name,organism,pident,length,evalue,bitscore,title,go_ids,go_bp,go_cc,go_mf,goslim_ids,goslim_names
OG_08226,1.3229117378479078,FUN_036097-T2,Peve_00032194,Pocillopora_meandrina_HIv1___RNAseq.g27437.t1,three_way,61.02516666666666,FUN_036097-T2,Q801E2,ANLN_XENLA,,Anillin,Xenopus laevis (African clawed frog),34.7,432.0,4.6e-56,221.5,sp|Q801E2|ANLN_XENLA Anillin OS=Xenopus laevis OX=8355 GN=anln PE=1 SV=1,GO:0000281; GO:0000915; GO:0003779; GO:0005634; GO:0005826; GO:0005938; GO:0031106; GO:0032059; GO:1904172,actomyosin contractile ring assembly [GO:0000915]; mitotic cytokinesis [GO:0000281]; positive regulation of bleb assembly [GO:1904172]; septin ring organization [GO:0031106],actomyosin contractile ring [GO:0005826]; bleb [GO:0032059]; cell cortex [GO:0005938]; nucleus [GO:0005634],actin binding [GO:0003779],GO:0000910; GO:0005634; GO:0007010; GO:0008092; GO:0043226,cytokinesis; nucleus; cytoskeleton organization; cytoskeletal protein binding; organelle
OG_07554,1.3206993053643064,FUN_034149-T1,Peve_00026010,Pocillopora_meandrina_HIv1___TS.g23718.t1b,three_way,50.663833333333336,,,,,,,,,,,,,,,,,
OG_01941,1.319425751442567,FUN_007993-T1,Peve_00018053,Pocillopora_meandrina_HIv1___RNAseq.g5090.t1,three_way,42.72566666666666,FUN_007993-T1,Q96RW7,HMCN1_HUMAN,,Hemicentin-1 (Fibulin-6) (FIBL-6),Homo sapiens (Human),25.9,587.0,7.1e-39,163.7,sp|Q96RW7|HMCN1_HUMAN Hemicentin-1 OS=Homo sapiens OX=9606 GN=HMCN1 PE=1 SV=2,GO:0005201; GO:0005509; GO:0005604; GO:0005737; GO:0005912; GO:0005927; GO:0005938; GO:0007156; GO:0007157; GO:0007601; GO:0009617; GO:0030036; GO:0032154; GO:0051301; GO:0062023; GO:0070062; GO:0071711,actin cytoskeleton organization [GO:0030036]; basement membrane organization [GO:0071711]; cell division [GO:0051301]; heterophilic cell-cell adhesion via plasma membrane cell adhesion molecules [GO:0007157]; homophilic cell adhesion via plasma membrane adhesion molecules [GO:0007156]; response to bacterium [GO:0009617]; visual perception [GO:0007601],adherens junction [GO:0005912]; basement membrane [GO:0005604]; cell cortex [GO:0005938]; cleavage furrow [GO:0032154]; collagen-containing extracellular matrix [GO:0062023]; cytoplasm [GO:0005737]; extracellular exosome [GO:0070062]; muscle tendon junction [GO:0005927],calcium ion binding [GO:0005509]; extracellular matrix structural constituent [GO:0005201],GO:0005198; GO:0007010; GO:0007155; GO:0030198; GO:0030312; GO:0031012; GO:0043226; GO:0050877,structural molecule activity; cytoskeleton organization; cell adhesion; extracellular matrix organization; external encapsulating structure; extracellular matrix; organelle; nervous system process
OG_05442,1.3165679424120704,FUN_024395-T1,Peve_00005021,Pocillopora_meandrina_HIv1___RNAseq.g18630.t1,three_way,66.315,FUN_024395-T1,P57102,HAND2_DANRE,,"Heart- and neural crest derivatives-expressed protein 2 (Deciduum, heart, autonomic nervous system and neural crest derivatives-expressed protein 2) (dHAND)",Danio rerio (Zebrafish) (Brachydanio rerio),43.6,140.0,1.8e-16,87.4,sp|P57102|HAND2_DANRE Heart- and neural crest derivatives-expressed protein 2 OS=Danio rerio OX=7955 GN=hand2 PE=2 SV=1,GO:0000977; GO:0000981; GO:0001947; GO:0003007; GO:0003142; GO:0003144; GO:0003342; GO:0003357; GO:0005634; GO:0006357; GO:0007507; GO:0010002; GO:0030859; GO:0030878; GO:0035051; GO:0035118; GO:0046983; GO:0048485; GO:0048703; GO:0055007; GO:0060047; GO:0071908; GO:0072015,cardiac muscle cell differentiation [GO:0055007]; cardioblast differentiation [GO:0010002]; cardiocyte differentiation [GO:0035051]; cardiogenic plate morphogenesis [GO:0003142]; determination of intestine left/right asymmetry [GO:0071908]; embryonic heart tube formation [GO:0003144]; embryonic pectoral fin morphogenesis [GO:0035118]; embryonic viscerocranium morphogenesis [GO:0048703]; heart contraction [GO:0060047]; heart development [GO:0007507]; heart looping [GO:0001947]; heart morphogenesis [GO:0003007]; noradrenergic neuron differentiation [GO:0003357]; podocyte development [GO:0072015]; polarized epithelial cell differentiation [GO:0030859]; proepicardium development [GO:0003342]; regulation of transcription by RNA polymerase II [GO:0006357]; sympathetic nervous system development [GO:0048485]; thyroid gland development [GO:0030878],nucleus [GO:0005634],"DNA-binding transcription factor activity, RNA polymerase II-specific [GO:0000981]; protein dimerization activity [GO:0046983]; RNA polymerase II transcription regulatory region sequence-specific DNA binding [GO:0000977]",GO:0003013; GO:0003677; GO:0005634; GO:0006355; GO:0030154; GO:0043226; GO:0048856; GO:0140110,circulatory system process; DNA binding; nucleus; regulation of DNA-templated transcription; cell differentiation; organelle; anatomical structure development; transcription regulator activity
OG_04868,1.312866319324652,FUN_022895-T1,Peve_00001718,Pocillopora_meandrina_HIv1___RNAseq.g3694.t1,three_way,68.29366666666667,FUN_022895-T1,F1RD85,LOX3A_DANRE,,Lysyl oxidase homolog 3A (EC 1.4.3.-) (EC 1.4.3.13) (Lysyl oxidase-like protein 3A),Danio rerio (Zebrafish) (Brachydanio rerio),39.7,715.0,1.4e-142,508.4,sp|F1RD85|LOX3A_DANRE Lysyl oxidase homolog 3A OS=Danio rerio OX=7955 GN=loxl3a PE=2 SV=1,GO:0001968; GO:0004720; GO:0005507; GO:0005615; GO:0005634; GO:0005737; GO:0006954; GO:0016020; GO:0018057; GO:0021510; GO:0030199; GO:0030324; GO:0060021; GO:0061053; GO:0062023; GO:1905590; GO:2000329; GO:2001046,collagen fibril organization [GO:0030199]; fibronectin fibril organization [GO:1905590]; inflammatory response [GO:0006954]; lung development [GO:0030324]; negative regulation of T-helper 17 cell lineage commitment [GO:2000329]; peptidyl-lysine oxidation [GO:0018057]; positive regulation of integrin-mediated signaling pathway [GO:2001046]; roof of mouth development [GO:0060021]; somite development [GO:0061053]; spinal cord development [GO:0021510],collagen-containing extracellular matrix [GO:0062023]; cytoplasm [GO:0005737]; extracellular space [GO:0005615]; membrane [GO:0016020]; nucleus [GO:0005634],copper ion binding [GO:0005507]; fibronectin binding [GO:0001968]; protein-lysine 6-oxidase activity [GO:0004720],GO:0003824; GO:0005615; GO:0005634; GO:0006954; GO:0016491; GO:0030198; GO:0043226; GO:0048856; GO:0140096,"catalytic activity; extracellular space; nucleus; inflammatory response; oxidoreductase activity; extracellular matrix organization; organelle; anatomical structure development; catalytic activity, acting on a protein"
OG_07519,1.312631995996543,FUN_034088-T1,Peve_00037071,Pocillopora_meandrina_HIv1___RNAseq.g26059.t1,three_way,77.17566666666667,FUN_034088-T1,Q4V920,PACN1_DANRE,,Protein kinase C and casein kinase substrate in neurons protein 1 (Syndapin-1),Danio rerio (Zebrafish) (Brachydanio rerio),36.1,449.0,4.1e-70,266.9,sp|Q4V920|PACN1_DANRE Protein kinase C and casein kinase substrate in neurons protein 1 OS=Danio rerio OX=7955 GN=pacsin1b PE=1 SV=1,GO:0005543; GO:0005737; GO:0005768; GO:0005829; GO:0006897; GO:0007010; GO:0007015; GO:0030100; GO:0030659; GO:0032587; GO:0043005; GO:0045202; GO:0048812; GO:0060088; GO:0060271; GO:0097320; GO:1900006,actin filament organization [GO:0007015]; auditory receptor cell stereocilium organization [GO:0060088]; cilium assembly [GO:0060271]; cytoskeleton organization [GO:0007010]; endocytosis [GO:0006897]; neuron projection morphogenesis [GO:0048812]; plasma membrane tubulation [GO:0097320]; positive regulation of dendrite development [GO:1900006]; regulation of endocytosis [GO:0030100],cytoplasm [GO:0005737]; cytoplasmic vesicle membrane [GO:0030659]; cytosol [GO:0005829]; endosome [GO:0005768]; neuron projection [GO:0043005]; ruffle membrane [GO:0032587]; synapse [GO:0045202],phospholipid binding [GO:0005543],GO:0005768; GO:0005829; GO:0007010; GO:0008289; GO:0016192; GO:0031410; GO:0043226; GO:0044782; GO:0061024,endosome; cytosol; cytoskeleton organization; lipid binding; vesicle-mediated transport; cytoplasmic vesicle; organelle; cilium organization; membrane organization
OG_07052,1.3109208781881854,FUN_032274-T1,Peve_00011763,Pocillopora_meandrina_HIv1___RNAseq.g24974.t1,three_way,68.399,FUN_032274-T1,A8E7N9,,,,,31.6,370.0,2.9e-44,181.0,sp|A8E7N9|GDF6B_DANRE Growth/differentiation factor 6-B OS=Danio rerio OX=7955 GN=gdf6b PE=2 SV=1,,,,,,
OG_02537,1.3065527998123398,FUN_010620-T1,Peve_00031460,Pocillopora_meandrina_HIv1___TS.g26115.t1,three_way,50.77283333333333,FUN_010620-T1,O14514,AGRB1_HUMAN,,Adhesion G protein-coupled receptor B1 (Brain-specific angiogenesis inhibitor 1) [Cleaved into: Vasculostatin-40 (Vstat40); Vasculostatin-120 (Vstat120)],Homo sapiens (Human),29.6,659.0,1.9999999999999999e-63,246.9,sp|O14514|AGRB1_HUMAN Adhesion G protein-coupled receptor B1 OS=Homo sapiens OX=9606 GN=ADGRB1 PE=1 SV=2,GO:0001530; GO:0001786; GO:0001891; GO:0004930; GO:0005615; GO:0005886; GO:0005911; GO:0005925; GO:0006910; GO:0007155; GO:0007165; GO:0007166; GO:0007186; GO:0007189; GO:0007409; GO:0007422; GO:0007517; GO:0008285; GO:0010596; GO:0014069; GO:0016020; GO:0016525; GO:0030165; GO:0030425; GO:0031397; GO:0042177; GO:0043197; GO:0043277; GO:0043652; GO:0045087; GO:0048167; GO:0048471; GO:0050829; GO:0051965; GO:1901741; GO:1903428,"adenylate cyclase-activating G protein-coupled receptor signaling pathway [GO:0007189]; apoptotic cell clearance [GO:0043277]; axonogenesis [GO:0007409]; cell adhesion [GO:0007155]; cell surface receptor signaling pathway [GO:0007166]; defense response to Gram-negative bacterium [GO:0050829]; engulfment of apoptotic cell [GO:0043652]; G protein-coupled receptor signaling pathway [GO:0007186]; innate immune response [GO:0045087]; muscle organ development [GO:0007517]; negative regulation of angiogenesis [GO:0016525]; negative regulation of cell population proliferation [GO:0008285]; negative regulation of endothelial cell migration [GO:0010596]; negative regulation of protein catabolic process [GO:0042177]; negative regulation of protein ubiquitination [GO:0031397]; peripheral nervous system development [GO:0007422]; phagocytosis, recognition [GO:0006910]; positive regulation of myoblast fusion [GO:1901741]; positive regulation of reactive oxygen species biosynthetic process [GO:1903428]; positive regulation of synapse assembly [GO:0051965]; regulation of synaptic plasticity [GO:0048167]; signal transduction [GO:0007165]",cell-cell junction [GO:0005911]; dendrite [GO:0030425]; dendritic spine [GO:0043197]; extracellular space [GO:0005615]; focal adhesion [GO:0005925]; membrane [GO:0016020]; perinuclear region of cytoplasm [GO:0048471]; phagocytic cup [GO:0001891]; plasma membrane [GO:0005886]; postsynaptic density [GO:0014069],G protein-coupled receptor activity [GO:0004930]; lipopolysaccharide binding [GO:0001530]; PDZ domain binding [GO:0030165]; phosphatidylserine binding [GO:0001786],GO:0002376; GO:0005615; GO:0005886; GO:0007155; GO:0008289; GO:0016192; GO:0043226; GO:0048856; GO:0060089; GO:0061024; GO:0098542,immune system process; extracellular space; plasma membrane; cell adhesion; lipid binding; vesicle-mediated transport; organelle; anatomical structure development; molecular transducer activity; membrane organization; defense response to other organism
OG_01475,1.303171382154843,FUN_006038-T1,Peve_00023433,Pocillopora_meandrina_HIv1___RNAseq.g20251.t1,three_way,65.71133333333333,FUN_006038-T1,Q7T2C4,S26A5_DANRE,,Prestin (Solute carrier family 26 member 5),Danio rerio (Zebrafish) (Brachydanio rerio),37.0,686.0,1.8e-115,418.3,sp|Q7T2C4|S26A5_DANRE Prestin OS=Danio rerio OX=7955 GN=slc26a5 PE=2 SV=1,GO:0005737; GO:0005886; GO:0006821; GO:0008271; GO:0015075; GO:0015106; GO:0015108; GO:0015116; GO:0015499; GO:0016020; GO:0019531; GO:0019532; GO:0042391; GO:0160044; GO:0160046; GO:1902358; GO:1902476,chloride transmembrane transport [GO:1902476]; chloride transport [GO:0006821]; oxalate transport [GO:0019532]; regulation of membrane potential [GO:0042391]; sulfate transmembrane transport [GO:1902358],cytoplasm [GO:0005737]; membrane [GO:0016020]; plasma membrane [GO:0005886],bicarbonate transmembrane transporter activity [GO:0015106]; chloride transmembrane transporter activity [GO:0015108]; formate transmembrane transporter activity [GO:0015499]; monoatomic ion transmembrane transporter activity [GO:0015075]; oxalate transmembrane transporter activity [GO:0019531]; oxalate:chloride antiporter activity [GO:0160046]; secondary active sulfate transmembrane transporter activity [GO:0008271]; sulfate transmembrane transporter activity [GO:0015116]; sulfate:chloride antiporter activity [GO:0160044],GO:0005215; GO:0005886; GO:0055085,transporter activity; plasma membrane; transmembrane transport
OG_05757,1.301652049566925,FUN_025692-T1,Peve_00005578,Pocillopora_meandrina_HIv1___RNAseq.g13161.t2,three_way,54.39333333333333,,,,,,,,,,,,,,,,,
OG_03061,1.2976554456844789,FUN_012325-T1,Peve_00022885,Pocillopora_meandrina_HIv1___RNAseq.g23751.t1,three_way,82.00566666666667,FUN_012325-T1,Q8R3S2,TSN33_MOUSE,,Tetraspanin-33 (Tspan-33) (Penumbra) (mPen) (Proerythroblast new membrane),Mus musculus (Mouse),45.7,258.0,7.699999999999999e-56,218.8,sp|Q8R3S2|TSN33_MOUSE Tetraspanin-33 OS=Mus musculus OX=10090 GN=Tspan33 PE=1 SV=1,GO:0005737; GO:0005912; GO:0009986; GO:0019899; GO:0046930; GO:0046931; GO:0051604; GO:0072659; GO:0097197,pore complex assembly [GO:0046931]; protein localization to plasma membrane [GO:0072659]; protein maturation [GO:0051604],adherens junction [GO:0005912]; cell surface [GO:0009986]; cytoplasm [GO:0005737]; pore complex [GO:0046930]; tetraspanin-enriched microdomain [GO:0097197],enzyme binding [GO:0019899],GO:0051604; GO:0065003; GO:0072659,protein maturation; protein-containing complex assembly; protein localization to plasma membrane
OG_08633,1.2952881370143254,FUN_037802-T1,Peve_00026129,Pocillopora_meandrina_HIv1___RNAseq.g1562.t1,three_way,59.398,,,,,,,,,,,,,,,,,
OG_07835,1.2929697118285894,FUN_035161-T1,Peve_00006324,Pocillopora_meandrina_HIv1___RNAseq.11026_t,three_way,61.05166666666667,FUN_035161-T1,Q923Y6,,,,,26.7,330.0,9.8e-13,75.9,sp|Q923Y6|TAAR9_RAT Trace amine-associated receptor 9 OS=Rattus norvegicus OX=10116 GN=Taar9 PE=2 SV=1,,,,,,
OG_09247,1.2894576211272906,FUN_040037-T1,Peve_00040431,Pocillopora_meandrina_HIv1___RNAseq.g8456.t1,three_way,47.013000000000005,FUN_040037-T1,P02788,TRFL_HUMAN,,Lactotransferrin (Lactoferrin) (EC 3.4.21.-) (Growth-inhibiting protein 12) (Talalactoferrin) [Cleaved into: Lactoferricin-H (Lfcin-H); Kaliocin-1; Lactoferroxin-A; Lactoferroxin-B; Lactoferroxin-C],Homo sapiens (Human),26.8,567.0,3.6e-34,149.1,sp|P02788|TRFL_HUMAN Lactotransferrin OS=Homo sapiens OX=9606 GN=LTF PE=1 SV=6,GO:0001503; GO:0001530; GO:0001817; GO:0002227; GO:0003677; GO:0004252; GO:0004869; GO:0005506; GO:0005576; GO:0005615; GO:0005634; GO:0005737; GO:0005769; GO:0005886; GO:0006508; GO:0006826; GO:0006959; GO:0008201; GO:0009986; GO:0019731; GO:0019732; GO:0030141; GO:0031640; GO:0031665; GO:0032680; GO:0032780; GO:0032991; GO:0033690; GO:0034145; GO:0035580; GO:0042581; GO:0043066; GO:0043123; GO:0043539; GO:0044793; GO:0045071; GO:0045669; GO:0048525; GO:0050829; GO:0051092; GO:0055037; GO:0060349; GO:0061844; GO:0070062; GO:0071902; GO:0097013; GO:0140912; GO:1900159; GO:1900229; GO:1902732; GO:1904724; GO:2000308; GO:2001205,antibacterial humoral response [GO:0019731]; antifungal humoral response [GO:0019732]; antimicrobial humoral immune response mediated by antimicrobial peptide [GO:0061844]; bone morphogenesis [GO:0060349]; defense response to Gram-negative bacterium [GO:0050829]; humoral immune response [GO:0006959]; innate immune response in mucosa [GO:0002227]; iron ion transport [GO:0006826]; killing of cells of another organism [GO:0031640]; negative regulation by host of viral process [GO:0044793]; negative regulation of apoptotic process [GO:0043066]; negative regulation of ATP-dependent activity [GO:0032780]; negative regulation of lipopolysaccharide-mediated signaling pathway [GO:0031665]; negative regulation of osteoclast development [GO:2001205]; negative regulation of single-species biofilm formation in or on host organism [GO:1900229]; negative regulation of tumor necrosis factor (ligand) superfamily member 11 production [GO:2000308]; negative regulation of viral genome replication [GO:0045071]; negative regulation of viral process [GO:0048525]; ossification [GO:0001503]; positive regulation of bone mineralization involved in bone maturation [GO:1900159]; positive regulation of canonical NF-kappaB signal transduction [GO:0043123]; positive regulation of chondrocyte proliferation [GO:1902732]; positive regulation of NF-kappaB transcription factor activity [GO:0051092]; positive regulation of osteoblast differentiation [GO:0045669]; positive regulation of osteoblast proliferation [GO:0033690]; positive regulation of protein serine/threonine kinase activity [GO:0071902]; positive regulation of toll-like receptor 4 signaling pathway [GO:0034145]; proteolysis [GO:0006508]; regulation of cytokine production [GO:0001817]; regulation of tumor necrosis factor production [GO:0032680],cell surface [GO:0009986]; cytoplasm [GO:0005737]; early endosome [GO:0005769]; extracellular exosome [GO:0070062]; extracellular region [GO:0005576]; extracellular space [GO:0005615]; nucleus [GO:0005634]; phagocytic vesicle lumen [GO:0097013]; plasma membrane [GO:0005886]; protein-containing complex [GO:0032991]; recycling endosome [GO:0055037]; secretory granule [GO:0030141]; specific granule [GO:0042581]; specific granule lumen [GO:0035580]; tertiary granule lumen [GO:1904724],cysteine-type endopeptidase inhibitor activity [GO:0004869]; DNA binding [GO:0003677]; heparin binding [GO:0008201]; iron ion binding [GO:0005506]; lipopolysaccharide binding [GO:0001530]; membrane destabilizing activity [GO:0140912]; protein serine/threonine kinase activator activity [GO:0043539]; serine-type endopeptidase activity [GO:0004252],GO:0002376; GO:0003677; GO:0003824; GO:0005576; GO:0005615; GO:0005634; GO:0005768; GO:0005886; GO:0006355; GO:0008289; GO:0016787; GO:0031410; GO:0043226; GO:0098542; GO:0098772; GO:0140096,"immune system process; DNA binding; catalytic activity; extracellular region; extracellular space; nucleus; endosome; plasma membrane; regulation of DNA-templated transcription; lipid binding; hydrolase activity; cytoplasmic vesicle; organelle; defense response to other organism; molecular function regulator activity; catalytic activity, acting on a protein"
OG_08095,1.2812555262142509,FUN_035833-T1,Peve_00002593,Pocillopora_meandrina_HIv1___RNAseq.g11963.t1,three_way,82.79166666666667,FUN_035833-T1,O74212,,,,,49.9,443.0,1.9999999999999999e-128,460.7,sp|O74212|D5FAD_MORAP Acyl-lipid (8-3)-desaturase OS=Mortierella alpina OX=64518 GN=DES1 PE=1 SV=1,,,,,,
OG_00729,1.2740359559796892,FUN_002695-T1,Peve_00009946,Pocillopora_meandrina_HIv1___RNAseq.g20725.t1,three_way,61.78816666666667,FUN_002695-T1,Q90VV1,HES4B_XENLA,,Transcription factor HES-4-B (Hairy and enhancer of split 4-B) (Protein hairy-2) (Xhairy2) (Protein hairy-2a) (Xhairy2b),Xenopus laevis (African clawed frog),37.6,194.0,7.2e-20,99.0,sp|Q90VV1|HES4B_XENLA Transcription factor HES-4-B OS=Xenopus laevis OX=8355 GN=hes4-b PE=1 SV=1,GO:0000122; GO:0000978; GO:0002088; GO:0005634; GO:0007219; GO:0007517; GO:0014029; GO:0021501; GO:0033504; GO:0043066; GO:0043565; GO:0045892; GO:0046982; GO:0048642; GO:0050767,floor plate development [GO:0033504]; lens development in camera-type eye [GO:0002088]; muscle organ development [GO:0007517]; negative regulation of apoptotic process [GO:0043066]; negative regulation of DNA-templated transcription [GO:0045892]; negative regulation of skeletal muscle tissue development [GO:0048642]; negative regulation of transcription by RNA polymerase II [GO:0000122]; neural crest formation [GO:0014029]; Notch signaling pathway [GO:0007219]; prechordal plate formation [GO:0021501]; regulation of neurogenesis [GO:0050767],nucleus [GO:0005634],protein heterodimerization activity [GO:0046982]; RNA polymerase II cis-regulatory region sequence-specific DNA binding [GO:0000978]; sequence-specific DNA binding [GO:0043565],GO:0003677; GO:0005634; GO:0006355; GO:0030154; GO:0043226; GO:0048856,DNA binding; nucleus; regulation of DNA-templated transcription; cell differentiation; organelle; anatomical structure development
OG_01498,1.2707588294567065,FUN_006222-T1,Peve_00020211,Pocillopora_meandrina_HIv1___RNAseq.g20439.t1,three_way,85.01766666666667,FUN_006222-T1,P56560,,,,,53.5,505.0,2.2e-152,540.4,sp|P56560|AOFB_BOVIN Amine oxidase [flavin-containing] B OS=Bos taurus OX=9913 GN=MAOB PE=1 SV=4,,,,,,
OG_05445,1.2677214013665434,FUN_024401-T1,Peve_00033232,Pocillopora_meandrina_HIv1___RNAseq.g18633.t1,three_way,75.52233333333334,FUN_024401-T1,P20595,GCYB1_RAT,,Guanylate cyclase soluble subunit beta-1 (GCS-beta-1) (EC 4.6.1.2) (Guanylate cyclase soluble subunit beta-3) (GCS-beta-3) (Soluble guanylate cyclase small subunit),Rattus norvegicus (Rat),46.0,620.0,2.1e-138,494.6,sp|P20595|GCYB1_RAT Guanylate cyclase soluble subunit beta-1 OS=Rattus norvegicus OX=10116 GN=Gucy1b1 PE=1 SV=2,GO:0004383; GO:0005525; GO:0005829; GO:0006182; GO:0008074; GO:0019934; GO:0020037; GO:0032991; GO:0038060; GO:0044877; GO:0046872; GO:0051879; GO:0070026; GO:0070482; GO:0071732; GO:0098831; GO:0098978,cellular response to nitric oxide [GO:0071732]; cGMP biosynthetic process [GO:0006182]; cGMP-mediated signaling [GO:0019934]; nitric oxide-cGMP-mediated signaling [GO:0038060]; response to oxygen levels [GO:0070482],"cytosol [GO:0005829]; glutamatergic synapse [GO:0098978]; guanylate cyclase complex, soluble [GO:0008074]; presynaptic active zone cytoplasmic component [GO:0098831]; protein-containing complex [GO:0032991]",GTP binding [GO:0005525]; guanylate cyclase activity [GO:0004383]; heme binding [GO:0020037]; Hsp90 protein binding [GO:0051879]; metal ion binding [GO:0046872]; nitric oxide binding [GO:0070026]; protein-containing complex binding [GO:0044877],GO:0003824; GO:0005829; GO:0009975; GO:0016829; GO:0055086; GO:1901135,catalytic activity; cytosol; cyclase activity; lyase activity; nucleobase-containing small molecule metabolic process; carbohydrate derivative metabolic process
OG_02550,1.2663686946436097,FUN_010638-T1,Peve_00009636,Pocillopora_meandrina_HIv1___RNAseq.g21309.t1,three_way,85.60366666666667,FUN_010638-T1,P79733,RIR2_DANRE,,Ribonucleoside-diphosphate reductase subunit M2 (EC 1.17.4.1) (Ribonucleotide reductase protein R2 class I) (Ribonucleotide reductase small chain) (Ribonucleotide reductase small subunit),Danio rerio (Zebrafish) (Brachydanio rerio),79.4,335.0,5.3e-151,535.4,sp|P79733|RIR2_DANRE Ribonucleoside-diphosphate reductase subunit M2 OS=Danio rerio OX=7955 GN=rrm2 PE=1 SV=1,GO:0004748; GO:0005829; GO:0009263; GO:0046872,deoxyribonucleotide biosynthetic process [GO:0009263],cytosol [GO:0005829],"metal ion binding [GO:0046872]; ribonucleoside-diphosphate reductase activity, thioredoxin disulfide as acceptor [GO:0004748]",GO:0003824; GO:0005829; GO:0016491; GO:0055086; GO:1901135,catalytic activity; cytosol; oxidoreductase activity; nucleobase-containing small molecule metabolic process; carbohydrate derivative metabolic process
OG_05551,1.2655366174356304,FUN_024758-T1,Peve_00027326,Pocillopora_meandrina_HIv1___RNAseq.g18826.t1,three_way,87.74933333333333,,,,,,,,,,,,,,,,,
OG_08930,1.262898412918651,FUN_038392-T1,Peve_00000048,Pocillopora_meandrina_HIv1___RNAseq.g28264.t1,three_way,76.04899999999999,FUN_038392-T1,P16065,,,,,36.6,998.0,4.3999999999999996e-160,567.0,sp|P16065|GCY_STRPU Speract receptor OS=Strongylocentrotus purpuratus OX=7668 PE=2 SV=1,,,,,,
