group_id,Component_3,apul,peve,ptua,type,avg_identity,query,accession,id,reviewed,protein_name,organism,pident,length,evalue,bitscore,title,go_ids,go_bp,go_cc,go_mf,goslim_ids,goslim_names
OG_04737,6.77774926124572,FUN_022613-T1,Peve_00012263,Pocillopora_meandrina_HIv1___RNAseq.g4397.t1,three_way,68.725,FUN_022613-T1,A0A0R4IKU3,RECK_DANRE,,Reversion-inducing cysteine-rich protein with Kazal motifs,Danio rerio (Zebrafish) (Brachydanio rerio),38.2,961.0,2.3000000000000002e-201,704.1,sp|A0A0R4IKU3|RECK_DANRE Reversion-inducing cysteine-rich protein with Kazal motifs OS=Danio rerio OX=7955 GN=reck PE=1 SV=3,GO:0001944; GO:0001955; GO:0002040; GO:0004866; GO:0004867; GO:0005886; GO:0008191; GO:0015026; GO:0016055; GO:0030198; GO:0045765; GO:0051726; GO:0060070; GO:0060828; GO:0090049; GO:0090210; GO:0098552; GO:1904684; GO:1990791; GO:1990909,blood vessel maturation [GO:0001955]; canonical Wnt signaling pathway [GO:0060070]; dorsal root ganglion development [GO:1990791]; extracellular matrix organization [GO:0030198]; negative regulation of metalloendopeptidase activity [GO:1904684]; regulation of angiogenesis [GO:0045765]; regulation of canonical Wnt signaling pathway [GO:0060828]; regulation of cell cycle [GO:0051726]; regulation of cell migration involved in sprouting angiogenesis [GO:0090049]; regulation of establishment of blood-brain barrier [GO:0090210]; sprouting angiogenesis [GO:0002040]; vasculature development [GO:0001944]; Wnt signaling pathway [GO:0016055],plasma membrane [GO:0005886]; side of membrane [GO:0098552]; Wnt signalosome [GO:1990909],coreceptor activity [GO:0015026]; endopeptidase inhibitor activity [GO:0004866]; metalloendopeptidase inhibitor activity [GO:0008191]; serine-type endopeptidase inhibitor activity [GO:0004867],GO:0005886; GO:0030198; GO:0048856; GO:0060089; GO:0098772,plasma membrane; extracellular matrix organization; anatomical structure development; molecular transducer activity; molecular function regulator activity
OG_01210,5.371429094048994,FUN_004887-T1,Peve_00005850,Pocillopora_meandrina_HIv1___RNAseq.g10661.t1,three_way,61.143166666666666,FUN_004887-T1,A0A0R4IBK5,R213A_DANRE,,E3 ubiquitin-protein ligase rnf213-alpha (EC 2.3.2.27) (EC 3.6.4.-) (E3 ubiquitin-lipopolysaccharide ligase rnf213-alpha) (EC 2.3.2.-) (Mysterin-A) (Mysterin-alpha) (RING finger protein 213-A) (RING finger protein 213-alpha),Danio rerio (Zebrafish) (Brachydanio rerio),31.4,1097.0,1.9e-124,450.7,sp|A0A0R4IBK5|R213A_DANRE E3 ubiquitin-protein ligase rnf213-alpha OS=Danio rerio OX=7955 GN=rnf213a PE=3 SV=1,GO:0002040; GO:0002376; GO:0004842; GO:0005524; GO:0005730; GO:0005811; GO:0005829; GO:0006511; GO:0008015; GO:0008270; GO:0016887; GO:0019216; GO:0042742; GO:0045765; GO:0061630; GO:0070534; GO:0098792; GO:0120323; GO:0140042; GO:2000051,blood circulation [GO:0008015]; defense response to bacterium [GO:0042742]; immune system process [GO:0002376]; lipid droplet formation [GO:0140042]; lipid ubiquitination [GO:0120323]; negative regulation of non-canonical Wnt signaling pathway [GO:2000051]; protein K63-linked ubiquitination [GO:0070534]; regulation of angiogenesis [GO:0045765]; regulation of lipid metabolic process [GO:0019216]; sprouting angiogenesis [GO:0002040]; ubiquitin-dependent protein catabolic process [GO:0006511]; xenophagy [GO:0098792],cytosol [GO:0005829]; lipid droplet [GO:0005811]; nucleolus [GO:0005730],ATP binding [GO:0005524]; ATP hydrolysis activity [GO:0016887]; ubiquitin protein ligase activity [GO:0061630]; ubiquitin-protein transferase activity [GO:0004842]; zinc ion binding [GO:0008270],GO:0002376; GO:0003013; GO:0003824; GO:0005730; GO:0005811; GO:0005829; GO:0006629; GO:0006914; GO:0016740; GO:0016787; GO:0043226; GO:0140096,"immune system process; circulatory system process; catalytic activity; nucleolus; lipid droplet; cytosol; lipid metabolic process; autophagy; transferase activity; hydrolase activity; organelle; catalytic activity, acting on a protein"
OG_07103,5.199872637182682,FUN_032365-T1,Peve_00020147,Pocillopora_meandrina_HIv1___RNAseq.g29821.t1,three_way,68.24633333333333,FUN_032365-T1,Q2KIA4,SCD5_BOVIN,,Stearoyl-CoA desaturase 5 (EC 1.14.19.1) (Acyl-CoA-desaturase 4) (Stearoyl-CoA 9-desaturase),Bos taurus (Bovine),56.5,283.0,1.6e-100,367.5,sp|Q2KIA4|SCD5_BOVIN Stearoyl-CoA desaturase 5 OS=Bos taurus OX=9913 GN=SCD5 PE=2 SV=1,GO:0004768; GO:0005506; GO:0005789; GO:0006636; GO:0016491,unsaturated fatty acid biosynthetic process [GO:0006636],endoplasmic reticulum membrane [GO:0005789],iron ion binding [GO:0005506]; oxidoreductase activity [GO:0016491]; stearoyl-CoA 9-desaturase activity [GO:0004768],GO:0003824; GO:0006629; GO:0016491,catalytic activity; lipid metabolic process; oxidoreductase activity
OG_01437,5.120495130462837,FUN_005873-T1,Peve_00015756,Pocillopora_meandrina_HIv1___RNAseq.g19664.t1,three_way,58.21833333333333,,,,,,,,,,,,,,,,,
OG_06522,5.075672015591818,FUN_029339-T1,Peve_00023361,Pocillopora_meandrina_HIv1___RNAseq.g17301.t1,three_way,61.434333333333335,FUN_029339-T1,Q01973,ROR1_HUMAN,,"Inactive tyrosine-protein kinase transmembrane receptor ROR1 (Neurotrophic tyrosine kinase, receptor-related 1)",Homo sapiens (Human),31.6,773.0,1.1000000000000001e-118,429.1,sp|Q01973|ROR1_HUMAN Inactive tyrosine-protein kinase transmembrane receptor ROR1 OS=Homo sapiens OX=9606 GN=ROR1 PE=1 SV=2,GO:0001725; GO:0004714; GO:0005524; GO:0005737; GO:0005886; GO:0007169; GO:0007605; GO:0008283; GO:0009986; GO:0014002; GO:0015026; GO:0017147; GO:0030424; GO:0038023; GO:0042813; GO:0043123; GO:0043235; GO:0043679; GO:0048839; GO:0051092,astrocyte development [GO:0014002]; cell population proliferation [GO:0008283]; cell surface receptor protein tyrosine kinase signaling pathway [GO:0007169]; inner ear development [GO:0048839]; positive regulation of canonical NF-kappaB signal transduction [GO:0043123]; positive regulation of NF-kappaB transcription factor activity [GO:0051092]; sensory perception of sound [GO:0007605],axon [GO:0030424]; axon terminus [GO:0043679]; cell surface [GO:0009986]; cytoplasm [GO:0005737]; plasma membrane [GO:0005886]; receptor complex [GO:0043235]; stress fiber [GO:0001725],ATP binding [GO:0005524]; coreceptor activity [GO:0015026]; signaling receptor activity [GO:0038023]; transmembrane receptor protein tyrosine kinase activity [GO:0004714]; Wnt receptor activity [GO:0042813]; Wnt-protein binding [GO:0017147],GO:0003824; GO:0005886; GO:0006355; GO:0016740; GO:0048856; GO:0050877; GO:0060089; GO:0140096,"catalytic activity; plasma membrane; regulation of DNA-templated transcription; transferase activity; anatomical structure development; nervous system process; molecular transducer activity; catalytic activity, acting on a protein"
OG_05395,5.031766000714915,FUN_024222-T1,Peve_00031895,Pocillopora_meandrina_HIv1___RNAseq.g18914.t1,three_way,77.07900000000001,FUN_024222-T1,Q13887,KLF5_HUMAN,,Krueppel-like factor 5 (Basic transcription element-binding protein 2) (BTE-binding protein 2) (Colon krueppel-like factor) (GC-box-binding protein 2) (Intestinal-enriched krueppel-like factor) (Transcription factor BTEB2),Homo sapiens (Human),38.6,166.0,5.3e-19,96.7,sp|Q13887|KLF5_HUMAN Krueppel-like factor 5 OS=Homo sapiens OX=9606 GN=KLF5 PE=1 SV=2,GO:0000122; GO:0000785; GO:0000978; GO:0000981; GO:0001228; GO:0001525; GO:0005654; GO:0005667; GO:0005794; GO:0006357; GO:0008270; GO:0008284; GO:0014816; GO:0014901; GO:0014908; GO:0030033; GO:0032534; GO:0043231; GO:0043426; GO:0045600; GO:0045944; GO:0060576; GO:0061586; GO:1901653; GO:1990830; GO:1990837,angiogenesis [GO:0001525]; cellular response to leukemia inhibitory factor [GO:1990830]; cellular response to peptide [GO:1901653]; intestinal epithelial cell development [GO:0060576]; microvillus assembly [GO:0030033]; myotube differentiation involved in skeletal muscle regeneration [GO:0014908]; negative regulation of transcription by RNA polymerase II [GO:0000122]; positive regulation of cell population proliferation [GO:0008284]; positive regulation of fat cell differentiation [GO:0045600]; positive regulation of transcription by RNA polymerase II [GO:0045944]; positive regulation of transcription by transcription factor localization [GO:0061586]; regulation of microvillus assembly [GO:0032534]; regulation of transcription by RNA polymerase II [GO:0006357]; satellite cell activation involved in skeletal muscle regeneration [GO:0014901]; skeletal muscle satellite cell differentiation [GO:0014816],chromatin [GO:0000785]; Golgi apparatus [GO:0005794]; intracellular membrane-bounded organelle [GO:0043231]; nucleoplasm [GO:0005654]; transcription regulator complex [GO:0005667],"DNA-binding transcription activator activity, RNA polymerase II-specific [GO:0001228]; DNA-binding transcription factor activity, RNA polymerase II-specific [GO:0000981]; MRF binding [GO:0043426]; RNA polymerase II cis-regulatory region sequence-specific DNA binding [GO:0000978]; sequence-specific double-stranded DNA binding [GO:1990837]; zinc ion binding [GO:0008270]",GO:0003677; GO:0005654; GO:0005794; GO:0006355; GO:0030154; GO:0043226; GO:0048856; GO:0140110,DNA binding; nucleoplasm; Golgi apparatus; regulation of DNA-templated transcription; cell differentiation; organelle; anatomical structure development; transcription regulator activity
OG_01261,4.920195327577303,FUN_005023-T1,Peve_00028649,Pocillopora_meandrina_HIv1___RNAseq.g8329.t1,three_way,83.2865,FUN_005023-T1,A2BEA6,,,,,62.1,195.0,1.3e-58,228.8,sp|A2BEA6|ARI3A_DANRE AT-rich interactive domain-containing protein 3A OS=Danio rerio OX=7955 GN=arid3a PE=1 SV=1,,,,,,
OG_07956,4.726343287580161,FUN_035500-T1,Peve_00033958,Pocillopora_meandrina_HIv1___RNAseq.g26993.t1,three_way,59.97516666666667,FUN_035500-T1,Q5R2J4,,,,,34.4,430.0,2.7999999999999997e-68,261.2,sp|Q5R2J4|APCD1_PELSI Protein APCDD1 OS=Pelodiscus sinensis OX=13735 GN=APCDD1 PE=2 SV=1,,,,,,
OG_04195,4.657029204191634,FUN_016720-T1,Peve_00014673,Pocillopora_meandrina_HIv1___RNAseq.g230.t1,three_way,61.32066666666666,FUN_016720-T1,Q64729,TGFR1_MOUSE,,TGF-beta receptor type-1 (TGFR-1) (EC 2.7.11.30) (ESK2) (Transforming growth factor-beta receptor type I) (TGF-beta receptor type I) (TbetaR-I),Mus musculus (Mouse),38.4,487.0,5.7e-74,280.0,sp|Q64729|TGFR1_MOUSE TGF-beta receptor type-1 OS=Mus musculus OX=10090 GN=Tgfbr1 PE=1 SV=1,GO:0001501; GO:0001525; GO:0001701; GO:0001822; GO:0001824; GO:0001935; GO:0001937; GO:0001938; GO:0002088; GO:0003222; GO:0003223; GO:0005024; GO:0005025; GO:0005102; GO:0005114; GO:0005524; GO:0005634; GO:0005654; GO:0005768; GO:0005886; GO:0005901; GO:0005923; GO:0005929; GO:0006915; GO:0007179; GO:0007507; GO:0008354; GO:0008584; GO:0009791; GO:0009952; GO:0009986; GO:0010468; GO:0010628; GO:0010717; GO:0010718; GO:0016020; GO:0030199; GO:0030307; GO:0030335; GO:0030336; GO:0031396; GO:0031625; GO:0032331; GO:0032924; GO:0035556; GO:0036446; GO:0042118; GO:0043065; GO:0043066; GO:0043542; GO:0045121; GO:0045893; GO:0046332; GO:0046847; GO:0046872; GO:0048538; GO:0048663; GO:0048701; GO:0048705; GO:0048762; GO:0048844; GO:0050431; GO:0051491; GO:0051496; GO:0051897; GO:0060017; GO:0060021; GO:0060037; GO:0060043; GO:0060317; GO:0060391; GO:0060395; GO:0060412; GO:0060978; GO:0060982; GO:0061450; GO:0070021; GO:0070411; GO:0070723; GO:0071560; GO:1901203; GO:1902462; GO:1904018; GO:1905007; GO:1905075; GO:1905223; GO:2001235; GO:2001237,activin receptor signaling pathway [GO:0032924]; angiogenesis [GO:0001525]; angiogenesis involved in coronary vascular morphogenesis [GO:0060978]; anterior/posterior pattern specification [GO:0009952]; apoptotic process [GO:0006915]; artery morphogenesis [GO:0048844]; blastocyst development [GO:0001824]; cardiac epithelial to mesenchymal transition [GO:0060317]; cellular response to transforming growth factor beta stimulus [GO:0071560]; collagen fibril organization [GO:0030199]; coronary artery morphogenesis [GO:0060982]; embryonic cranial skeleton morphogenesis [GO:0048701]; endothelial cell activation [GO:0042118]; endothelial cell migration [GO:0043542]; endothelial cell proliferation [GO:0001935]; epicardium morphogenesis [GO:1905223]; filopodium assembly [GO:0046847]; germ cell migration [GO:0008354]; heart development [GO:0007507]; in utero embryonic development [GO:0001701]; intracellular signal transduction [GO:0035556]; kidney development [GO:0001822]; lens development in camera-type eye [GO:0002088]; male gonad development [GO:0008584]; mesenchymal cell differentiation [GO:0048762]; myofibroblast differentiation [GO:0036446]; negative regulation of apoptotic process [GO:0043066]; negative regulation of cell migration [GO:0030336]; negative regulation of chondrocyte differentiation [GO:0032331]; negative regulation of endothelial cell proliferation [GO:0001937]; negative regulation of extrinsic apoptotic signaling pathway [GO:2001237]; neuron fate commitment [GO:0048663]; parathyroid gland development [GO:0060017]; pharyngeal system development [GO:0060037]; positive regulation of apoptotic process [GO:0043065]; positive regulation of apoptotic signaling pathway [GO:2001235]; positive regulation of cell growth [GO:0030307]; positive regulation of cell migration [GO:0030335]; positive regulation of DNA-templated transcription [GO:0045893]; positive regulation of endothelial cell proliferation [GO:0001938]; positive regulation of epithelial to mesenchymal transition [GO:0010718]; positive regulation of epithelial to mesenchymal transition involved in endocardial cushion formation [GO:1905007]; positive regulation of extracellular matrix assembly [GO:1901203]; positive regulation of filopodium assembly [GO:0051491]; positive regulation of gene expression [GO:0010628]; positive regulation of mesenchymal stem cell proliferation [GO:1902462]; positive regulation of phosphatidylinositol 3-kinase/protein kinase B signal transduction [GO:0051897]; positive regulation of SMAD protein signal transduction [GO:0060391]; positive regulation of stress fiber assembly [GO:0051496]; positive regulation of tight junction disassembly [GO:1905075]; positive regulation of vasculature development [GO:1904018]; post-embryonic development [GO:0009791]; regulation of cardiac muscle cell proliferation [GO:0060043]; regulation of epithelial to mesenchymal transition [GO:0010717]; regulation of gene expression [GO:0010468]; regulation of protein ubiquitination [GO:0031396]; response to cholesterol [GO:0070723]; roof of mouth development [GO:0060021]; skeletal system development [GO:0001501]; skeletal system morphogenesis [GO:0048705]; SMAD protein signal transduction [GO:0060395]; thymus development [GO:0048538]; transforming growth factor beta receptor signaling pathway [GO:0007179]; trophoblast cell migration [GO:0061450]; ventricular compact myocardium morphogenesis [GO:0003223]; ventricular septum morphogenesis [GO:0060412]; ventricular trabecula myocardium morphogenesis [GO:0003222],bicellular tight junction [GO:0005923]; caveola [GO:0005901]; cell surface [GO:0009986]; cilium [GO:0005929]; endosome [GO:0005768]; membrane [GO:0016020]; membrane raft [GO:0045121]; nucleoplasm [GO:0005654]; nucleus [GO:0005634]; plasma membrane [GO:0005886]; transforming growth factor beta ligand-receptor complex [GO:0070021],"ATP binding [GO:0005524]; I-SMAD binding [GO:0070411]; metal ion binding [GO:0046872]; signaling receptor binding [GO:0005102]; SMAD binding [GO:0046332]; transforming growth factor beta binding [GO:0050431]; transforming growth factor beta receptor activity [GO:0005024]; transforming growth factor beta receptor activity, type I [GO:0005025]; type II transforming growth factor beta receptor binding [GO:0005114]; ubiquitin protein ligase binding [GO:0031625]",GO:0003824; GO:0005634; GO:0005654; GO:0005768; GO:0005886; GO:0005929; GO:0006355; GO:0012501; GO:0016740; GO:0022414; GO:0030154; GO:0030198; GO:0031410; GO:0043226; GO:0048856; GO:0048870; GO:0060089; GO:0140096,"catalytic activity; nucleus; nucleoplasm; endosome; plasma membrane; cilium; regulation of DNA-templated transcription; programmed cell death; transferase activity; reproductive process; cell differentiation; extracellular matrix organization; cytoplasmic vesicle; organelle; anatomical structure development; cell motility; molecular transducer activity; catalytic activity, acting on a protein"
OG_03500,4.616036656352642,FUN_014610-T1,Peve_00027567,Pocillopora_meandrina_HIv1___TS.g27529.t1,three_way,75.49566666666666,FUN_014610-T1,P27465,,,,,48.5,361.0,3.7e-97,356.7,"sp|P27465|PISD_CRIGR Phosphatidylserine decarboxylase proenzyme, mitochondrial OS=Cricetulus griseus OX=10029 GN=Pisd PE=1 SV=2",,,,,,
OG_07762,4.590944010814665,FUN_034956-T1,Peve_00036680,Pocillopora_meandrina_HIv1___RNAseq.g27836.t1,three_way,74.127,FUN_034956-T1,P39949,CCNE1_RAT,,G1/S-specific cyclin-E1,Rattus norvegicus (Rat),51.8,311.0,1.5e-85,318.2,sp|P39949|CCNE1_RAT G1/S-specific cyclin-E1 OS=Rattus norvegicus OX=10116 GN=Ccne1 PE=1 SV=2,GO:0000082; GO:0000122; GO:0000307; GO:0000723; GO:0001547; GO:0001889; GO:0005634; GO:0005737; GO:0005813; GO:0005815; GO:0006270; GO:0007129; GO:0009410; GO:0014074; GO:0016055; GO:0016301; GO:0016538; GO:0019901; GO:0031100; GO:0031670; GO:0032355; GO:0032570; GO:0032880; GO:0033197; GO:0034097; GO:0044877; GO:0045471; GO:0045597; GO:0048545; GO:0051301; GO:0051412; GO:0051597; GO:0051726; GO:0070192; GO:0097134; GO:1900087; GO:1902462,animal organ regeneration [GO:0031100]; antral ovarian follicle growth [GO:0001547]; cell division [GO:0051301]; cellular response to nutrient [GO:0031670]; chromosome organization involved in meiotic cell cycle [GO:0070192]; DNA replication initiation [GO:0006270]; G1/S transition of mitotic cell cycle [GO:0000082]; homologous chromosome pairing at meiosis [GO:0007129]; liver development [GO:0001889]; negative regulation of transcription by RNA polymerase II [GO:0000122]; positive regulation of cell differentiation [GO:0045597]; positive regulation of G1/S transition of mitotic cell cycle [GO:1900087]; positive regulation of mesenchymal stem cell proliferation [GO:1902462]; regulation of cell cycle [GO:0051726]; regulation of protein localization [GO:0032880]; response to corticosterone [GO:0051412]; response to cytokine [GO:0034097]; response to estradiol [GO:0032355]; response to ethanol [GO:0045471]; response to methylmercury [GO:0051597]; response to progesterone [GO:0032570]; response to purine-containing compound [GO:0014074]; response to steroid hormone [GO:0048545]; response to vitamin E [GO:0033197]; response to xenobiotic stimulus [GO:0009410]; telomere maintenance [GO:0000723]; Wnt signaling pathway [GO:0016055],centrosome [GO:0005813]; cyclin E1-CDK2 complex [GO:0097134]; cyclin-dependent protein kinase holoenzyme complex [GO:0000307]; cytoplasm [GO:0005737]; microtubule organizing center [GO:0005815]; nucleus [GO:0005634],cyclin-dependent protein serine/threonine kinase regulator activity [GO:0016538]; kinase activity [GO:0016301]; protein kinase binding [GO:0019901]; protein-containing complex binding [GO:0044877],GO:0003824; GO:0005634; GO:0005815; GO:0006355; GO:0016740; GO:0022414; GO:0032200; GO:0043226; GO:0048856; GO:0098772,catalytic activity; nucleus; microtubule organizing center; regulation of DNA-templated transcription; transferase activity; reproductive process; telomere organization; organelle; anatomical structure development; molecular function regulator activity
OG_00252,4.590447624108837,FUN_001016-T1,Peve_00041043,Pocillopora_meandrina_HIv1___RNAseq.g29160.t1,three_way,48.55133333333333,FUN_001016-T1,Q0IHU9,,,,,42.9,203.0,7.6e-44,180.6,sp|Q0IHU9|PRUN2_XENTR Protein prune homolog 2 OS=Xenopus tropicalis OX=8364 GN=Prune2 PE=2 SV=1,,,,,,
OG_02599,4.527313442234168,FUN_010720-T1,Peve_00029905,Pocillopora_meandrina_HIv1___RNAseq.g20949.t2,three_way,83.7885,FUN_010720-T1,P58197,AP2A_RAT,,Transcription factor AP-2-alpha (AP2-alpha) (AP-2 transcription factor) (Activating enhancer-binding protein 2-alpha) (Activator protein 2) (AP-2),Rattus norvegicus (Rat),63.4,227.0,3.3e-68,260.8,sp|P58197|AP2A_RAT Transcription factor AP-2-alpha OS=Rattus norvegicus OX=10116 GN=Tfap2a PE=1 SV=1,GO:0000122; GO:0000976; GO:0000977; GO:0000978; GO:0000981; GO:0000987; GO:0001227; GO:0001228; GO:0001501; GO:0001822; GO:0001843; GO:0002089; GO:0003151; GO:0003334; GO:0003404; GO:0003409; GO:0003677; GO:0003682; GO:0003700; GO:0003713; GO:0003714; GO:0005634; GO:0005905; GO:0006355; GO:0006357; GO:0006366; GO:0007173; GO:0007399; GO:0007423; GO:0007605; GO:0008283; GO:0008285; GO:0009880; GO:0010172; GO:0010628; GO:0010761; GO:0010763; GO:0010842; GO:0010944; GO:0014032; GO:0014044; GO:0021506; GO:0021559; GO:0021623; GO:0021884; GO:0030501; GO:0032496; GO:0035115; GO:0035136; GO:0042059; GO:0042127; GO:0042472; GO:0042802; GO:0043066; GO:0043524; GO:0043525; GO:0043565; GO:0043588; GO:0045595; GO:0045664; GO:0045892; GO:0045893; GO:0045944; GO:0048485; GO:0048596; GO:0048701; GO:0048705; GO:0048730; GO:0051402; GO:0060021; GO:0060235; GO:0060325; GO:0060349; GO:0061029; GO:0061303; GO:0070172; GO:0071281; GO:0071711; GO:0072210; GO:1990837; GO:2000378,anterior neuropore closure [GO:0021506]; basement membrane organization [GO:0071711]; bone morphogenesis [GO:0060349]; cell population proliferation [GO:0008283]; cellular response to iron ion [GO:0071281]; cornea development in camera-type eye [GO:0061303]; embryonic body morphogenesis [GO:0010172]; embryonic camera-type eye morphogenesis [GO:0048596]; embryonic cranial skeleton morphogenesis [GO:0048701]; embryonic forelimb morphogenesis [GO:0035115]; embryonic pattern specification [GO:0009880]; epidermal growth factor receptor signaling pathway [GO:0007173]; epidermis morphogenesis [GO:0048730]; eyelid development in camera-type eye [GO:0061029]; face morphogenesis [GO:0060325]; fibroblast migration [GO:0010761]; forebrain neuron development [GO:0021884]; forelimb morphogenesis [GO:0035136]; inner ear morphogenesis [GO:0042472]; keratinocyte development [GO:0003334]; kidney development [GO:0001822]; lens induction in camera-type eye [GO:0060235]; lens morphogenesis in camera-type eye [GO:0002089]; metanephric nephron development [GO:0072210]; negative regulation of apoptotic process [GO:0043066]; negative regulation of cell population proliferation [GO:0008285]; negative regulation of DNA-templated transcription [GO:0045892]; negative regulation of epidermal growth factor receptor signaling pathway [GO:0042059]; negative regulation of neuron apoptotic process [GO:0043524]; negative regulation of reactive oxygen species metabolic process [GO:2000378]; negative regulation of transcription by competitive promoter binding [GO:0010944]; negative regulation of transcription by RNA polymerase II [GO:0000122]; nervous system development [GO:0007399]; neural crest cell development [GO:0014032]; neural tube closure [GO:0001843]; neuron apoptotic process [GO:0051402]; oculomotor nerve formation [GO:0021623]; optic cup structural organization [GO:0003409]; optic vesicle morphogenesis [GO:0003404]; outflow tract morphogenesis [GO:0003151]; positive regulation of bone mineralization [GO:0030501]; positive regulation of DNA-templated transcription [GO:0045893]; positive regulation of fibroblast migration [GO:0010763]; positive regulation of gene expression [GO:0010628]; positive regulation of neuron apoptotic process [GO:0043525]; positive regulation of tooth mineralization [GO:0070172]; positive regulation of transcription by RNA polymerase II [GO:0045944]; regulation of cell differentiation [GO:0045595]; regulation of cell population proliferation [GO:0042127]; regulation of DNA-templated transcription [GO:0006355]; regulation of neuron differentiation [GO:0045664]; regulation of transcription by RNA polymerase II [GO:0006357]; response to lipopolysaccharide [GO:0032496]; retina layer formation [GO:0010842]; roof of mouth development [GO:0060021]; Schwann cell development [GO:0014044]; sensory organ development [GO:0007423]; sensory perception of sound [GO:0007605]; skeletal system development [GO:0001501]; skeletal system morphogenesis [GO:0048705]; skin development [GO:0043588]; sympathetic nervous system development [GO:0048485]; transcription by RNA polymerase II [GO:0006366]; trigeminal nerve development [GO:0021559],clathrin-coated pit [GO:0005905]; nucleus [GO:0005634],"chromatin binding [GO:0003682]; cis-regulatory region sequence-specific DNA binding [GO:0000987]; DNA binding [GO:0003677]; DNA-binding transcription activator activity, RNA polymerase II-specific [GO:0001228]; DNA-binding transcription factor activity [GO:0003700]; DNA-binding transcription factor activity, RNA polymerase II-specific [GO:0000981]; DNA-binding transcription repressor activity, RNA polymerase II-specific [GO:0001227]; identical protein binding [GO:0042802]; RNA polymerase II cis-regulatory region sequence-specific DNA binding [GO:0000978]; RNA polymerase II transcription regulatory region sequence-specific DNA binding [GO:0000977]; sequence-specific DNA binding [GO:0043565]; sequence-specific double-stranded DNA binding [GO:1990837]; transcription cis-regulatory region binding [GO:0000976]; transcription coactivator activity [GO:0003713]; transcription corepressor activity [GO:0003714]",GO:0003677; GO:0005634; GO:0006351; GO:0006355; GO:0012501; GO:0030198; GO:0043226; GO:0048856; GO:0048870; GO:0050877; GO:0060090; GO:0140110,DNA binding; nucleus; DNA-templated transcription; regulation of DNA-templated transcription; programmed cell death; extracellular matrix organization; organelle; anatomical structure development; cell motility; nervous system process; molecular adaptor activity; transcription regulator activity
OG_09757,4.437844952297904,FUN_042029-T1,Peve_00025063,Pocillopora_meandrina_HIv1___RNAseq.g15174.t1,three_way,47.64533333333333,FUN_042029-T1,Q9QYM2,,,,,31.9,354.0,1.1e-38,163.7,sp|Q9QYM2|PARG_RAT Poly(ADP-ribose) glycohydrolase OS=Rattus norvegicus OX=10116 GN=Parg PE=1 SV=1,,,,,,
