group_id,Component_10,apul,peve,ptua,type,avg_identity,query,accession,id,reviewed,protein_name,organism,pident,length,evalue,bitscore,title,go_ids,go_bp,go_cc,go_mf,goslim_ids,goslim_names
OG_02599,1.3922499304235678,FUN_010720-T1,Peve_00029905,Pocillopora_meandrina_HIv1___RNAseq.g20949.t2,three_way,83.7885,FUN_010720-T1,P58197,AP2A_RAT,,Transcription factor AP-2-alpha (AP2-alpha) (AP-2 transcription factor) (Activating enhancer-binding protein 2-alpha) (Activator protein 2) (AP-2),Rattus norvegicus (Rat),63.4,227.0,3.3e-68,260.8,sp|P58197|AP2A_RAT Transcription factor AP-2-alpha OS=Rattus norvegicus OX=10116 GN=Tfap2a PE=1 SV=1,GO:0000122; GO:0000976; GO:0000977; GO:0000978; GO:0000981; GO:0000987; GO:0001227; GO:0001228; GO:0001501; GO:0001822; GO:0001843; GO:0002089; GO:0003151; GO:0003334; GO:0003404; GO:0003409; GO:0003677; GO:0003682; GO:0003700; GO:0003713; GO:0003714; GO:0005634; GO:0005905; GO:0006355; GO:0006357; GO:0006366; GO:0007173; GO:0007399; GO:0007423; GO:0007605; GO:0008283; GO:0008285; GO:0009880; GO:0010172; GO:0010628; GO:0010761; GO:0010763; GO:0010842; GO:0010944; GO:0014032; GO:0014044; GO:0021506; GO:0021559; GO:0021623; GO:0021884; GO:0030501; GO:0032496; GO:0035115; GO:0035136; GO:0042059; GO:0042127; GO:0042472; GO:0042802; GO:0043066; GO:0043524; GO:0043525; GO:0043565; GO:0043588; GO:0045595; GO:0045664; GO:0045892; GO:0045893; GO:0045944; GO:0048485; GO:0048596; GO:0048701; GO:0048705; GO:0048730; GO:0051402; GO:0060021; GO:0060235; GO:0060325; GO:0060349; GO:0061029; GO:0061303; GO:0070172; GO:0071281; GO:0071711; GO:0072210; GO:1990837; GO:2000378,anterior neuropore closure [GO:0021506]; basement membrane organization [GO:0071711]; bone morphogenesis [GO:0060349]; cell population proliferation [GO:0008283]; cellular response to iron ion [GO:0071281]; cornea development in camera-type eye [GO:0061303]; embryonic body morphogenesis [GO:0010172]; embryonic camera-type eye morphogenesis [GO:0048596]; embryonic cranial skeleton morphogenesis [GO:0048701]; embryonic forelimb morphogenesis [GO:0035115]; embryonic pattern specification [GO:0009880]; epidermal growth factor receptor signaling pathway [GO:0007173]; epidermis morphogenesis [GO:0048730]; eyelid development in camera-type eye [GO:0061029]; face morphogenesis [GO:0060325]; fibroblast migration [GO:0010761]; forebrain neuron development [GO:0021884]; forelimb morphogenesis [GO:0035136]; inner ear morphogenesis [GO:0042472]; keratinocyte development [GO:0003334]; kidney development [GO:0001822]; lens induction in camera-type eye [GO:0060235]; lens morphogenesis in camera-type eye [GO:0002089]; metanephric nephron development [GO:0072210]; negative regulation of apoptotic process [GO:0043066]; negative regulation of cell population proliferation [GO:0008285]; negative regulation of DNA-templated transcription [GO:0045892]; negative regulation of epidermal growth factor receptor signaling pathway [GO:0042059]; negative regulation of neuron apoptotic process [GO:0043524]; negative regulation of reactive oxygen species metabolic process [GO:2000378]; negative regulation of transcription by competitive promoter binding [GO:0010944]; negative regulation of transcription by RNA polymerase II [GO:0000122]; nervous system development [GO:0007399]; neural crest cell development [GO:0014032]; neural tube closure [GO:0001843]; neuron apoptotic process [GO:0051402]; oculomotor nerve formation [GO:0021623]; optic cup structural organization [GO:0003409]; optic vesicle morphogenesis [GO:0003404]; outflow tract morphogenesis [GO:0003151]; positive regulation of bone mineralization [GO:0030501]; positive regulation of DNA-templated transcription [GO:0045893]; positive regulation of fibroblast migration [GO:0010763]; positive regulation of gene expression [GO:0010628]; positive regulation of neuron apoptotic process [GO:0043525]; positive regulation of tooth mineralization [GO:0070172]; positive regulation of transcription by RNA polymerase II [GO:0045944]; regulation of cell differentiation [GO:0045595]; regulation of cell population proliferation [GO:0042127]; regulation of DNA-templated transcription [GO:0006355]; regulation of neuron differentiation [GO:0045664]; regulation of transcription by RNA polymerase II [GO:0006357]; response to lipopolysaccharide [GO:0032496]; retina layer formation [GO:0010842]; roof of mouth development [GO:0060021]; Schwann cell development [GO:0014044]; sensory organ development [GO:0007423]; sensory perception of sound [GO:0007605]; skeletal system development [GO:0001501]; skeletal system morphogenesis [GO:0048705]; skin development [GO:0043588]; sympathetic nervous system development [GO:0048485]; transcription by RNA polymerase II [GO:0006366]; trigeminal nerve development [GO:0021559],clathrin-coated pit [GO:0005905]; nucleus [GO:0005634],"chromatin binding [GO:0003682]; cis-regulatory region sequence-specific DNA binding [GO:0000987]; DNA binding [GO:0003677]; DNA-binding transcription activator activity, RNA polymerase II-specific [GO:0001228]; DNA-binding transcription factor activity [GO:0003700]; DNA-binding transcription factor activity, RNA polymerase II-specific [GO:0000981]; DNA-binding transcription repressor activity, RNA polymerase II-specific [GO:0001227]; identical protein binding [GO:0042802]; RNA polymerase II cis-regulatory region sequence-specific DNA binding [GO:0000978]; RNA polymerase II transcription regulatory region sequence-specific DNA binding [GO:0000977]; sequence-specific DNA binding [GO:0043565]; sequence-specific double-stranded DNA binding [GO:1990837]; transcription cis-regulatory region binding [GO:0000976]; transcription coactivator activity [GO:0003713]; transcription corepressor activity [GO:0003714]",GO:0003677; GO:0005634; GO:0006351; GO:0006355; GO:0012501; GO:0030198; GO:0043226; GO:0048856; GO:0048870; GO:0050877; GO:0060090; GO:0140110,DNA binding; nucleus; DNA-templated transcription; regulation of DNA-templated transcription; programmed cell death; extracellular matrix organization; organelle; anatomical structure development; cell motility; nervous system process; molecular adaptor activity; transcription regulator activity
OG_07441,1.3779104621671938,FUN_033933-T1,Peve_00020980,Pocillopora_meandrina_HIv1___RNAseq.g26583.t1,three_way,86.51866666666666,FUN_033933-T1,Q15915,ZIC1_HUMAN,,Zinc finger protein ZIC 1 (Zinc finger protein 201) (Zinc finger protein of the cerebellum 1),Homo sapiens (Human),37.8,249.0,1.7e-36,155.2,sp|Q15915|ZIC1_HUMAN Zinc finger protein ZIC 1 OS=Homo sapiens OX=9606 GN=ZIC1 PE=1 SV=2,GO:0000978; GO:0000981; GO:0001228; GO:0003700; GO:0005634; GO:0005654; GO:0005737; GO:0006357; GO:0007389; GO:0007417; GO:0007420; GO:0007628; GO:0008270; GO:0008589; GO:0010467; GO:0021510; GO:0021766; GO:0021772; GO:0030154; GO:0042307; GO:0042472; GO:0045893; GO:0098727; GO:1990837,adult walking behavior [GO:0007628]; brain development [GO:0007420]; cell differentiation [GO:0030154]; central nervous system development [GO:0007417]; gene expression [GO:0010467]; hippocampus development [GO:0021766]; inner ear morphogenesis [GO:0042472]; maintenance of cell number [GO:0098727]; olfactory bulb development [GO:0021772]; pattern specification process [GO:0007389]; positive regulation of DNA-templated transcription [GO:0045893]; positive regulation of protein import into nucleus [GO:0042307]; regulation of smoothened signaling pathway [GO:0008589]; regulation of transcription by RNA polymerase II [GO:0006357]; spinal cord development [GO:0021510],cytoplasm [GO:0005737]; nucleoplasm [GO:0005654]; nucleus [GO:0005634],"DNA-binding transcription activator activity, RNA polymerase II-specific [GO:0001228]; DNA-binding transcription factor activity [GO:0003700]; DNA-binding transcription factor activity, RNA polymerase II-specific [GO:0000981]; RNA polymerase II cis-regulatory region sequence-specific DNA binding [GO:0000978]; sequence-specific double-stranded DNA binding [GO:1990837]; zinc ion binding [GO:0008270]",GO:0003677; GO:0005634; GO:0005654; GO:0006355; GO:0030154; GO:0043226; GO:0048856; GO:0140110,DNA binding; nucleus; nucleoplasm; regulation of DNA-templated transcription; cell differentiation; organelle; anatomical structure development; transcription regulator activity
OG_02853,1.377861360887254,FUN_011890-T1,Peve_00042786,Pocillopora_meandrina_HIv1___RNAseq.g13675.t1,three_way,73.18133333333333,FUN_011890-T1,Q9ULI1,,,,,28.0,898.0,2.4e-78,296.2,sp|Q9ULI1|NWD2_HUMAN NACHT and WD repeat domain-containing protein 2 OS=Homo sapiens OX=9606 GN=NWD2 PE=1 SV=3,,,,,,
OG_00252,1.3777047109829936,FUN_001016-T1,Peve_00041043,Pocillopora_meandrina_HIv1___RNAseq.g29160.t1,three_way,48.55133333333333,FUN_001016-T1,Q0IHU9,,,,,42.9,203.0,7.6e-44,180.6,sp|Q0IHU9|PRUN2_XENTR Protein prune homolog 2 OS=Xenopus tropicalis OX=8364 GN=Prune2 PE=2 SV=1,,,,,,
OG_07861,1.3699558437560213,FUN_035216-T2,Peve_00035892,Pocillopora_meandrina_HIv1___RNAseq.g27615.t1,three_way,70.04816666666666,FUN_035216-T2,Q503Z8,IRX6A_DANRE,,Iroquois homeobox protein 6a,Danio rerio (Zebrafish) (Brachydanio rerio),47.6,233.0,1.9e-40,168.3,sp|Q503Z8|IRX6A_DANRE Iroquois homeobox protein 6a OS=Danio rerio OX=7955 GN=irx6a PE=2 SV=1,GO:0000978; GO:0000981; GO:0005634; GO:0006357; GO:0030182; GO:0048468,cell development [GO:0048468]; neuron differentiation [GO:0030182]; regulation of transcription by RNA polymerase II [GO:0006357],nucleus [GO:0005634],"DNA-binding transcription factor activity, RNA polymerase II-specific [GO:0000981]; RNA polymerase II cis-regulatory region sequence-specific DNA binding [GO:0000978]",GO:0003677; GO:0005634; GO:0006355; GO:0030154; GO:0043226; GO:0048856; GO:0140110,DNA binding; nucleus; regulation of DNA-templated transcription; cell differentiation; organelle; anatomical structure development; transcription regulator activity
OG_09807,1.3681995730408665,FUN_042628-T1,Peve_00016195,Pocillopora_meandrina_HIv1___RNAseq.g11508.t1,three_way,45.25,FUN_042628-T1,O95390,GDF11_HUMAN,,Growth/differentiation factor 11 (GDF-11) (Bone morphogenetic protein 11) (BMP-11),Homo sapiens (Human),29.0,372.0,2.3000000000000002e-33,144.8,sp|O95390|GDF11_HUMAN Growth/differentiation factor 11 OS=Homo sapiens OX=9606 GN=GDF11 PE=1 SV=1,GO:0001501; GO:0001656; GO:0001657; GO:0005125; GO:0005615; GO:0007399; GO:0007498; GO:0008083; GO:0008283; GO:0008285; GO:0021512; GO:0032924; GO:0032991; GO:0035881; GO:0048593; GO:0060021; GO:0060391; GO:0072560; GO:1902870,activin receptor signaling pathway [GO:0032924]; amacrine cell differentiation [GO:0035881]; camera-type eye morphogenesis [GO:0048593]; cell population proliferation [GO:0008283]; mesoderm development [GO:0007498]; metanephros development [GO:0001656]; negative regulation of amacrine cell differentiation [GO:1902870]; negative regulation of cell population proliferation [GO:0008285]; nervous system development [GO:0007399]; positive regulation of SMAD protein signal transduction [GO:0060391]; roof of mouth development [GO:0060021]; skeletal system development [GO:0001501]; spinal cord anterior/posterior patterning [GO:0021512]; type B pancreatic cell maturation [GO:0072560]; ureteric bud development [GO:0001657],extracellular space [GO:0005615]; protein-containing complex [GO:0032991],cytokine activity [GO:0005125]; growth factor activity [GO:0008083],GO:0005615; GO:0030154; GO:0048018; GO:0048856; GO:0098772,extracellular space; cell differentiation; receptor ligand activity; anatomical structure development; molecular function regulator activity
OG_04195,1.3614656257576037,FUN_016720-T1,Peve_00014673,Pocillopora_meandrina_HIv1___RNAseq.g230.t1,three_way,61.32066666666666,FUN_016720-T1,Q64729,TGFR1_MOUSE,,TGF-beta receptor type-1 (TGFR-1) (EC 2.7.11.30) (ESK2) (Transforming growth factor-beta receptor type I) (TGF-beta receptor type I) (TbetaR-I),Mus musculus (Mouse),38.4,487.0,5.7e-74,280.0,sp|Q64729|TGFR1_MOUSE TGF-beta receptor type-1 OS=Mus musculus OX=10090 GN=Tgfbr1 PE=1 SV=1,GO:0001501; GO:0001525; GO:0001701; GO:0001822; GO:0001824; GO:0001935; GO:0001937; GO:0001938; GO:0002088; GO:0003222; GO:0003223; GO:0005024; GO:0005025; GO:0005102; GO:0005114; GO:0005524; GO:0005634; GO:0005654; GO:0005768; GO:0005886; GO:0005901; GO:0005923; GO:0005929; GO:0006915; GO:0007179; GO:0007507; GO:0008354; GO:0008584; GO:0009791; GO:0009952; GO:0009986; GO:0010468; GO:0010628; GO:0010717; GO:0010718; GO:0016020; GO:0030199; GO:0030307; GO:0030335; GO:0030336; GO:0031396; GO:0031625; GO:0032331; GO:0032924; GO:0035556; GO:0036446; GO:0042118; GO:0043065; GO:0043066; GO:0043542; GO:0045121; GO:0045893; GO:0046332; GO:0046847; GO:0046872; GO:0048538; GO:0048663; GO:0048701; GO:0048705; GO:0048762; GO:0048844; GO:0050431; GO:0051491; GO:0051496; GO:0051897; GO:0060017; GO:0060021; GO:0060037; GO:0060043; GO:0060317; GO:0060391; GO:0060395; GO:0060412; GO:0060978; GO:0060982; GO:0061450; GO:0070021; GO:0070411; GO:0070723; GO:0071560; GO:1901203; GO:1902462; GO:1904018; GO:1905007; GO:1905075; GO:1905223; GO:2001235; GO:2001237,activin receptor signaling pathway [GO:0032924]; angiogenesis [GO:0001525]; angiogenesis involved in coronary vascular morphogenesis [GO:0060978]; anterior/posterior pattern specification [GO:0009952]; apoptotic process [GO:0006915]; artery morphogenesis [GO:0048844]; blastocyst development [GO:0001824]; cardiac epithelial to mesenchymal transition [GO:0060317]; cellular response to transforming growth factor beta stimulus [GO:0071560]; collagen fibril organization [GO:0030199]; coronary artery morphogenesis [GO:0060982]; embryonic cranial skeleton morphogenesis [GO:0048701]; endothelial cell activation [GO:0042118]; endothelial cell migration [GO:0043542]; endothelial cell proliferation [GO:0001935]; epicardium morphogenesis [GO:1905223]; filopodium assembly [GO:0046847]; germ cell migration [GO:0008354]; heart development [GO:0007507]; in utero embryonic development [GO:0001701]; intracellular signal transduction [GO:0035556]; kidney development [GO:0001822]; lens development in camera-type eye [GO:0002088]; male gonad development [GO:0008584]; mesenchymal cell differentiation [GO:0048762]; myofibroblast differentiation [GO:0036446]; negative regulation of apoptotic process [GO:0043066]; negative regulation of cell migration [GO:0030336]; negative regulation of chondrocyte differentiation [GO:0032331]; negative regulation of endothelial cell proliferation [GO:0001937]; negative regulation of extrinsic apoptotic signaling pathway [GO:2001237]; neuron fate commitment [GO:0048663]; parathyroid gland development [GO:0060017]; pharyngeal system development [GO:0060037]; positive regulation of apoptotic process [GO:0043065]; positive regulation of apoptotic signaling pathway [GO:2001235]; positive regulation of cell growth [GO:0030307]; positive regulation of cell migration [GO:0030335]; positive regulation of DNA-templated transcription [GO:0045893]; positive regulation of endothelial cell proliferation [GO:0001938]; positive regulation of epithelial to mesenchymal transition [GO:0010718]; positive regulation of epithelial to mesenchymal transition involved in endocardial cushion formation [GO:1905007]; positive regulation of extracellular matrix assembly [GO:1901203]; positive regulation of filopodium assembly [GO:0051491]; positive regulation of gene expression [GO:0010628]; positive regulation of mesenchymal stem cell proliferation [GO:1902462]; positive regulation of phosphatidylinositol 3-kinase/protein kinase B signal transduction [GO:0051897]; positive regulation of SMAD protein signal transduction [GO:0060391]; positive regulation of stress fiber assembly [GO:0051496]; positive regulation of tight junction disassembly [GO:1905075]; positive regulation of vasculature development [GO:1904018]; post-embryonic development [GO:0009791]; regulation of cardiac muscle cell proliferation [GO:0060043]; regulation of epithelial to mesenchymal transition [GO:0010717]; regulation of gene expression [GO:0010468]; regulation of protein ubiquitination [GO:0031396]; response to cholesterol [GO:0070723]; roof of mouth development [GO:0060021]; skeletal system development [GO:0001501]; skeletal system morphogenesis [GO:0048705]; SMAD protein signal transduction [GO:0060395]; thymus development [GO:0048538]; transforming growth factor beta receptor signaling pathway [GO:0007179]; trophoblast cell migration [GO:0061450]; ventricular compact myocardium morphogenesis [GO:0003223]; ventricular septum morphogenesis [GO:0060412]; ventricular trabecula myocardium morphogenesis [GO:0003222],bicellular tight junction [GO:0005923]; caveola [GO:0005901]; cell surface [GO:0009986]; cilium [GO:0005929]; endosome [GO:0005768]; membrane [GO:0016020]; membrane raft [GO:0045121]; nucleoplasm [GO:0005654]; nucleus [GO:0005634]; plasma membrane [GO:0005886]; transforming growth factor beta ligand-receptor complex [GO:0070021],"ATP binding [GO:0005524]; I-SMAD binding [GO:0070411]; metal ion binding [GO:0046872]; signaling receptor binding [GO:0005102]; SMAD binding [GO:0046332]; transforming growth factor beta binding [GO:0050431]; transforming growth factor beta receptor activity [GO:0005024]; transforming growth factor beta receptor activity, type I [GO:0005025]; type II transforming growth factor beta receptor binding [GO:0005114]; ubiquitin protein ligase binding [GO:0031625]",GO:0003824; GO:0005634; GO:0005654; GO:0005768; GO:0005886; GO:0005929; GO:0006355; GO:0012501; GO:0016740; GO:0022414; GO:0030154; GO:0030198; GO:0031410; GO:0043226; GO:0048856; GO:0048870; GO:0060089; GO:0140096,"catalytic activity; nucleus; nucleoplasm; endosome; plasma membrane; cilium; regulation of DNA-templated transcription; programmed cell death; transferase activity; reproductive process; cell differentiation; extracellular matrix organization; cytoplasmic vesicle; organelle; anatomical structure development; cell motility; molecular transducer activity; catalytic activity, acting on a protein"
OG_02949,1.3582347890924995,FUN_012067-T1,Peve_00004104,Pocillopora_meandrina_HIv1___RNAseq.g23636.t1,three_way,67.023,FUN_012067-T1,Q7Z020,,,,,28.6,553.0,9.3e-45,184.1,sp|Q7Z020|TRPA1_DROME Transient receptor potential cation channel subfamily A member 1 OS=Drosophila melanogaster OX=7227 GN=TrpA1 PE=1 SV=4,,,,,,
OG_01210,1.350698693831892,FUN_004887-T1,Peve_00005850,Pocillopora_meandrina_HIv1___RNAseq.g10661.t1,three_way,61.143166666666666,FUN_004887-T1,A0A0R4IBK5,R213A_DANRE,,E3 ubiquitin-protein ligase rnf213-alpha (EC 2.3.2.27) (EC 3.6.4.-) (E3 ubiquitin-lipopolysaccharide ligase rnf213-alpha) (EC 2.3.2.-) (Mysterin-A) (Mysterin-alpha) (RING finger protein 213-A) (RING finger protein 213-alpha),Danio rerio (Zebrafish) (Brachydanio rerio),31.4,1097.0,1.9e-124,450.7,sp|A0A0R4IBK5|R213A_DANRE E3 ubiquitin-protein ligase rnf213-alpha OS=Danio rerio OX=7955 GN=rnf213a PE=3 SV=1,GO:0002040; GO:0002376; GO:0004842; GO:0005524; GO:0005730; GO:0005811; GO:0005829; GO:0006511; GO:0008015; GO:0008270; GO:0016887; GO:0019216; GO:0042742; GO:0045765; GO:0061630; GO:0070534; GO:0098792; GO:0120323; GO:0140042; GO:2000051,blood circulation [GO:0008015]; defense response to bacterium [GO:0042742]; immune system process [GO:0002376]; lipid droplet formation [GO:0140042]; lipid ubiquitination [GO:0120323]; negative regulation of non-canonical Wnt signaling pathway [GO:2000051]; protein K63-linked ubiquitination [GO:0070534]; regulation of angiogenesis [GO:0045765]; regulation of lipid metabolic process [GO:0019216]; sprouting angiogenesis [GO:0002040]; ubiquitin-dependent protein catabolic process [GO:0006511]; xenophagy [GO:0098792],cytosol [GO:0005829]; lipid droplet [GO:0005811]; nucleolus [GO:0005730],ATP binding [GO:0005524]; ATP hydrolysis activity [GO:0016887]; ubiquitin protein ligase activity [GO:0061630]; ubiquitin-protein transferase activity [GO:0004842]; zinc ion binding [GO:0008270],GO:0002376; GO:0003013; GO:0003824; GO:0005730; GO:0005811; GO:0005829; GO:0006629; GO:0006914; GO:0016740; GO:0016787; GO:0043226; GO:0140096,"immune system process; circulatory system process; catalytic activity; nucleolus; lipid droplet; cytosol; lipid metabolic process; autophagy; transferase activity; hydrolase activity; organelle; catalytic activity, acting on a protein"
OG_04615,1.3442347815660838,FUN_022314-T1,Peve_00021691,Pocillopora_meandrina_HIv1___TS.g22047.t1,three_way,61.79866666666667,,,,,,,,,,,,,,,,,
OG_04041,1.3395542566992076,FUN_016350-T1,Peve_00004331,Pocillopora_meandrina_HIv1___RNAseq.16312_t,three_way,70.639,FUN_016350-T1,Q90WR8,SP3_CHICK,,Transcription factor Sp3,Gallus gallus (Chicken),48.7,117.0,7.9e-20,100.1,sp|Q90WR8|SP3_CHICK Transcription factor Sp3 OS=Gallus gallus OX=9031 GN=SP3 PE=1 SV=1,GO:0000978; GO:0000981; GO:0001227; GO:0001503; GO:0001779; GO:0001889; GO:0002318; GO:0003682; GO:0005829; GO:0006357; GO:0008270; GO:0016605; GO:0017053; GO:0030183; GO:0030217; GO:0030219; GO:0030224; GO:0030324; GO:0030851; GO:0043353; GO:0045944; GO:0048596; GO:0048706; GO:0060216; GO:0061629,B cell differentiation [GO:0030183]; definitive hemopoiesis [GO:0060216]; embryonic camera-type eye morphogenesis [GO:0048596]; embryonic skeletal system development [GO:0048706]; enucleate erythrocyte differentiation [GO:0043353]; granulocyte differentiation [GO:0030851]; liver development [GO:0001889]; lung development [GO:0030324]; megakaryocyte differentiation [GO:0030219]; monocyte differentiation [GO:0030224]; myeloid progenitor cell differentiation [GO:0002318]; natural killer cell differentiation [GO:0001779]; ossification [GO:0001503]; positive regulation of transcription by RNA polymerase II [GO:0045944]; regulation of transcription by RNA polymerase II [GO:0006357]; T cell differentiation [GO:0030217],cytosol [GO:0005829]; PML body [GO:0016605]; transcription repressor complex [GO:0017053],"chromatin binding [GO:0003682]; DNA-binding transcription factor activity, RNA polymerase II-specific [GO:0000981]; DNA-binding transcription repressor activity, RNA polymerase II-specific [GO:0001227]; RNA polymerase II cis-regulatory region sequence-specific DNA binding [GO:0000978]; RNA polymerase II-specific DNA-binding transcription factor binding [GO:0061629]; zinc ion binding [GO:0008270]",GO:0002376; GO:0003677; GO:0005829; GO:0006355; GO:0030154; GO:0043226; GO:0048856; GO:0140110,immune system process; DNA binding; cytosol; regulation of DNA-templated transcription; cell differentiation; organelle; anatomical structure development; transcription regulator activity
OG_04503,1.3395284590984269,FUN_022013-T1,Peve_00042673,Pocillopora_meandrina_HIv1___RNAseq.g3139.t1,three_way,74.30833333333334,FUN_022013-T1,Q05360,,,,,43.6,676.0,1.9e-149,531.2,sp|Q05360|WHITE_LUCCU Protein white OS=Lucilia cuprina OX=7375 GN=W PE=2 SV=2,,,,,,
OG_08704,1.337302601241303,FUN_037953-T1,Peve_00040733,Pocillopora_meandrina_HIv1___RNAseq.g26512.t1,three_way,50.168,FUN_037953-T1,Q91905,,,,,68.3,60.0,4.7e-18,92.8,sp|Q91905|FXI1B_XENLA Forkhead box protein I1-B OS=Xenopus laevis OX=8355 GN=foxi1-b PE=2 SV=1,,,,,,
OG_01407,1.3359694341467945,FUN_005476-T1,Peve_00041489,Pocillopora_meandrina_HIv1___RNAseq.g6630.t1,three_way,45.82566666666667,,,,,,,,,,,,,,,,,
OG_09789,1.3302415979377142,FUN_042591-T1,Peve_00012673,Pocillopora_meandrina_HIv1___RNAseq.g16869.t1,three_way,79.75733333333334,FUN_042591-T1,Q87PP5,,,,,36.3,535.0,8.499999999999999e-92,339.7,sp|Q87PP5|BCCT1_VIBPA Glycine betaine/proline/choline/ectoine transporter VP1456 OS=Vibrio parahaemolyticus serotype O3:K6 (strain RIMD 2210633) OX=223926 GN=VP1456 PE=1 SV=1,,,,,,
OG_04538,1.3297608391897444,FUN_022094-T1,Peve_00038682,Pocillopora_meandrina_HIv1___RNAseq.g4121.t1,three_way,74.00383333333333,FUN_022094-T1,Q5R5C1,UROM_PONAB,,"Uromodulin [Cleaved into: Uromodulin, secreted form]",Pongo abelii (Sumatran orangutan) (Pongo pygmaeus abelii),25.9,336.0,2.6e-20,101.7,sp|Q5R5C1|UROM_PONAB Uromodulin OS=Pongo abelii OX=9601 GN=UMOD PE=2 SV=1,GO:0000922; GO:0005509; GO:0005576; GO:0005929; GO:0016020; GO:0016323; GO:0016324; GO:0050829; GO:0060170; GO:0098552; GO:0140367,antibacterial innate immune response [GO:0140367]; defense response to Gram-negative bacterium [GO:0050829],apical plasma membrane [GO:0016324]; basolateral plasma membrane [GO:0016323]; ciliary membrane [GO:0060170]; cilium [GO:0005929]; extracellular region [GO:0005576]; membrane [GO:0016020]; side of membrane [GO:0098552]; spindle pole [GO:0000922],calcium ion binding [GO:0005509],GO:0002376; GO:0005576; GO:0005929; GO:0043226; GO:0098542,immune system process; extracellular region; cilium; organelle; defense response to other organism
OG_06993,1.3294510128605437,FUN_032139-T1,Peve_00007913,Pocillopora_meandrina_HIv1___TS.g24062.t1,three_way,49.26766666666666,,,,,,,,,,,,,,,,,
OG_00234,1.3284811234994265,FUN_000988-T1,Peve_00022149,Pocillopora_meandrina_HIv1___RNAseq.g29209.t1,three_way,82.41166666666666,FUN_000988-T1,Q92828,,,,,47.6,401.0,3.4e-101,370.5,sp|Q92828|COR2A_HUMAN Coronin-2A OS=Homo sapiens OX=9606 GN=CORO2A PE=1 SV=2,,,,,,
OG_00843,1.3246581633282408,FUN_004094-T1,Peve_00003934,Pocillopora_meandrina_HIv1___RNAseq.g12638.t1,three_way,54.284,FUN_004094-T1,Q91062,,,,,21.7,927.0,2.1e-50,203.4,sp|Q91062|VIT_ICHUN Vitellogenin OS=Ichthyomyzon unicuspis OX=30308 PE=1 SV=1,,,,,,
