group_id,Component_8,apul,peve,ptua,type,avg_identity,query,accession,id,reviewed,protein_name,organism,pident,length,evalue,bitscore,title,go_ids,go_bp,go_cc,go_mf,goslim_ids,goslim_names
OG_04195,2.39450261400579,FUN_016720-T1,Peve_00014673,Pocillopora_meandrina_HIv1___RNAseq.g230.t1,three_way,61.32066666666666,FUN_016720-T1,Q64729,TGFR1_MOUSE,,TGF-beta receptor type-1 (TGFR-1) (EC 2.7.11.30) (ESK2) (Transforming growth factor-beta receptor type I) (TGF-beta receptor type I) (TbetaR-I),Mus musculus (Mouse),38.4,487.0,5.7e-74,280.0,sp|Q64729|TGFR1_MOUSE TGF-beta receptor type-1 OS=Mus musculus OX=10090 GN=Tgfbr1 PE=1 SV=1,GO:0001501; GO:0001525; GO:0001701; GO:0001822; GO:0001824; GO:0001935; GO:0001937; GO:0001938; GO:0002088; GO:0003222; GO:0003223; GO:0005024; GO:0005025; GO:0005102; GO:0005114; GO:0005524; GO:0005634; GO:0005654; GO:0005768; GO:0005886; GO:0005901; GO:0005923; GO:0005929; GO:0006915; GO:0007179; GO:0007507; GO:0008354; GO:0008584; GO:0009791; GO:0009952; GO:0009986; GO:0010468; GO:0010628; GO:0010717; GO:0010718; GO:0016020; GO:0030199; GO:0030307; GO:0030335; GO:0030336; GO:0031396; GO:0031625; GO:0032331; GO:0032924; GO:0035556; GO:0036446; GO:0042118; GO:0043065; GO:0043066; GO:0043542; GO:0045121; GO:0045893; GO:0046332; GO:0046847; GO:0046872; GO:0048538; GO:0048663; GO:0048701; GO:0048705; GO:0048762; GO:0048844; GO:0050431; GO:0051491; GO:0051496; GO:0051897; GO:0060017; GO:0060021; GO:0060037; GO:0060043; GO:0060317; GO:0060391; GO:0060395; GO:0060412; GO:0060978; GO:0060982; GO:0061450; GO:0070021; GO:0070411; GO:0070723; GO:0071560; GO:1901203; GO:1902462; GO:1904018; GO:1905007; GO:1905075; GO:1905223; GO:2001235; GO:2001237,activin receptor signaling pathway [GO:0032924]; angiogenesis [GO:0001525]; angiogenesis involved in coronary vascular morphogenesis [GO:0060978]; anterior/posterior pattern specification [GO:0009952]; apoptotic process [GO:0006915]; artery morphogenesis [GO:0048844]; blastocyst development [GO:0001824]; cardiac epithelial to mesenchymal transition [GO:0060317]; cellular response to transforming growth factor beta stimulus [GO:0071560]; collagen fibril organization [GO:0030199]; coronary artery morphogenesis [GO:0060982]; embryonic cranial skeleton morphogenesis [GO:0048701]; endothelial cell activation [GO:0042118]; endothelial cell migration [GO:0043542]; endothelial cell proliferation [GO:0001935]; epicardium morphogenesis [GO:1905223]; filopodium assembly [GO:0046847]; germ cell migration [GO:0008354]; heart development [GO:0007507]; in utero embryonic development [GO:0001701]; intracellular signal transduction [GO:0035556]; kidney development [GO:0001822]; lens development in camera-type eye [GO:0002088]; male gonad development [GO:0008584]; mesenchymal cell differentiation [GO:0048762]; myofibroblast differentiation [GO:0036446]; negative regulation of apoptotic process [GO:0043066]; negative regulation of cell migration [GO:0030336]; negative regulation of chondrocyte differentiation [GO:0032331]; negative regulation of endothelial cell proliferation [GO:0001937]; negative regulation of extrinsic apoptotic signaling pathway [GO:2001237]; neuron fate commitment [GO:0048663]; parathyroid gland development [GO:0060017]; pharyngeal system development [GO:0060037]; positive regulation of apoptotic process [GO:0043065]; positive regulation of apoptotic signaling pathway [GO:2001235]; positive regulation of cell growth [GO:0030307]; positive regulation of cell migration [GO:0030335]; positive regulation of DNA-templated transcription [GO:0045893]; positive regulation of endothelial cell proliferation [GO:0001938]; positive regulation of epithelial to mesenchymal transition [GO:0010718]; positive regulation of epithelial to mesenchymal transition involved in endocardial cushion formation [GO:1905007]; positive regulation of extracellular matrix assembly [GO:1901203]; positive regulation of filopodium assembly [GO:0051491]; positive regulation of gene expression [GO:0010628]; positive regulation of mesenchymal stem cell proliferation [GO:1902462]; positive regulation of phosphatidylinositol 3-kinase/protein kinase B signal transduction [GO:0051897]; positive regulation of SMAD protein signal transduction [GO:0060391]; positive regulation of stress fiber assembly [GO:0051496]; positive regulation of tight junction disassembly [GO:1905075]; positive regulation of vasculature development [GO:1904018]; post-embryonic development [GO:0009791]; regulation of cardiac muscle cell proliferation [GO:0060043]; regulation of epithelial to mesenchymal transition [GO:0010717]; regulation of gene expression [GO:0010468]; regulation of protein ubiquitination [GO:0031396]; response to cholesterol [GO:0070723]; roof of mouth development [GO:0060021]; skeletal system development [GO:0001501]; skeletal system morphogenesis [GO:0048705]; SMAD protein signal transduction [GO:0060395]; thymus development [GO:0048538]; transforming growth factor beta receptor signaling pathway [GO:0007179]; trophoblast cell migration [GO:0061450]; ventricular compact myocardium morphogenesis [GO:0003223]; ventricular septum morphogenesis [GO:0060412]; ventricular trabecula myocardium morphogenesis [GO:0003222],bicellular tight junction [GO:0005923]; caveola [GO:0005901]; cell surface [GO:0009986]; cilium [GO:0005929]; endosome [GO:0005768]; membrane [GO:0016020]; membrane raft [GO:0045121]; nucleoplasm [GO:0005654]; nucleus [GO:0005634]; plasma membrane [GO:0005886]; transforming growth factor beta ligand-receptor complex [GO:0070021],"ATP binding [GO:0005524]; I-SMAD binding [GO:0070411]; metal ion binding [GO:0046872]; signaling receptor binding [GO:0005102]; SMAD binding [GO:0046332]; transforming growth factor beta binding [GO:0050431]; transforming growth factor beta receptor activity [GO:0005024]; transforming growth factor beta receptor activity, type I [GO:0005025]; type II transforming growth factor beta receptor binding [GO:0005114]; ubiquitin protein ligase binding [GO:0031625]",GO:0003824; GO:0005634; GO:0005654; GO:0005768; GO:0005886; GO:0005929; GO:0006355; GO:0012501; GO:0016740; GO:0022414; GO:0030154; GO:0030198; GO:0031410; GO:0043226; GO:0048856; GO:0048870; GO:0060089; GO:0140096,"catalytic activity; nucleus; nucleoplasm; endosome; plasma membrane; cilium; regulation of DNA-templated transcription; programmed cell death; transferase activity; reproductive process; cell differentiation; extracellular matrix organization; cytoplasmic vesicle; organelle; anatomical structure development; cell motility; molecular transducer activity; catalytic activity, acting on a protein"
OG_06152,2.392231919692073,FUN_027984-T2,Peve_00011299,Pocillopora_meandrina_HIv1___RNAseq.g13864.t1,three_way,75.97583333333333,,,,,,,,,,,,,,,,,
OG_07865,2.3740151569964847,FUN_035222-T1,Peve_00035887,Pocillopora_meandrina_HIv1___RNAseq.g27609.t1,three_way,55.40566666666666,FUN_035222-T1,Q501V0,KPSH1_DANRE,,Serine/threonine-protein kinase H1 homolog (EC 2.7.11.1),Danio rerio (Zebrafish) (Brachydanio rerio),66.9,323.0,4.8e-116,419.9,sp|Q501V0|KPSH1_DANRE Serine/threonine-protein kinase H1 homolog OS=Danio rerio OX=7955 GN=pskh1 PE=2 SV=2,GO:0004674; GO:0005524; GO:0005737; GO:0106310,,cytoplasm [GO:0005737],ATP binding [GO:0005524]; protein serine kinase activity [GO:0106310]; protein serine/threonine kinase activity [GO:0004674],GO:0003824; GO:0016740; GO:0140096,"catalytic activity; transferase activity; catalytic activity, acting on a protein"
OG_01002,2.37102117178737,FUN_004421-T1,Peve_00026932,Pocillopora_meandrina_HIv1___RNAseq.g16665.t1,three_way,58.136,FUN_004421-T1,F1NWE3,,,,,29.1,1542.0,2.5e-170,601.7,sp|F1NWE3|PTPRS_CHICK Receptor-type tyrosine-protein phosphatase S OS=Gallus gallus OX=9031 GN=PTPRS PE=1 SV=3,,,,,,
OG_09609,2.362711577804823,FUN_041767-T1,Peve_00041572,Pocillopora_meandrina_HIv1___RNAseq.g15244.t1,three_way,57.924,FUN_041767-T1,Q6WRH9,,,,,29.6,406.0,5.6000000000000005e-28,128.6,sp|Q6WRH9|IGS10_RAT Immunoglobulin superfamily member 10 OS=Rattus norvegicus OX=10116 GN=Igsf10 PE=1 SV=1,,,,,,
OG_00308,2.341992686621205,FUN_001110-T1,Peve_00029335,Pocillopora_meandrina_HIv1___RNAseq.g29363.t1,three_way,71.534,FUN_001110-T1,P15384,,,,,49.9,407.0,2.3e-84,314.7,sp|P15384|KCNA3_RAT Potassium voltage-gated channel subfamily A member 3 OS=Rattus norvegicus OX=10116 GN=Kcna3 PE=1 SV=2,,,,,,
OG_01656,2.3411142401605343,FUN_006826-T1,Peve_00023770,Pocillopora_meandrina_HIv1___RNAseq.g20475.t1,three_way,76.18166666666667,,,,,,,,,,,,,,,,,
OG_07066,2.3350085494317936,FUN_032299-T1,Peve_00020128,Pocillopora_meandrina_HIv1___RNAseq.g24900.t1,three_way,50.632333333333335,FUN_032299-T1,Q3ZT31,SNX25_MOUSE,,Sorting nexin-25,Mus musculus (Mouse),27.2,125.0,1.3e-07,60.8,sp|Q3ZT31|SNX25_MOUSE Sorting nexin-25 OS=Mus musculus OX=10090 GN=Snx25 PE=1 SV=3,GO:0005768; GO:0010008; GO:0015031; GO:0030512; GO:0032801; GO:0034713; GO:0035091,negative regulation of transforming growth factor beta receptor signaling pathway [GO:0030512]; protein transport [GO:0015031]; receptor catabolic process [GO:0032801],endosome [GO:0005768]; endosome membrane [GO:0010008],phosphatidylinositol binding [GO:0035091]; type I transforming growth factor beta receptor binding [GO:0034713],GO:0005768; GO:0008289; GO:0031410; GO:0043226,endosome; lipid binding; cytoplasmic vesicle; organelle
OG_00386,2.322497845179811,FUN_001238-T1,Peve_00002842,Pocillopora_meandrina_HIv1___RNAseq.g2515.t2,three_way,45.375,FUN_001238-T1,Q8IVU1,,,,,32.5,517.0,1.1e-67,260.4,sp|Q8IVU1|IGDC3_HUMAN Immunoglobulin superfamily DCC subclass member 3 OS=Homo sapiens OX=9606 GN=IGDCC3 PE=1 SV=2,,,,,,
OG_01475,2.31502926297432,FUN_006038-T1,Peve_00023433,Pocillopora_meandrina_HIv1___RNAseq.g20251.t1,three_way,65.71133333333333,FUN_006038-T1,Q7T2C4,S26A5_DANRE,,Prestin (Solute carrier family 26 member 5),Danio rerio (Zebrafish) (Brachydanio rerio),37.0,686.0,1.8e-115,418.3,sp|Q7T2C4|S26A5_DANRE Prestin OS=Danio rerio OX=7955 GN=slc26a5 PE=2 SV=1,GO:0005737; GO:0005886; GO:0006821; GO:0008271; GO:0015075; GO:0015106; GO:0015108; GO:0015116; GO:0015499; GO:0016020; GO:0019531; GO:0019532; GO:0042391; GO:0160044; GO:0160046; GO:1902358; GO:1902476,chloride transmembrane transport [GO:1902476]; chloride transport [GO:0006821]; oxalate transport [GO:0019532]; regulation of membrane potential [GO:0042391]; sulfate transmembrane transport [GO:1902358],cytoplasm [GO:0005737]; membrane [GO:0016020]; plasma membrane [GO:0005886],bicarbonate transmembrane transporter activity [GO:0015106]; chloride transmembrane transporter activity [GO:0015108]; formate transmembrane transporter activity [GO:0015499]; monoatomic ion transmembrane transporter activity [GO:0015075]; oxalate transmembrane transporter activity [GO:0019531]; oxalate:chloride antiporter activity [GO:0160046]; secondary active sulfate transmembrane transporter activity [GO:0008271]; sulfate transmembrane transporter activity [GO:0015116]; sulfate:chloride antiporter activity [GO:0160044],GO:0005215; GO:0005886; GO:0055085,transporter activity; plasma membrane; transmembrane transport
OG_05256,2.310228708055397,FUN_023759-T1,Peve_00044461,Pocillopora_meandrina_HIv1___RNAseq.g3497.t1,three_way,51.79566666666666,FUN_023759-T1,E7FBY6,AGRA2_DANRE,,Adhesion G protein-coupled receptor A2 (G-protein coupled receptor 124),Danio rerio (Zebrafish) (Brachydanio rerio),26.0,889.0,4.7e-66,255.4,sp|E7FBY6|AGRA2_DANRE Adhesion G protein-coupled receptor A2 OS=Danio rerio OX=7955 GN=adgra2 PE=1 SV=2,GO:0001525; GO:0004930; GO:0005886; GO:0007399; GO:0060070; GO:1990909,angiogenesis [GO:0001525]; canonical Wnt signaling pathway [GO:0060070]; nervous system development [GO:0007399],plasma membrane [GO:0005886]; Wnt signalosome [GO:1990909],G protein-coupled receptor activity [GO:0004930],GO:0005886; GO:0048856; GO:0060089,plasma membrane; anatomical structure development; molecular transducer activity
OG_07716,2.296541240069186,FUN_034870-T1,Peve_00005769,Pocillopora_meandrina_HIv1___RNAseq.g27159.t1,three_way,54.551,FUN_034870-T1,Q91Y77,,,,,29.8,423.0,2.3e-49,198.7,sp|Q91Y77|MOT10_RAT Monocarboxylate transporter 10 OS=Rattus norvegicus OX=10116 GN=Slc16a10 PE=1 SV=2,,,,,,
OG_02090,2.295269066213001,FUN_008328-T1,Peve_00040489,Pocillopora_meandrina_HIv1___TS.g24166.t1,three_way,48.269666666666666,FUN_008328-T1,B3EWY9,,,,,39.3,990.0,2.1999999999999998e-166,589.3,sp|B3EWY9|MLP_ACRMI Mucin-like protein (Fragment) OS=Acropora millepora OX=45264 PE=1 SV=1,,,,,,
OG_01407,2.2946770812475936,FUN_005476-T1,Peve_00041489,Pocillopora_meandrina_HIv1___RNAseq.g6630.t1,three_way,45.82566666666667,,,,,,,,,,,,,,,,,
OG_01437,2.2920087115870675,FUN_005873-T1,Peve_00015756,Pocillopora_meandrina_HIv1___RNAseq.g19664.t1,three_way,58.21833333333333,,,,,,,,,,,,,,,,,
OG_07861,2.2893828934448086,FUN_035216-T2,Peve_00035892,Pocillopora_meandrina_HIv1___RNAseq.g27615.t1,three_way,70.04816666666666,FUN_035216-T2,Q503Z8,IRX6A_DANRE,,Iroquois homeobox protein 6a,Danio rerio (Zebrafish) (Brachydanio rerio),47.6,233.0,1.9e-40,168.3,sp|Q503Z8|IRX6A_DANRE Iroquois homeobox protein 6a OS=Danio rerio OX=7955 GN=irx6a PE=2 SV=1,GO:0000978; GO:0000981; GO:0005634; GO:0006357; GO:0030182; GO:0048468,cell development [GO:0048468]; neuron differentiation [GO:0030182]; regulation of transcription by RNA polymerase II [GO:0006357],nucleus [GO:0005634],"DNA-binding transcription factor activity, RNA polymerase II-specific [GO:0000981]; RNA polymerase II cis-regulatory region sequence-specific DNA binding [GO:0000978]",GO:0003677; GO:0005634; GO:0006355; GO:0030154; GO:0043226; GO:0048856; GO:0140110,DNA binding; nucleus; regulation of DNA-templated transcription; cell differentiation; organelle; anatomical structure development; transcription regulator activity
OG_10121,2.277084976554659,FUN_043499-T1,Peve_00024907,Pocillopora_meandrina_HIv1___RNAseq.g7964.t1,three_way,56.86333333333334,FUN_043499-T1,P82279,CRUM1_HUMAN,,Protein crumbs homolog 1,Homo sapiens (Human),23.8,741.0,3.6e-48,196.4,sp|P82279|CRUM1_HUMAN Protein crumbs homolog 1 OS=Homo sapiens OX=9606 GN=CRB1 PE=1 SV=2,GO:0001750; GO:0001917; GO:0001974; GO:0005509; GO:0005576; GO:0005886; GO:0005902; GO:0005912; GO:0007009; GO:0007157; GO:0007163; GO:0007267; GO:0008104; GO:0010001; GO:0010467; GO:0010842; GO:0016324; GO:0032991; GO:0035003; GO:0035845; GO:0042462; GO:0043296; GO:0045197; GO:0045494; GO:0050908; GO:0060060; GO:0061159; GO:0071482; GO:0097386,blood vessel remodeling [GO:0001974]; cell-cell signaling [GO:0007267]; cellular response to light stimulus [GO:0071482]; detection of light stimulus involved in visual perception [GO:0050908]; establishment of bipolar cell polarity involved in cell morphogenesis [GO:0061159]; establishment or maintenance of cell polarity [GO:0007163]; establishment or maintenance of epithelial cell apical/basal polarity [GO:0045197]; eye photoreceptor cell development [GO:0042462]; gene expression [GO:0010467]; glial cell differentiation [GO:0010001]; heterophilic cell-cell adhesion via plasma membrane cell adhesion molecules [GO:0007157]; photoreceptor cell maintenance [GO:0045494]; photoreceptor cell outer segment organization [GO:0035845]; plasma membrane organization [GO:0007009]; post-embryonic retina morphogenesis in camera-type eye [GO:0060060]; protein localization [GO:0008104]; retina layer formation [GO:0010842],adherens junction [GO:0005912]; apical junction complex [GO:0043296]; apical plasma membrane [GO:0016324]; extracellular region [GO:0005576]; glial cell projection [GO:0097386]; microvillus [GO:0005902]; photoreceptor inner segment [GO:0001917]; photoreceptor outer segment [GO:0001750]; plasma membrane [GO:0005886]; protein-containing complex [GO:0032991]; subapical complex [GO:0035003],calcium ion binding [GO:0005509],GO:0005576; GO:0005886; GO:0007155; GO:0007163; GO:0023052; GO:0030154; GO:0048856; GO:0061024,extracellular region; plasma membrane; cell adhesion; establishment or maintenance of cell polarity; signaling; cell differentiation; anatomical structure development; membrane organization
OG_04615,2.2590263406479174,FUN_022314-T1,Peve_00021691,Pocillopora_meandrina_HIv1___TS.g22047.t1,three_way,61.79866666666667,,,,,,,,,,,,,,,,,
OG_08856,2.2379248749219163,FUN_038241-T1,Peve_00029455,Pocillopora_meandrina_HIv1___RNAseq.g907.t1,three_way,65.7855,FUN_038241-T1,Q8AV58,SDK1_CHICK,,Protein sidekick-1,Gallus gallus (Chicken),30.8,1999.0,6.3e-250,866.7,sp|Q8AV58|SDK1_CHICK Protein sidekick-1 OS=Gallus gallus OX=9031 GN=SDK1 PE=1 SV=1,GO:0005886; GO:0007156; GO:0007416; GO:0010842; GO:0042802; GO:0045202,homophilic cell adhesion via plasma membrane adhesion molecules [GO:0007156]; retina layer formation [GO:0010842]; synapse assembly [GO:0007416],plasma membrane [GO:0005886]; synapse [GO:0045202],identical protein binding [GO:0042802],GO:0005886; GO:0007155; GO:0034330,plasma membrane; cell adhesion; cell junction organization
OG_07349,2.2319107810691765,FUN_033756-T1,Peve_00004915,Pocillopora_meandrina_HIv1___RNAseq.g28747.t1,three_way,85.5945,FUN_033756-T1,Q13136,LIPA1_HUMAN,,Liprin-alpha-1 (LAR-interacting protein 1) (LIP-1) (Protein tyrosine phosphatase receptor type f polypeptide-interacting protein alpha-1) (PTPRF-interacting protein alpha-1),Homo sapiens (Human),45.4,1218.0,1.3e-187,658.7,sp|Q13136|LIPA1_HUMAN Liprin-alpha-1 OS=Homo sapiens OX=9606 GN=PPFIA1 PE=1 SV=1,GO:0005737; GO:0005829; GO:0005925; GO:0005938; GO:0007160; GO:0007165; GO:0030424; GO:0032991; GO:0043622; GO:0048786; GO:0050808; GO:0051497; GO:0097444; GO:0098685; GO:0099072; GO:1903077,cell-matrix adhesion [GO:0007160]; cortical microtubule organization [GO:0043622]; negative regulation of protein localization to plasma membrane [GO:1903077]; negative regulation of stress fiber assembly [GO:0051497]; regulation of postsynaptic membrane neurotransmitter receptor levels [GO:0099072]; signal transduction [GO:0007165]; synapse organization [GO:0050808],axon [GO:0030424]; cell cortex [GO:0005938]; cytoplasm [GO:0005737]; cytosol [GO:0005829]; focal adhesion [GO:0005925]; presynaptic active zone [GO:0048786]; protein-containing complex [GO:0032991]; Schaffer collateral - CA1 synapse [GO:0098685]; spine apparatus [GO:0097444],,GO:0005829; GO:0007010; GO:0007155; GO:0034330; GO:0043226,cytosol; cytoskeleton organization; cell adhesion; cell junction organization; organelle
OG_05437,2.2209878326275296,FUN_024390-T2,Peve_00018042,Pocillopora_meandrina_HIv1___RNAseq.g18621.t1,three_way,74.62266666666667,FUN_024390-T2,Q80VL3,,,,,50.8,413.0,3e-126,454.1,sp|Q80VL3|PRIC3_MOUSE Prickle planar cell polarity protein 3 OS=Mus musculus OX=10090 GN=Prickle3 PE=1 SV=1,,,,,,
OG_01489,2.2170322182663567,FUN_006165-T1,Peve_00023607,Pocillopora_meandrina_HIv1___RNAseq.g20426.t1,three_way,60.60533333333333,FUN_006165-T1,Q2PZL6,FAT4_MOUSE,,Protocadherin Fat 4 (FAT tumor suppressor homolog 4) (Fat-like cadherin protein FAT-J),Mus musculus (Mouse),33.7,5014.0,0.0,2299.2,sp|Q2PZL6|FAT4_MOUSE Protocadherin Fat 4 OS=Mus musculus OX=10090 GN=Fat4 PE=1 SV=2,GO:0001658; GO:0001736; GO:0001822; GO:0003007; GO:0005509; GO:0005886; GO:0007009; GO:0007156; GO:0007157; GO:0007219; GO:0008543; GO:0021987; GO:0022008; GO:0035329; GO:0043931; GO:0045177; GO:0048565; GO:0060122; GO:0072006; GO:0072137; GO:0072307,branching involved in ureteric bud morphogenesis [GO:0001658]; cerebral cortex development [GO:0021987]; condensed mesenchymal cell proliferation [GO:0072137]; digestive tract development [GO:0048565]; establishment of planar polarity [GO:0001736]; fibroblast growth factor receptor signaling pathway [GO:0008543]; heart morphogenesis [GO:0003007]; heterophilic cell-cell adhesion via plasma membrane cell adhesion molecules [GO:0007157]; hippo signaling [GO:0035329]; homophilic cell adhesion via plasma membrane adhesion molecules [GO:0007156]; inner ear receptor cell stereocilium organization [GO:0060122]; kidney development [GO:0001822]; nephron development [GO:0072006]; neurogenesis [GO:0022008]; Notch signaling pathway [GO:0007219]; ossification involved in bone maturation [GO:0043931]; plasma membrane organization [GO:0007009]; regulation of metanephric nephron tubule epithelial cell differentiation [GO:0072307],apical part of cell [GO:0045177]; plasma membrane [GO:0005886],calcium ion binding [GO:0005509],GO:0005886; GO:0007155; GO:0030154; GO:0048856; GO:0061024,plasma membrane; cell adhesion; cell differentiation; anatomical structure development; membrane organization
OG_02475,2.2055803796704665,FUN_009736-T1,Peve_00033566,Pocillopora_meandrina_HIv1___RNAseq.g29063.t1,three_way,57.04183333333333,FUN_009736-T1,G5EBQ8,CHS2_CAEEL,,Chitin synthase chs-2 (EC 2.4.1.16) (Chitin-UDP acetyl-glucosaminyl transferase chs-2),Caenorhabditis elegans,32.1,764.0,9.100000000000001e-104,380.6,sp|G5EBQ8|CHS2_CAEEL Chitin synthase chs-2 OS=Caenorhabditis elegans OX=6239 GN=chs-2 PE=1 SV=1,GO:0004100; GO:0005886; GO:0006031; GO:0061063,chitin biosynthetic process [GO:0006031]; positive regulation of nematode larval development [GO:0061063],plasma membrane [GO:0005886],chitin synthase activity [GO:0004100],GO:0003824; GO:0005886; GO:0016740; GO:1901135,catalytic activity; plasma membrane; transferase activity; carbohydrate derivative metabolic process
OG_08396,2.1672997491976704,FUN_037010-T1,Peve_00032338,Pocillopora_meandrina_HIv1___RNAseq.g26698.t1,three_way,85.58966666666667,FUN_037010-T1,Q8N2G6,,,,,56.0,234.0,5.3e-63,242.7,sp|Q8N2G6|ZCH24_HUMAN Zinc finger CCHC domain-containing protein 24 OS=Homo sapiens OX=9606 GN=ZCCHC24 PE=1 SV=1,,,,,,
OG_05274,2.1574320355091783,FUN_023928-T1,Peve_00026565,Pocillopora_meandrina_HIv1___TS.g27906.t1a,three_way,36.54933333333333,FUN_023928-T1,Q3V2Q8,N42L1_MOUSE,,NEDD4-binding protein 2-like 1,Mus musculus (Mouse),51.4,175.0,3.6999999999999997e-41,172.2,sp|Q3V2Q8|N42L1_MOUSE NEDD4-binding protein 2-like 1 OS=Mus musculus OX=10090 GN=N4bp2l1 PE=1 SV=1,,,,,,
OG_10139,2.1558503054705485,FUN_043526-T1,Peve_00011962,Pocillopora_meandrina_HIv1___RNAseq.g8034.t1,three_way,58.651,FUN_043526-T1,Q9NY43,,,,,44.1,118.0,1.7e-15,84.3,sp|Q9NY43|BARH2_HUMAN BarH-like 2 homeobox protein OS=Homo sapiens OX=9606 GN=BARHL2 PE=1 SV=2,,,,,,
OG_00588,2.154713263498348,FUN_001671-T2,Peve_00038393,Pocillopora_meandrina_HIv1___RNAseq.g29390.t1,three_way,54.833666666666666,FUN_001671-T2,O60293,,,,,28.7,1468.0,5.8000000000000005e-133,478.0,sp|O60293|ZC3H1_HUMAN Zinc finger C3H1 domain-containing protein OS=Homo sapiens OX=9606 GN=ZFC3H1 PE=1 SV=3,,,,,,
OG_02949,2.148532229343344,FUN_012067-T1,Peve_00004104,Pocillopora_meandrina_HIv1___RNAseq.g23636.t1,three_way,67.023,FUN_012067-T1,Q7Z020,,,,,28.6,553.0,9.3e-45,184.1,sp|Q7Z020|TRPA1_DROME Transient receptor potential cation channel subfamily A member 1 OS=Drosophila melanogaster OX=7227 GN=TrpA1 PE=1 SV=4,,,,,,
OG_05841,2.144148306917158,FUN_025889-T1,Peve_00024284,Pocillopora_meandrina_HIv1___RNAseq.g10542.t1,three_way,53.60116666666666,FUN_025889-T1,Q5ZM41,,,,,29.0,728.0,7.4e-64,247.3,sp|Q5ZM41|TEX10_CHICK Testis-expressed protein 10 homolog OS=Gallus gallus OX=9031 GN=TEX10 PE=2 SV=1,,,,,,
OG_09591,2.1407177142380136,FUN_041734-T1,Peve_00024444,Pocillopora_meandrina_HIv1___RNAseq.6485_t,three_way,58.46866666666666,FUN_041734-T1,Q7Z7M0,MEGF8_HUMAN,,Multiple epidermal growth factor-like domains protein 8 (Multiple EGF-like domains protein 8) (Epidermal growth factor-like protein 4) (EGF-like protein 4),Homo sapiens (Human),33.1,2861.0,0.0,1367.4,sp|Q7Z7M0|MEGF8_HUMAN Multiple epidermal growth factor-like domains protein 8 OS=Homo sapiens OX=9606 GN=MEGF8 PE=1 SV=2,GO:0000151; GO:0003143; GO:0005509; GO:0005634; GO:0007224; GO:0010468; GO:0016020; GO:0016567; GO:0030326; GO:0030509; GO:0035108; GO:0035904; GO:0042074; GO:0042733; GO:0045879; GO:0048704; GO:0048842; GO:0055113; GO:0060971; GO:0060972; GO:0060976; GO:0061371; GO:0061626; GO:0065003; GO:0070062; GO:0071907; GO:0097094; GO:0097155; GO:1990403,aorta development [GO:0035904]; BMP signaling pathway [GO:0030509]; cell migration involved in gastrulation [GO:0042074]; coronary vasculature development [GO:0060976]; craniofacial suture morphogenesis [GO:0097094]; determination of digestive tract left/right asymmetry [GO:0071907]; determination of heart left/right asymmetry [GO:0061371]; embryonic brain development [GO:1990403]; embryonic digit morphogenesis [GO:0042733]; embryonic heart tube left/right pattern formation [GO:0060971]; embryonic heart tube morphogenesis [GO:0003143]; embryonic limb morphogenesis [GO:0030326]; embryonic skeletal system morphogenesis [GO:0048704]; epiboly involved in gastrulation with mouth forming second [GO:0055113]; fasciculation of sensory neuron axon [GO:0097155]; left/right pattern formation [GO:0060972]; limb morphogenesis [GO:0035108]; negative regulation of smoothened signaling pathway [GO:0045879]; pharyngeal arch artery morphogenesis [GO:0061626]; positive regulation of axon extension involved in axon guidance [GO:0048842]; protein ubiquitination [GO:0016567]; protein-containing complex assembly [GO:0065003]; regulation of gene expression [GO:0010468]; smoothened signaling pathway [GO:0007224],extracellular exosome [GO:0070062]; membrane [GO:0016020]; nucleus [GO:0005634]; ubiquitin ligase complex [GO:0000151],calcium ion binding [GO:0005509],GO:0005634; GO:0043226; GO:0048856; GO:0048870; GO:0065003,nucleus; organelle; anatomical structure development; cell motility; protein-containing complex assembly
OG_05551,2.132405788663642,FUN_024758-T1,Peve_00027326,Pocillopora_meandrina_HIv1___RNAseq.g18826.t1,three_way,87.74933333333333,,,,,,,,,,,,,,,,,
