group_id,Component_8,apul,peve,ptua,type,avg_identity,query,accession,id,reviewed,protein_name,organism,pident,length,evalue,bitscore,title,go_ids,go_bp,go_cc,go_mf,goslim_ids,goslim_names
OG_08842,3.37749459856881,FUN_038187-T1,Peve_00006347,Pocillopora_meandrina_HIv1___RNAseq.g945.t1,three_way,61.87833333333334,FUN_038187-T1,Q80ZA4,PKHL1_MOUSE,,Fibrocystin-L (Polycystic kidney and hepatic disease 1-like protein 1) (PKHD1-like protein 1) (Protein D86),Mus musculus (Mouse),34.3,4297.0,0.0,2329.7,sp|Q80ZA4|PKHL1_MOUSE Fibrocystin-L OS=Mus musculus OX=10090 GN=Pkhd1l1 PE=1 SV=1,GO:0007605; GO:0032426; GO:0060171; GO:0120234,sensory perception of sound [GO:0007605],stereocilium coat [GO:0120234]; stereocilium membrane [GO:0060171]; stereocilium tip [GO:0032426],,GO:0030312; GO:0050877,external encapsulating structure; nervous system process
OG_07351,3.1559537881278525,FUN_033759-T1,Peve_00009253,Pocillopora_meandrina_HIv1___RNAseq.g28744.t1,three_way,61.443,FUN_033759-T1,Q28005,LSHR_BOVIN,,Lutropin-choriogonadotropic hormone receptor (LH/CG-R) (Luteinizing hormone receptor) (LSH-R),Bos taurus (Bovine),36.1,498.0,3.2000000000000003e-80,301.6,sp|Q28005|LSHR_BOVIN Lutropin-choriogonadotropic hormone receptor OS=Bos taurus OX=9913 GN=LHCGR PE=2 SV=1,GO:0001541; GO:0004964; GO:0005886; GO:0007189; GO:0007200; GO:0008528; GO:0008584; GO:0009755; GO:0022602; GO:0042700; GO:0071373,adenylate cyclase-activating G protein-coupled receptor signaling pathway [GO:0007189]; cellular response to luteinizing hormone stimulus [GO:0071373]; hormone-mediated signaling pathway [GO:0009755]; luteinizing hormone signaling pathway [GO:0042700]; male gonad development [GO:0008584]; ovarian follicle development [GO:0001541]; ovulation cycle process [GO:0022602]; phospholipase C-activating G protein-coupled receptor signaling pathway [GO:0007200],plasma membrane [GO:0005886],G protein-coupled peptide receptor activity [GO:0008528]; luteinizing hormone receptor activity [GO:0004964],GO:0005886; GO:0022414; GO:0048856; GO:0060089,plasma membrane; reproductive process; anatomical structure development; molecular transducer activity
OG_06522,3.155576272145366,FUN_029339-T1,Peve_00023361,Pocillopora_meandrina_HIv1___RNAseq.g17301.t1,three_way,61.434333333333335,FUN_029339-T1,Q01973,ROR1_HUMAN,,"Inactive tyrosine-protein kinase transmembrane receptor ROR1 (Neurotrophic tyrosine kinase, receptor-related 1)",Homo sapiens (Human),31.6,773.0,1.1000000000000001e-118,429.1,sp|Q01973|ROR1_HUMAN Inactive tyrosine-protein kinase transmembrane receptor ROR1 OS=Homo sapiens OX=9606 GN=ROR1 PE=1 SV=2,GO:0001725; GO:0004714; GO:0005524; GO:0005737; GO:0005886; GO:0007169; GO:0007605; GO:0008283; GO:0009986; GO:0014002; GO:0015026; GO:0017147; GO:0030424; GO:0038023; GO:0042813; GO:0043123; GO:0043235; GO:0043679; GO:0048839; GO:0051092,astrocyte development [GO:0014002]; cell population proliferation [GO:0008283]; cell surface receptor protein tyrosine kinase signaling pathway [GO:0007169]; inner ear development [GO:0048839]; positive regulation of canonical NF-kappaB signal transduction [GO:0043123]; positive regulation of NF-kappaB transcription factor activity [GO:0051092]; sensory perception of sound [GO:0007605],axon [GO:0030424]; axon terminus [GO:0043679]; cell surface [GO:0009986]; cytoplasm [GO:0005737]; plasma membrane [GO:0005886]; receptor complex [GO:0043235]; stress fiber [GO:0001725],ATP binding [GO:0005524]; coreceptor activity [GO:0015026]; signaling receptor activity [GO:0038023]; transmembrane receptor protein tyrosine kinase activity [GO:0004714]; Wnt receptor activity [GO:0042813]; Wnt-protein binding [GO:0017147],GO:0003824; GO:0005886; GO:0006355; GO:0016740; GO:0048856; GO:0050877; GO:0060089; GO:0140096,"catalytic activity; plasma membrane; regulation of DNA-templated transcription; transferase activity; anatomical structure development; nervous system process; molecular transducer activity; catalytic activity, acting on a protein"
OG_01210,2.957742214201597,FUN_004887-T1,Peve_00005850,Pocillopora_meandrina_HIv1___RNAseq.g10661.t1,three_way,61.143166666666666,FUN_004887-T1,A0A0R4IBK5,R213A_DANRE,,E3 ubiquitin-protein ligase rnf213-alpha (EC 2.3.2.27) (EC 3.6.4.-) (E3 ubiquitin-lipopolysaccharide ligase rnf213-alpha) (EC 2.3.2.-) (Mysterin-A) (Mysterin-alpha) (RING finger protein 213-A) (RING finger protein 213-alpha),Danio rerio (Zebrafish) (Brachydanio rerio),31.4,1097.0,1.9e-124,450.7,sp|A0A0R4IBK5|R213A_DANRE E3 ubiquitin-protein ligase rnf213-alpha OS=Danio rerio OX=7955 GN=rnf213a PE=3 SV=1,GO:0002040; GO:0002376; GO:0004842; GO:0005524; GO:0005730; GO:0005811; GO:0005829; GO:0006511; GO:0008015; GO:0008270; GO:0016887; GO:0019216; GO:0042742; GO:0045765; GO:0061630; GO:0070534; GO:0098792; GO:0120323; GO:0140042; GO:2000051,blood circulation [GO:0008015]; defense response to bacterium [GO:0042742]; immune system process [GO:0002376]; lipid droplet formation [GO:0140042]; lipid ubiquitination [GO:0120323]; negative regulation of non-canonical Wnt signaling pathway [GO:2000051]; protein K63-linked ubiquitination [GO:0070534]; regulation of angiogenesis [GO:0045765]; regulation of lipid metabolic process [GO:0019216]; sprouting angiogenesis [GO:0002040]; ubiquitin-dependent protein catabolic process [GO:0006511]; xenophagy [GO:0098792],cytosol [GO:0005829]; lipid droplet [GO:0005811]; nucleolus [GO:0005730],ATP binding [GO:0005524]; ATP hydrolysis activity [GO:0016887]; ubiquitin protein ligase activity [GO:0061630]; ubiquitin-protein transferase activity [GO:0004842]; zinc ion binding [GO:0008270],GO:0002376; GO:0003013; GO:0003824; GO:0005730; GO:0005811; GO:0005829; GO:0006629; GO:0006914; GO:0016740; GO:0016787; GO:0043226; GO:0140096,"immune system process; circulatory system process; catalytic activity; nucleolus; lipid droplet; cytosol; lipid metabolic process; autophagy; transferase activity; hydrolase activity; organelle; catalytic activity, acting on a protein"
OG_01740,2.8243284005993647,FUN_007062-T1,Peve_00025326,Pocillopora_meandrina_HIv1___RNAseq.g20109.t1,three_way,70.79983333333334,FUN_007062-T1,Q8IX03,KIBRA_HUMAN,,Protein KIBRA (HBeAg-binding protein 3) (Kidney and brain protein) (KIBRA) (WW domain-containing protein 1),Homo sapiens (Human),29.0,1136.0,8.3e-51,204.1,sp|Q8IX03|KIBRA_HUMAN Protein KIBRA OS=Homo sapiens OX=9606 GN=WWC1 PE=1 SV=1,GO:0000122; GO:0003713; GO:0005634; GO:0005737; GO:0005829; GO:0006355; GO:0008285; GO:0016477; GO:0019900; GO:0030010; GO:0032386; GO:0032587; GO:0035329; GO:0035330; GO:0035331; GO:0035591; GO:0043410; GO:0046621; GO:0048471; GO:0060090,cell migration [GO:0016477]; establishment of cell polarity [GO:0030010]; hippo signaling [GO:0035329]; negative regulation of cell population proliferation [GO:0008285]; negative regulation of hippo signaling [GO:0035331]; negative regulation of organ growth [GO:0046621]; negative regulation of transcription by RNA polymerase II [GO:0000122]; positive regulation of MAPK cascade [GO:0043410]; regulation of DNA-templated transcription [GO:0006355]; regulation of hippo signaling [GO:0035330]; regulation of intracellular transport [GO:0032386],cytoplasm [GO:0005737]; cytosol [GO:0005829]; nucleus [GO:0005634]; perinuclear region of cytoplasm [GO:0048471]; ruffle membrane [GO:0032587],kinase binding [GO:0019900]; molecular adaptor activity [GO:0060090]; signaling adaptor activity [GO:0035591]; transcription coactivator activity [GO:0003713],GO:0005634; GO:0005829; GO:0006355; GO:0007163; GO:0043226; GO:0048870; GO:0060090; GO:0140110,nucleus; cytosol; regulation of DNA-templated transcription; establishment or maintenance of cell polarity; organelle; cell motility; molecular adaptor activity; transcription regulator activity
OG_04041,2.71413382343305,FUN_016350-T1,Peve_00004331,Pocillopora_meandrina_HIv1___RNAseq.16312_t,three_way,70.639,FUN_016350-T1,Q90WR8,SP3_CHICK,,Transcription factor Sp3,Gallus gallus (Chicken),48.7,117.0,7.9e-20,100.1,sp|Q90WR8|SP3_CHICK Transcription factor Sp3 OS=Gallus gallus OX=9031 GN=SP3 PE=1 SV=1,GO:0000978; GO:0000981; GO:0001227; GO:0001503; GO:0001779; GO:0001889; GO:0002318; GO:0003682; GO:0005829; GO:0006357; GO:0008270; GO:0016605; GO:0017053; GO:0030183; GO:0030217; GO:0030219; GO:0030224; GO:0030324; GO:0030851; GO:0043353; GO:0045944; GO:0048596; GO:0048706; GO:0060216; GO:0061629,B cell differentiation [GO:0030183]; definitive hemopoiesis [GO:0060216]; embryonic camera-type eye morphogenesis [GO:0048596]; embryonic skeletal system development [GO:0048706]; enucleate erythrocyte differentiation [GO:0043353]; granulocyte differentiation [GO:0030851]; liver development [GO:0001889]; lung development [GO:0030324]; megakaryocyte differentiation [GO:0030219]; monocyte differentiation [GO:0030224]; myeloid progenitor cell differentiation [GO:0002318]; natural killer cell differentiation [GO:0001779]; ossification [GO:0001503]; positive regulation of transcription by RNA polymerase II [GO:0045944]; regulation of transcription by RNA polymerase II [GO:0006357]; T cell differentiation [GO:0030217],cytosol [GO:0005829]; PML body [GO:0016605]; transcription repressor complex [GO:0017053],"chromatin binding [GO:0003682]; DNA-binding transcription factor activity, RNA polymerase II-specific [GO:0000981]; DNA-binding transcription repressor activity, RNA polymerase II-specific [GO:0001227]; RNA polymerase II cis-regulatory region sequence-specific DNA binding [GO:0000978]; RNA polymerase II-specific DNA-binding transcription factor binding [GO:0061629]; zinc ion binding [GO:0008270]",GO:0002376; GO:0003677; GO:0005829; GO:0006355; GO:0030154; GO:0043226; GO:0048856; GO:0140110,immune system process; DNA binding; cytosol; regulation of DNA-templated transcription; cell differentiation; organelle; anatomical structure development; transcription regulator activity
OG_07441,2.686527549193079,FUN_033933-T1,Peve_00020980,Pocillopora_meandrina_HIv1___RNAseq.g26583.t1,three_way,86.51866666666666,FUN_033933-T1,Q15915,ZIC1_HUMAN,,Zinc finger protein ZIC 1 (Zinc finger protein 201) (Zinc finger protein of the cerebellum 1),Homo sapiens (Human),37.8,249.0,1.7e-36,155.2,sp|Q15915|ZIC1_HUMAN Zinc finger protein ZIC 1 OS=Homo sapiens OX=9606 GN=ZIC1 PE=1 SV=2,GO:0000978; GO:0000981; GO:0001228; GO:0003700; GO:0005634; GO:0005654; GO:0005737; GO:0006357; GO:0007389; GO:0007417; GO:0007420; GO:0007628; GO:0008270; GO:0008589; GO:0010467; GO:0021510; GO:0021766; GO:0021772; GO:0030154; GO:0042307; GO:0042472; GO:0045893; GO:0098727; GO:1990837,adult walking behavior [GO:0007628]; brain development [GO:0007420]; cell differentiation [GO:0030154]; central nervous system development [GO:0007417]; gene expression [GO:0010467]; hippocampus development [GO:0021766]; inner ear morphogenesis [GO:0042472]; maintenance of cell number [GO:0098727]; olfactory bulb development [GO:0021772]; pattern specification process [GO:0007389]; positive regulation of DNA-templated transcription [GO:0045893]; positive regulation of protein import into nucleus [GO:0042307]; regulation of smoothened signaling pathway [GO:0008589]; regulation of transcription by RNA polymerase II [GO:0006357]; spinal cord development [GO:0021510],cytoplasm [GO:0005737]; nucleoplasm [GO:0005654]; nucleus [GO:0005634],"DNA-binding transcription activator activity, RNA polymerase II-specific [GO:0001228]; DNA-binding transcription factor activity [GO:0003700]; DNA-binding transcription factor activity, RNA polymerase II-specific [GO:0000981]; RNA polymerase II cis-regulatory region sequence-specific DNA binding [GO:0000978]; sequence-specific double-stranded DNA binding [GO:1990837]; zinc ion binding [GO:0008270]",GO:0003677; GO:0005634; GO:0005654; GO:0006355; GO:0030154; GO:0043226; GO:0048856; GO:0140110,DNA binding; nucleus; nucleoplasm; regulation of DNA-templated transcription; cell differentiation; organelle; anatomical structure development; transcription regulator activity
OG_01630,2.646176645613031,FUN_006744-T1,Peve_00039581,Pocillopora_meandrina_HIv1___RNAseq.g20530.t1,three_way,63.90916666666666,FUN_006744-T1,Q8BNA6,FAT3_MOUSE,,Protocadherin Fat 3 (FAT tumor suppressor homolog 3),Mus musculus (Mouse),33.8,4122.0,0.0,2094.3,sp|Q8BNA6|FAT3_MOUSE Protocadherin Fat 3 OS=Mus musculus OX=10090 GN=Fat3 PE=1 SV=2,GO:0005509; GO:0005886; GO:0007156; GO:0010842; GO:0016358; GO:0030425; GO:0048667; GO:1904936; GO:2000171,cell morphogenesis involved in neuron differentiation [GO:0048667]; dendrite development [GO:0016358]; homophilic cell adhesion via plasma membrane adhesion molecules [GO:0007156]; interneuron migration [GO:1904936]; negative regulation of dendrite development [GO:2000171]; retina layer formation [GO:0010842],dendrite [GO:0030425]; plasma membrane [GO:0005886],calcium ion binding [GO:0005509],GO:0005886; GO:0007155; GO:0048856; GO:0048870,plasma membrane; cell adhesion; anatomical structure development; cell motility
OG_09806,2.630724106640852,FUN_042624-T1,Peve_00016197,Pocillopora_meandrina_HIv1___RNAseq.g11511.t1,three_way,48.837833333333336,FUN_042624-T1,E9Q414,APOB_MOUSE,,Apolipoprotein B-100 (Apo B-100) [Cleaved into: Apolipoprotein B-48 (Apo B-48)],Mus musculus (Mouse),24.7,1102.0,3e-65,254.6,sp|E9Q414|APOB_MOUSE Apolipoprotein B-100 OS=Mus musculus OX=10090 GN=Apob PE=1 SV=1,GO:0001701; GO:0005543; GO:0005576; GO:0005783; GO:0005811; GO:0005829; GO:0006629; GO:0006642; GO:0007283; GO:0007399; GO:0008201; GO:0008203; GO:0009566; GO:0009615; GO:0009791; GO:0010628; GO:0010744; GO:0010886; GO:0016042; GO:0019433; GO:0030301; GO:0030317; GO:0033344; GO:0034359; GO:0034361; GO:0034362; GO:0034363; GO:0034374; GO:0034383; GO:0035473; GO:0042157; GO:0042158; GO:0042159; GO:0042632; GO:0042953; GO:0043025; GO:0045540; GO:0048018; GO:0048844; GO:0050750; GO:0051649; GO:0070971; GO:0071402; GO:0120020,artery morphogenesis [GO:0048844]; cellular response to lipoprotein particle stimulus [GO:0071402]; cholesterol efflux [GO:0033344]; cholesterol homeostasis [GO:0042632]; cholesterol metabolic process [GO:0008203]; cholesterol transport [GO:0030301]; establishment of localization in cell [GO:0051649]; fertilization [GO:0009566]; flagellated sperm motility [GO:0030317]; in utero embryonic development [GO:0001701]; lipid catabolic process [GO:0016042]; lipid metabolic process [GO:0006629]; lipoprotein biosynthetic process [GO:0042158]; lipoprotein catabolic process [GO:0042159]; lipoprotein metabolic process [GO:0042157]; lipoprotein transport [GO:0042953]; low-density lipoprotein particle clearance [GO:0034383]; low-density lipoprotein particle remodeling [GO:0034374]; nervous system development [GO:0007399]; positive regulation of cholesterol storage [GO:0010886]; positive regulation of gene expression [GO:0010628]; positive regulation of macrophage derived foam cell differentiation [GO:0010744]; post-embryonic development [GO:0009791]; regulation of cholesterol biosynthetic process [GO:0045540]; response to virus [GO:0009615]; spermatogenesis [GO:0007283]; triglyceride catabolic process [GO:0019433]; triglyceride mobilization [GO:0006642],cytosol [GO:0005829]; endoplasmic reticulum [GO:0005783]; endoplasmic reticulum exit site [GO:0070971]; extracellular region [GO:0005576]; intermediate-density lipoprotein particle [GO:0034363]; lipid droplet [GO:0005811]; low-density lipoprotein particle [GO:0034362]; mature chylomicron [GO:0034359]; neuronal cell body [GO:0043025]; very-low-density lipoprotein particle [GO:0034361],cholesterol transfer activity [GO:0120020]; heparin binding [GO:0008201]; lipase binding [GO:0035473]; low-density lipoprotein particle receptor binding [GO:0050750]; phospholipid binding [GO:0005543]; receptor ligand activity [GO:0048018],GO:0005215; GO:0005576; GO:0005783; GO:0005811; GO:0005829; GO:0006629; GO:0007018; GO:0008289; GO:0022414; GO:0030163; GO:0043226; GO:0048018; GO:0048856; GO:0048870; GO:0098772,transporter activity; extracellular region; endoplasmic reticulum; lipid droplet; cytosol; lipid metabolic process; microtubule-based movement; lipid binding; reproductive process; protein catabolic process; organelle; receptor ligand activity; anatomical structure development; cell motility; molecular function regulator activity
OG_04737,2.5876660574210675,FUN_022613-T1,Peve_00012263,Pocillopora_meandrina_HIv1___RNAseq.g4397.t1,three_way,68.725,FUN_022613-T1,A0A0R4IKU3,RECK_DANRE,,Reversion-inducing cysteine-rich protein with Kazal motifs,Danio rerio (Zebrafish) (Brachydanio rerio),38.2,961.0,2.3000000000000002e-201,704.1,sp|A0A0R4IKU3|RECK_DANRE Reversion-inducing cysteine-rich protein with Kazal motifs OS=Danio rerio OX=7955 GN=reck PE=1 SV=3,GO:0001944; GO:0001955; GO:0002040; GO:0004866; GO:0004867; GO:0005886; GO:0008191; GO:0015026; GO:0016055; GO:0030198; GO:0045765; GO:0051726; GO:0060070; GO:0060828; GO:0090049; GO:0090210; GO:0098552; GO:1904684; GO:1990791; GO:1990909,blood vessel maturation [GO:0001955]; canonical Wnt signaling pathway [GO:0060070]; dorsal root ganglion development [GO:1990791]; extracellular matrix organization [GO:0030198]; negative regulation of metalloendopeptidase activity [GO:1904684]; regulation of angiogenesis [GO:0045765]; regulation of canonical Wnt signaling pathway [GO:0060828]; regulation of cell cycle [GO:0051726]; regulation of cell migration involved in sprouting angiogenesis [GO:0090049]; regulation of establishment of blood-brain barrier [GO:0090210]; sprouting angiogenesis [GO:0002040]; vasculature development [GO:0001944]; Wnt signaling pathway [GO:0016055],plasma membrane [GO:0005886]; side of membrane [GO:0098552]; Wnt signalosome [GO:1990909],coreceptor activity [GO:0015026]; endopeptidase inhibitor activity [GO:0004866]; metalloendopeptidase inhibitor activity [GO:0008191]; serine-type endopeptidase inhibitor activity [GO:0004867],GO:0005886; GO:0030198; GO:0048856; GO:0060089; GO:0098772,plasma membrane; extracellular matrix organization; anatomical structure development; molecular transducer activity; molecular function regulator activity
OG_01728,2.527948333032758,FUN_007020-T1,Peve_00037180,Pocillopora_meandrina_HIv1___RNAseq.g20542.t1,three_way,63.67233333333333,FUN_007020-T1,Q6ZZY0,,,,,46.9,497.0,1.3e-139,499.6,sp|Q6ZZY0|CRY1_SYLBO Cryptochrome-1 OS=Sylvia borin OX=73324 GN=CRY1 PE=2 SV=1,,,,,,
OG_07052,2.50393901022788,FUN_032274-T1,Peve_00011763,Pocillopora_meandrina_HIv1___RNAseq.g24974.t1,three_way,68.399,FUN_032274-T1,A8E7N9,,,,,31.6,370.0,2.9e-44,181.0,sp|A8E7N9|GDF6B_DANRE Growth/differentiation factor 6-B OS=Danio rerio OX=7955 GN=gdf6b PE=2 SV=1,,,,,,
OG_00679,2.4619134896657755,FUN_002102-T1,Peve_00004294,Pocillopora_meandrina_HIv1___RNAseq.g1737.t1,three_way,59.12716666666666,FUN_002102-T1,P18461,,,,,37.9,833.0,3.8e-141,503.8,sp|P18461|FGFR2_CHICK Fibroblast growth factor receptor 2 OS=Gallus gallus OX=9031 GN=FGFR2 PE=2 SV=1,,,,,,
OG_03906,2.454303332404023,FUN_015982-T1,Peve_00024012,Pocillopora_meandrina_HIv1___RNAseq.g21404.t2,three_way,57.955,FUN_015982-T1,Q00174,LAMA_DROME,,Laminin subunit alpha (Laminin A chain),Drosophila melanogaster (Fruit fly),29.8,729.0,2.6e-88,330.1,sp|Q00174|LAMA_DROME Laminin subunit alpha OS=Drosophila melanogaster OX=7227 GN=LanA PE=1 SV=2,GO:0005102; GO:0005201; GO:0005576; GO:0005604; GO:0007411; GO:0007498; GO:0007507; GO:0008021; GO:0009887; GO:0009888; GO:0030155; GO:0030334; GO:0030424; GO:0031012; GO:0033627; GO:0034446; GO:0035001; GO:0035011; GO:0036062; GO:0045886; GO:0045995; GO:0071711,"animal organ morphogenesis [GO:0009887]; axon guidance [GO:0007411]; basement membrane organization [GO:0071711]; cell adhesion mediated by integrin [GO:0033627]; dorsal trunk growth, open tracheal system [GO:0035001]; heart development [GO:0007507]; melanotic encapsulation of foreign target [GO:0035011]; mesoderm development [GO:0007498]; negative regulation of synaptic assembly at neuromuscular junction [GO:0045886]; regulation of cell adhesion [GO:0030155]; regulation of cell migration [GO:0030334]; regulation of embryonic development [GO:0045995]; substrate adhesion-dependent cell spreading [GO:0034446]; tissue development [GO:0009888]",axon [GO:0030424]; basement membrane [GO:0005604]; extracellular matrix [GO:0031012]; extracellular region [GO:0005576]; presynaptic periactive zone [GO:0036062]; synaptic vesicle [GO:0008021],extracellular matrix structural constituent [GO:0005201]; signaling receptor binding [GO:0005102],GO:0002376; GO:0005198; GO:0005576; GO:0007155; GO:0030198; GO:0030312; GO:0031012; GO:0031410; GO:0043226; GO:0048856; GO:0098542,immune system process; structural molecule activity; extracellular region; cell adhesion; extracellular matrix organization; external encapsulating structure; extracellular matrix; cytoplasmic vesicle; organelle; anatomical structure development; defense response to other organism
OG_03911,2.430869240596452,FUN_015990-T1,Peve_00023998,Pocillopora_meandrina_HIv1___RNAseq.g21387.t1,three_way,69.50233333333334,FUN_015990-T1,Q5BIM1,,,,,25.3,490.0,3.2e-30,135.2,sp|Q5BIM1|TRI45_BOVIN E3 ubiquitin-protein ligase TRIM45 OS=Bos taurus OX=9913 GN=TRIM45 PE=2 SV=1,,,,,,
OG_01608,2.394940327121771,FUN_006652-T1,Peve_00029039,Pocillopora_meandrina_HIv1___RNAseq.g19955.t1,three_way,64.58433333333333,FUN_006652-T1,Q6V0I7,FAT4_HUMAN,,Protocadherin Fat 4 (hFat4) (Cadherin family member 14) (FAT tumor suppressor homolog 4) (Fat-like cadherin protein FAT-J),Homo sapiens (Human),32.4,1666.0,2.3000000000000004e-224,781.6,sp|Q6V0I7|FAT4_HUMAN Protocadherin Fat 4 OS=Homo sapiens OX=9606 GN=FAT4 PE=1 SV=2,GO:0005509; GO:0005886; GO:0007156; GO:0007157; GO:0021987; GO:0022008; GO:0035329; GO:0070062; GO:0098609,cell-cell adhesion [GO:0098609]; cerebral cortex development [GO:0021987]; heterophilic cell-cell adhesion via plasma membrane cell adhesion molecules [GO:0007157]; hippo signaling [GO:0035329]; homophilic cell adhesion via plasma membrane adhesion molecules [GO:0007156]; neurogenesis [GO:0022008],extracellular exosome [GO:0070062]; plasma membrane [GO:0005886],calcium ion binding [GO:0005509],GO:0005886; GO:0007155; GO:0030154; GO:0043226; GO:0048856,plasma membrane; cell adhesion; cell differentiation; organelle; anatomical structure development
