group_id,max_val,apul,peve,ptua,type,avg_identity,query,accession,id,reviewed,protein_name,organism,pident,length,evalue,bitscore,title,go_ids,go_bp,go_cc,go_mf,goslim_ids,goslim_names
OG_00163,1.126282313822893,FUN_000637-T1,Peve_00012867,Pocillopora_meandrina_HIv1___RNAseq.g16016.t1,three_way,83.68833333333333,FUN_000637-T1,O97125,,,,,74.2,613.0,9.1e-265,914.1,sp|O97125|HSP68_DROME Heat shock protein 68 OS=Drosophila melanogaster OX=7227 GN=Hsp68 PE=1 SV=1,,,,,,
OG_01642,1.2044834729632767,FUN_006790-T1,Peve_00028070,Pocillopora_meandrina_HIv1___RNAseq.g20501.t1,three_way,54.868,FUN_006790-T1,P35918,,,,,31.5,961.0,9.8e-99,363.6,sp|P35918|VGFR2_MOUSE Vascular endothelial growth factor receptor 2 OS=Mus musculus OX=10090 GN=Kdr PE=1 SV=2,,,,,,
OG_02012,1.1005927717735524,FUN_008185-T1,Peve_00018749,Pocillopora_meandrina_HIv1___RNAseq.g29992.t1,three_way,52.86033333333334,FUN_008185-T1,O57382,,,,,29.0,317.0,5.399999999999999e-31,137.5,sp|O57382|TLL2_XENLA Tolloid-like protein 2 OS=Xenopus laevis OX=8355 GN=tll2 PE=2 SV=1,,,,,,
OG_03250,1.2862941044878178,FUN_012970-T1,Peve_00000426,Pocillopora_meandrina_HIv1___RNAseq.g12971.t1,three_way,92.84033333333332,FUN_012970-T1,A1Z6E0,GUS_DROME,,Protein gustavus,Drosophila melanogaster (Fruit fly),59.8,281.0,4.3e-97,355.9,sp|A1Z6E0|GUS_DROME Protein gustavus OS=Drosophila melanogaster OX=7227 GN=gus PE=1 SV=2,GO:0005634; GO:0005737; GO:0005938; GO:0007281; GO:0007314; GO:0007315; GO:0007472; GO:0008104; GO:0008354; GO:0019005; GO:0031466; GO:0035017; GO:0035556; GO:0043161; GO:0045495; GO:0045732; GO:0046843; GO:0048471; GO:0070449,cuticle pattern formation [GO:0035017]; dorsal appendage formation [GO:0046843]; germ cell development [GO:0007281]; germ cell migration [GO:0008354]; intracellular signal transduction [GO:0035556]; oocyte anterior/posterior axis specification [GO:0007314]; pole plasm assembly [GO:0007315]; positive regulation of protein catabolic process [GO:0045732]; proteasome-mediated ubiquitin-dependent protein catabolic process [GO:0043161]; protein localization [GO:0008104]; wing disc morphogenesis [GO:0007472],cell cortex [GO:0005938]; Cul5-RING ubiquitin ligase complex [GO:0031466]; cytoplasm [GO:0005737]; elongin complex [GO:0070449]; nucleus [GO:0005634]; perinuclear region of cytoplasm [GO:0048471]; pole plasm [GO:0045495]; SCF ubiquitin ligase complex [GO:0019005],,GO:0005634; GO:0022414; GO:0030163; GO:0043226; GO:0048856; GO:0048870,nucleus; reproductive process; protein catabolic process; organelle; anatomical structure development; cell motility
OG_06279,1.170547297433619,FUN_028447-T1,Peve_00026233,Pocillopora_meandrina_HIv1___RNAseq.g16195.t1,three_way,59.692,FUN_028447-T1,Q60997,DMBT1_MOUSE,,Scavenger receptor cysteine-rich domain-containing protein DMBT1 (Apactin) (CRP-ductin) (Deleted in malignant brain tumors 1 protein) (Glycoprotein 300) (gp300) (Hensin) (Mucin-like glycoprotein) (Muclin) (Vomeroglandin) (p80),Mus musculus (Mouse),40.3,573.0,9.700000000000001e-117,423.7,sp|Q60997|DMBT1_MOUSE Scavenger receptor cysteine-rich domain-containing protein DMBT1 OS=Mus musculus OX=10090 GN=Dmbt1 PE=1 SV=2,GO:0001824; GO:0001833; GO:0002065; GO:0005576; GO:0009617; GO:0015031; GO:0030658; GO:0030858; GO:0031012; GO:0035375; GO:0042589; GO:0050829; GO:0050830; GO:0062023,blastocyst development [GO:0001824]; columnar/cuboidal epithelial cell differentiation [GO:0002065]; defense response to Gram-negative bacterium [GO:0050829]; defense response to Gram-positive bacterium [GO:0050830]; inner cell mass cell proliferation [GO:0001833]; positive regulation of epithelial cell differentiation [GO:0030858]; protein transport [GO:0015031]; response to bacterium [GO:0009617],collagen-containing extracellular matrix [GO:0062023]; extracellular matrix [GO:0031012]; extracellular region [GO:0005576]; transport vesicle membrane [GO:0030658]; zymogen granule membrane [GO:0042589],zymogen binding [GO:0035375],GO:0005576; GO:0030154; GO:0030312; GO:0031012; GO:0048856,extracellular region; cell differentiation; external encapsulating structure; extracellular matrix; anatomical structure development
OG_06842,1.0862392455190306,FUN_031782-T1,Peve_00010427,Pocillopora_meandrina_HIv1___RNAseq.g5565.t1,three_way,65.31783333333333,FUN_031782-T1,P29176,,,,,44.2,77.0,1.2e-06,55.1,sp|P29176|FOSX_MSVFR Transforming protein v-Fos/v-Fox OS=FBR murine osteosarcoma virus OX=353765 GN=FOS-FOX PE=3 SV=1,,,,,,
OG_07659,1.2261001617173402,FUN_034604-T1,Peve_00037084,Pocillopora_meandrina_HIv1___TS.g18635.t1,three_way,65.48566666666666,FUN_034604-T1,Q90XE6,KLF1_DANRE,,Kruppel-like factor 1 (Erythroid krueppel-like transcription factor) (Kruppel-like factor d),Danio rerio (Zebrafish) (Brachydanio rerio),80.0,80.0,5.7e-08,59.7,sp|Q90XE6|KLF1_DANRE Kruppel-like factor 1 OS=Danio rerio OX=7955 GN=klf1 PE=2 SV=1,GO:0000785; GO:0000978; GO:0000981; GO:0003700; GO:0005634; GO:0005829; GO:0006357; GO:0008270; GO:0010628; GO:0010725; GO:0031100; GO:0043565; GO:0043697; GO:0045214; GO:0055007; GO:0060038; GO:0060319,animal organ regeneration [GO:0031100]; cardiac muscle cell differentiation [GO:0055007]; cardiac muscle cell proliferation [GO:0060038]; cell dedifferentiation [GO:0043697]; positive regulation of gene expression [GO:0010628]; primitive erythrocyte differentiation [GO:0060319]; regulation of primitive erythrocyte differentiation [GO:0010725]; regulation of transcription by RNA polymerase II [GO:0006357]; sarcomere organization [GO:0045214],chromatin [GO:0000785]; cytosol [GO:0005829]; nucleus [GO:0005634],"DNA-binding transcription factor activity [GO:0003700]; DNA-binding transcription factor activity, RNA polymerase II-specific [GO:0000981]; RNA polymerase II cis-regulatory region sequence-specific DNA binding [GO:0000978]; sequence-specific DNA binding [GO:0043565]; zinc ion binding [GO:0008270]",GO:0003677; GO:0005634; GO:0005829; GO:0006355; GO:0007010; GO:0030154; GO:0043226; GO:0048856; GO:0140110,DNA binding; nucleus; cytosol; regulation of DNA-templated transcription; cytoskeleton organization; cell differentiation; organelle; anatomical structure development; transcription regulator activity
OG_08557,1.032235933790904,FUN_037545-T1,Peve_00032229,Pocillopora_meandrina_HIv1___RNAseq.g1633.t2,three_way,65.51433333333333,FUN_037545-T1,P60483,,,,,47.9,382.0,1.2e-98,361.7,"sp|P60483|PTEN_CANLF Phosphatidylinositol 3,4,5-trisphosphate 3-phosphatase and dual-specificity protein phosphatase PTEN OS=Canis lupus familiaris OX=9615 GN=PTEN PE=2 SV=1",,,,,,
OG_09443,1.0885692978203385,FUN_041432-T2,Peve_00027845,Pocillopora_meandrina_HIv1___RNAseq.g15740.t1,three_way,86.71633333333334,FUN_041432-T2,Q90837,,,,,41.4,459.0,1.8000000000000002e-81,304.7,sp|Q90837|ERG_CHICK Transcriptional regulator Erg OS=Gallus gallus OX=9031 GN=ERG PE=2 SV=1,,,,,,
