group_id,max_val,apul,peve,ptua,type,avg_identity,query,accession,id,reviewed,protein_name,organism,pident,length,evalue,bitscore,title,go_ids,go_bp,go_cc,go_mf,goslim_ids,goslim_names
OG_00691,0.2246996587738996,FUN_002378-T1,Peve_00034013,Pocillopora_meandrina_HIv1___RNAseq.g21.t1,three_way,75.79133333333333,FUN_002378-T1,Q8TCT0,CERK1_HUMAN,,Ceramide kinase (hCERK) (EC 2.7.1.138) (Acylsphingosine kinase) (Lipid kinase 4) (LK4),Homo sapiens (Human),45.1,457.0,4.400000000000001e-111,403.3,sp|Q8TCT0|CERK1_HUMAN Ceramide kinase OS=Homo sapiens OX=9606 GN=CERK PE=1 SV=1,GO:0000287; GO:0001729; GO:0005524; GO:0005737; GO:0005886; GO:0006672; GO:0006688; GO:0016020,ceramide metabolic process [GO:0006672]; glycosphingolipid biosynthetic process [GO:0006688],cytoplasm [GO:0005737]; membrane [GO:0016020]; plasma membrane [GO:0005886],ATP binding [GO:0005524]; ceramide kinase activity [GO:0001729]; magnesium ion binding [GO:0000287],GO:0003824; GO:0005886; GO:0006629; GO:0016740; GO:1901135,catalytic activity; plasma membrane; lipid metabolic process; transferase activity; carbohydrate derivative metabolic process
OG_01290,0.3258721974501605,FUN_005113-T1,Peve_00007463,Pocillopora_meandrina_HIv1___RNAseq.g8268.t1,three_way,72.56616666666666,FUN_005113-T1,O15945,ARNT_DROME,,Aryl hydrocarbon receptor nuclear translocator homolog (dARNT) (Hypoxia-inducible factor 1-beta) (Protein tango),Drosophila melanogaster (Fruit fly),57.4,378.0,5.4e-115,416.8,sp|O15945|ARNT_DROME Aryl hydrocarbon receptor nuclear translocator homolog OS=Drosophila melanogaster OX=7227 GN=tgo PE=1 SV=3,GO:0000122; GO:0000978; GO:0000981; GO:0001228; GO:0003700; GO:0005634; GO:0005737; GO:0006355; GO:0006357; GO:0007417; GO:0007420; GO:0008286; GO:0008347; GO:0016348; GO:0017022; GO:0032869; GO:0032991; GO:0034751; GO:0043565; GO:0045676; GO:0045944; GO:0046982; GO:0048477; GO:0048736; GO:0071456; GO:0090575,appendage development [GO:0048736]; brain development [GO:0007420]; cellular response to hypoxia [GO:0071456]; cellular response to insulin stimulus [GO:0032869]; central nervous system development [GO:0007417]; glial cell migration [GO:0008347]; imaginal disc-derived leg joint morphogenesis [GO:0016348]; insulin receptor signaling pathway [GO:0008286]; negative regulation of transcription by RNA polymerase II [GO:0000122]; oogenesis [GO:0048477]; positive regulation of transcription by RNA polymerase II [GO:0045944]; regulation of DNA-templated transcription [GO:0006355]; regulation of R7 cell differentiation [GO:0045676]; regulation of transcription by RNA polymerase II [GO:0006357],aryl hydrocarbon receptor complex [GO:0034751]; cytoplasm [GO:0005737]; nucleus [GO:0005634]; protein-containing complex [GO:0032991]; RNA polymerase II transcription regulator complex [GO:0090575],"DNA-binding transcription activator activity, RNA polymerase II-specific [GO:0001228]; DNA-binding transcription factor activity [GO:0003700]; DNA-binding transcription factor activity, RNA polymerase II-specific [GO:0000981]; myosin binding [GO:0017022]; protein heterodimerization activity [GO:0046982]; RNA polymerase II cis-regulatory region sequence-specific DNA binding [GO:0000978]; sequence-specific DNA binding [GO:0043565]",GO:0003677; GO:0005634; GO:0006355; GO:0008092; GO:0022414; GO:0043226; GO:0048856; GO:0048870; GO:0140110,DNA binding; nucleus; regulation of DNA-templated transcription; cytoskeletal protein binding; reproductive process; organelle; anatomical structure development; cell motility; transcription regulator activity
OG_01314,0.4484024782805163,FUN_005177-T1,Peve_00022720,Pocillopora_meandrina_HIv1___RNAseq.g7584.t1,three_way,78.689,FUN_005177-T1,Q7Z401,MYCPP_HUMAN,,C-myc promoter-binding protein (DENN domain-containing protein 4A),Homo sapiens (Human),34.8,1885.0,8.6e-282,971.8,sp|Q7Z401|MYCPP_HUMAN C-myc promoter-binding protein OS=Homo sapiens OX=9606 GN=DENND4A PE=1 SV=2,GO:0003677; GO:0005085; GO:0005634; GO:0005829; GO:0006355; GO:0031410; GO:0032483,regulation of DNA-templated transcription [GO:0006355]; regulation of Rab protein signal transduction [GO:0032483],cytoplasmic vesicle [GO:0031410]; cytosol [GO:0005829]; nucleus [GO:0005634],DNA binding [GO:0003677]; guanyl-nucleotide exchange factor activity [GO:0005085],GO:0003677; GO:0005634; GO:0005829; GO:0006355; GO:0031410; GO:0043226; GO:0098772,DNA binding; nucleus; cytosol; regulation of DNA-templated transcription; cytoplasmic vesicle; organelle; molecular function regulator activity
OG_01440,0.2304134304213865,FUN_005878-T1,Peve_00015762,Pocillopora_meandrina_HIv1___RNAseq.g19674.t1,three_way,82.214,FUN_005878-T1,Q9Y619,ORNT1_HUMAN,,Mitochondrial ornithine transporter 1 (Solute carrier family 25 member 15),Homo sapiens (Human),54.9,288.0,1.4e-85,317.8,sp|Q9Y619|ORNT1_HUMAN Mitochondrial ornithine transporter 1 OS=Homo sapiens OX=9606 GN=SLC25A15 PE=1 SV=1,GO:0000050; GO:0000064; GO:0005739; GO:0005743; GO:0015189; GO:0015297; GO:0016020; GO:0061459; GO:1903401; GO:1903826; GO:1990575,L-arginine transmembrane transport [GO:1903826]; L-lysine transmembrane transport [GO:1903401]; mitochondrial L-ornithine transmembrane transport [GO:1990575]; urea cycle [GO:0000050],membrane [GO:0016020]; mitochondrial inner membrane [GO:0005743]; mitochondrion [GO:0005739],antiporter activity [GO:0015297]; L-arginine transmembrane transporter activity [GO:0061459]; L-lysine transmembrane transporter activity [GO:0015189]; L-ornithine transmembrane transporter activity [GO:0000064],GO:0005215; GO:0005739; GO:0043226; GO:0055085; GO:0071941,transporter activity; mitochondrion; organelle; transmembrane transport; nitrogen cycle metabolic process
OG_01444,0.307129793856425,FUN_005890-T1,Peve_00015769,Pocillopora_meandrina_HIv1___RNAseq.g19679.t1,three_way,69.12316666666668,FUN_005890-T1,O94868,,,,,36.6,673.0,7.4e-94,346.7,sp|O94868|FCSD2_HUMAN F-BAR and double SH3 domains protein 2 OS=Homo sapiens OX=9606 GN=FCHSD2 PE=1 SV=3,,,,,,
OG_01522,0.4306767208947966,FUN_006276-T1,Peve_00031100,Pocillopora_meandrina_HIv1___RNAseq.g20369.t1,three_way,84.9125,FUN_006276-T1,Q8K5C0,GRHL2_MOUSE,,Grainyhead-like protein 2 homolog (Brother of mammalian grainyhead) (Transcription factor CP2-like 3),Mus musculus (Mouse),32.7,620.0,2.6999999999999998e-70,268.1,sp|Q8K5C0|GRHL2_MOUSE Grainyhead-like protein 2 homolog OS=Mus musculus OX=10090 GN=Grhl2 PE=2 SV=1,GO:0001161; GO:0001228; GO:0001701; GO:0001843; GO:0003208; GO:0003382; GO:0003677; GO:0003682; GO:0003700; GO:0005634; GO:0005654; GO:0005911; GO:0006355; GO:0006357; GO:0007155; GO:0007420; GO:0008544; GO:0010468; GO:0016020; GO:0021915; GO:0030216; GO:0030323; GO:0031490; GO:0034329; GO:0035264; GO:0042733; GO:0042802; GO:0043010; GO:0043565; GO:0045893; GO:0045944; GO:0048568; GO:0048701; GO:0060324; GO:0060463; GO:0060487; GO:0060672; GO:0061713; GO:0070830; GO:0090132; GO:0140297,anterior neural tube closure [GO:0061713]; bicellular tight junction assembly [GO:0070830]; brain development [GO:0007420]; camera-type eye development [GO:0043010]; cardiac ventricle morphogenesis [GO:0003208]; cell adhesion [GO:0007155]; cell junction assembly [GO:0034329]; embryonic cranial skeleton morphogenesis [GO:0048701]; embryonic digit morphogenesis [GO:0042733]; embryonic organ development [GO:0048568]; epidermis development [GO:0008544]; epithelial cell morphogenesis [GO:0003382]; epithelial cell morphogenesis involved in placental branching [GO:0060672]; epithelium migration [GO:0090132]; face development [GO:0060324]; in utero embryonic development [GO:0001701]; keratinocyte differentiation [GO:0030216]; lung epithelial cell differentiation [GO:0060487]; lung lobe morphogenesis [GO:0060463]; multicellular organism growth [GO:0035264]; neural tube closure [GO:0001843]; neural tube development [GO:0021915]; positive regulation of DNA-templated transcription [GO:0045893]; positive regulation of transcription by RNA polymerase II [GO:0045944]; regulation of DNA-templated transcription [GO:0006355]; regulation of gene expression [GO:0010468]; regulation of transcription by RNA polymerase II [GO:0006357]; respiratory tube development [GO:0030323],cell-cell junction [GO:0005911]; membrane [GO:0016020]; nucleoplasm [GO:0005654]; nucleus [GO:0005634],"chromatin binding [GO:0003682]; chromatin DNA binding [GO:0031490]; DNA binding [GO:0003677]; DNA-binding transcription activator activity, RNA polymerase II-specific [GO:0001228]; DNA-binding transcription factor activity [GO:0003700]; DNA-binding transcription factor binding [GO:0140297]; identical protein binding [GO:0042802]; intronic transcription regulatory region sequence-specific DNA binding [GO:0001161]; sequence-specific DNA binding [GO:0043565]",GO:0003677; GO:0005634; GO:0005654; GO:0006355; GO:0007155; GO:0030154; GO:0034330; GO:0043226; GO:0048856; GO:0140110,DNA binding; nucleus; nucleoplasm; regulation of DNA-templated transcription; cell adhesion; cell differentiation; cell junction organization; organelle; anatomical structure development; transcription regulator activity
OG_02373,0.2695314038106999,FUN_008983-T1,Peve_00017858,Pocillopora_meandrina_HIv1___RNAseq.g3906.t1,three_way,57.8225,FUN_008983-T1,Q63187,ELOA1_RAT,,Elongin-A (EloA) (Elongin 110 kDa subunit) (RNA polymerase II transcription factor SIII subunit A1) (SIII p110) (Transcription elongation factor B polypeptide 3),Rattus norvegicus (Rat),32.7,370.0,1.1999999999999999e-35,152.5,sp|Q63187|ELOA1_RAT Elongin-A OS=Rattus norvegicus OX=10116 GN=Eloa PE=1 SV=1,GO:0003690; GO:0006357; GO:0006367; GO:0006368; GO:0008023; GO:0070449; GO:0090734,regulation of transcription by RNA polymerase II [GO:0006357]; transcription elongation by RNA polymerase II [GO:0006368]; transcription initiation at RNA polymerase II promoter [GO:0006367],elongin complex [GO:0070449]; site of DNA damage [GO:0090734]; transcription elongation factor complex [GO:0008023],double-stranded DNA binding [GO:0003690],GO:0003677; GO:0006355,DNA binding; regulation of DNA-templated transcription
OG_03189,0.4859201182546524,FUN_012660-T1,Peve_00020497,Pocillopora_meandrina_HIv1___RNAseq.g22893.t1,three_way,86.607,FUN_012660-T1,Q8C811,,,,,49.4,265.0,7.899999999999999e-62,238.8,sp|Q8C811|S35E2_MOUSE Solute carrier family 35 member E2A OS=Mus musculus OX=10090 GN=Slc35e2a PE=2 SV=1,,,,,,
OG_03209,0.4853229755760181,FUN_012701-T1,Peve_00016835,Pocillopora_meandrina_HIv1___RNAseq.g12828.t1,three_way,66.00966666666667,,,,,,,,,,,,,,,,,
OG_03253,0.0838682233098384,FUN_013011-T1,Peve_00011640,Pocillopora_meandrina_HIv1___RNAseq.g16598.t1,three_way,60.175,,,,,,,,,,,,,,,,,
OG_03330,0.2410392161876251,FUN_013421-T1,Peve_00038575,Pocillopora_meandrina_HIv1___TS.g15837.t1,three_way,55.18933333333333,FUN_013421-T1,P42893,,,,,35.5,707.0,1.3000000000000002e-124,448.7,sp|P42893|ECE1_RAT Endothelin-converting enzyme 1 OS=Rattus norvegicus OX=10116 GN=Ece1 PE=1 SV=2,,,,,,
OG_03618,0.3804995125031362,FUN_014803-T1,Peve_00010343,Pocillopora_meandrina_HIv1___RNAseq.g22413.t1,three_way,74.0495,FUN_014803-T1,Q3UQ28,PXDN_MOUSE,,Peroxidasin homolog (EC 1.11.2.-) [Cleaved into: PXDN active fragment],Mus musculus (Mouse),52.2,1478.0,0.0,1216.8,sp|Q3UQ28|PXDN_MOUSE Peroxidasin homolog OS=Mus musculus OX=10090 GN=Pxdn PE=1 SV=2,GO:0001525; GO:0001654; GO:0004601; GO:0005201; GO:0005604; GO:0005615; GO:0005783; GO:0006979; GO:0007155; GO:0009986; GO:0016684; GO:0020037; GO:0030198; GO:0030199; GO:0042744; GO:0043237; GO:0046872; GO:0051260; GO:0062023; GO:0070207; GO:0070831; GO:0071711; GO:0140825,angiogenesis [GO:0001525]; basement membrane assembly [GO:0070831]; basement membrane organization [GO:0071711]; cell adhesion [GO:0007155]; collagen fibril organization [GO:0030199]; extracellular matrix organization [GO:0030198]; eye development [GO:0001654]; hydrogen peroxide catabolic process [GO:0042744]; protein homooligomerization [GO:0051260]; protein homotrimerization [GO:0070207]; response to oxidative stress [GO:0006979],basement membrane [GO:0005604]; cell surface [GO:0009986]; collagen-containing extracellular matrix [GO:0062023]; endoplasmic reticulum [GO:0005783]; extracellular space [GO:0005615],"extracellular matrix structural constituent [GO:0005201]; heme binding [GO:0020037]; lactoperoxidase activity [GO:0140825]; laminin-1 binding [GO:0043237]; metal ion binding [GO:0046872]; oxidoreductase activity, acting on peroxide as acceptor [GO:0016684]; peroxidase activity [GO:0004601]",GO:0003824; GO:0005198; GO:0005615; GO:0005783; GO:0007155; GO:0016209; GO:0016491; GO:0030198; GO:0030312; GO:0031012; GO:0043226; GO:0048856; GO:0065003,catalytic activity; structural molecule activity; extracellular space; endoplasmic reticulum; cell adhesion; antioxidant activity; oxidoreductase activity; extracellular matrix organization; external encapsulating structure; extracellular matrix; organelle; anatomical structure development; protein-containing complex assembly
OG_04241,0.3665594552140578,FUN_017762-T1,Peve_00003285,Pocillopora_meandrina_HIv1___RNAseq.g441.t1,three_way,80.27833333333334,FUN_017762-T1,Q8BPM2,,,,,46.1,857.0,7.6e-203,708.8,sp|Q8BPM2|M4K5_MOUSE Mitogen-activated protein kinase kinase kinase kinase 5 OS=Mus musculus OX=10090 GN=Map4k5 PE=1 SV=2,,,,,,
OG_04541,0.1868180241139525,FUN_022098-T1,Peve_00038678,Pocillopora_meandrina_HIv1___RNAseq.g4106.t1,three_way,67.46583333333334,FUN_022098-T1,Q9IA31,,,,,31.5,523.0,6.9e-32,141.4,sp|Q9IA31|GLI3_CHICK Transcriptional activator GLI3 (Fragment) OS=Gallus gallus OX=9031 GN=GLI3 PE=1 SV=1,,,,,,
OG_04746,0.5969874562864191,FUN_022627-T1,Peve_00012280,Pocillopora_meandrina_HIv1___RNAseq.g4385.t1,three_way,74.43166666666667,FUN_022627-T1,Q13485,SMAD4_HUMAN,,Mothers against decapentaplegic homolog 4 (MAD homolog 4) (Mothers against DPP homolog 4) (Deletion target in pancreatic carcinoma 4) (SMAD family member 4) (SMAD 4) (Smad4) (hSMAD4),Homo sapiens (Human),52.7,220.0,2.4e-51,205.7,sp|Q13485|SMAD4_HUMAN Mothers against decapentaplegic homolog 4 OS=Homo sapiens OX=9606 GN=SMAD4 PE=1 SV=1,GO:0000122; GO:0000785; GO:0000976; GO:0000978; GO:0000981; GO:0001222; GO:0001223; GO:0001228; GO:0001541; GO:0001649; GO:0001658; GO:0001666; GO:0001701; GO:0001702; GO:0001837; GO:0003148; GO:0003161; GO:0003190; GO:0003198; GO:0003220; GO:0003251; GO:0003360; GO:0003682; GO:0003700; GO:0005518; GO:0005634; GO:0005654; GO:0005667; GO:0005737; GO:0005813; GO:0005829; GO:0006351; GO:0006355; GO:0006357; GO:0006366; GO:0006879; GO:0007179; GO:0007283; GO:0007338; GO:0007411; GO:0008283; GO:0008285; GO:0009653; GO:0010614; GO:0010628; GO:0010631; GO:0010666; GO:0010718; GO:0014033; GO:0014898; GO:0030154; GO:0030308; GO:0030325; GO:0030509; GO:0030511; GO:0031005; GO:0032444; GO:0032525; GO:0032909; GO:0032924; GO:0033686; GO:0035556; GO:0036064; GO:0036302; GO:0042118; GO:0042177; GO:0042733; GO:0042802; GO:0042803; GO:0043199; GO:0043565; GO:0045892; GO:0045893; GO:0045944; GO:0046872; GO:0046881; GO:0048382; GO:0048589; GO:0048665; GO:0048733; GO:0048859; GO:0051797; GO:0060065; GO:0060391; GO:0060395; GO:0060412; GO:0060956; GO:0061040; GO:0061629; GO:0062009; GO:0070102; GO:0070371; GO:0070373; GO:0070411; GO:0070412; GO:0071141; GO:0071144; GO:0071333; GO:0071559; GO:0071560; GO:0071773; GO:0072133; GO:0072134; GO:0072520; GO:0090090; GO:0097191; GO:1901203; GO:1902895; GO:1905305,activin receptor signaling pathway [GO:0032924]; adrenal gland development [GO:0030325]; anatomical structure morphogenesis [GO:0009653]; atrioventricular canal development [GO:0036302]; atrioventricular valve formation [GO:0003190]; axon guidance [GO:0007411]; BMP signaling pathway [GO:0030509]; brainstem development [GO:0003360]; branching involved in ureteric bud morphogenesis [GO:0001658]; cardiac conduction system development [GO:0003161]; cardiac muscle hypertrophy in response to stress [GO:0014898]; cell differentiation [GO:0030154]; cell population proliferation [GO:0008283]; cellular response to BMP stimulus [GO:0071773]; cellular response to glucose stimulus [GO:0071333]; cellular response to transforming growth factor beta stimulus [GO:0071560]; developmental growth [GO:0048589]; DNA-templated transcription [GO:0006351]; embryonic digit morphogenesis [GO:0042733]; endocardial cell differentiation [GO:0060956]; endothelial cell activation [GO:0042118]; epithelial cell migration [GO:0010631]; epithelial to mesenchymal transition [GO:0001837]; epithelial to mesenchymal transition involved in endocardial cushion formation [GO:0003198]; ERK1 and ERK2 cascade [GO:0070371]; extrinsic apoptotic signaling pathway [GO:0097191]; female gonad morphogenesis [GO:0061040]; formation of anatomical boundary [GO:0048859]; gastrulation with mouth forming second [GO:0001702]; in utero embryonic development [GO:0001701]; interleukin-6-mediated signaling pathway [GO:0070102]; intracellular iron ion homeostasis [GO:0006879]; intracellular signal transduction [GO:0035556]; left ventricular cardiac muscle tissue morphogenesis [GO:0003220]; mesendoderm development [GO:0048382]; metanephric mesenchyme morphogenesis [GO:0072133]; negative regulation of canonical Wnt signaling pathway [GO:0090090]; negative regulation of cardiac muscle hypertrophy [GO:0010614]; negative regulation of cardiac myofibril assembly [GO:1905305]; negative regulation of cell growth [GO:0030308]; negative regulation of cell population proliferation [GO:0008285]; negative regulation of DNA-templated transcription [GO:0045892]; negative regulation of ERK1 and ERK2 cascade [GO:0070373]; negative regulation of protein catabolic process [GO:0042177]; negative regulation of transcription by RNA polymerase II [GO:0000122]; nephrogenic mesenchyme morphogenesis [GO:0072134]; neural crest cell differentiation [GO:0014033]; neuron fate specification [GO:0048665]; osteoblast differentiation [GO:0001649]; outflow tract septum morphogenesis [GO:0003148]; ovarian follicle development [GO:0001541]; positive regulation of cardiac muscle cell apoptotic process [GO:0010666]; positive regulation of cell proliferation involved in heart valve morphogenesis [GO:0003251]; positive regulation of DNA-templated transcription [GO:0045893]; positive regulation of epithelial to mesenchymal transition [GO:0010718]; positive regulation of extracellular matrix assembly [GO:1901203]; positive regulation of follicle-stimulating hormone secretion [GO:0046881]; positive regulation of gene expression [GO:0010628]; positive regulation of luteinizing hormone secretion [GO:0033686]; positive regulation of miRNA transcription [GO:1902895]; positive regulation of SMAD protein signal transduction [GO:0060391]; positive regulation of transcription by RNA polymerase II [GO:0045944]; positive regulation of transforming growth factor beta receptor signaling pathway [GO:0030511]; regulation of DNA-templated transcription [GO:0006355]; regulation of hair follicle development [GO:0051797]; regulation of transcription by RNA polymerase II [GO:0006357]; regulation of transforming growth factor beta2 production [GO:0032909]; response to hypoxia [GO:0001666]; response to transforming growth factor beta [GO:0071559]; sebaceous gland development [GO:0048733]; secondary palate development [GO:0062009]; seminiferous tubule development [GO:0072520]; single fertilization [GO:0007338]; SMAD protein signal transduction [GO:0060395]; somite rostral/caudal axis specification [GO:0032525]; spermatogenesis [GO:0007283]; transcription by RNA polymerase II [GO:0006366]; transforming growth factor beta receptor signaling pathway [GO:0007179]; uterus development [GO:0060065]; ventricular septum morphogenesis [GO:0060412],activin responsive factor complex [GO:0032444]; centrosome [GO:0005813]; chromatin [GO:0000785]; ciliary basal body [GO:0036064]; cytoplasm [GO:0005737]; cytosol [GO:0005829]; heteromeric SMAD protein complex [GO:0071144]; nucleoplasm [GO:0005654]; nucleus [GO:0005634]; SMAD protein complex [GO:0071141]; transcription regulator complex [GO:0005667],"chromatin binding [GO:0003682]; collagen binding [GO:0005518]; DNA-binding transcription activator activity, RNA polymerase II-specific [GO:0001228]; DNA-binding transcription factor activity [GO:0003700]; DNA-binding transcription factor activity, RNA polymerase II-specific [GO:0000981]; filamin binding [GO:0031005]; I-SMAD binding [GO:0070411]; identical protein binding [GO:0042802]; metal ion binding [GO:0046872]; protein homodimerization activity [GO:0042803]; R-SMAD binding [GO:0070412]; RNA polymerase II cis-regulatory region sequence-specific DNA binding [GO:0000978]; RNA polymerase II-specific DNA-binding transcription factor binding [GO:0061629]; sequence-specific DNA binding [GO:0043565]; sulfate binding [GO:0043199]; transcription cis-regulatory region binding [GO:0000976]; transcription coactivator binding [GO:0001223]; transcription corepressor binding [GO:0001222]",GO:0003012; GO:0003677; GO:0005634; GO:0005654; GO:0005815; GO:0005829; GO:0006351; GO:0006355; GO:0008092; GO:0022414; GO:0030154; GO:0043226; GO:0048856; GO:0048870; GO:0140110,muscle system process; DNA binding; nucleus; nucleoplasm; microtubule organizing center; cytosol; DNA-templated transcription; regulation of DNA-templated transcription; cytoskeletal protein binding; reproductive process; cell differentiation; organelle; anatomical structure development; cell motility; transcription regulator activity
OG_05340,0.3720366257983009,FUN_024063-T1,Peve_00000155,Pocillopora_meandrina_HIv1___RNAseq.g19256.t1,three_way,75.40483333333333,FUN_024063-T1,Q9P241,AT10D_HUMAN,,Phospholipid-transporting ATPase VD (EC 7.6.2.1) (ATPase class V type 10D) (P4-ATPase flippase complex alpha subunit ATP10D),Homo sapiens (Human),43.6,1316.0,3.3999999999999998e-279,963.0,sp|Q9P241|AT10D_HUMAN Phospholipid-transporting ATPase VD OS=Homo sapiens OX=9606 GN=ATP10D PE=1 SV=3,GO:0000287; GO:0005524; GO:0005654; GO:0005783; GO:0005789; GO:0005886; GO:0006812; GO:0016020; GO:0016887; GO:0034220; GO:0045332; GO:0140326; GO:0140351; GO:1990531,monoatomic cation transport [GO:0006812]; monoatomic ion transmembrane transport [GO:0034220]; phospholipid translocation [GO:0045332],endoplasmic reticulum [GO:0005783]; endoplasmic reticulum membrane [GO:0005789]; membrane [GO:0016020]; nucleoplasm [GO:0005654]; phospholipid-translocating ATPase complex [GO:1990531]; plasma membrane [GO:0005886],ATP binding [GO:0005524]; ATP hydrolysis activity [GO:0016887]; ATPase-coupled intramembrane lipid transporter activity [GO:0140326]; glycosylceramide flippase activity [GO:0140351]; magnesium ion binding [GO:0000287],GO:0003824; GO:0005215; GO:0005654; GO:0005783; GO:0005886; GO:0016787; GO:0043226; GO:0055085; GO:0061024; GO:0140657,catalytic activity; transporter activity; nucleoplasm; endoplasmic reticulum; plasma membrane; hydrolase activity; organelle; transmembrane transport; membrane organization; ATP-dependent activity
OG_05750,0.3301424337801741,FUN_025682-T1,Peve_00000456,Pocillopora_meandrina_HIv1___TS.g2103.t1,three_way,67.785,FUN_025682-T1,Q3UQ28,PXDN_MOUSE,,Peroxidasin homolog (EC 1.11.2.-) [Cleaved into: PXDN active fragment],Mus musculus (Mouse),38.9,742.0,5.6000000000000005e-126,454.1,sp|Q3UQ28|PXDN_MOUSE Peroxidasin homolog OS=Mus musculus OX=10090 GN=Pxdn PE=1 SV=2,GO:0001525; GO:0001654; GO:0004601; GO:0005201; GO:0005604; GO:0005615; GO:0005783; GO:0006979; GO:0007155; GO:0009986; GO:0016684; GO:0020037; GO:0030198; GO:0030199; GO:0042744; GO:0043237; GO:0046872; GO:0051260; GO:0062023; GO:0070207; GO:0070831; GO:0071711; GO:0140825,angiogenesis [GO:0001525]; basement membrane assembly [GO:0070831]; basement membrane organization [GO:0071711]; cell adhesion [GO:0007155]; collagen fibril organization [GO:0030199]; extracellular matrix organization [GO:0030198]; eye development [GO:0001654]; hydrogen peroxide catabolic process [GO:0042744]; protein homooligomerization [GO:0051260]; protein homotrimerization [GO:0070207]; response to oxidative stress [GO:0006979],basement membrane [GO:0005604]; cell surface [GO:0009986]; collagen-containing extracellular matrix [GO:0062023]; endoplasmic reticulum [GO:0005783]; extracellular space [GO:0005615],"extracellular matrix structural constituent [GO:0005201]; heme binding [GO:0020037]; lactoperoxidase activity [GO:0140825]; laminin-1 binding [GO:0043237]; metal ion binding [GO:0046872]; oxidoreductase activity, acting on peroxide as acceptor [GO:0016684]; peroxidase activity [GO:0004601]",GO:0003824; GO:0005198; GO:0005615; GO:0005783; GO:0007155; GO:0016209; GO:0016491; GO:0030198; GO:0030312; GO:0031012; GO:0043226; GO:0048856; GO:0065003,catalytic activity; structural molecule activity; extracellular space; endoplasmic reticulum; cell adhesion; antioxidant activity; oxidoreductase activity; extracellular matrix organization; external encapsulating structure; extracellular matrix; organelle; anatomical structure development; protein-containing complex assembly
