group_id,Component_7,apul,peve,ptua,type,avg_identity,query,accession,id,reviewed,protein_name,organism,pident,length,evalue,bitscore,title,go_ids,go_bp,go_cc,go_mf,goslim_ids,goslim_names
OG_03147,1.547636200232552,FUN_012533-T1,Peve_00034230,Pocillopora_meandrina_HIv1___RNAseq.g23954.t1,three_way,57.28066666666667,,,,,,,,,,,,,,,,,
OG_07947,1.5438203085158717,FUN_035468-T1,Peve_00012132,Pocillopora_meandrina_HIv1___TS.g14397.t1,three_way,83.6845,FUN_035468-T1,Q8BH04,PCKGM_MOUSE,,"Phosphoenolpyruvate carboxykinase [GTP], mitochondrial (PEPCK-M) (EC 4.1.1.32)",Mus musculus (Mouse),65.5,611.0,6.100000000000001e-248,858.2,"sp|Q8BH04|PCKGM_MOUSE Phosphoenolpyruvate carboxykinase [GTP], mitochondrial OS=Mus musculus OX=10090 GN=Pck2 PE=1 SV=1",GO:0004613; GO:0005525; GO:0005739; GO:0005759; GO:0006090; GO:0006094; GO:0006107; GO:0030145; GO:0032024; GO:0032496; GO:0071333; GO:0071356; GO:0071548,cellular response to glucose stimulus [GO:0071333]; cellular response to tumor necrosis factor [GO:0071356]; gluconeogenesis [GO:0006094]; oxaloacetate metabolic process [GO:0006107]; positive regulation of insulin secretion [GO:0032024]; pyruvate metabolic process [GO:0006090]; response to dexamethasone [GO:0071548]; response to lipopolysaccharide [GO:0032496],mitochondrial matrix [GO:0005759]; mitochondrion [GO:0005739],GTP binding [GO:0005525]; manganese ion binding [GO:0030145]; phosphoenolpyruvate carboxykinase (GTP) activity [GO:0004613],GO:0003824; GO:0005739; GO:0005975; GO:0016829; GO:0043226,catalytic activity; mitochondrion; carbohydrate metabolic process; lyase activity; organelle
OG_10113,1.543602779218613,FUN_043483-T1,Peve_00021710,Pocillopora_meandrina_HIv1___RNAseq.g7933.t1,three_way,81.26899999999999,FUN_043483-T1,Q96E35,,,,,48.1,241.0,4.4e-58,226.1,sp|Q96E35|ZMY19_HUMAN Zinc finger MYND domain-containing protein 19 OS=Homo sapiens OX=9606 GN=ZMYND19 PE=1 SV=1,,,,,,
OG_02976,1.5376713729924092,FUN_012142-T1,Peve_00001101,Pocillopora_meandrina_HIv1___RNAseq.g23866.t1,three_way,57.71,,,,,,,,,,,,,,,,,
OG_06909,1.536858604256659,FUN_031967-T1,Peve_00013260,Pocillopora_meandrina_HIv1___RNAseq.g17806.t1,three_way,83.551,FUN_031967-T1,Q95M17,CHIA_BOVIN,,Acidic mammalian chitinase (AMCase) (EC 3.2.1.14) (Chitin-binding protein b04) (CBPb04),Bos taurus (Bovine),46.4,390.0,4.3999999999999996e-91,336.7,sp|Q95M17|CHIA_BOVIN Acidic mammalian chitinase OS=Bos taurus OX=9913 GN=CHIA PE=1 SV=1,GO:0000272; GO:0002376; GO:0002532; GO:0004568; GO:0005576; GO:0005615; GO:0005737; GO:0006032; GO:0006915; GO:0008061; GO:0008843; GO:0032722,apoptotic process [GO:0006915]; chitin catabolic process [GO:0006032]; immune system process [GO:0002376]; polysaccharide catabolic process [GO:0000272]; positive regulation of chemokine production [GO:0032722]; production of molecular mediator involved in inflammatory response [GO:0002532],cytoplasm [GO:0005737]; extracellular region [GO:0005576]; extracellular space [GO:0005615],chitin binding [GO:0008061]; chitinase activity [GO:0004568]; endochitinase activity [GO:0008843],GO:0002376; GO:0003824; GO:0005576; GO:0005615; GO:0005975; GO:0012501; GO:0016787; GO:1901135,immune system process; catalytic activity; extracellular region; extracellular space; carbohydrate metabolic process; programmed cell death; hydrolase activity; carbohydrate derivative metabolic process
OG_03122,1.5363490973048093,FUN_012476-T1,Peve_00004005,Pocillopora_meandrina_HIv1___RNAseq.g23990.t1,three_way,74.48633333333333,FUN_012476-T1,O15247,CLIC2_HUMAN,,Chloride intracellular channel protein 2 (Glutaredoxin-like oxidoreductase CLIC2) (EC 1.8.-.-) (Glutaredoxin-like peroxidase CLIC2) (EC 1.11.1.-) (XAP121),Homo sapiens (Human),31.7,230.0,1.5e-23,111.3,sp|O15247|CLIC2_HUMAN Chloride intracellular channel protein 2 OS=Homo sapiens OX=9606 GN=CLIC2 PE=1 SV=3,GO:0004602; GO:0005254; GO:0005634; GO:0005654; GO:0005737; GO:0005829; GO:0005886; GO:0006821; GO:0007165; GO:0010880; GO:0010881; GO:0016020; GO:0034707,chloride transport [GO:0006821]; regulation of cardiac muscle contraction by regulation of the release of sequestered calcium ion [GO:0010881]; regulation of release of sequestered calcium ion into cytosol by sarcoplasmic reticulum [GO:0010880]; signal transduction [GO:0007165],chloride channel complex [GO:0034707]; cytoplasm [GO:0005737]; cytosol [GO:0005829]; membrane [GO:0016020]; nucleoplasm [GO:0005654]; nucleus [GO:0005634]; plasma membrane [GO:0005886],chloride channel activity [GO:0005254]; glutathione peroxidase activity [GO:0004602],GO:0003824; GO:0005215; GO:0005634; GO:0005654; GO:0005829; GO:0005886; GO:0016209; GO:0016491; GO:0043226,catalytic activity; transporter activity; nucleus; nucleoplasm; cytosol; plasma membrane; antioxidant activity; oxidoreductase activity; organelle
