group_id,Component_4,apul,peve,ptua,type,avg_identity,query,accession,id,reviewed,protein_name,organism,pident,length,evalue,bitscore,title,go_ids,go_bp,go_cc,go_mf,goslim_ids,goslim_names
OG_04592,0.5785336977250531,FUN_022267-T1,Peve_00043987,Pocillopora_meandrina_HIv1___RNAseq.g4714.t2,three_way,76.18966666666667,FUN_022267-T1,Q63357,MYO1D_RAT,,Unconventional myosin-Id (Myosin heavy chain myr 4),Rattus norvegicus (Rat),52.1,637.0,3e-186,653.3,sp|Q63357|MYO1D_RAT Unconventional myosin-Id OS=Rattus norvegicus OX=10116 GN=Myo1d PE=1 SV=3,GO:0000146; GO:0005516; GO:0005524; GO:0005737; GO:0005768; GO:0005769; GO:0005886; GO:0005902; GO:0005903; GO:0005938; GO:0006897; GO:0007015; GO:0015031; GO:0015629; GO:0016323; GO:0016459; GO:0019904; GO:0030048; GO:0030424; GO:0030673; GO:0030900; GO:0031410; GO:0043005; GO:0043025; GO:0043204; GO:0043209; GO:0044853; GO:0048306; GO:0051015; GO:0061502; GO:0097440,actin filament organization [GO:0007015]; actin filament-based movement [GO:0030048]; early endosome to recycling endosome transport [GO:0061502]; endocytosis [GO:0006897]; forebrain development [GO:0030900]; protein transport [GO:0015031],actin cytoskeleton [GO:0015629]; apical dendrite [GO:0097440]; axolemma [GO:0030673]; axon [GO:0030424]; basolateral plasma membrane [GO:0016323]; brush border [GO:0005903]; cell cortex [GO:0005938]; cytoplasm [GO:0005737]; cytoplasmic vesicle [GO:0031410]; early endosome [GO:0005769]; endosome [GO:0005768]; microvillus [GO:0005902]; myelin sheath [GO:0043209]; myosin complex [GO:0016459]; neuron projection [GO:0043005]; neuronal cell body [GO:0043025]; perikaryon [GO:0043204]; plasma membrane [GO:0005886]; plasma membrane raft [GO:0044853],actin filament binding [GO:0051015]; ATP binding [GO:0005524]; calcium-dependent protein binding [GO:0048306]; calmodulin binding [GO:0005516]; microfilament motor activity [GO:0000146]; protein domain specific binding [GO:0019904],GO:0003774; GO:0003824; GO:0005768; GO:0005856; GO:0005886; GO:0008092; GO:0016192; GO:0016853; GO:0031410; GO:0043226; GO:0048856; GO:0140657,cytoskeletal motor activity; catalytic activity; endosome; cytoskeleton; plasma membrane; cytoskeletal protein binding; vesicle-mediated transport; isomerase activity; cytoplasmic vesicle; organelle; anatomical structure development; ATP-dependent activity
OG_04351,0.5771256256778342,FUN_017990-T1,Peve_00037470,Pocillopora_meandrina_HIv1___RNAseq.g25285.t1,three_way,80.066,FUN_017990-T1,Q16665,,,,,40.2,388.0,3.2e-77,291.2,sp|Q16665|HIF1A_HUMAN Hypoxia-inducible factor 1-alpha OS=Homo sapiens OX=9606 GN=HIF1A PE=1 SV=1,,,,,,
OG_10033,0.574972531115304,FUN_043290-T1,Peve_00016457,Pocillopora_meandrina_HIv1___RNAseq.g8864.t1,three_way,76.351,FUN_043290-T1,Q6GN42,CTL4_XENLA,,Choline transporter-like protein 4 (Solute carrier family 44 member 4),Xenopus laevis (African clawed frog),41.9,704.0,1e-147,525.4,sp|Q6GN42|CTL4_XENLA Choline transporter-like protein 4 OS=Xenopus laevis OX=8355 GN=slc44a4 PE=2 SV=1,GO:0005886; GO:0008292; GO:0015220; GO:0015297; GO:0015871; GO:0016324; GO:0030307; GO:0030974; GO:0032475; GO:0035675; GO:0061526; GO:0090422,acetylcholine biosynthetic process [GO:0008292]; acetylcholine secretion [GO:0061526]; choline transport [GO:0015871]; neuromast hair cell development [GO:0035675]; otolith formation [GO:0032475]; positive regulation of cell growth [GO:0030307]; thiamine pyrophosphate transmembrane transport [GO:0030974],apical plasma membrane [GO:0016324]; plasma membrane [GO:0005886],antiporter activity [GO:0015297]; choline transmembrane transporter activity [GO:0015220]; thiamine pyrophosphate transmembrane transporter activity [GO:0090422],GO:0005215; GO:0005886; GO:0048856; GO:0055085,transporter activity; plasma membrane; anatomical structure development; transmembrane transport
OG_00319,0.5749403394474165,FUN_001137-T1,Peve_00029385,Pocillopora_meandrina_HIv1___RNAseq.g29339.t1,three_way,81.55166666666666,FUN_001137-T1,Q9Y345,,,,,44.3,625.0,1.2e-152,541.6,sp|Q9Y345|SC6A5_HUMAN Sodium- and chloride-dependent glycine transporter 2 OS=Homo sapiens OX=9606 GN=SLC6A5 PE=1 SV=3,,,,,,
OG_02650,0.5748257958650043,FUN_010832-T1,Peve_00017537,Pocillopora_meandrina_HIv1___RNAseq.g20916.t1,three_way,73.97983333333333,FUN_010832-T1,Q13118,KLF10_HUMAN,,Krueppel-like factor 10 (EGR-alpha) (Transforming growth factor-beta-inducible early growth response protein 1) (TGFB-inducible early growth response protein 1) (TIEG-1),Homo sapiens (Human),62.6,179.0,2.5e-12,74.7,sp|Q13118|KLF10_HUMAN Krueppel-like factor 10 OS=Homo sapiens OX=9606 GN=KLF10 PE=1 SV=1,GO:0000122; GO:0000785; GO:0000978; GO:0000981; GO:0001046; GO:0001228; GO:0003700; GO:0005634; GO:0006357; GO:0007267; GO:0007623; GO:0008270; GO:0008285; GO:0009267; GO:0030282; GO:0035019; GO:0042752; GO:0045672; GO:0045892; GO:0045944; GO:1990837,bone mineralization [GO:0030282]; cell-cell signaling [GO:0007267]; cellular response to starvation [GO:0009267]; circadian rhythm [GO:0007623]; negative regulation of cell population proliferation [GO:0008285]; negative regulation of DNA-templated transcription [GO:0045892]; negative regulation of transcription by RNA polymerase II [GO:0000122]; positive regulation of osteoclast differentiation [GO:0045672]; positive regulation of transcription by RNA polymerase II [GO:0045944]; regulation of circadian rhythm [GO:0042752]; regulation of transcription by RNA polymerase II [GO:0006357]; somatic stem cell population maintenance [GO:0035019],chromatin [GO:0000785]; nucleus [GO:0005634],"core promoter sequence-specific DNA binding [GO:0001046]; DNA-binding transcription activator activity, RNA polymerase II-specific [GO:0001228]; DNA-binding transcription factor activity [GO:0003700]; DNA-binding transcription factor activity, RNA polymerase II-specific [GO:0000981]; RNA polymerase II cis-regulatory region sequence-specific DNA binding [GO:0000978]; sequence-specific double-stranded DNA binding [GO:1990837]; zinc ion binding [GO:0008270]",GO:0003677; GO:0005634; GO:0006355; GO:0023052; GO:0043226; GO:0048856; GO:0140110,DNA binding; nucleus; regulation of DNA-templated transcription; signaling; organelle; anatomical structure development; transcription regulator activity
OG_05471,0.5747260731715848,FUN_024454-T1,Peve_00010316,Pocillopora_meandrina_HIv1___RNAseq.g18577.t1,three_way,67.4025,FUN_024454-T1,Q5DTZ6,,,,,45.4,273.0,1.5e-58,228.4,sp|Q5DTZ6|RN150_MOUSE RING finger protein 150 OS=Mus musculus OX=10090 GN=Rnf150 PE=2 SV=2,,,,,,
OG_02454,0.5742787359500143,FUN_009532-T1,Peve_00009560,Pocillopora_meandrina_HIv1___RNAseq.g24493.t1,three_way,88.02533333333334,FUN_009532-T1,Q148N0,,,,,64.9,976.0,0.0,1304.7,sp|Q148N0|ODO1_BOVIN 2-oxoglutarate dehydrogenase complex component E1 OS=Bos taurus OX=9913 GN=OGDH PE=1 SV=1,,,,,,
OG_08716,0.5741705599755914,FUN_037968-T1,Peve_00012657,Pocillopora_meandrina_HIv1___RNAseq.g26237.t1,three_way,76.11933333333333,FUN_037968-T1,Q16658,FSCN1_HUMAN,,Fascin (55 kDa actin-bundling protein) (Singed-like protein) (p55),Homo sapiens (Human),40.2,488.0,2.5e-97,357.5,sp|Q16658|FSCN1_HUMAN Fascin OS=Homo sapiens OX=9606 GN=FSCN1 PE=1 SV=3,GO:0001725; GO:0001726; GO:0002102; GO:0003723; GO:0003779; GO:0005737; GO:0005829; GO:0005856; GO:0005902; GO:0005911; GO:0005938; GO:0007043; GO:0007163; GO:0010592; GO:0015629; GO:0016477; GO:0030027; GO:0030035; GO:0030036; GO:0030046; GO:0030175; GO:0030426; GO:0030674; GO:0031253; GO:0032534; GO:0032956; GO:0035089; GO:0044393; GO:0045296; GO:0048870; GO:0051015; GO:0051017; GO:0051491; GO:0070062; GO:0071803; GO:0090091,actin cytoskeleton organization [GO:0030036]; actin filament bundle assembly [GO:0051017]; cell migration [GO:0016477]; cell motility [GO:0048870]; cell-cell junction assembly [GO:0007043]; establishment of apical/basal cell polarity [GO:0035089]; establishment or maintenance of cell polarity [GO:0007163]; microspike assembly [GO:0030035]; parallel actin filament bundle assembly [GO:0030046]; positive regulation of extracellular matrix disassembly [GO:0090091]; positive regulation of filopodium assembly [GO:0051491]; positive regulation of lamellipodium assembly [GO:0010592]; positive regulation of podosome assembly [GO:0071803]; regulation of actin cytoskeleton organization [GO:0032956]; regulation of microvillus assembly [GO:0032534],actin cytoskeleton [GO:0015629]; cell cortex [GO:0005938]; cell projection membrane [GO:0031253]; cell-cell junction [GO:0005911]; cytoplasm [GO:0005737]; cytoskeleton [GO:0005856]; cytosol [GO:0005829]; extracellular exosome [GO:0070062]; filopodium [GO:0030175]; growth cone [GO:0030426]; lamellipodium [GO:0030027]; microspike [GO:0044393]; microvillus [GO:0005902]; podosome [GO:0002102]; ruffle [GO:0001726]; stress fiber [GO:0001725],actin binding [GO:0003779]; actin filament binding [GO:0051015]; cadherin binding [GO:0045296]; protein-macromolecule adaptor activity [GO:0030674]; RNA binding [GO:0003723],GO:0003723; GO:0005829; GO:0005856; GO:0007010; GO:0007163; GO:0008092; GO:0034330; GO:0043226; GO:0048870; GO:0060090,RNA binding; cytosol; cytoskeleton; cytoskeleton organization; establishment or maintenance of cell polarity; cytoskeletal protein binding; cell junction organization; organelle; cell motility; molecular adaptor activity
OG_03559,0.5736315383871063,FUN_014706-T1,Peve_00021213,Pocillopora_meandrina_HIv1___RNAseq.g22534.t1,three_way,85.49499999999999,FUN_014706-T1,Q2KIR8,,,,,63.2,307.0,4.6e-117,422.5,"sp|Q2KIR8|TDH_BOVIN L-threonine 3-dehydrogenase, mitochondrial OS=Bos taurus OX=9913 GN=TDH PE=2 SV=1",,,,,,
OG_09269,0.5735776181850077,FUN_040075-T1,Peve_00021003,Pocillopora_meandrina_HIv1___RNAseq.g7690.t1,three_way,38.61383333333333,,,,,,,,,,,,,,,,,
OG_08433,0.572023863525004,FUN_037167-T1,Peve_00003254,Pocillopora_meandrina_HIv1___RNAseq.g11080.t1,three_way,59.40383333333333,,,,,,,,,,,,,,,,,
OG_04032,0.5716394046990161,FUN_016340-T1,Peve_00044576,Pocillopora_meandrina_HIv1___RNAseq.g9730.t1,three_way,73.72266666666667,FUN_016340-T1,Q6P7A2,UBE4A_RAT,,Ubiquitin conjugation factor E4 A (EC 2.3.2.27) (RING-type E3 ubiquitin transferase E4 A),Rattus norvegicus (Rat),39.6,1095.0,2.2e-194,681.0,sp|Q6P7A2|UBE4A_RAT Ubiquitin conjugation factor E4 A OS=Rattus norvegicus OX=10116 GN=Ube4a PE=2 SV=1,GO:0000151; GO:0000209; GO:0005634; GO:0005737; GO:0006511; GO:0034450; GO:0036503; GO:0061630,ERAD pathway [GO:0036503]; protein polyubiquitination [GO:0000209]; ubiquitin-dependent protein catabolic process [GO:0006511],cytoplasm [GO:0005737]; nucleus [GO:0005634]; ubiquitin ligase complex [GO:0000151],ubiquitin protein ligase activity [GO:0061630]; ubiquitin-ubiquitin ligase activity [GO:0034450],GO:0003824; GO:0005634; GO:0016740; GO:0030163; GO:0043226; GO:0140096,"catalytic activity; nucleus; transferase activity; protein catabolic process; organelle; catalytic activity, acting on a protein"
OG_02198,0.5712152492055274,FUN_008562-T1,Peve_00044733,Pocillopora_meandrina_HIv1___TS.g25491.t1,three_way,80.36,,,,,,,,,,,,,,,,,
OG_02084,0.5704805229852362,FUN_008307-T1,Peve_00015429,Pocillopora_meandrina_HIv1___RNAseq.g5789.t1,three_way,71.01916666666666,FUN_008307-T1,Q3SYV5,TSN33_BOVIN,,Tetraspanin-33 (Tspan-33),Bos taurus (Bovine),40.9,252.0,4.3e-47,189.9,sp|Q3SYV5|TSN33_BOVIN Tetraspanin-33 OS=Bos taurus OX=9913 GN=TSPAN33 PE=1 SV=1,GO:0005737; GO:0005886; GO:0005912; GO:0051604; GO:0072659,protein localization to plasma membrane [GO:0072659]; protein maturation [GO:0051604],adherens junction [GO:0005912]; cytoplasm [GO:0005737]; plasma membrane [GO:0005886],,GO:0005886; GO:0051604; GO:0072659,plasma membrane; protein maturation; protein localization to plasma membrane
OG_00355,0.5690496865140707,FUN_001185-T1,Peve_00040986,Pocillopora_meandrina_HIv1___RNAseq.g29540.t1,three_way,52.84166666666667,FUN_001185-T1,C0HL13,LRP2_PIG,,Low-density lipoprotein receptor-related protein 2 (LRP-2) (Glycoprotein 330) (gp330) (Megalin),Sus scrofa (Pig),41.7,412.0,3.4e-63,245.0,sp|C0HL13|LRP2_PIG Low-density lipoprotein receptor-related protein 2 OS=Sus scrofa OX=9823 GN=LRP2 PE=1 SV=1,GO:0001843; GO:0003139; GO:0003148; GO:0003223; GO:0005509; GO:0005905; GO:0006898; GO:0007605; GO:0008584; GO:0009897; GO:0016324; GO:0017124; GO:0030001; GO:0030424; GO:0030425; GO:0030514; GO:0031526; GO:0031904; GO:0043235; GO:0050769; GO:0051087; GO:0060068; GO:0060982; GO:0061156; GO:0070447; GO:0140058; GO:1904447; GO:1905167,coronary artery morphogenesis [GO:0060982]; folate import across plasma membrane [GO:1904447]; male gonad development [GO:0008584]; metal ion transport [GO:0030001]; negative regulation of BMP signaling pathway [GO:0030514]; neural tube closure [GO:0001843]; neuron projection arborization [GO:0140058]; outflow tract septum morphogenesis [GO:0003148]; positive regulation of lysosomal protein catabolic process [GO:1905167]; positive regulation of neurogenesis [GO:0050769]; positive regulation of oligodendrocyte progenitor proliferation [GO:0070447]; pulmonary artery morphogenesis [GO:0061156]; receptor-mediated endocytosis [GO:0006898]; secondary heart field specification [GO:0003139]; sensory perception of sound [GO:0007605]; vagina development [GO:0060068]; ventricular compact myocardium morphogenesis [GO:0003223],apical plasma membrane [GO:0016324]; axon [GO:0030424]; brush border membrane [GO:0031526]; clathrin-coated pit [GO:0005905]; dendrite [GO:0030425]; endosome lumen [GO:0031904]; external side of plasma membrane [GO:0009897]; receptor complex [GO:0043235],calcium ion binding [GO:0005509]; protein-folding chaperone binding [GO:0051087]; SH3 domain binding [GO:0017124],GO:0016192; GO:0022414; GO:0048856; GO:0050877; GO:0055085,vesicle-mediated transport; reproductive process; anatomical structure development; nervous system process; transmembrane transport
OG_04759,0.5680483220970287,FUN_022649-T1,Peve_00019793,Pocillopora_meandrina_HIv1___RNAseq.g4450.t2,three_way,87.07466666666667,FUN_022649-T1,Q6ZWH5,NEK10_HUMAN,,Serine/threonine-protein kinase Nek10 (EC 2.7.11.1) (Never in mitosis A-related kinase 10) (NimA-related protein kinase 10),Homo sapiens (Human),45.7,1046.0,4.3e-211,736.5,sp|Q6ZWH5|NEK10_HUMAN Serine/threonine-protein kinase Nek10 OS=Homo sapiens OX=9606 GN=NEK10 PE=1 SV=3,GO:0004672; GO:0004674; GO:0005524; GO:0005576; GO:0006468; GO:0031954; GO:0043406; GO:0046872; GO:0070372; GO:0106310; GO:0120197; GO:1902749; GO:1902911,mucociliary clearance [GO:0120197]; positive regulation of MAP kinase activity [GO:0043406]; positive regulation of protein autophosphorylation [GO:0031954]; protein phosphorylation [GO:0006468]; regulation of cell cycle G2/M phase transition [GO:1902749]; regulation of ERK1 and ERK2 cascade [GO:0070372],extracellular region [GO:0005576]; protein kinase complex [GO:1902911],ATP binding [GO:0005524]; metal ion binding [GO:0046872]; protein kinase activity [GO:0004672]; protein serine kinase activity [GO:0106310]; protein serine/threonine kinase activity [GO:0004674],GO:0003016; GO:0003824; GO:0005576; GO:0007018; GO:0016740; GO:0140096,"respiratory system process; catalytic activity; extracellular region; microtubule-based movement; transferase activity; catalytic activity, acting on a protein"
OG_01612,0.5620007753182159,FUN_006692-T1,Peve_00029050,Pocillopora_meandrina_HIv1___RNAseq.g19966.t1,three_way,46.55916666666666,,,,,,,,,,,,,,,,,
OG_07062,0.5619646632134103,FUN_032288-T1,Peve_00015511,Pocillopora_meandrina_HIv1___RNAseq.g24311.t1,three_way,76.559,FUN_032288-T1,Q6P5E8,DGKQ_MOUSE,,Diacylglycerol kinase theta (DAG kinase theta) (EC 2.7.1.107) (EC 2.7.1.93) (Diglyceride kinase theta) (DGK-theta),Mus musculus (Mouse),40.0,879.0,2.1e-185,651.0,sp|Q6P5E8|DGKQ_MOUSE Diacylglycerol kinase theta OS=Mus musculus OX=10090 GN=Dgkq PE=1 SV=1,GO:0004143; GO:0004697; GO:0005524; GO:0005730; GO:0005768; GO:0005829; GO:0005856; GO:0005886; GO:0006111; GO:0006357; GO:0006654; GO:0007173; GO:0007189; GO:0007200; GO:0008270; GO:0010628; GO:0010629; GO:0012506; GO:0016363; GO:0016607; GO:0030297; GO:0030971; GO:0043274; GO:0046339; GO:0046834; GO:0047649; GO:0051591; GO:0070493; GO:0090037; GO:0090181; GO:0098793; GO:0098794; GO:0098978; GO:0140297; GO:1900242; GO:1903413; GO:1903432; GO:2000064; GO:2000182,adenylate cyclase-activating G protein-coupled receptor signaling pathway [GO:0007189]; cellular response to bile acid [GO:1903413]; diacylglycerol metabolic process [GO:0046339]; epidermal growth factor receptor signaling pathway [GO:0007173]; lipid phosphorylation [GO:0046834]; negative regulation of gene expression [GO:0010629]; phosphatidic acid biosynthetic process [GO:0006654]; phospholipase C-activating G protein-coupled receptor signaling pathway [GO:0007200]; positive regulation of gene expression [GO:0010628]; positive regulation of protein kinase C signaling [GO:0090037]; regulation of cholesterol metabolic process [GO:0090181]; regulation of cortisol biosynthetic process [GO:2000064]; regulation of gluconeogenesis [GO:0006111]; regulation of progesterone biosynthetic process [GO:2000182]; regulation of synaptic vesicle endocytosis [GO:1900242]; regulation of TORC1 signaling [GO:1903432]; regulation of transcription by RNA polymerase II [GO:0006357]; response to cAMP [GO:0051591]; thrombin-activated receptor signaling pathway [GO:0070493],cytoskeleton [GO:0005856]; cytosol [GO:0005829]; endosome [GO:0005768]; glutamatergic synapse [GO:0098978]; nuclear matrix [GO:0016363]; nuclear speck [GO:0016607]; nucleolus [GO:0005730]; plasma membrane [GO:0005886]; postsynapse [GO:0098794]; presynapse [GO:0098793]; vesicle membrane [GO:0012506],alkylglycerol kinase activity [GO:0047649]; ATP binding [GO:0005524]; ATP-dependent diacylglycerol kinase activity [GO:0004143]; diacylglycerol-dependent serine/threonine kinase activity [GO:0004697]; DNA-binding transcription factor binding [GO:0140297]; phospholipase binding [GO:0043274]; receptor tyrosine kinase binding [GO:0030971]; transmembrane receptor protein tyrosine kinase activator activity [GO:0030297]; zinc ion binding [GO:0008270],GO:0003824; GO:0005730; GO:0005768; GO:0005829; GO:0005856; GO:0005886; GO:0006355; GO:0006629; GO:0016740; GO:0031410; GO:0043226; GO:0098772; GO:0140096,"catalytic activity; nucleolus; endosome; cytosol; cytoskeleton; plasma membrane; regulation of DNA-templated transcription; lipid metabolic process; transferase activity; cytoplasmic vesicle; organelle; molecular function regulator activity; catalytic activity, acting on a protein"
OG_10121,0.5617101079720628,FUN_043499-T1,Peve_00024907,Pocillopora_meandrina_HIv1___RNAseq.g7964.t1,three_way,56.86333333333334,FUN_043499-T1,P82279,CRUM1_HUMAN,,Protein crumbs homolog 1,Homo sapiens (Human),23.8,741.0,3.6e-48,196.4,sp|P82279|CRUM1_HUMAN Protein crumbs homolog 1 OS=Homo sapiens OX=9606 GN=CRB1 PE=1 SV=2,GO:0001750; GO:0001917; GO:0001974; GO:0005509; GO:0005576; GO:0005886; GO:0005902; GO:0005912; GO:0007009; GO:0007157; GO:0007163; GO:0007267; GO:0008104; GO:0010001; GO:0010467; GO:0010842; GO:0016324; GO:0032991; GO:0035003; GO:0035845; GO:0042462; GO:0043296; GO:0045197; GO:0045494; GO:0050908; GO:0060060; GO:0061159; GO:0071482; GO:0097386,blood vessel remodeling [GO:0001974]; cell-cell signaling [GO:0007267]; cellular response to light stimulus [GO:0071482]; detection of light stimulus involved in visual perception [GO:0050908]; establishment of bipolar cell polarity involved in cell morphogenesis [GO:0061159]; establishment or maintenance of cell polarity [GO:0007163]; establishment or maintenance of epithelial cell apical/basal polarity [GO:0045197]; eye photoreceptor cell development [GO:0042462]; gene expression [GO:0010467]; glial cell differentiation [GO:0010001]; heterophilic cell-cell adhesion via plasma membrane cell adhesion molecules [GO:0007157]; photoreceptor cell maintenance [GO:0045494]; photoreceptor cell outer segment organization [GO:0035845]; plasma membrane organization [GO:0007009]; post-embryonic retina morphogenesis in camera-type eye [GO:0060060]; protein localization [GO:0008104]; retina layer formation [GO:0010842],adherens junction [GO:0005912]; apical junction complex [GO:0043296]; apical plasma membrane [GO:0016324]; extracellular region [GO:0005576]; glial cell projection [GO:0097386]; microvillus [GO:0005902]; photoreceptor inner segment [GO:0001917]; photoreceptor outer segment [GO:0001750]; plasma membrane [GO:0005886]; protein-containing complex [GO:0032991]; subapical complex [GO:0035003],calcium ion binding [GO:0005509],GO:0005576; GO:0005886; GO:0007155; GO:0007163; GO:0023052; GO:0030154; GO:0048856; GO:0061024,extracellular region; plasma membrane; cell adhesion; establishment or maintenance of cell polarity; signaling; cell differentiation; anatomical structure development; membrane organization
OG_02849,0.5616361451043916,FUN_011876-T1,Peve_00018839,Pocillopora_meandrina_HIv1___RNAseq.g23400.t1,three_way,55.41233333333333,FUN_011876-T1,Q9C0D7,ZC12C_HUMAN,,Probable ribonuclease ZC3H12C (EC 3.1.-.-) (MCP-induced protein 3) (Zinc finger CCCH domain-containing protein 12C),Homo sapiens (Human),45.0,351.0,3.5999999999999997e-69,264.6,sp|Q9C0D7|ZC12C_HUMAN Probable ribonuclease ZC3H12C OS=Homo sapiens OX=9606 GN=ZC3H12C PE=1 SV=2,GO:0003729; GO:0004521; GO:0005634; GO:0008270; GO:0036464,,cytoplasmic ribonucleoprotein granule [GO:0036464]; nucleus [GO:0005634],mRNA binding [GO:0003729]; RNA endonuclease activity [GO:0004521]; zinc ion binding [GO:0008270],GO:0003723; GO:0003824; GO:0005634; GO:0043226; GO:0140098,"RNA binding; catalytic activity; nucleus; organelle; catalytic activity, acting on RNA"
OG_09835,0.5614004488750681,FUN_042814-T1,Peve_00021878,Pocillopora_meandrina_HIv1___RNAseq.g7429.t1,three_way,82.54266666666666,FUN_042814-T1,E9Q634,MYO1E_MOUSE,,Unconventional myosin-Ie (Unconventional myosin 1E),Mus musculus (Mouse),66.0,1113.0,0.0,1439.5,sp|E9Q634|MYO1E_MOUSE Unconventional myosin-Ie OS=Mus musculus OX=10090 GN=Myo1e PE=1 SV=1,GO:0001570; GO:0001701; GO:0001822; GO:0003094; GO:0003774; GO:0005516; GO:0005524; GO:0005737; GO:0005856; GO:0005903; GO:0005912; GO:0006897; GO:0016459; GO:0016887; GO:0030097; GO:0032836; GO:0035091; GO:0035166; GO:0045334; GO:0048008; GO:0051015; GO:0072015,endocytosis [GO:0006897]; glomerular basement membrane development [GO:0032836]; glomerular filtration [GO:0003094]; hemopoiesis [GO:0030097]; in utero embryonic development [GO:0001701]; kidney development [GO:0001822]; platelet-derived growth factor receptor signaling pathway [GO:0048008]; podocyte development [GO:0072015]; post-embryonic hemopoiesis [GO:0035166]; vasculogenesis [GO:0001570],adherens junction [GO:0005912]; brush border [GO:0005903]; clathrin-coated endocytic vesicle [GO:0045334]; cytoplasm [GO:0005737]; cytoskeleton [GO:0005856]; myosin complex [GO:0016459],actin filament binding [GO:0051015]; ATP binding [GO:0005524]; ATP hydrolysis activity [GO:0016887]; calmodulin binding [GO:0005516]; cytoskeletal motor activity [GO:0003774]; phosphatidylinositol binding [GO:0035091],GO:0003014; GO:0003774; GO:0003824; GO:0005856; GO:0008092; GO:0008289; GO:0016192; GO:0016787; GO:0030154; GO:0030198; GO:0031410; GO:0043226; GO:0048856,renal system process; cytoskeletal motor activity; catalytic activity; cytoskeleton; cytoskeletal protein binding; lipid binding; vesicle-mediated transport; hydrolase activity; cell differentiation; extracellular matrix organization; cytoplasmic vesicle; organelle; anatomical structure development
OG_08249,0.55956893982207,FUN_036158-T1,Peve_00039218,Pocillopora_meandrina_HIv1___RNAseq.g27493.t1,three_way,85.587,FUN_036158-T1,Q5PQY6,,,,,58.8,838.0,6.9e-268,924.9,"sp|Q5PQY6|LONP2_DANRE Lon protease homolog 2, peroxisomal OS=Danio rerio OX=7955 GN=lonp2 PE=2 SV=1",,,,,,
OG_00611,0.5591153147039459,FUN_001777-T1,Peve_00035594,Pocillopora_meandrina_HIv1___RNAseq.g2684.t2,three_way,77.261,FUN_001777-T1,Q969G6,RIFK_HUMAN,,Riboflavin kinase (EC 2.7.1.26) (ATP:riboflavin 5'-phosphotransferase) (Flavokinase),Homo sapiens (Human),63.0,154.0,5.6e-51,202.2,sp|Q969G6|RIFK_HUMAN Riboflavin kinase OS=Homo sapiens OX=9606 GN=RFK PE=1 SV=2,GO:0005524; GO:0005737; GO:0005739; GO:0005829; GO:0006771; GO:0006915; GO:0008531; GO:0009231; GO:0009398; GO:0033864; GO:0046872; GO:0072388; GO:0072593,apoptotic process [GO:0006915]; flavin adenine dinucleotide biosynthetic process [GO:0072388]; FMN biosynthetic process [GO:0009398]; positive regulation of NAD(P)H oxidase activity [GO:0033864]; reactive oxygen species metabolic process [GO:0072593]; riboflavin biosynthetic process [GO:0009231]; riboflavin metabolic process [GO:0006771],cytoplasm [GO:0005737]; cytosol [GO:0005829]; mitochondrion [GO:0005739],ATP binding [GO:0005524]; metal ion binding [GO:0046872]; riboflavin kinase activity [GO:0008531],GO:0003824; GO:0005739; GO:0005829; GO:0006766; GO:0012501; GO:0016740; GO:0043226; GO:0055086; GO:1901135,catalytic activity; mitochondrion; cytosol; vitamin metabolic process; programmed cell death; transferase activity; organelle; nucleobase-containing small molecule metabolic process; carbohydrate derivative metabolic process
