group_id,Component_4,apul,peve,ptua,type,avg_identity,query,accession,id,reviewed,protein_name,organism,pident,length,evalue,bitscore,title,go_ids,go_bp,go_cc,go_mf,goslim_ids,goslim_names
OG_06599,0.6125598745773068,FUN_029673-T1,Peve_00038759,Pocillopora_meandrina_HIv1___RNAseq.g17212.t1,three_way,61.962,FUN_029673-T1,O88572,LRP6_MOUSE,,Low-density lipoprotein receptor-related protein 6 (LRP-6),Mus musculus (Mouse),38.7,310.0,4.200000000000001e-58,228.0,sp|O88572|LRP6_MOUSE Low-density lipoprotein receptor-related protein 6 OS=Mus musculus OX=10090 GN=Lrp6 PE=1 SV=1,GO:0001702; GO:0001756; GO:0001843; GO:0001947; GO:0002053; GO:0003151; GO:0003344; GO:0003401; GO:0005041; GO:0005769; GO:0005783; GO:0005886; GO:0008078; GO:0009880; GO:0009950; GO:0009952; GO:0010463; GO:0010976; GO:0016020; GO:0017147; GO:0019534; GO:0021587; GO:0021794; GO:0021795; GO:0021861; GO:0021872; GO:0021874; GO:0021915; GO:0021943; GO:0021987; GO:0030326; GO:0030900; GO:0030901; GO:0030917; GO:0034185; GO:0035108; GO:0035115; GO:0035116; GO:0035261; GO:0036342; GO:0042074; GO:0042475; GO:0042733; GO:0042813; GO:0043065; GO:0045121; GO:0045444; GO:0045599; GO:0045778; GO:0045780; GO:0045944; GO:0046849; GO:0048596; GO:0048699; GO:0048705; GO:0050678; GO:0050680; GO:0051593; GO:0055008; GO:0060021; GO:0060026; GO:0060042; GO:0060059; GO:0060070; GO:0060284; GO:0060325; GO:0060412; GO:0060444; GO:0060535; GO:0060596; GO:0060603; GO:0060856; GO:0071542; GO:0072089; GO:0090009; GO:0090118; GO:0090244; GO:0090245; GO:0110135; GO:1990963; GO:2000051; GO:2000648,anterior/posterior pattern specification [GO:0009952]; axis elongation [GO:0003401]; axis elongation involved in somitogenesis [GO:0090245]; bone remodeling [GO:0046849]; branching involved in mammary gland duct morphogenesis [GO:0060444]; canonical Wnt signaling pathway [GO:0060070]; cardiac muscle tissue morphogenesis [GO:0055008]; cell migration involved in gastrulation [GO:0042074]; cerebellum morphogenesis [GO:0021587]; cerebral cortex cell migration [GO:0021795]; cerebral cortex development [GO:0021987]; convergent extension [GO:0060026]; dopaminergic neuron differentiation [GO:0071542]; dorsal/ventral axis specification [GO:0009950]; embryonic camera-type eye morphogenesis [GO:0048596]; embryonic digit morphogenesis [GO:0042733]; embryonic forelimb morphogenesis [GO:0035115]; embryonic hindlimb morphogenesis [GO:0035116]; embryonic limb morphogenesis [GO:0030326]; embryonic pattern specification [GO:0009880]; embryonic retina morphogenesis in camera-type eye [GO:0060059]; establishment of blood-brain barrier [GO:0060856]; establishment of blood-retinal barrier [GO:1990963]; external genitalia morphogenesis [GO:0035261]; face morphogenesis [GO:0060325]; fat cell differentiation [GO:0045444]; forebrain development [GO:0030900]; forebrain generation of neurons [GO:0021872]; forebrain radial glial cell differentiation [GO:0021861]; formation of radial glial scaffolds [GO:0021943]; gastrulation with mouth forming second [GO:0001702]; generation of neurons [GO:0048699]; heart looping [GO:0001947]; limb morphogenesis [GO:0035108]; mammary gland duct morphogenesis [GO:0060603]; mammary placode formation [GO:0060596]; mesenchymal cell proliferation [GO:0010463]; mesodermal cell migration [GO:0008078]; midbrain development [GO:0030901]; midbrain-hindbrain boundary development [GO:0030917]; negative regulation of epithelial cell proliferation [GO:0050680]; negative regulation of fat cell differentiation [GO:0045599]; negative regulation of non-canonical Wnt signaling pathway [GO:2000051]; neural tube closure [GO:0001843]; neural tube development [GO:0021915]; Norrin signaling pathway [GO:0110135]; odontogenesis of dentin-containing tooth [GO:0042475]; outflow tract morphogenesis [GO:0003151]; pericardium morphogenesis [GO:0003344]; positive regulation of apoptotic process [GO:0043065]; positive regulation of bone resorption [GO:0045780]; positive regulation of mesenchymal cell proliferation [GO:0002053]; positive regulation of neuron projection development [GO:0010976]; positive regulation of ossification [GO:0045778]; positive regulation of stem cell proliferation [GO:2000648]; positive regulation of transcription by RNA polymerase II [GO:0045944]; post-anal tail morphogenesis [GO:0036342]; primitive streak formation [GO:0090009]; receptor-mediated endocytosis involved in cholesterol transport [GO:0090118]; regulation of cell development [GO:0060284]; regulation of epithelial cell proliferation [GO:0050678]; response to folic acid [GO:0051593]; retina morphogenesis in camera-type eye [GO:0060042]; roof of mouth development [GO:0060021]; skeletal system morphogenesis [GO:0048705]; somitogenesis [GO:0001756]; stem cell proliferation [GO:0072089]; thalamus development [GO:0021794]; trachea cartilage morphogenesis [GO:0060535]; ventricular septum morphogenesis [GO:0060412]; Wnt signaling pathway involved in forebrain neuroblast division [GO:0021874]; Wnt signaling pathway involved in somitogenesis [GO:0090244],early endosome [GO:0005769]; endoplasmic reticulum [GO:0005783]; membrane [GO:0016020]; membrane raft [GO:0045121]; plasma membrane [GO:0005886],apolipoprotein binding [GO:0034185]; low-density lipoprotein particle receptor activity [GO:0005041]; toxin transmembrane transporter activity [GO:0019534]; Wnt receptor activity [GO:0042813]; Wnt-protein binding [GO:0017147],GO:0005215; GO:0005768; GO:0005783; GO:0005886; GO:0006355; GO:0016192; GO:0022414; GO:0030154; GO:0031410; GO:0038024; GO:0043226; GO:0048856; GO:0048870; GO:0060089,transporter activity; endosome; endoplasmic reticulum; plasma membrane; regulation of DNA-templated transcription; vesicle-mediated transport; reproductive process; cell differentiation; cytoplasmic vesicle; cargo receptor activity; organelle; anatomical structure development; cell motility; molecular transducer activity
OG_08661,0.6124941771363125,FUN_037877-T1,Peve_00027466,Pocillopora_meandrina_HIv1___TS.g13174.t1,three_way,47.705333333333336,FUN_037877-T1,P86733,,,,,41.8,110.0,7.4e-27,125.6,sp|P86733|KCP_HALAI BPTI/Kunitz domain-containing protein (Fragment) OS=Haliotis asinina OX=109174 PE=1 SV=1,,,,,,
OG_00111,0.6099976874023795,FUN_000503-T1,Peve_00043531,Pocillopora_meandrina_HIv1___RNAseq.g18598.t1,three_way,56.31033333333333,,,,,,,,,,,,,,,,,
OG_04624,0.6088259843242597,FUN_022332-T1,Peve_00028602,Pocillopora_meandrina_HIv1___RNAseq.g4651.t2,three_way,52.3965,FUN_022332-T1,P26008,,,,,27.8,994.0,3.3000000000000003e-81,305.1,sp|P26008|ITAV_CHICK Integrin alpha-V OS=Gallus gallus OX=9031 GN=ITGAV PE=2 SV=1,,,,,,
OG_02473,0.6087001169334082,FUN_009675-T1,Peve_00009262,Pocillopora_meandrina_HIv1___RNAseq.g24569.t1,three_way,75.73666666666666,FUN_009675-T1,Q8K078,SO4A1_MOUSE,,Solute carrier organic anion transporter family member 4A1 (Organic anion-transporting polypeptide E) (OATP-E) (Sodium-independent organic anion transporter E) (Solute carrier family 21 member 12),Mus musculus (Mouse),38.1,637.0,2.3e-114,414.5,sp|Q8K078|SO4A1_MOUSE Solute carrier organic anion transporter family member 4A1 OS=Mus musculus OX=10090 GN=Slco4a1 PE=1 SV=2,GO:0005886; GO:0006811; GO:0008514; GO:0015132; GO:0015711,monoatomic ion transport [GO:0006811]; organic anion transport [GO:0015711],plasma membrane [GO:0005886],organic anion transmembrane transporter activity [GO:0008514]; prostaglandin transmembrane transporter activity [GO:0015132],GO:0005215; GO:0005886,transporter activity; plasma membrane
OG_05644,0.6082154539339365,FUN_025362-T1,Peve_00040527,Pocillopora_meandrina_HIv1___RNAseq.g13347.t1,three_way,93.85966666666668,FUN_025362-T1,Q5PQN7,,,,,68.9,190.0,6.3e-62,238.8,sp|Q5PQN7|LZIC_RAT Protein LZIC OS=Rattus norvegicus OX=10116 GN=Lzic PE=2 SV=1,,,,,,
OG_02828,0.6077022284769549,FUN_011843-T1,Peve_00034373,Pocillopora_meandrina_HIv1___RNAseq.g23373.t1,three_way,84.43299999999999,FUN_011843-T1,Q9SEE4,,,,,41.8,297.0,9.3e-61,235.3,sp|Q9SEE4|PIRL_SOLLC Pirin-like protein OS=Solanum lycopersicum OX=4081 PE=2 SV=1,,,,,,
OG_06663,0.6051672047275027,FUN_031054-T1,Peve_00028185,Pocillopora_meandrina_HIv1___RNAseq.g30322.t1,three_way,84.973,FUN_031054-T1,Q8CIB5,FERM2_MOUSE,,Fermitin family homolog 2 (Kindlin-2) (Pleckstrin homology domain-containing family C member 1),Mus musculus (Mouse),47.4,694.0,4.1000000000000004e-170,599.7,sp|Q8CIB5|FERM2_MOUSE Fermitin family homolog 2 OS=Mus musculus OX=10090 GN=Fermt2 PE=1 SV=1,GO:0001725; GO:0005547; GO:0005634; GO:0005654; GO:0005737; GO:0005829; GO:0005912; GO:0005925; GO:0005938; GO:0007160; GO:0007179; GO:0007229; GO:0008360; GO:0009898; GO:0009986; GO:0010718; GO:0016055; GO:0031258; GO:0031674; GO:0033622; GO:0033625; GO:0034334; GO:0034446; GO:0034713; GO:0035025; GO:0043116; GO:0043539; GO:0045599; GO:0045669; GO:0046332; GO:0048041; GO:0051015; GO:0051496; GO:0051894; GO:0051897; GO:0060173; GO:0070374; GO:0072657; GO:0120283; GO:1900026; GO:1900182; GO:1902414; GO:1902462; GO:1903691,"adherens junction maintenance [GO:0034334]; cell-matrix adhesion [GO:0007160]; focal adhesion assembly [GO:0048041]; integrin activation [GO:0033622]; integrin-mediated signaling pathway [GO:0007229]; limb development [GO:0060173]; negative regulation of fat cell differentiation [GO:0045599]; negative regulation of vascular permeability [GO:0043116]; positive regulation of epithelial to mesenchymal transition [GO:0010718]; positive regulation of ERK1 and ERK2 cascade [GO:0070374]; positive regulation of focal adhesion assembly [GO:0051894]; positive regulation of integrin activation [GO:0033625]; positive regulation of mesenchymal stem cell proliferation [GO:1902462]; positive regulation of osteoblast differentiation [GO:0045669]; positive regulation of phosphatidylinositol 3-kinase/protein kinase B signal transduction [GO:0051897]; positive regulation of protein localization to nucleus [GO:1900182]; positive regulation of Rho protein signal transduction [GO:0035025]; positive regulation of stress fiber assembly [GO:0051496]; positive regulation of substrate adhesion-dependent cell spreading [GO:1900026]; positive regulation of wound healing, spreading of epidermal cells [GO:1903691]; protein localization to cell junction [GO:1902414]; protein localization to membrane [GO:0072657]; regulation of cell shape [GO:0008360]; substrate adhesion-dependent cell spreading [GO:0034446]; transforming growth factor beta receptor signaling pathway [GO:0007179]; Wnt signaling pathway [GO:0016055]",adherens junction [GO:0005912]; cell cortex [GO:0005938]; cell surface [GO:0009986]; cytoplasm [GO:0005737]; cytoplasmic side of plasma membrane [GO:0009898]; cytosol [GO:0005829]; focal adhesion [GO:0005925]; I band [GO:0031674]; lamellipodium membrane [GO:0031258]; nucleoplasm [GO:0005654]; nucleus [GO:0005634]; stress fiber [GO:0001725],"actin filament binding [GO:0051015]; phosphatidylinositol-3,4,5-trisphosphate binding [GO:0005547]; protein serine/threonine kinase activator activity [GO:0043539]; protein serine/threonine kinase binding [GO:0120283]; SMAD binding [GO:0046332]; type I transforming growth factor beta receptor binding [GO:0034713]",GO:0003013; GO:0005634; GO:0005654; GO:0005829; GO:0007155; GO:0008092; GO:0008289; GO:0034330; GO:0043226; GO:0048856; GO:0065003; GO:0098772,circulatory system process; nucleus; nucleoplasm; cytosol; cell adhesion; cytoskeletal protein binding; lipid binding; cell junction organization; organelle; anatomical structure development; protein-containing complex assembly; molecular function regulator activity
OG_01210,0.6047859475587846,FUN_004887-T1,Peve_00005850,Pocillopora_meandrina_HIv1___RNAseq.g10661.t1,three_way,61.143166666666666,FUN_004887-T1,A0A0R4IBK5,R213A_DANRE,,E3 ubiquitin-protein ligase rnf213-alpha (EC 2.3.2.27) (EC 3.6.4.-) (E3 ubiquitin-lipopolysaccharide ligase rnf213-alpha) (EC 2.3.2.-) (Mysterin-A) (Mysterin-alpha) (RING finger protein 213-A) (RING finger protein 213-alpha),Danio rerio (Zebrafish) (Brachydanio rerio),31.4,1097.0,1.9e-124,450.7,sp|A0A0R4IBK5|R213A_DANRE E3 ubiquitin-protein ligase rnf213-alpha OS=Danio rerio OX=7955 GN=rnf213a PE=3 SV=1,GO:0002040; GO:0002376; GO:0004842; GO:0005524; GO:0005730; GO:0005811; GO:0005829; GO:0006511; GO:0008015; GO:0008270; GO:0016887; GO:0019216; GO:0042742; GO:0045765; GO:0061630; GO:0070534; GO:0098792; GO:0120323; GO:0140042; GO:2000051,blood circulation [GO:0008015]; defense response to bacterium [GO:0042742]; immune system process [GO:0002376]; lipid droplet formation [GO:0140042]; lipid ubiquitination [GO:0120323]; negative regulation of non-canonical Wnt signaling pathway [GO:2000051]; protein K63-linked ubiquitination [GO:0070534]; regulation of angiogenesis [GO:0045765]; regulation of lipid metabolic process [GO:0019216]; sprouting angiogenesis [GO:0002040]; ubiquitin-dependent protein catabolic process [GO:0006511]; xenophagy [GO:0098792],cytosol [GO:0005829]; lipid droplet [GO:0005811]; nucleolus [GO:0005730],ATP binding [GO:0005524]; ATP hydrolysis activity [GO:0016887]; ubiquitin protein ligase activity [GO:0061630]; ubiquitin-protein transferase activity [GO:0004842]; zinc ion binding [GO:0008270],GO:0002376; GO:0003013; GO:0003824; GO:0005730; GO:0005811; GO:0005829; GO:0006629; GO:0006914; GO:0016740; GO:0016787; GO:0043226; GO:0140096,"immune system process; circulatory system process; catalytic activity; nucleolus; lipid droplet; cytosol; lipid metabolic process; autophagy; transferase activity; hydrolase activity; organelle; catalytic activity, acting on a protein"
OG_01464,0.6040124462783084,FUN_006000-T1,Peve_00036040,Pocillopora_meandrina_HIv1___RNAseq.3462_t,three_way,85.708,FUN_006000-T1,Q8CIH9,PUR1_MOUSE,,Amidophosphoribosyltransferase (ATase) (EC 2.4.2.14) (Glutamine phosphoribosylpyrophosphate amidotransferase) (GPAT),Mus musculus (Mouse),60.8,533.0,4.7e-179,629.0,sp|Q8CIH9|PUR1_MOUSE Amidophosphoribosyltransferase OS=Mus musculus OX=10090 GN=Ppat PE=1 SV=1,GO:0004044; GO:0006177; GO:0006189; GO:0009113; GO:0044208; GO:0046872; GO:0051539; GO:0097294,'de novo' AMP biosynthetic process [GO:0044208]; 'de novo' IMP biosynthetic process [GO:0006189]; 'de novo' XMP biosynthetic process [GO:0097294]; GMP biosynthetic process [GO:0006177]; purine nucleobase biosynthetic process [GO:0009113],,"4 iron, 4 sulfur cluster binding [GO:0051539]; amidophosphoribosyltransferase activity [GO:0004044]; metal ion binding [GO:0046872]",GO:0003824; GO:0016740; GO:0055086; GO:1901135,catalytic activity; transferase activity; nucleobase-containing small molecule metabolic process; carbohydrate derivative metabolic process
OG_07749,0.6025459306886186,FUN_034938-T1,Peve_00036685,Pocillopora_meandrina_HIv1___RNAseq.g27832.t1,three_way,69.10716666666667,FUN_034938-T1,Q7Z614,SNX20_HUMAN,,Sorting nexin-20 (Selectin ligand-interactor cytoplasmic 1) (SLIC-1),Homo sapiens (Human),35.0,246.0,3.5000000000000005e-22,107.1,sp|Q7Z614|SNX20_HUMAN Sorting nexin-20 OS=Homo sapiens OX=9606 GN=SNX20 PE=1 SV=1,GO:0005546; GO:0005654; GO:0005886; GO:0015031; GO:0031901; GO:0032266; GO:1901981,protein transport [GO:0015031],early endosome membrane [GO:0031901]; nucleoplasm [GO:0005654]; plasma membrane [GO:0005886],"phosphatidylinositol phosphate binding [GO:1901981]; phosphatidylinositol-3-phosphate binding [GO:0032266]; phosphatidylinositol-4,5-bisphosphate binding [GO:0005546]",GO:0005654; GO:0005886; GO:0008289,nucleoplasm; plasma membrane; lipid binding
OG_01576,0.5997808069328925,FUN_006581-T1,Peve_00015613,Pocillopora_meandrina_HIv1___RNAseq.g20271.t1,three_way,58.029,FUN_006581-T1,P18460,,,,,34.3,769.0,1.3e-91,339.3,sp|P18460|FGFR3_CHICK Fibroblast growth factor receptor 3 OS=Gallus gallus OX=9031 GN=FGFR3 PE=2 SV=1,,,,,,
OG_06622,0.5988151683047683,FUN_029891-T1,Peve_00008454,Pocillopora_meandrina_HIv1___RNAseq.g17343.t1,three_way,56.2075,FUN_029891-T1,O15146,,,,,37.1,318.0,1.7e-61,239.2,"sp|O15146|MUSK_HUMAN Muscle, skeletal receptor tyrosine-protein kinase OS=Homo sapiens OX=9606 GN=MUSK PE=1 SV=1",,,,,,
OG_06046,0.5964008119760579,FUN_026714-T1,Peve_00018519,Pocillopora_meandrina_HIv1___RNAseq.g9373.t1,three_way,56.48,FUN_026714-T1,Q96EW2,,,,,42.0,138.0,4.4e-20,99.4,sp|Q96EW2|HBAP1_HUMAN HSPB1-associated protein 1 OS=Homo sapiens OX=9606 GN=HSPBAP1 PE=1 SV=1,,,,,,
OG_08293,0.5958521346336508,FUN_036231-T1,Peve_00032844,Pocillopora_meandrina_HIv1___RNAseq.g27552.t1,three_way,77.99933333333334,FUN_036231-T1,Q8WTS1,ABHD5_HUMAN,,1-acylglycerol-3-phosphate O-acyltransferase ABHD5 (EC 2.3.1.51) (Abhydrolase domain-containing protein 5) (Lipid droplet-binding protein CGI-58),Homo sapiens (Human),56.8,315.0,1.9000000000000002e-110,400.6,sp|Q8WTS1|ABHD5_HUMAN 1-acylglycerol-3-phosphate O-acyltransferase ABHD5 OS=Homo sapiens OX=9606 GN=ABHD5 PE=1 SV=1,GO:0003841; GO:0005654; GO:0005739; GO:0005811; GO:0005829; GO:0006631; GO:0006654; GO:0010891; GO:0010898; GO:0030154; GO:0042171; GO:0043231; GO:0052689; GO:0055088; GO:0060229,cell differentiation [GO:0030154]; fatty acid metabolic process [GO:0006631]; lipid homeostasis [GO:0055088]; negative regulation of triglyceride storage [GO:0010891]; phosphatidic acid biosynthetic process [GO:0006654]; positive regulation of triglyceride catabolic process [GO:0010898],cytosol [GO:0005829]; intracellular membrane-bounded organelle [GO:0043231]; lipid droplet [GO:0005811]; mitochondrion [GO:0005739]; nucleoplasm [GO:0005654],1-acylglycerol-3-phosphate O-acyltransferase activity [GO:0003841]; carboxylic ester hydrolase activity [GO:0052689]; lipase activator activity [GO:0060229]; lysophosphatidic acid acyltransferase activity [GO:0042171],GO:0003824; GO:0005654; GO:0005739; GO:0005811; GO:0005829; GO:0006629; GO:0016740; GO:0016787; GO:0030154; GO:0043226; GO:0098772,catalytic activity; nucleoplasm; mitochondrion; lipid droplet; cytosol; lipid metabolic process; transferase activity; hydrolase activity; cell differentiation; organelle; molecular function regulator activity
OG_08800,0.5931702521438944,FUN_038103-T1,Peve_00025353,Pocillopora_meandrina_HIv1___RNAseq.g837.t1,three_way,71.89616666666667,FUN_038103-T1,Q4R7U0,,,,,32.1,701.0,1.2e-85,319.3,sp|Q4R7U0|TMC7_MACFA Transmembrane channel-like protein 7 OS=Macaca fascicularis OX=9541 GN=TMC7 PE=2 SV=1,,,,,,
OG_04199,0.5913714731735833,FUN_016732-T1,Peve_00014684,Pocillopora_meandrina_HIv1___RNAseq.g234.t1,three_way,56.1385,,,,,,,,,,,,,,,,,
OG_07838,0.5873562613380435,FUN_035169-T1,Peve_00036181,Pocillopora_meandrina_HIv1___RNAseq.g27918.t1,three_way,87.309,FUN_035169-T1,Q9JK84,,,,,54.5,299.0,5.5000000000000004e-80,299.3,sp|Q9JK84|PAR6G_MOUSE Partitioning defective 6 homolog gamma OS=Mus musculus OX=10090 GN=Pard6g PE=2 SV=1,,,,,,
OG_07112,0.5851665691119591,FUN_032385-T1,Peve_00007850,Pocillopora_meandrina_HIv1___RNAseq.g29733.t1,three_way,82.91166666666666,FUN_032385-T1,P52649,,,,,54.6,467.0,1.3e-138,494.6,sp|P52649|CY24B_PIG NADPH oxidase 2 OS=Sus scrofa OX=9823 GN=CYBB PE=2 SV=3,,,,,,
OG_04932,0.584338325978338,FUN_023000-T1,Peve_00024659,Pocillopora_meandrina_HIv1___RNAseq.g3813.t1,three_way,53.00183333333333,FUN_023000-T1,Q90Z00,FGR1A_DANRE,,Fibroblast growth factor receptor 1-A (FGFR-1-A) (bFGF-R-1-A) (EC 2.7.10.1) (Basic fibroblast growth factor receptor 1-A),Danio rerio (Zebrafish) (Brachydanio rerio),37.9,804.0,7.2e-136,486.5,sp|Q90Z00|FGR1A_DANRE Fibroblast growth factor receptor 1-A OS=Danio rerio OX=7955 GN=fgfr1a PE=1 SV=2,GO:0001889; GO:0005007; GO:0005524; GO:0005634; GO:0005829; GO:0005886; GO:0007498; GO:0008201; GO:0008284; GO:0008543; GO:0009953; GO:0017134; GO:0021535; GO:0021628; GO:0031101; GO:0031410; GO:0033339; GO:0036342; GO:0042664; GO:0043235; GO:0043410; GO:0043589; GO:0045471; GO:0045597; GO:0048738; GO:0048916; GO:0051216; GO:0060249; GO:0071699,anatomical structure homeostasis [GO:0060249]; cardiac muscle tissue development [GO:0048738]; cartilage development [GO:0051216]; cell migration in hindbrain [GO:0021535]; dorsal/ventral pattern formation [GO:0009953]; fibroblast growth factor receptor signaling pathway [GO:0008543]; fin regeneration [GO:0031101]; liver development [GO:0001889]; mesoderm development [GO:0007498]; negative regulation of endodermal cell fate specification [GO:0042664]; olfactory nerve formation [GO:0021628]; olfactory placode morphogenesis [GO:0071699]; pectoral fin development [GO:0033339]; positive regulation of cell differentiation [GO:0045597]; positive regulation of cell population proliferation [GO:0008284]; positive regulation of MAPK cascade [GO:0043410]; post-anal tail morphogenesis [GO:0036342]; posterior lateral line development [GO:0048916]; response to ethanol [GO:0045471]; skin morphogenesis [GO:0043589],cytoplasmic vesicle [GO:0031410]; cytosol [GO:0005829]; nucleus [GO:0005634]; plasma membrane [GO:0005886]; receptor complex [GO:0043235],ATP binding [GO:0005524]; fibroblast growth factor binding [GO:0017134]; fibroblast growth factor receptor activity [GO:0005007]; heparin binding [GO:0008201],GO:0003824; GO:0005634; GO:0005829; GO:0005886; GO:0016740; GO:0031410; GO:0043226; GO:0048856; GO:0048870; GO:0060089; GO:0140096,"catalytic activity; nucleus; cytosol; plasma membrane; transferase activity; cytoplasmic vesicle; organelle; anatomical structure development; cell motility; molecular transducer activity; catalytic activity, acting on a protein"
OG_03674,0.5823051533697692,FUN_014925-T1,Peve_00006270,Pocillopora_meandrina_HIv1___RNAseq.g21082.t1,three_way,77.86116666666666,FUN_014925-T1,Q9I9E0,,,,,43.7,581.0,9.9e-52,206.5,sp|Q9I9E0|TAOK3_CHICK Serine/threonine-protein kinase TAO3 OS=Gallus gallus OX=9031 GN=TAOK3 PE=2 SV=2,,,,,,
OG_05294,0.5822621569884844,FUN_023962-T1,Peve_00043985,Pocillopora_meandrina_HIv1___RNAseq.g18585.t1,three_way,84.302,,,,,,,,,,,,,,,,,
OG_09007,0.5820299836275852,FUN_038557-T1,Peve_00020191,Pocillopora_meandrina_HIv1___RNAseq.g1024.t1,three_way,38.4565,,,,,,,,,,,,,,,,,
OG_05457,0.5814805139604187,FUN_024418-T1,Peve_00029260,Pocillopora_meandrina_HIv1___RNAseq.g18720.t1,three_way,74.32566666666666,FUN_024418-T1,Q98SN7,,,,,55.1,345.0,5e-110,399.4,sp|Q98SN7|WNT2B_CHICK Protein Wnt-2b OS=Gallus gallus OX=9031 GN=WNT2B PE=1 SV=1,,,,,,
OG_05026,0.579351782852192,FUN_023189-T1,Peve_00009992,Pocillopora_meandrina_HIv1___TS.g25367.t1,three_way,58.125,FUN_023189-T1,O43490,,,,,27.2,751.0,1.8e-53,212.6,sp|O43490|PROM1_HUMAN Prominin-1 OS=Homo sapiens OX=9606 GN=PROM1 PE=1 SV=1,,,,,,
OG_04627,0.5787593323428999,FUN_022340-T1,Peve_00028608,Pocillopora_meandrina_HIv1___RNAseq.g4654.t1,three_way,62.08733333333333,FUN_022340-T1,Q63258,ITA7_RAT,,Integrin alpha-7 (H36-alpha7) [Cleaved into: Integrin alpha-7 heavy chain; Integrin alpha-7 light chain; Integrin alpha-7 70 kDa form],Rattus norvegicus (Rat),27.7,1149.0,3.1e-87,325.1,sp|Q63258|ITA7_RAT Integrin alpha-7 OS=Rattus norvegicus OX=10116 GN=Itga7 PE=1 SV=2,GO:0005178; GO:0005737; GO:0005927; GO:0007155; GO:0007229; GO:0007519; GO:0008305; GO:0008360; GO:0009897; GO:0009986; GO:0016477; GO:0031594; GO:0033627; GO:0034113; GO:0034677; GO:0035987; GO:0042383; GO:0043236; GO:0044877; GO:0046872; GO:0048514; GO:0050839; GO:0050900; GO:0098609,blood vessel morphogenesis [GO:0048514]; cell adhesion [GO:0007155]; cell adhesion mediated by integrin [GO:0033627]; cell migration [GO:0016477]; cell-cell adhesion [GO:0098609]; endodermal cell differentiation [GO:0035987]; heterotypic cell-cell adhesion [GO:0034113]; integrin-mediated signaling pathway [GO:0007229]; leukocyte migration [GO:0050900]; regulation of cell shape [GO:0008360]; skeletal muscle tissue development [GO:0007519],cell surface [GO:0009986]; cytoplasm [GO:0005737]; external side of plasma membrane [GO:0009897]; integrin alpha7-beta1 complex [GO:0034677]; integrin complex [GO:0008305]; muscle tendon junction [GO:0005927]; neuromuscular junction [GO:0031594]; sarcolemma [GO:0042383],cell adhesion molecule binding [GO:0050839]; integrin binding [GO:0005178]; laminin binding [GO:0043236]; metal ion binding [GO:0046872]; protein-containing complex binding [GO:0044877],GO:0002376; GO:0005886; GO:0007155; GO:0030154; GO:0048856; GO:0048870,immune system process; plasma membrane; cell adhesion; cell differentiation; anatomical structure development; cell motility
