group_id,Component_4,apul,peve,ptua,type,avg_identity,query,accession,id,reviewed,protein_name,organism,pident,length,evalue,bitscore,title,go_ids,go_bp,go_cc,go_mf,goslim_ids,goslim_names
OG_02101,0.8832614023339969,FUN_008377-T1,Peve_00024686,Pocillopora_meandrina_HIv1___RNAseq.g18396.t1,three_way,53.3375,,,,,,,,,,,,,,,,,
OG_05375,0.7069320907894069,FUN_024188-T1,Peve_00013618,Pocillopora_meandrina_HIv1___RNAseq.g18884.t1,three_way,43.766,,,,,,,,,,,,,,,,,
OG_05718,0.6974059664043459,FUN_025610-T1,Peve_00009537,Pocillopora_meandrina_HIv1___RNAseq.g23128.t1,three_way,58.688833333333335,FUN_025610-T1,Q07497,,,,,34.9,935.0,3.6999999999999996e-147,523.9,sp|Q07497|EPHB5_CHICK Ephrin type-B receptor 5 OS=Gallus gallus OX=9031 GN=EPHB5 PE=2 SV=1,,,,,,
OG_00483,0.6929507202801811,FUN_001447-T1,Peve_00019961,Pocillopora_meandrina_HIv1___RNAseq.g1952.t1,three_way,57.163,FUN_001447-T1,Q61824,,,,,37.3,714.0,8.5e-130,466.5,sp|Q61824|ADA12_MOUSE Disintegrin and metalloproteinase domain-containing protein 12 OS=Mus musculus OX=10090 GN=Adam12 PE=1 SV=2,,,,,,
OG_08842,0.691904138220094,FUN_038187-T1,Peve_00006347,Pocillopora_meandrina_HIv1___RNAseq.g945.t1,three_way,61.87833333333334,FUN_038187-T1,Q80ZA4,PKHL1_MOUSE,,Fibrocystin-L (Polycystic kidney and hepatic disease 1-like protein 1) (PKHD1-like protein 1) (Protein D86),Mus musculus (Mouse),34.3,4297.0,0.0,2329.7,sp|Q80ZA4|PKHL1_MOUSE Fibrocystin-L OS=Mus musculus OX=10090 GN=Pkhd1l1 PE=1 SV=1,GO:0007605; GO:0032426; GO:0060171; GO:0120234,sensory perception of sound [GO:0007605],stereocilium coat [GO:0120234]; stereocilium membrane [GO:0060171]; stereocilium tip [GO:0032426],,GO:0030312; GO:0050877,external encapsulating structure; nervous system process
OG_09235,0.6917694669702408,FUN_039980-T1,Peve_00014321,Pocillopora_meandrina_HIv1___RNAseq.g7547.t1,three_way,79.15883333333333,FUN_039980-T1,Q55G75,,,,,35.5,265.0,6.200000000000001e-44,179.5,sp|Q55G75|Y7786_DICDI PH domain-containing protein DDB_G0267786 OS=Dictyostelium discoideum OX=44689 GN=DDB_G0267786 PE=4 SV=1,,,,,,
OG_02929,0.6616612089299658,FUN_012028-T1,Peve_00030379,Pocillopora_meandrina_HIv1___RNAseq.g24047.t2,three_way,77.09433333333334,FUN_012028-T1,Q14192,FHL2_HUMAN,,Four and a half LIM domains protein 2 (FHL-2) (LIM domain protein DRAL) (Skeletal muscle LIM-protein 3) (SLIM-3),Homo sapiens (Human),42.1,273.0,1.7000000000000002e-74,282.0,sp|Q14192|FHL2_HUMAN Four and a half LIM domains protein 2 OS=Homo sapiens OX=9606 GN=FHL2 PE=1 SV=3,GO:0000122; GO:0001649; GO:0003714; GO:0005634; GO:0005654; GO:0005925; GO:0008134; GO:0008270; GO:0009725; GO:0030018; GO:0042802; GO:0043066; GO:0043425; GO:0055014; GO:0055015; GO:0060347; GO:0070885,atrial cardiac muscle cell development [GO:0055014]; heart trabecula formation [GO:0060347]; negative regulation of apoptotic process [GO:0043066]; negative regulation of calcineurin-NFAT signaling cascade [GO:0070885]; negative regulation of transcription by RNA polymerase II [GO:0000122]; osteoblast differentiation [GO:0001649]; response to hormone [GO:0009725]; ventricular cardiac muscle cell development [GO:0055015],focal adhesion [GO:0005925]; nucleoplasm [GO:0005654]; nucleus [GO:0005634]; Z disc [GO:0030018],bHLH transcription factor binding [GO:0043425]; identical protein binding [GO:0042802]; transcription corepressor activity [GO:0003714]; transcription factor binding [GO:0008134]; zinc ion binding [GO:0008270],GO:0005634; GO:0005654; GO:0006355; GO:0030154; GO:0043226; GO:0048856; GO:0060090; GO:0140110,nucleus; nucleoplasm; regulation of DNA-templated transcription; cell differentiation; organelle; anatomical structure development; molecular adaptor activity; transcription regulator activity
OG_00880,0.6581849735271605,FUN_004174-T1,Peve_00019597,Pocillopora_meandrina_HIv1___TS.g17559.t2,three_way,57.525333333333336,FUN_004174-T1,P23468,PTPRD_HUMAN,,Receptor-type tyrosine-protein phosphatase delta (Protein-tyrosine phosphatase delta) (R-PTP-delta) (EC 3.1.3.48),Homo sapiens (Human),35.1,1661.0,5.0999999999999996e-250,867.1,sp|P23468|PTPRD_HUMAN Receptor-type tyrosine-protein phosphatase delta OS=Homo sapiens OX=9606 GN=PTPRD PE=1 SV=2,GO:0004725; GO:0005001; GO:0005102; GO:0005886; GO:0006796; GO:0007157; GO:0007165; GO:0007185; GO:0030182; GO:0042734; GO:0046426; GO:0050776; GO:0050804; GO:0050839; GO:0051965; GO:0061003; GO:0070062; GO:0097105; GO:0098685; GO:0098686; GO:0098978; GO:0099054; GO:0099151; GO:0099545; GO:0099560,cell surface receptor protein tyrosine phosphatase signaling pathway [GO:0007185]; heterophilic cell-cell adhesion via plasma membrane cell adhesion molecules [GO:0007157]; modulation of chemical synaptic transmission [GO:0050804]; negative regulation of receptor signaling pathway via JAK-STAT [GO:0046426]; neuron differentiation [GO:0030182]; phosphate-containing compound metabolic process [GO:0006796]; positive regulation of dendritic spine morphogenesis [GO:0061003]; positive regulation of synapse assembly [GO:0051965]; presynapse assembly [GO:0099054]; presynaptic membrane assembly [GO:0097105]; regulation of immune response [GO:0050776]; regulation of postsynaptic density assembly [GO:0099151]; signal transduction [GO:0007165]; synaptic membrane adhesion [GO:0099560]; trans-synaptic signaling by trans-synaptic complex [GO:0099545],extracellular exosome [GO:0070062]; glutamatergic synapse [GO:0098978]; hippocampal mossy fiber to CA3 synapse [GO:0098686]; plasma membrane [GO:0005886]; presynaptic membrane [GO:0042734]; Schaffer collateral - CA1 synapse [GO:0098685],cell adhesion molecule binding [GO:0050839]; protein tyrosine phosphatase activity [GO:0004725]; signaling receptor binding [GO:0005102]; transmembrane receptor protein tyrosine phosphatase activity [GO:0005001],GO:0003824; GO:0005886; GO:0007155; GO:0016787; GO:0023052; GO:0030154; GO:0043226; GO:0060089; GO:0061024; GO:0140096,"catalytic activity; plasma membrane; cell adhesion; hydrolase activity; signaling; cell differentiation; organelle; molecular transducer activity; membrane organization; catalytic activity, acting on a protein"
OG_04747,0.6569142793706687,FUN_022630-T1,Peve_00012283,Pocillopora_meandrina_HIv1___RNAseq.g2910.t1,three_way,68.43933333333334,FUN_022630-T1,P07228,,,,,38.2,815.0,1.2e-144,515.4,sp|P07228|ITB1_CHICK Integrin beta-1 OS=Gallus gallus OX=9031 GN=ITGB1 PE=1 SV=1,,,,,,
OG_05341,0.6326543340769035,FUN_024067-T1,Peve_00000150,Pocillopora_meandrina_HIv1___RNAseq.g19254.t1,three_way,69.05799999999999,FUN_024067-T1,Q54RA4,,,,,34.9,352.0,9.9e-50,198.7,sp|Q54RA4|Y3291_DICDI Probable iron/ascorbate oxidoreductase DDB_G0283291 OS=Dictyostelium discoideum OX=44689 GN=DDB_G0283291 PE=3 SV=1,,,,,,
OG_06109,0.6244614488209271,FUN_027814-T1,Peve_00036499,Pocillopora_meandrina_HIv1___RNAseq.g13890.t1,three_way,84.264,FUN_027814-T1,O00571,DDX3X_HUMAN,,"ATP-dependent RNA helicase DDX3X (EC 3.6.4.13) (CAP-Rf) (DEAD box protein 3, X-chromosomal) (DEAD box, X isoform) (DBX) (Helicase-like protein 2) (HLP2)",Homo sapiens (Human),71.5,425.0,1.6999999999999996e-177,623.6,sp|O00571|DDX3X_HUMAN ATP-dependent RNA helicase DDX3X OS=Homo sapiens OX=9606 GN=DDX3X PE=1 SV=3,GO:0002753; GO:0003677; GO:0003678; GO:0003723; GO:0003724; GO:0003729; GO:0003924; GO:0005524; GO:0005576; GO:0005634; GO:0005737; GO:0005739; GO:0005813; GO:0005829; GO:0005886; GO:0006413; GO:0007059; GO:0007276; GO:0008134; GO:0008143; GO:0008190; GO:0008625; GO:0009615; GO:0010494; GO:0010628; GO:0010629; GO:0016055; GO:0016887; GO:0017111; GO:0017148; GO:0030027; GO:0030154; GO:0030307; GO:0030308; GO:0031252; GO:0031333; GO:0031369; GO:0032481; GO:0032727; GO:0032728; GO:0033592; GO:0034063; GO:0034157; GO:0034161; GO:0034774; GO:0035556; GO:0035591; GO:0035613; GO:0036493; GO:0042256; GO:0043015; GO:0043024; GO:0043065; GO:0043066; GO:0043186; GO:0043273; GO:0043539; GO:0045070; GO:0045087; GO:0045296; GO:0045727; GO:0045944; GO:0045948; GO:0048027; GO:0055088; GO:0070062; GO:0070131; GO:0071243; GO:0071470; GO:0071651; GO:0072559; GO:0090263; GO:0097193; GO:0098586; GO:1900087; GO:1900227; GO:1901223; GO:1901224; GO:1902042; GO:1902523; GO:1903608; GO:1904813; GO:2001243,cell differentiation [GO:0030154]; cellular response to arsenic-containing substance [GO:0071243]; cellular response to osmotic stress [GO:0071470]; cellular response to virus [GO:0098586]; chromosome segregation [GO:0007059]; cytoplasmic pattern recognition receptor signaling pathway [GO:0002753]; cytosolic ribosome assembly [GO:0042256]; extrinsic apoptotic signaling pathway via death domain receptors [GO:0008625]; gamete generation [GO:0007276]; innate immune response [GO:0045087]; intracellular signal transduction [GO:0035556]; intrinsic apoptotic signaling pathway [GO:0097193]; lipid homeostasis [GO:0055088]; negative regulation of apoptotic process [GO:0043066]; negative regulation of cell growth [GO:0030308]; negative regulation of extrinsic apoptotic signaling pathway via death domain receptors [GO:1902042]; negative regulation of gene expression [GO:0010629]; negative regulation of intrinsic apoptotic signaling pathway [GO:2001243]; negative regulation of non-canonical NF-kappaB signal transduction [GO:1901223]; negative regulation of protein-containing complex assembly [GO:0031333]; negative regulation of translation [GO:0017148]; positive regulation of apoptotic process [GO:0043065]; positive regulation of canonical Wnt signaling pathway [GO:0090263]; positive regulation of cell growth [GO:0030307]; positive regulation of chemokine (C-C motif) ligand 5 production [GO:0071651]; positive regulation of G1/S transition of mitotic cell cycle [GO:1900087]; positive regulation of gene expression [GO:0010628]; positive regulation of interferon-alpha production [GO:0032727]; positive regulation of interferon-beta production [GO:0032728]; positive regulation of mitochondrial translation [GO:0070131]; positive regulation of NLRP3 inflammasome complex assembly [GO:1900227]; positive regulation of non-canonical NF-kappaB signal transduction [GO:1901224]; positive regulation of protein K63-linked ubiquitination [GO:1902523]; positive regulation of toll-like receptor 7 signaling pathway [GO:0034157]; positive regulation of toll-like receptor 8 signaling pathway [GO:0034161]; positive regulation of transcription by RNA polymerase II [GO:0045944]; positive regulation of translation [GO:0045727]; positive regulation of translation in response to endoplasmic reticulum stress [GO:0036493]; positive regulation of translational initiation [GO:0045948]; positive regulation of type I interferon production [GO:0032481]; positive regulation of viral genome replication [GO:0045070]; protein localization to cytoplasmic stress granule [GO:1903608]; response to virus [GO:0009615]; stress granule assembly [GO:0034063]; translational initiation [GO:0006413]; Wnt signaling pathway [GO:0016055],cell leading edge [GO:0031252]; centrosome [GO:0005813]; cytoplasm [GO:0005737]; cytoplasmic stress granule [GO:0010494]; cytosol [GO:0005829]; extracellular exosome [GO:0070062]; extracellular region [GO:0005576]; ficolin-1-rich granule lumen [GO:1904813]; lamellipodium [GO:0030027]; mitochondrion [GO:0005739]; NLRP3 inflammasome complex [GO:0072559]; nucleus [GO:0005634]; P granule [GO:0043186]; plasma membrane [GO:0005886]; secretory granule lumen [GO:0034774],ATP binding [GO:0005524]; ATP hydrolysis activity [GO:0016887]; cadherin binding [GO:0045296]; CTPase activity [GO:0043273]; DNA binding [GO:0003677]; DNA helicase activity [GO:0003678]; eukaryotic initiation factor 4E binding [GO:0008190]; gamma-tubulin binding [GO:0043015]; GTPase activity [GO:0003924]; mRNA 5'-UTR binding [GO:0048027]; mRNA binding [GO:0003729]; poly(A) binding [GO:0008143]; protein serine/threonine kinase activator activity [GO:0043539]; ribonucleoside triphosphate phosphatase activity [GO:0017111]; ribosomal small subunit binding [GO:0043024]; RNA binding [GO:0003723]; RNA helicase activity [GO:0003724]; RNA stem-loop binding [GO:0035613]; RNA strand annealing activity [GO:0033592]; signaling adaptor activity [GO:0035591]; transcription factor binding [GO:0008134]; translation initiation factor binding [GO:0031369],GO:0002376; GO:0003677; GO:0003723; GO:0003824; GO:0003924; GO:0005576; GO:0005634; GO:0005739; GO:0005815; GO:0005829; GO:0005886; GO:0006355; GO:0007059; GO:0008092; GO:0016787; GO:0016853; GO:0022414; GO:0030154; GO:0043226; GO:0060090; GO:0098542; GO:0098772; GO:0140097; GO:0140098; GO:0140657,"immune system process; DNA binding; RNA binding; catalytic activity; GTPase activity; extracellular region; nucleus; mitochondrion; microtubule organizing center; cytosol; plasma membrane; regulation of DNA-templated transcription; chromosome segregation; cytoskeletal protein binding; hydrolase activity; isomerase activity; reproductive process; cell differentiation; organelle; molecular adaptor activity; defense response to other organism; molecular function regulator activity; catalytic activity, acting on DNA; catalytic activity, acting on RNA; ATP-dependent activity"
OG_06480,0.6223403969703941,FUN_029250-T1,Peve_00024382,Pocillopora_meandrina_HIv1___TS.g9401.t1,three_way,59.02816666666666,FUN_029250-T1,Q8IZF6,AGRG4_HUMAN,,"Adhesion G-protein coupled receptor G4 (G-protein coupled receptor 112) [Cleaved into: Adhesion G-protein coupled receptor G4, N-terminal fragment (ADGRG4 N-terminal fragment); Adhesion G-protein coupled receptor G4, C-terminal fragment (ADGRG4 C-terminal fragment)]",Homo sapiens (Human),26.0,665.0,5.099999999999999e-55,218.4,sp|Q8IZF6|AGRG4_HUMAN Adhesion G-protein coupled receptor G4 OS=Homo sapiens OX=9606 GN=ADGRG4 PE=1 SV=2,GO:0004930; GO:0005886; GO:0007166; GO:0007186; GO:0007189; GO:0016020,adenylate cyclase-activating G protein-coupled receptor signaling pathway [GO:0007189]; cell surface receptor signaling pathway [GO:0007166]; G protein-coupled receptor signaling pathway [GO:0007186],membrane [GO:0016020]; plasma membrane [GO:0005886],G protein-coupled receptor activity [GO:0004930],GO:0005886; GO:0060089,plasma membrane; molecular transducer activity
OG_02338,0.6211176286346998,FUN_008934-T1,Peve_00036402,Pocillopora_meandrina_HIv1___RNAseq.g14257.t1,three_way,76.08966666666667,FUN_008934-T1,A5D7I4,EXT1_BOVIN,,Exostosin-1 (EC 2.4.1.225) (N-acetylglucosaminyl-proteoglycan 4-beta-glucuronosyltransferase),Bos taurus (Bovine),50.3,749.0,7.999999999999999e-217,755.0,sp|A5D7I4|EXT1_BOVIN Exostosin-1 OS=Bos taurus OX=9913 GN=EXT1 PE=2 SV=1,GO:0000139; GO:0000271; GO:0001958; GO:0001974; GO:0002067; GO:0002524; GO:0003128; GO:0003415; GO:0003416; GO:0005783; GO:0005789; GO:0005794; GO:0006024; GO:0006486; GO:0007033; GO:0007369; GO:0007411; GO:0007492; GO:0007498; GO:0008217; GO:0008375; GO:0008543; GO:0009642; GO:0010467; GO:0010803; GO:0014033; GO:0015012; GO:0015020; GO:0017145; GO:0019882; GO:0021554; GO:0021772; GO:0030163; GO:0030199; GO:0030210; GO:0030509; GO:0031069; GO:0032836; GO:0033627; GO:0035176; GO:0035249; GO:0035264; GO:0035988; GO:0036022; GO:0036336; GO:0036339; GO:0042044; GO:0042060; GO:0042311; GO:0042596; GO:0042803; GO:0043931; GO:0045165; GO:0045202; GO:0045453; GO:0046872; GO:0046982; GO:0048733; GO:0050508; GO:0050509; GO:0050891; GO:0050901; GO:0051923; GO:0055078; GO:0060047; GO:0060070; GO:0060218; GO:0060351; GO:0060441; GO:0060506; GO:0060560; GO:0060792; GO:0061484; GO:0061744; GO:0061974; GO:0062094; GO:0065003; GO:0070593; GO:0071503; GO:0071625; GO:0071711; GO:0072112; GO:0072498; GO:0097021; GO:0097241; GO:0098586; GO:0120193; GO:1901706; GO:1902494; GO:1904888; GO:1990823,"antigen processing and presentation [GO:0019882]; axon guidance [GO:0007411]; basement membrane organization [GO:0071711]; blood vessel remodeling [GO:0001974]; BMP signaling pathway [GO:0030509]; bone resorption [GO:0045453]; canonical Wnt signaling pathway [GO:0060070]; cartilage development involved in endochondral bone morphogenesis [GO:0060351]; cell adhesion mediated by integrin [GO:0033627]; cell fate commitment [GO:0045165]; cellular response to virus [GO:0098586]; chondrocyte hypertrophy [GO:0003415]; chondrocyte proliferation [GO:0035988]; collagen fibril organization [GO:0030199]; cranial skeletal system development [GO:1904888]; dendrite self-avoidance [GO:0070593]; dendritic cell migration [GO:0036336]; developmental growth involved in morphogenesis [GO:0060560]; embryonic skeletal joint development [GO:0072498]; endochondral bone growth [GO:0003416]; endochondral ossification [GO:0001958]; endoderm development [GO:0007492]; epithelial tube branching involved in lung morphogenesis [GO:0060441]; fear response [GO:0042596]; fibroblast growth factor receptor signaling pathway [GO:0008543]; fluid transport [GO:0042044]; gastrulation [GO:0007369]; gene expression [GO:0010467]; glandular epithelial cell differentiation [GO:0002067]; glomerular basement membrane development [GO:0032836]; glycosaminoglycan biosynthetic process [GO:0006024]; hair follicle morphogenesis [GO:0031069]; heart contraction [GO:0060047]; heart field specification [GO:0003128]; hematopoietic stem cell differentiation [GO:0060218]; hematopoietic stem cell homeostasis [GO:0061484]; hematopoietic stem cell migration to bone marrow [GO:0097241]; heparan sulfate proteoglycan biosynthetic process [GO:0015012]; heparin proteoglycan biosynthetic process [GO:0030210]; hypersensitivity [GO:0002524]; leukocyte tethering or rolling [GO:0050901]; limb joint morphogenesis [GO:0036022]; lymphocyte adhesion to endothelial cell of high endothelial venule [GO:0036339]; lymphocyte migration into lymphoid organs [GO:0097021]; mesenchymal cell differentiation involved in bone development [GO:1901706]; mesoderm development [GO:0007498]; motor behavior [GO:0061744]; multicellular organism growth [GO:0035264]; multicellular organismal-level water homeostasis [GO:0050891]; neural crest cell differentiation [GO:0014033]; olfactory bulb development [GO:0021772]; optic nerve development [GO:0021554]; ossification involved in bone maturation [GO:0043931]; perichondral bone morphogenesis [GO:0061974]; podocyte differentiation [GO:0072112]; polysaccharide biosynthetic process [GO:0000271]; protein catabolic process [GO:0030163]; protein glycosylation [GO:0006486]; protein-containing complex assembly [GO:0065003]; regulation of blood pressure [GO:0008217]; regulation of tumor necrosis factor-mediated signaling pathway [GO:0010803]; response to heparin [GO:0071503]; response to leukemia inhibitory factor [GO:1990823]; response to light intensity [GO:0009642]; sebaceous gland development [GO:0048733]; smoothened signaling pathway involved in lung development [GO:0060506]; social behavior [GO:0035176]; sodium ion homeostasis [GO:0055078]; stem cell division [GO:0017145]; stomach development [GO:0062094]; sulfation [GO:0051923]; sweat gland development [GO:0060792]; synaptic transmission, glutamatergic [GO:0035249]; tight junction organization [GO:0120193]; vacuole organization [GO:0007033]; vasodilation [GO:0042311]; vocalization behavior [GO:0071625]; wound healing [GO:0042060]",catalytic complex [GO:1902494]; endoplasmic reticulum [GO:0005783]; endoplasmic reticulum membrane [GO:0005789]; Golgi apparatus [GO:0005794]; Golgi membrane [GO:0000139]; synapse [GO:0045202],acetylglucosaminyltransferase activity [GO:0008375]; glucuronosyl-N-acetylglucosaminyl-proteoglycan 4-alpha-N-acetylglucosaminyltransferase activity [GO:0050508]; glucuronosyltransferase activity [GO:0015020]; metal ion binding [GO:0046872]; N-acetylglucosaminyl-proteoglycan 4-beta-glucuronosyltransferase activity [GO:0050509]; protein heterodimerization activity [GO:0046982]; protein homodimerization activity [GO:0042803],GO:0002376; GO:0003013; GO:0003824; GO:0005783; GO:0005794; GO:0005975; GO:0006486; GO:0006790; GO:0006954; GO:0007155; GO:0009101; GO:0016740; GO:0023052; GO:0030154; GO:0030163; GO:0030198; GO:0034330; GO:0042060; GO:0043226; GO:0048856; GO:0048870; GO:0065003; GO:1901135,immune system process; circulatory system process; catalytic activity; endoplasmic reticulum; Golgi apparatus; carbohydrate metabolic process; protein glycosylation; sulfur compound metabolic process; inflammatory response; cell adhesion; glycoprotein biosynthetic process; transferase activity; signaling; cell differentiation; protein catabolic process; extracellular matrix organization; cell junction organization; wound healing; organelle; anatomical structure development; cell motility; protein-containing complex assembly; carbohydrate derivative metabolic process
OG_07044,0.6190300603993132,FUN_032246-T1,Peve_00036312,Pocillopora_meandrina_HIv1___RNAseq.g24842.t1,three_way,59.7065,,,,,,,,,,,,,,,,,
OG_07947,0.6183427049455924,FUN_035468-T1,Peve_00012132,Pocillopora_meandrina_HIv1___TS.g14397.t1,three_way,83.6845,FUN_035468-T1,Q8BH04,PCKGM_MOUSE,,"Phosphoenolpyruvate carboxykinase [GTP], mitochondrial (PEPCK-M) (EC 4.1.1.32)",Mus musculus (Mouse),65.5,611.0,6.100000000000001e-248,858.2,"sp|Q8BH04|PCKGM_MOUSE Phosphoenolpyruvate carboxykinase [GTP], mitochondrial OS=Mus musculus OX=10090 GN=Pck2 PE=1 SV=1",GO:0004613; GO:0005525; GO:0005739; GO:0005759; GO:0006090; GO:0006094; GO:0006107; GO:0030145; GO:0032024; GO:0032496; GO:0071333; GO:0071356; GO:0071548,cellular response to glucose stimulus [GO:0071333]; cellular response to tumor necrosis factor [GO:0071356]; gluconeogenesis [GO:0006094]; oxaloacetate metabolic process [GO:0006107]; positive regulation of insulin secretion [GO:0032024]; pyruvate metabolic process [GO:0006090]; response to dexamethasone [GO:0071548]; response to lipopolysaccharide [GO:0032496],mitochondrial matrix [GO:0005759]; mitochondrion [GO:0005739],GTP binding [GO:0005525]; manganese ion binding [GO:0030145]; phosphoenolpyruvate carboxykinase (GTP) activity [GO:0004613],GO:0003824; GO:0005739; GO:0005975; GO:0016829; GO:0043226,catalytic activity; mitochondrion; carbohydrate metabolic process; lyase activity; organelle
OG_02190,0.6165684931913941,FUN_008544-T1,Peve_00013775,Pocillopora_meandrina_HIv1___RNAseq.g6331.t2,three_way,81.17266666666667,FUN_008544-T1,Q99MD6,TRXR3_MOUSE,,Thioredoxin reductase 3 (EC 1.8.1.9) (Thioredoxin and glutathione reductase) (Thioredoxin reductase TR2),Mus musculus (Mouse),60.5,588.0,1.7000000000000002e-209,730.3,sp|Q99MD6|TRXR3_MOUSE Thioredoxin reductase 3 OS=Mus musculus OX=10090 GN=Txnrd3 PE=1 SV=3,GO:0001825; GO:0004791; GO:0005634; GO:0005783; GO:0006749; GO:0007283; GO:0030154; GO:0045454; GO:0050660,blastocyst formation [GO:0001825]; cell differentiation [GO:0030154]; cell redox homeostasis [GO:0045454]; glutathione metabolic process [GO:0006749]; spermatogenesis [GO:0007283],endoplasmic reticulum [GO:0005783]; nucleus [GO:0005634],flavin adenine dinucleotide binding [GO:0050660]; thioredoxin-disulfide reductase (NADPH) activity [GO:0004791],GO:0003824; GO:0005634; GO:0005783; GO:0006575; GO:0006790; GO:0016209; GO:0016491; GO:0022414; GO:0030154; GO:0043226; GO:0140096,"catalytic activity; nucleus; endoplasmic reticulum; modified amino acid metabolic process; sulfur compound metabolic process; antioxidant activity; oxidoreductase activity; reproductive process; cell differentiation; organelle; catalytic activity, acting on a protein"
OG_07344,0.6148671134163962,FUN_033751-T1,Peve_00004933,Pocillopora_meandrina_HIv1___TS.g8542.t1,three_way,79.90966666666667,FUN_033751-T1,O95461,,,,,60.2,689.0,6.4e-254,878.2,sp|O95461|LARG1_HUMAN Xylosyl- and glucuronyltransferase LARGE1 OS=Homo sapiens OX=9606 GN=LARGE1 PE=1 SV=1,,,,,,
