group_id,Component_4,apul,peve,ptua,type,avg_identity,query,accession,id,reviewed,protein_name,organism,pident,length,evalue,bitscore,title,go_ids,go_bp,go_cc,go_mf,goslim_ids,goslim_names
OG_03031,0.5562112252423551,FUN_012265-T1,Peve_00036383,Pocillopora_meandrina_HIv1___RNAseq.9171_t,three_way,76.63199999999999,FUN_012265-T1,Q86SQ9,DHDDS_HUMAN,,Dehydrodolichyl diphosphate synthase complex subunit DHDDS (EC 2.5.1.87) (Cis-isoprenyltransferase) (CIT) (Cis-IPTase) (Cis-prenyltransferase subunit hCIT) (Epididymis tissue protein Li 189m),Homo sapiens (Human),62.4,274.0,2.3e-95,350.5,sp|Q86SQ9|DHDDS_HUMAN Dehydrodolichyl diphosphate synthase complex subunit DHDDS OS=Homo sapiens OX=9606 GN=DHDDS PE=1 SV=3,GO:0005783; GO:0005789; GO:0006489; GO:0016094; GO:0019408; GO:0045547; GO:0046872; GO:1904423,dolichol biosynthetic process [GO:0019408]; dolichyl diphosphate biosynthetic process [GO:0006489]; polyprenol biosynthetic process [GO:0016094],dehydrodolichyl diphosphate synthase complex [GO:1904423]; endoplasmic reticulum [GO:0005783]; endoplasmic reticulum membrane [GO:0005789],"ditrans,polycis-polyprenyl diphosphate synthase [(2E,6E)-farnesyl diphosphate specific] activity [GO:0045547]; metal ion binding [GO:0046872]",GO:0003824; GO:0005783; GO:0006629; GO:0016740; GO:0043226,catalytic activity; endoplasmic reticulum; lipid metabolic process; transferase activity; organelle
OG_06627,0.5560749461879804,FUN_030057-T1,Peve_00027775,Pocillopora_meandrina_HIv1___RNAseq.g17349.t1,three_way,71.34366666666666,FUN_030057-T1,Q19425,,,,,43.3,536.0,1.2e-109,398.7,sp|Q19425|S38A9_CAEEL Sodium-coupled neutral amino acid transporter 9 homolog OS=Caenorhabditis elegans OX=6239 GN=F13H10.3 PE=3 SV=2,,,,,,
OG_09438,0.5542002982781845,FUN_041410-T1,Peve_00017540,Pocillopora_meandrina_HIv1___RNAseq.g15731.t1,three_way,64.53566666666667,FUN_041410-T1,Q95241,A4_SAISC,,Amyloid-beta precursor protein (ABPP) (APP) (Alzheimer disease amyloid A4 protein homolog) (Alzheimer disease amyloid protein) (Amyloid precursor protein) (Amyloid-beta (A4) precursor protein) (Amyloid-beta A4 protein) [Cleaved into: N-APP; Soluble APP-alpha (S-APP-alpha); Soluble APP-beta (S-APP-beta); C99 (Beta-secretase C-terminal fragment) (Beta-CTF); Amyloid-beta protein 42 (Abeta42) (Beta-APP42); Amyloid-beta protein 40 (Abeta40) (Beta-APP40); C83 (Alpha-secretase C-terminal fragment) (Alpha-CTF); P3(42); P3(40); C80; Gamma-secretase C-terminal fragment 59 (Gamma-CTF(59)); Gamma-secretase C-terminal fragment 57 (Gamma-CTF(57)); Gamma-secretase C-terminal fragment 50 (Gamma-CTF(50)); C31],Saimiri sciureus (Common squirrel monkey),24.4,737.0,3.4e-45,184.5,sp|Q95241|A4_SAISC Amyloid-beta precursor protein OS=Saimiri sciureus OX=9521 GN=APP PE=2 SV=1,GO:0003677; GO:0004867; GO:0005102; GO:0005576; GO:0005634; GO:0005737; GO:0005769; GO:0005783; GO:0005794; GO:0005798; GO:0005886; GO:0005905; GO:0006417; GO:0006878; GO:0006897; GO:0006915; GO:0007155; GO:0007219; GO:0007409; GO:0007417; GO:0007617; GO:0007626; GO:0008088; GO:0008201; GO:0008344; GO:0008542; GO:0009986; GO:0016020; GO:0016199; GO:0016322; GO:0016358; GO:0030198; GO:0030424; GO:0030426; GO:0030546; GO:0031175; GO:0035235; GO:0040014; GO:0043204; GO:0045121; GO:0045931; GO:0046914; GO:0048669; GO:0050803; GO:0055037,adult locomotory behavior [GO:0008344]; apoptotic process [GO:0006915]; axo-dendritic transport [GO:0008088]; axon midline choice point recognition [GO:0016199]; axonogenesis [GO:0007409]; cell adhesion [GO:0007155]; central nervous system development [GO:0007417]; collateral sprouting in absence of injury [GO:0048669]; dendrite development [GO:0016358]; endocytosis [GO:0006897]; extracellular matrix organization [GO:0030198]; intracellular copper ion homeostasis [GO:0006878]; ionotropic glutamate receptor signaling pathway [GO:0035235]; locomotory behavior [GO:0007626]; mating behavior [GO:0007617]; neuron projection development [GO:0031175]; neuron remodeling [GO:0016322]; Notch signaling pathway [GO:0007219]; positive regulation of mitotic cell cycle [GO:0045931]; regulation of multicellular organism growth [GO:0040014]; regulation of synapse structure or activity [GO:0050803]; regulation of translation [GO:0006417]; visual learning [GO:0008542],axon [GO:0030424]; cell surface [GO:0009986]; clathrin-coated pit [GO:0005905]; cytoplasm [GO:0005737]; early endosome [GO:0005769]; endoplasmic reticulum [GO:0005783]; extracellular region [GO:0005576]; Golgi apparatus [GO:0005794]; Golgi-associated vesicle [GO:0005798]; growth cone [GO:0030426]; membrane [GO:0016020]; membrane raft [GO:0045121]; nucleus [GO:0005634]; perikaryon [GO:0043204]; plasma membrane [GO:0005886]; recycling endosome [GO:0055037],DNA binding [GO:0003677]; heparin binding [GO:0008201]; serine-type endopeptidase inhibitor activity [GO:0004867]; signaling receptor activator activity [GO:0030546]; signaling receptor binding [GO:0005102]; transition metal ion binding [GO:0046914],GO:0003677; GO:0005576; GO:0005634; GO:0005768; GO:0005783; GO:0005794; GO:0005886; GO:0007018; GO:0007155; GO:0012501; GO:0016192; GO:0022414; GO:0030198; GO:0031410; GO:0043226; GO:0048856; GO:0050877; GO:0098772,DNA binding; extracellular region; nucleus; endosome; endoplasmic reticulum; Golgi apparatus; plasma membrane; microtubule-based movement; cell adhesion; programmed cell death; vesicle-mediated transport; reproductive process; extracellular matrix organization; cytoplasmic vesicle; organelle; anatomical structure development; nervous system process; molecular function regulator activity
OG_01760,0.554026536441497,FUN_007115-T1,Peve_00017834,Pocillopora_meandrina_HIv1___TS.g28404.t1,three_way,70.838,FUN_007115-T1,P23468,PTPRD_HUMAN,,Receptor-type tyrosine-protein phosphatase delta (Protein-tyrosine phosphatase delta) (R-PTP-delta) (EC 3.1.3.48),Homo sapiens (Human),30.5,1384.0,1.1000000000000001e-164,582.8,sp|P23468|PTPRD_HUMAN Receptor-type tyrosine-protein phosphatase delta OS=Homo sapiens OX=9606 GN=PTPRD PE=1 SV=2,GO:0004725; GO:0005001; GO:0005102; GO:0005886; GO:0006796; GO:0007157; GO:0007165; GO:0007185; GO:0030182; GO:0042734; GO:0046426; GO:0050776; GO:0050804; GO:0050839; GO:0051965; GO:0061003; GO:0070062; GO:0097105; GO:0098685; GO:0098686; GO:0098978; GO:0099054; GO:0099151; GO:0099545; GO:0099560,cell surface receptor protein tyrosine phosphatase signaling pathway [GO:0007185]; heterophilic cell-cell adhesion via plasma membrane cell adhesion molecules [GO:0007157]; modulation of chemical synaptic transmission [GO:0050804]; negative regulation of receptor signaling pathway via JAK-STAT [GO:0046426]; neuron differentiation [GO:0030182]; phosphate-containing compound metabolic process [GO:0006796]; positive regulation of dendritic spine morphogenesis [GO:0061003]; positive regulation of synapse assembly [GO:0051965]; presynapse assembly [GO:0099054]; presynaptic membrane assembly [GO:0097105]; regulation of immune response [GO:0050776]; regulation of postsynaptic density assembly [GO:0099151]; signal transduction [GO:0007165]; synaptic membrane adhesion [GO:0099560]; trans-synaptic signaling by trans-synaptic complex [GO:0099545],extracellular exosome [GO:0070062]; glutamatergic synapse [GO:0098978]; hippocampal mossy fiber to CA3 synapse [GO:0098686]; plasma membrane [GO:0005886]; presynaptic membrane [GO:0042734]; Schaffer collateral - CA1 synapse [GO:0098685],cell adhesion molecule binding [GO:0050839]; protein tyrosine phosphatase activity [GO:0004725]; signaling receptor binding [GO:0005102]; transmembrane receptor protein tyrosine phosphatase activity [GO:0005001],GO:0003824; GO:0005886; GO:0007155; GO:0016787; GO:0023052; GO:0030154; GO:0043226; GO:0060089; GO:0061024; GO:0140096,"catalytic activity; plasma membrane; cell adhesion; hydrolase activity; signaling; cell differentiation; organelle; molecular transducer activity; membrane organization; catalytic activity, acting on a protein"
OG_04811,0.5537658813929408,FUN_022775-T1,Peve_00043390,Pocillopora_meandrina_HIv1___RNAseq.g4768.t1,three_way,88.94066666666666,FUN_022775-T1,F1R4U0,TXTPB_DANRE,,"Tricarboxylate transport protein B, mitochondrial (Citrate transport protein B) (Solute carrier family 25 member 1b)",Danio rerio (Zebrafish) (Brachydanio rerio),64.8,307.0,8.1e-116,418.3,"sp|F1R4U0|TXTPB_DANRE Tricarboxylate transport protein B, mitochondrial OS=Danio rerio OX=7955 GN=slc25a1b PE=3 SV=2",GO:0005739; GO:0005743; GO:0006843; GO:0007528; GO:0015142; GO:0015297; GO:0071913,mitochondrial citrate transmembrane transport [GO:0006843]; neuromuscular junction development [GO:0007528],mitochondrial inner membrane [GO:0005743]; mitochondrion [GO:0005739],antiporter activity [GO:0015297]; citrate secondary active transmembrane transporter activity [GO:0071913]; tricarboxylic acid transmembrane transporter activity [GO:0015142],GO:0005215; GO:0005739; GO:0034330; GO:0043226; GO:0055085,transporter activity; mitochondrion; cell junction organization; organelle; transmembrane transport
OG_09462,0.5527566580573634,FUN_041481-T1,Peve_00015167,Pocillopora_meandrina_HIv1___RNAseq.g15673.t1,three_way,81.04583333333333,FUN_041481-T1,Q6NVN0,SOX2_XENTR,,Transcription factor Sox-2 (SRY (sex determining region Y)-box 2),Xenopus tropicalis (Western clawed frog) (Silurana tropicalis),45.8,271.0,2.8e-42,174.1,sp|Q6NVN0|SOX2_XENTR Transcription factor Sox-2 OS=Xenopus tropicalis OX=8364 GN=sox2 PE=2 SV=1,GO:0003682; GO:0003700; GO:0005634; GO:0005737; GO:0007399; GO:0008283; GO:0021522; GO:0021538; GO:0021982; GO:0031101; GO:0043565; GO:0045893; GO:0045944; GO:0048592; GO:0060119; GO:0071599; GO:1905040; GO:1905812,cell population proliferation [GO:0008283]; epithalamus development [GO:0021538]; eye morphogenesis [GO:0048592]; fin regeneration [GO:0031101]; inner ear receptor cell development [GO:0060119]; nervous system development [GO:0007399]; otic placode development [GO:1905040]; otic vesicle development [GO:0071599]; pineal gland development [GO:0021982]; positive regulation of DNA-templated transcription [GO:0045893]; positive regulation of transcription by RNA polymerase II [GO:0045944]; regulation of motor neuron axon guidance [GO:1905812]; spinal cord motor neuron differentiation [GO:0021522],cytoplasm [GO:0005737]; nucleus [GO:0005634],chromatin binding [GO:0003682]; DNA-binding transcription factor activity [GO:0003700]; sequence-specific DNA binding [GO:0043565],GO:0003677; GO:0005634; GO:0006355; GO:0030154; GO:0043226; GO:0048856; GO:0140110,DNA binding; nucleus; regulation of DNA-templated transcription; cell differentiation; organelle; anatomical structure development; transcription regulator activity
OG_07718,0.5522632152066504,FUN_034873-T1,Peve_00005762,Pocillopora_meandrina_HIv1___RNAseq.g27162.t1,three_way,90.15966666666668,FUN_034873-T1,A1L3F5,,,,,44.8,724.0,1.6e-163,577.8,sp|A1L3F5|CMIP_XENLA C-Maf-inducing protein OS=Xenopus laevis OX=8355 GN=cmip PE=2 SV=2,,,,,,
OG_01957,0.5517989958203653,FUN_008025-T1,Peve_00011341,Pocillopora_meandrina_HIv1___RNAseq.g30350.t1,three_way,62.04266666666667,,,,,,,,,,,,,,,,,
OG_02366,0.5510506278258347,FUN_008973-T1,Peve_00044338,Pocillopora_meandrina_HIv1___RNAseq.g3943.t1,three_way,66.187,FUN_008973-T1,P70057,,,,,37.0,573.0,1.5999999999999999e-83,312.4,sp|P70057|KCNQ1_XENLA Potassium voltage-gated channel subfamily KQT member 1 OS=Xenopus laevis OX=8355 GN=kcnq1 PE=1 SV=2,,,,,,
OG_00125,0.5507894491078792,FUN_000549-T1,Peve_00035147,Pocillopora_meandrina_HIv1___RNAseq.g17849.t1,three_way,56.6745,FUN_000549-T1,Q5FVH4,AKTIP_RAT,,AKT-interacting protein (Fused toes protein homolog),Rattus norvegicus (Rat),37.8,135.0,3.5000000000000005e-22,106.7,sp|Q5FVH4|AKTIP_RAT AKT-interacting protein OS=Rattus norvegicus OX=10116 GN=Aktip PE=1 SV=1,GO:0005634; GO:0005886; GO:0006301; GO:0006915; GO:0007032; GO:0007040; GO:0008333; GO:0015031; GO:0030897; GO:0045022; GO:0061631; GO:0070534; GO:0070695; GO:1905719,apoptotic process [GO:0006915]; early endosome to late endosome transport [GO:0045022]; endosome organization [GO:0007032]; endosome to lysosome transport [GO:0008333]; lysosome organization [GO:0007040]; postreplication repair [GO:0006301]; protein K63-linked ubiquitination [GO:0070534]; protein localization to perinuclear region of cytoplasm [GO:1905719]; protein transport [GO:0015031],FHF complex [GO:0070695]; HOPS complex [GO:0030897]; nucleus [GO:0005634]; plasma membrane [GO:0005886],ubiquitin conjugating enzyme activity [GO:0061631],GO:0003824; GO:0005634; GO:0005886; GO:0006281; GO:0007040; GO:0012501; GO:0016192; GO:0016740; GO:0043226; GO:0140096,"catalytic activity; nucleus; plasma membrane; DNA repair; lysosome organization; programmed cell death; vesicle-mediated transport; transferase activity; organelle; catalytic activity, acting on a protein"
OG_04001,0.550706939439134,FUN_016296-T1,Peve_00043168,Pocillopora_meandrina_HIv1___RNAseq.g503.t1,three_way,73.475,FUN_016296-T1,Q99758,ABCA3_HUMAN,,Phospholipid-transporting ATPase ABCA3 (EC 7.6.2.1) (ABC-C transporter) (ATP-binding cassette sub-family A member 3) (ATP-binding cassette transporter 3) (ATP-binding cassette 3) (Xenobiotic-transporting ATPase ABCA3) (EC 7.6.2.2) [Cleaved into: 150 Kda mature form],Homo sapiens (Human),35.3,1952.0,2.1e-296,1020.8,sp|Q99758|ABCA3_HUMAN Phospholipid-transporting ATPase ABCA3 OS=Homo sapiens OX=9606 GN=ABCA3 PE=1 SV=2,GO:0005319; GO:0005524; GO:0005615; GO:0005765; GO:0005770; GO:0005886; GO:0006855; GO:0006869; GO:0008559; GO:0009410; GO:0010875; GO:0015914; GO:0016887; GO:0030324; GO:0030659; GO:0032464; GO:0032585; GO:0042599; GO:0042626; GO:0042908; GO:0043129; GO:0043231; GO:0046470; GO:0046471; GO:0046618; GO:0046890; GO:0051384; GO:0055091; GO:0070925; GO:0097208; GO:0097232; GO:0097233; GO:0120019; GO:0140345; GO:0150172; GO:1902995; GO:2001140,lipid transport [GO:0006869]; lung development [GO:0030324]; organelle assembly [GO:0070925]; phosphatidylcholine metabolic process [GO:0046470]; phosphatidylglycerol metabolic process [GO:0046471]; phospholipid homeostasis [GO:0055091]; phospholipid transport [GO:0015914]; positive regulation of cholesterol efflux [GO:0010875]; positive regulation of phospholipid efflux [GO:1902995]; positive regulation of phospholipid transport [GO:2001140]; positive regulation of protein homooligomerization [GO:0032464]; regulation of lipid biosynthetic process [GO:0046890]; regulation of phosphatidylcholine metabolic process [GO:0150172]; response to glucocorticoid [GO:0051384]; response to xenobiotic stimulus [GO:0009410]; surfactant homeostasis [GO:0043129]; xenobiotic export from cell [GO:0046618]; xenobiotic transmembrane transport [GO:0006855]; xenobiotic transport [GO:0042908],alveolar lamellar body [GO:0097208]; alveolar lamellar body membrane [GO:0097233]; cytoplasmic vesicle membrane [GO:0030659]; extracellular space [GO:0005615]; intracellular membrane-bounded organelle [GO:0043231]; lamellar body [GO:0042599]; lamellar body membrane [GO:0097232]; late endosome [GO:0005770]; lysosomal membrane [GO:0005765]; multivesicular body membrane [GO:0032585]; plasma membrane [GO:0005886],ABC-type xenobiotic transporter activity [GO:0008559]; ATP binding [GO:0005524]; ATP hydrolysis activity [GO:0016887]; ATPase-coupled transmembrane transporter activity [GO:0042626]; lipid transporter activity [GO:0005319]; phosphatidylcholine flippase activity [GO:0140345]; phosphatidylcholine transfer activity [GO:0120019],GO:0003824; GO:0005215; GO:0005615; GO:0005768; GO:0005886; GO:0006629; GO:0016787; GO:0031410; GO:0043226; GO:0048856; GO:0055085; GO:0140657,catalytic activity; transporter activity; extracellular space; endosome; plasma membrane; lipid metabolic process; hydrolase activity; cytoplasmic vesicle; organelle; anatomical structure development; transmembrane transport; ATP-dependent activity
OG_02822,0.5506673747639388,FUN_011810-T1,Peve_00020919,Pocillopora_meandrina_HIv1___RNAseq.g23237.t1,three_way,64.20366666666666,,,,,,,,,,,,,,,,,
OG_01872,0.5504095106324407,FUN_007839-T1,Peve_00019308,Pocillopora_meandrina_HIv1___TS.g21414.t1,three_way,62.15633333333333,FUN_007839-T1,Q61830,,,,,29.1,299.0,1.1e-23,112.8,sp|Q61830|MRC1_MOUSE Macrophage mannose receptor 1 OS=Mus musculus OX=10090 GN=Mrc1 PE=1 SV=2,,,,,,
OG_03291,0.5495585617782948,FUN_013350-T1,Peve_00041996,Pocillopora_meandrina_HIv1___TS.g2168.t1a,three_way,66.735,FUN_013350-T1,Q8CBF3,EPHB1_MOUSE,,Ephrin type-B receptor 1 (EC 2.7.10.1),Mus musculus (Mouse),38.3,975.0,3.2e-176,620.5,sp|Q8CBF3|EPHB1_MOUSE Ephrin type-B receptor 1 OS=Mus musculus OX=10090 GN=Ephb1 PE=1 SV=1,GO:0001525; GO:0001771; GO:0005005; GO:0005524; GO:0005737; GO:0005783; GO:0005829; GO:0005886; GO:0007411; GO:0008046; GO:0014719; GO:0016020; GO:0021545; GO:0021631; GO:0021934; GO:0021952; GO:0022008; GO:0030010; GO:0030424; GO:0030425; GO:0031290; GO:0031589; GO:0031901; GO:0032433; GO:0044877; GO:0045121; GO:0046328; GO:0046777; GO:0048013; GO:0048593; GO:0050804; GO:0050965; GO:0051965; GO:0060326; GO:0060996; GO:0060997; GO:0061351; GO:0070372; GO:0098978; GO:1902723; GO:1902725,angiogenesis [GO:0001525]; axon guidance [GO:0007411]; camera-type eye morphogenesis [GO:0048593]; cell chemotaxis [GO:0060326]; cell-substrate adhesion [GO:0031589]; central nervous system projection neuron axonogenesis [GO:0021952]; cranial nerve development [GO:0021545]; dendritic spine development [GO:0060996]; dendritic spine morphogenesis [GO:0060997]; detection of temperature stimulus involved in sensory perception of pain [GO:0050965]; ephrin receptor signaling pathway [GO:0048013]; establishment of cell polarity [GO:0030010]; hindbrain tangential cell migration [GO:0021934]; immunological synapse formation [GO:0001771]; modulation of chemical synaptic transmission [GO:0050804]; negative regulation of satellite cell differentiation [GO:1902725]; negative regulation of skeletal muscle satellite cell proliferation [GO:1902723]; neural precursor cell proliferation [GO:0061351]; neurogenesis [GO:0022008]; optic nerve morphogenesis [GO:0021631]; positive regulation of synapse assembly [GO:0051965]; protein autophosphorylation [GO:0046777]; regulation of ERK1 and ERK2 cascade [GO:0070372]; regulation of JNK cascade [GO:0046328]; retinal ganglion cell axon guidance [GO:0031290]; skeletal muscle satellite cell activation [GO:0014719],axon [GO:0030424]; cytoplasm [GO:0005737]; cytosol [GO:0005829]; dendrite [GO:0030425]; early endosome membrane [GO:0031901]; endoplasmic reticulum [GO:0005783]; filopodium tip [GO:0032433]; glutamatergic synapse [GO:0098978]; membrane [GO:0016020]; membrane raft [GO:0045121]; plasma membrane [GO:0005886],ATP binding [GO:0005524]; axon guidance receptor activity [GO:0008046]; protein-containing complex binding [GO:0044877]; transmembrane-ephrin receptor activity [GO:0005005],GO:0003824; GO:0005783; GO:0005829; GO:0005886; GO:0007155; GO:0007163; GO:0016740; GO:0030154; GO:0043226; GO:0048856; GO:0048870; GO:0060089; GO:0140096,"catalytic activity; endoplasmic reticulum; cytosol; plasma membrane; cell adhesion; establishment or maintenance of cell polarity; transferase activity; cell differentiation; organelle; anatomical structure development; cell motility; molecular transducer activity; catalytic activity, acting on a protein"
OG_08202,0.5461515995283991,FUN_036047-T1,Peve_00029867,Pocillopora_meandrina_HIv1___RNAseq.g27387.t1,three_way,71.29666666666667,FUN_036047-T1,Q2HJ57,,,,,48.2,137.0,3.2999999999999997e-29,129.4,sp|Q2HJ57|COTL1_BOVIN Coactosin-like protein OS=Bos taurus OX=9913 GN=COTL1 PE=2 SV=3,,,,,,
OG_02948,0.5456184896763426,FUN_012066-T1,Peve_00004089,Pocillopora_meandrina_HIv1___RNAseq.g23637.t1,three_way,63.71233333333333,FUN_012066-T1,Q7Z020,,,,,25.4,562.0,7.2e-37,157.9,sp|Q7Z020|TRPA1_DROME Transient receptor potential cation channel subfamily A member 1 OS=Drosophila melanogaster OX=7227 GN=TrpA1 PE=1 SV=4,,,,,,
OG_07039,0.5448665785363562,FUN_032235-T1,Peve_00043486,Pocillopora_meandrina_HIv1___RNAseq.g24841.t1,three_way,59.83833333333334,,,,,,,,,,,,,,,,,
OG_05949,0.5447419604520958,FUN_026199-T1,Peve_00010232,Pocillopora_meandrina_HIv1___RNAseq.g3044.t1,three_way,45.858,,,,,,,,,,,,,,,,,
OG_08906,0.5423392110848522,FUN_038337-T1,Peve_00000101,Pocillopora_meandrina_HIv1___RNAseq.g1113.t1,three_way,71.11383333333333,FUN_038337-T1,Q553D3,,,,,30.7,212.0,2.5e-20,102.4,sp|Q553D3|GXCJJ_DICDI Rac guanine nucleotide exchange factor JJ OS=Dictyostelium discoideum OX=44689 GN=gxcJJ PE=1 SV=1,,,,,,
OG_06743,0.5405523420454766,FUN_031549-T1,Peve_00022771,Pocillopora_meandrina_HIv1___RNAseq.g5142.t1,three_way,79.50266666666667,FUN_031549-T1,Q5F480,ITPK1_CHICK,,"Inositol-tetrakisphosphate 1-kinase (EC 2.7.1.134) (Inositol 1,3,4-trisphosphate 5/6-kinase) (Inositol-triphosphate 5/6-kinase) (Ins(1,3,4)P(3) 5/6-kinase) (EC 2.7.1.159)",Gallus gallus (Chicken),42.8,320.0,4.6e-77,289.7,sp|Q5F480|ITPK1_CHICK Inositol-tetrakisphosphate 1-kinase OS=Gallus gallus OX=9031 GN=ITPK1 PE=2 SV=1,GO:0000287; GO:0000825; GO:0005524; GO:0016853; GO:0032957; GO:0047325; GO:0052725; GO:0052726; GO:0052835; GO:0070266,inositol trisphosphate metabolic process [GO:0032957]; necroptotic process [GO:0070266],,"ATP binding [GO:0005524]; inositol-1,3,4,5-tetrakisphosphate 6-kinase activity [GO:0000825]; inositol-1,3,4-trisphosphate 5-kinase activity [GO:0052726]; inositol-1,3,4-trisphosphate 6-kinase activity [GO:0052725]; inositol-3,4,5,6-tetrakisphosphate 1-kinase activity [GO:0047325]; inositol-3,4,6-trisphosphate 1-kinase activity [GO:0052835]; isomerase activity [GO:0016853]; magnesium ion binding [GO:0000287]",GO:0003824; GO:0012501; GO:0016740; GO:0016853,catalytic activity; programmed cell death; transferase activity; isomerase activity
OG_08937,0.5397199827642285,FUN_038401-T1,Peve_00000033,Pocillopora_meandrina_HIv1___RNAseq.g28276.t1,three_way,76.06083333333333,FUN_038401-T1,Q9BG91,,,,,65.5,148.0,5e-50,200.3,sp|Q9BG91|SOX9_CALJA Transcription factor SOX-9 OS=Callithrix jacchus OX=9483 GN=SOX9 PE=2 SV=1,,,,,,
OG_01630,0.5390560070468763,FUN_006744-T1,Peve_00039581,Pocillopora_meandrina_HIv1___RNAseq.g20530.t1,three_way,63.90916666666666,FUN_006744-T1,Q8BNA6,FAT3_MOUSE,,Protocadherin Fat 3 (FAT tumor suppressor homolog 3),Mus musculus (Mouse),33.8,4122.0,0.0,2094.3,sp|Q8BNA6|FAT3_MOUSE Protocadherin Fat 3 OS=Mus musculus OX=10090 GN=Fat3 PE=1 SV=2,GO:0005509; GO:0005886; GO:0007156; GO:0010842; GO:0016358; GO:0030425; GO:0048667; GO:1904936; GO:2000171,cell morphogenesis involved in neuron differentiation [GO:0048667]; dendrite development [GO:0016358]; homophilic cell adhesion via plasma membrane adhesion molecules [GO:0007156]; interneuron migration [GO:1904936]; negative regulation of dendrite development [GO:2000171]; retina layer formation [GO:0010842],dendrite [GO:0030425]; plasma membrane [GO:0005886],calcium ion binding [GO:0005509],GO:0005886; GO:0007155; GO:0048856; GO:0048870,plasma membrane; cell adhesion; anatomical structure development; cell motility
OG_06022,0.5382622176780403,FUN_026564-T1,Peve_00043274,Pocillopora_meandrina_HIv1___RNAseq.g4519.t1,three_way,45.92583333333333,FUN_026564-T1,Q9DD78,,,,,32.7,107.0,3.3e-12,75.1,sp|Q9DD78|TLR21_CHICK Toll-like receptor 2 type-1 OS=Gallus gallus OX=9031 GN=TLR2-1 PE=2 SV=1,,,,,,
OG_03431,0.5381104982106393,FUN_014487-T1,Peve_00037295,Pocillopora_meandrina_HIv1___RNAseq.1965_t,three_way,57.88816666666667,FUN_014487-T1,Q9D4H7,,,,,33.6,619.0,5e-91,337.0,sp|Q9D4H7|LONF3_MOUSE LON peptidase N-terminal domain and RING finger protein 3 OS=Mus musculus OX=10090 GN=Lonrf3 PE=2 SV=1,,,,,,
OG_06101,0.5379993713457524,FUN_027779-T1,Peve_00034984,Pocillopora_meandrina_HIv1___RNAseq.g12667.t1,three_way,61.244166666666665,FUN_027779-T1,Q7Z408,CSMD2_HUMAN,,CUB and sushi domain-containing protein 2 (CUB and sushi multiple domains protein 2),Homo sapiens (Human),23.2,921.0,4.8e-24,116.7,sp|Q7Z408|CSMD2_HUMAN CUB and sushi domain-containing protein 2 OS=Homo sapiens OX=9606 GN=CSMD2 PE=1 SV=2,GO:0097107; GO:0098839; GO:0098978; GO:0099562,maintenance of postsynaptic density structure [GO:0099562]; postsynaptic density assembly [GO:0097107],glutamatergic synapse [GO:0098978]; postsynaptic density membrane [GO:0098839],,GO:0034330,cell junction organization
