group_id,Component_1,apul,peve,ptua,type,avg_identity,query,accession,id,reviewed,protein_name,organism,pident,length,evalue,bitscore,title,go_ids,go_bp,go_cc,go_mf,goslim_ids,goslim_names
OG_03269,0.278476727200707,FUN_013138-T1,Peve_00042391,Pocillopora_meandrina_HIv1___TS.g15900.t1,three_way,81.306,FUN_013138-T1,Q7RTY7,OVCH1_HUMAN,,Ovochymase-1 (EC 3.4.21.-),Homo sapiens (Human),39.4,251.0,5.999999999999999e-44,179.5,sp|Q7RTY7|OVCH1_HUMAN Ovochymase-1 OS=Homo sapiens OX=9606 GN=OVCH1 PE=1 SV=3,GO:0004252; GO:0005576; GO:0006508; GO:0046872,proteolysis [GO:0006508],extracellular region [GO:0005576],metal ion binding [GO:0046872]; serine-type endopeptidase activity [GO:0004252],GO:0003824; GO:0005576; GO:0016787; GO:0140096,"catalytic activity; extracellular region; hydrolase activity; catalytic activity, acting on a protein"
OG_06485,0.2781700289108403,FUN_029259-T1,Peve_00024365,Pocillopora_meandrina_HIv1___RNAseq.g15031.t1b,three_way,71.01783333333333,FUN_029259-T1,Q6DN90,IQEC1_HUMAN,,IQ motif and SEC7 domain-containing protein 1 (ADP-ribosylation factors guanine nucleotide-exchange protein 100) (ADP-ribosylation factors guanine nucleotide-exchange protein 2) (Brefeldin-resistant Arf-GEF 2 protein) (BRAG2),Homo sapiens (Human),42.1,447.0,1.1e-74,283.1,sp|Q6DN90|IQEC1_HUMAN IQ motif and SEC7 domain-containing protein 1 OS=Homo sapiens OX=9606 GN=IQSEC1 PE=1 SV=1,GO:0005085; GO:0005654; GO:0005813; GO:0005829; GO:0008021; GO:0008289; GO:0014069; GO:0016020; GO:0030036; GO:0032012; GO:0043231; GO:0051549; GO:0060996; GO:0120183,actin cytoskeleton organization [GO:0030036]; dendritic spine development [GO:0060996]; positive regulation of focal adhesion disassembly [GO:0120183]; positive regulation of keratinocyte migration [GO:0051549]; regulation of ARF protein signal transduction [GO:0032012],centrosome [GO:0005813]; cytosol [GO:0005829]; intracellular membrane-bounded organelle [GO:0043231]; membrane [GO:0016020]; nucleoplasm [GO:0005654]; postsynaptic density [GO:0014069]; synaptic vesicle [GO:0008021],guanyl-nucleotide exchange factor activity [GO:0005085]; lipid binding [GO:0008289],GO:0005654; GO:0005815; GO:0005829; GO:0007010; GO:0008289; GO:0031410; GO:0043226; GO:0048856; GO:0098772,nucleoplasm; microtubule organizing center; cytosol; cytoskeleton organization; lipid binding; cytoplasmic vesicle; organelle; anatomical structure development; molecular function regulator activity
OG_03039,0.2778492013274173,FUN_012278-T1,Peve_00010528,Pocillopora_meandrina_HIv1___RNAseq.g23570.t1,three_way,80.52133333333333,FUN_012278-T1,Q9D5W4,,,,,40.4,708.0,7.8e-127,456.1,sp|Q9D5W4|CCD81_MOUSE Coiled-coil domain-containing protein 81 OS=Mus musculus OX=10090 GN=Ccdc81 PE=2 SV=1,,,,,,
OG_02112,0.2777807862796604,FUN_008397-T1,Peve_00043603,Pocillopora_meandrina_HIv1___RNAseq.g6179.t1,three_way,31.29733333333333,FUN_008397-T1,Q0P5F3,LIN7C_BOVIN,,Protein lin-7 homolog C (Lin-7C),Bos taurus (Bovine),35.4,99.0,4.4e-07,60.5,sp|Q0P5F3|LIN7C_BOVIN Protein lin-7 homolog C OS=Bos taurus OX=9913 GN=LIN7C PE=2 SV=1,GO:0005911; GO:0005923; GO:0006887; GO:0007269; GO:0008582; GO:0015031; GO:0016323; GO:0030674; GO:0043005; GO:0045202; GO:0048489; GO:0097025; GO:0098793; GO:0098839,exocytosis [GO:0006887]; neurotransmitter secretion [GO:0007269]; protein transport [GO:0015031]; regulation of synaptic assembly at neuromuscular junction [GO:0008582]; synaptic vesicle transport [GO:0048489],basolateral plasma membrane [GO:0016323]; bicellular tight junction [GO:0005923]; cell-cell junction [GO:0005911]; MPP7-DLG1-LIN7 complex [GO:0097025]; neuron projection [GO:0043005]; postsynaptic density membrane [GO:0098839]; presynapse [GO:0098793]; synapse [GO:0045202],protein-macromolecule adaptor activity [GO:0030674],GO:0016192; GO:0060090,vesicle-mediated transport; molecular adaptor activity
OG_08588,0.2774854918878685,FUN_037697-T1,Peve_00044127,Pocillopora_meandrina_HIv1___RNAseq.g1357.t1,three_way,66.68333333333334,FUN_037697-T1,Q6NZQ2,DDX31_MOUSE,,ATP-dependent DNA helicase DDX31 (EC 5.6.2.-) (DEAD box protein 31) (Probable ATP-dependent RNA helicase DDX31) (EC 3.6.4.13),Mus musculus (Mouse),46.4,686.0,1.1999999999999999e-148,528.5,sp|Q6NZQ2|DDX31_MOUSE ATP-dependent DNA helicase DDX31 OS=Mus musculus OX=10090 GN=Ddx31 PE=2 SV=2,GO:0003723; GO:0003724; GO:0005524; GO:0005730; GO:0005794; GO:0016887; GO:0042254,ribosome biogenesis [GO:0042254],Golgi apparatus [GO:0005794]; nucleolus [GO:0005730],ATP binding [GO:0005524]; ATP hydrolysis activity [GO:0016887]; RNA binding [GO:0003723]; RNA helicase activity [GO:0003724],GO:0003723; GO:0003824; GO:0005730; GO:0005794; GO:0016787; GO:0016853; GO:0042254; GO:0043226; GO:0140098; GO:0140657,"RNA binding; catalytic activity; nucleolus; Golgi apparatus; hydrolase activity; isomerase activity; ribosome biogenesis; organelle; catalytic activity, acting on RNA; ATP-dependent activity"
OG_03716,0.2773416815659659,FUN_014991-T1,Peve_00032857,Pocillopora_meandrina_HIv1___RNAseq.g21154.t2,three_way,83.89333333333333,FUN_014991-T1,Q9BUZ4,TRAF4_HUMAN,,TNF receptor-associated factor 4 (EC 2.3.2.27) (Cysteine-rich domain associated with RING and Traf domains protein 1) (Metastatic lymph node gene 62 protein) (MLN 62) (RING finger protein 83),Homo sapiens (Human),30.0,621.0,3.3e-94,347.4,sp|Q9BUZ4|TRAF4_HUMAN TNF receptor-associated factor 4 OS=Homo sapiens OX=9606 GN=TRAF4 PE=1 SV=1,GO:0001650; GO:0005164; GO:0005634; GO:0005654; GO:0005737; GO:0005829; GO:0005856; GO:0005886; GO:0005923; GO:0006915; GO:0007166; GO:0007585; GO:0008270; GO:0016740; GO:0019901; GO:0030323; GO:0031625; GO:0031996; GO:0035591; GO:0042802; GO:0042981; GO:0043122; GO:0043161; GO:0045087; GO:0045860; GO:0046330; GO:0048471; GO:0050699,apoptotic process [GO:0006915]; cell surface receptor signaling pathway [GO:0007166]; innate immune response [GO:0045087]; positive regulation of JNK cascade [GO:0046330]; positive regulation of protein kinase activity [GO:0045860]; proteasome-mediated ubiquitin-dependent protein catabolic process [GO:0043161]; regulation of apoptotic process [GO:0042981]; regulation of canonical NF-kappaB signal transduction [GO:0043122]; respiratory gaseous exchange by respiratory system [GO:0007585]; respiratory tube development [GO:0030323],bicellular tight junction [GO:0005923]; cytoplasm [GO:0005737]; cytoskeleton [GO:0005856]; cytosol [GO:0005829]; fibrillar center [GO:0001650]; nucleoplasm [GO:0005654]; nucleus [GO:0005634]; perinuclear region of cytoplasm [GO:0048471]; plasma membrane [GO:0005886],identical protein binding [GO:0042802]; protein kinase binding [GO:0019901]; signaling adaptor activity [GO:0035591]; thioesterase binding [GO:0031996]; transferase activity [GO:0016740]; tumor necrosis factor receptor binding [GO:0005164]; ubiquitin protein ligase binding [GO:0031625]; WW domain binding [GO:0050699]; zinc ion binding [GO:0008270],GO:0002376; GO:0003824; GO:0005634; GO:0005654; GO:0005829; GO:0005856; GO:0005886; GO:0012501; GO:0016740; GO:0030163; GO:0043226; GO:0048856; GO:0060090; GO:0098542,immune system process; catalytic activity; nucleus; nucleoplasm; cytosol; cytoskeleton; plasma membrane; programmed cell death; transferase activity; protein catabolic process; organelle; anatomical structure development; molecular adaptor activity; defense response to other organism
OG_01021,0.2772327028956066,FUN_004453-T1,Peve_00024317,Pocillopora_meandrina_HIv1___RNAseq.g5040.t1,three_way,69.144,FUN_004453-T1,Q5GN48,DMD_PIG,,Dystrophin,Sus scrofa (Pig),36.3,557.0,9.2e-96,352.4,sp|Q5GN48|DMD_PIG Dystrophin OS=Sus scrofa OX=9823 GN=DMD PE=1 SV=1,GO:0003779; GO:0005737; GO:0005856; GO:0007519; GO:0008270; GO:0016010; GO:0042383; GO:0045211; GO:0048666; GO:0055001; GO:0090257; GO:0099536; GO:0120025,muscle cell development [GO:0055001]; neuron development [GO:0048666]; regulation of muscle system process [GO:0090257]; skeletal muscle tissue development [GO:0007519]; synaptic signaling [GO:0099536],cytoplasm [GO:0005737]; cytoskeleton [GO:0005856]; dystrophin-associated glycoprotein complex [GO:0016010]; plasma membrane bounded cell projection [GO:0120025]; postsynaptic membrane [GO:0045211]; sarcolemma [GO:0042383],actin binding [GO:0003779]; zinc ion binding [GO:0008270],GO:0005856; GO:0005886; GO:0008092; GO:0023052; GO:0043226; GO:0048856,cytoskeleton; plasma membrane; cytoskeletal protein binding; signaling; organelle; anatomical structure development
OG_07786,0.2767725201179995,FUN_035007-T1,Peve_00024588,Pocillopora_meandrina_HIv1___RNAseq.g12133.t1,three_way,76.595,FUN_035007-T1,O60268,,,,,33.6,110.0,4.3e-10,65.5,sp|O60268|K0513_HUMAN Uncharacterized protein KIAA0513 OS=Homo sapiens OX=9606 GN=KIAA0513 PE=1 SV=1,,,,,,
OG_05506,0.2767588636044116,FUN_024587-T1,Peve_00037917,Pocillopora_meandrina_HIv1___RNAseq.2717_t,three_way,63.268,,,,,,,,,,,,,,,,,
OG_08902,0.276535847098357,FUN_038330-T1,Peve_00023108,Pocillopora_meandrina_HIv1___RNAseq.g1119.t2,three_way,80.42033333333333,FUN_038330-T1,Q9EQY0,ERN1_MOUSE,,Serine/threonine-protein kinase/endoribonuclease IRE1 (Endoplasmic reticulum-to-nucleus signaling 1) (Inositol-requiring protein 1) (Ire1-alpha) (IRE1a) [Includes: Serine/threonine-protein kinase (EC 2.7.11.1); Endoribonuclease (EC 3.1.26.-)],Mus musculus (Mouse),44.5,954.0,2.3e-213,743.8,sp|Q9EQY0|ERN1_MOUSE Serine/threonine-protein kinase/endoribonuclease IRE1 OS=Mus musculus OX=10090 GN=Ern1 PE=1 SV=1,GO:0000287; GO:0001935; GO:0004519; GO:0004521; GO:0004674; GO:0005161; GO:0005524; GO:0005637; GO:0005739; GO:0005789; GO:0006468; GO:0017148; GO:0019899; GO:0030544; GO:0030968; GO:0033120; GO:0035924; GO:0036498; GO:0042803; GO:0043507; GO:0043531; GO:0046777; GO:0051879; GO:0070054; GO:0070059; GO:0070301; GO:0071333; GO:0106310; GO:1900103; GO:1901142; GO:1904294; GO:1904707; GO:1990597; GO:1990604; GO:1990630,"cellular response to glucose stimulus [GO:0071333]; cellular response to hydrogen peroxide [GO:0070301]; cellular response to vascular endothelial growth factor stimulus [GO:0035924]; endoplasmic reticulum unfolded protein response [GO:0030968]; endothelial cell proliferation [GO:0001935]; insulin metabolic process [GO:1901142]; intrinsic apoptotic signaling pathway in response to endoplasmic reticulum stress [GO:0070059]; IRE1-mediated unfolded protein response [GO:0036498]; mRNA splicing, via endonucleolytic cleavage and ligation [GO:0070054]; negative regulation of translation [GO:0017148]; positive regulation of endoplasmic reticulum unfolded protein response [GO:1900103]; positive regulation of ERAD pathway [GO:1904294]; positive regulation of JUN kinase activity [GO:0043507]; positive regulation of RNA splicing [GO:0033120]; positive regulation of vascular associated smooth muscle cell proliferation [GO:1904707]; protein autophosphorylation [GO:0046777]; protein phosphorylation [GO:0006468]",AIP1-IRE1 complex [GO:1990597]; endoplasmic reticulum membrane [GO:0005789]; IRE1-RACK1-PP2A complex [GO:1990630]; IRE1-TRAF2-ASK1 complex [GO:1990604]; mitochondrion [GO:0005739]; nuclear inner membrane [GO:0005637],ADP binding [GO:0043531]; ATP binding [GO:0005524]; endonuclease activity [GO:0004519]; enzyme binding [GO:0019899]; Hsp70 protein binding [GO:0030544]; Hsp90 protein binding [GO:0051879]; magnesium ion binding [GO:0000287]; platelet-derived growth factor receptor binding [GO:0005161]; protein homodimerization activity [GO:0042803]; protein serine kinase activity [GO:0106310]; protein serine/threonine kinase activity [GO:0004674]; RNA endonuclease activity [GO:0004521],GO:0003824; GO:0005739; GO:0016071; GO:0016740; GO:0043226; GO:0140096; GO:0140098,"catalytic activity; mitochondrion; mRNA metabolic process; transferase activity; organelle; catalytic activity, acting on a protein; catalytic activity, acting on RNA"
OG_06571,0.2763435069124036,FUN_029484-T1,Peve_00017245,Pocillopora_meandrina_HIv1___RNAseq.g17128.t1,three_way,64.353,FUN_029484-T1,Q8NEA6,GLIS3_HUMAN,,Zinc finger protein GLIS3 (GLI-similar 3) (Zinc finger protein 515),Homo sapiens (Human),64.3,70.0,4.8e-23,110.9,sp|Q8NEA6|GLIS3_HUMAN Zinc finger protein GLIS3 OS=Homo sapiens OX=9606 GN=GLIS3 PE=1 SV=5,GO:0000122; GO:0000978; GO:0000981; GO:0001227; GO:0001228; GO:0005634; GO:0006357; GO:0006366; GO:0008270; GO:0045944,negative regulation of transcription by RNA polymerase II [GO:0000122]; positive regulation of transcription by RNA polymerase II [GO:0045944]; regulation of transcription by RNA polymerase II [GO:0006357]; transcription by RNA polymerase II [GO:0006366],nucleus [GO:0005634],"DNA-binding transcription activator activity, RNA polymerase II-specific [GO:0001228]; DNA-binding transcription factor activity, RNA polymerase II-specific [GO:0000981]; DNA-binding transcription repressor activity, RNA polymerase II-specific [GO:0001227]; RNA polymerase II cis-regulatory region sequence-specific DNA binding [GO:0000978]; zinc ion binding [GO:0008270]",GO:0003677; GO:0005634; GO:0006351; GO:0006355; GO:0043226; GO:0140110,DNA binding; nucleus; DNA-templated transcription; regulation of DNA-templated transcription; organelle; transcription regulator activity
