OG_ID,Component_27,group_id,apul,peve,ptua,type,avg_identity,query,accession,id,reviewed,protein_name,organism,pident,length,evalue,bitscore,title,go_ids,go_bp,go_cc,go_mf,goslim_ids,goslim_names
OG_04999,1.5100054761020252,OG_04999,FUN_023134-T1,Peve_00008524,Pocillopora_meandrina_HIv1___RNAseq.g1753.t1,three_way,84.611,FUN_023134-T1,P26632,EGR1_DANRE,,Early growth response protein 1 (EGR-1) (Zinc finger protein Krox-24),Danio rerio (Zebrafish) (Brachydanio rerio),46.4,125.0,1.4e-15,85.5,sp|P26632|EGR1_DANRE Early growth response protein 1 OS=Danio rerio OX=7955 GN=egr1 PE=2 SV=2,GO:0000978; GO:0000981; GO:0005634; GO:0005737; GO:0006357; GO:0008270; GO:0010385; GO:0010842; GO:0032922; GO:0043010; GO:0043565; GO:0044729; GO:0045893; GO:0045944; GO:0048703; GO:0060059; GO:1990841,camera-type eye development [GO:0043010]; circadian regulation of gene expression [GO:0032922]; embryonic retina morphogenesis in camera-type eye [GO:0060059]; embryonic viscerocranium morphogenesis [GO:0048703]; positive regulation of DNA-templated transcription [GO:0045893]; positive regulation of transcription by RNA polymerase II [GO:0045944]; regulation of transcription by RNA polymerase II [GO:0006357]; retina layer formation [GO:0010842],cytoplasm [GO:0005737]; nucleus [GO:0005634],"DNA-binding transcription factor activity, RNA polymerase II-specific [GO:0000981]; double-stranded methylated DNA binding [GO:0010385]; hemi-methylated DNA-binding [GO:0044729]; promoter-specific chromatin binding [GO:1990841]; RNA polymerase II cis-regulatory region sequence-specific DNA binding [GO:0000978]; sequence-specific DNA binding [GO:0043565]; zinc ion binding [GO:0008270]",GO:0003677; GO:0005634; GO:0006355; GO:0043226; GO:0048856; GO:0140110,DNA binding; nucleus; regulation of DNA-templated transcription; organelle; anatomical structure development; transcription regulator activity
OG_09596,1.4962386722865322,OG_09596,FUN_041743-T1,Peve_00002188,Pocillopora_meandrina_HIv1___RNAseq.g15788.t1,three_way,64.87933333333334,,,,,,,,,,,,,,,,,
OG_07996,1.4959832991086008,OG_07996,FUN_035637-T1,Peve_00029721,Pocillopora_meandrina_HIv1___RNAseq.g28085.t1,three_way,59.298,,,,,,,,,,,,,,,,,
OG_06174,1.4190828180278448,OG_06174,FUN_028030-T1,Peve_00044201,Pocillopora_meandrina_HIv1___RNAseq.g13933.t1,three_way,44.60566666666666,,,,,,,,,,,,,,,,,
OG_02967,1.3994817934497008,OG_02967,FUN_012126-T1,Peve_00035474,Pocillopora_meandrina_HIv1___RNAseq.g23920.t1,three_way,60.626333333333335,FUN_012126-T1,B3EWY9,,,,,38.6,166.0,3.999999999999999e-28,128.3,sp|B3EWY9|MLP_ACRMI Mucin-like protein (Fragment) OS=Acropora millepora OX=45264 PE=1 SV=1,,,,,,
OG_02497,1.3946866935994824,OG_02497,FUN_009835-T1,Peve_00000517,Pocillopora_meandrina_HIv1___RNAseq.g24530.t2,three_way,68.508,FUN_009835-T1,Q6PDN3,MYLK_MOUSE,,"Myosin light chain kinase, smooth muscle (MLCK) (smMLCK) (EC 2.7.11.18) (Kinase-related protein) (KRP) (Telokin) [Cleaved into: Myosin light chain kinase, smooth muscle, deglutamylated form]",Mus musculus (Mouse),46.4,371.0,2.3e-87,327.0,"sp|Q6PDN3|MYLK_MOUSE Myosin light chain kinase, smooth muscle OS=Mus musculus OX=10090 GN=Mylk PE=1 SV=3",GO:0001725; GO:0003779; GO:0004687; GO:0005516; GO:0005524; GO:0005737; GO:0005911; GO:0006939; GO:0014820; GO:0019899; GO:0030027; GO:0032154; GO:0035865; GO:0046872; GO:0071277; GO:0071466; GO:0098969,cellular response to calcium ion [GO:0071277]; cellular response to potassium ion [GO:0035865]; cellular response to xenobiotic stimulus [GO:0071466]; neurotransmitter receptor transport to postsynaptic membrane [GO:0098969]; smooth muscle contraction [GO:0006939]; tonic smooth muscle contraction [GO:0014820],cell-cell junction [GO:0005911]; cleavage furrow [GO:0032154]; cytoplasm [GO:0005737]; lamellipodium [GO:0030027]; stress fiber [GO:0001725],actin binding [GO:0003779]; ATP binding [GO:0005524]; calmodulin binding [GO:0005516]; enzyme binding [GO:0019899]; metal ion binding [GO:0046872]; myosin light chain kinase activity [GO:0004687],GO:0003012; GO:0003824; GO:0008092; GO:0016192; GO:0016740; GO:0140096,"muscle system process; catalytic activity; cytoskeletal protein binding; vesicle-mediated transport; transferase activity; catalytic activity, acting on a protein"
OG_06842,1.3711071641743322,OG_06842,FUN_031782-T1,Peve_00010427,Pocillopora_meandrina_HIv1___RNAseq.g5565.t1,three_way,65.31783333333333,FUN_031782-T1,P29176,,,,,44.2,77.0,1.2e-06,55.1,sp|P29176|FOSX_MSVFR Transforming protein v-Fos/v-Fox OS=FBR murine osteosarcoma virus OX=353765 GN=FOS-FOX PE=3 SV=1,,,,,,
OG_09963,1.3372624251279994,OG_09963,FUN_043144-T1,Peve_00034957,Pocillopora_meandrina_HIv1___RNAseq.g6886.t1,three_way,84.25150000000001,FUN_043144-T1,Q26481,,,,,73.1,279.0,2e-116,420.2,sp|Q26481|RL5_STYCL Large ribosomal subunit protein uL18 OS=Styela clava OX=7725 GN=RPL5 PE=3 SV=3,,,,,,
OG_00843,1.324288530172418,OG_00843,FUN_004094-T1,Peve_00003934,Pocillopora_meandrina_HIv1___RNAseq.g12638.t1,three_way,54.284,FUN_004094-T1,Q91062,,,,,21.7,927.0,2.1e-50,203.4,sp|Q91062|VIT_ICHUN Vitellogenin OS=Ichthyomyzon unicuspis OX=30308 PE=1 SV=1,,,,,,
OG_08292,1.3011138229126786,OG_08292,FUN_036230-T1,Peve_00032846,Pocillopora_meandrina_HIv1___RNAseq.g27551.t1,three_way,66.83933333333333,FUN_036230-T1,Q8TB40,,,,,51.4,319.0,7.7e-96,352.1,sp|Q8TB40|ABHD4_HUMAN (Lyso)-N-acylphosphatidylethanolamine lipase OS=Homo sapiens OX=9606 GN=ABHD4 PE=1 SV=1,,,,,,
OG_01642,1.297890372620336,OG_01642,FUN_006790-T1,Peve_00028070,Pocillopora_meandrina_HIv1___RNAseq.g20501.t1,three_way,54.868,FUN_006790-T1,P35918,,,,,31.5,961.0,9.8e-99,363.6,sp|P35918|VGFR2_MOUSE Vascular endothelial growth factor receptor 2 OS=Mus musculus OX=10090 GN=Kdr PE=1 SV=2,,,,,,
OG_08898,1.296931540435309,OG_08898,FUN_038311-T1,Peve_00020693,Pocillopora_meandrina_HIv1___RNAseq.g1142.t1,three_way,76.04366666666667,FUN_038311-T1,Q8R5K6,,,,,43.3,217.0,3.7999999999999996e-39,163.3,sp|Q8R5K6|TOB1_RAT Protein Tob1 OS=Rattus norvegicus OX=10116 GN=Tob1 PE=1 SV=1,,,,,,
OG_06416,1.293832598940951,OG_06416,FUN_029099-T1,Peve_00038062,Pocillopora_meandrina_HIv1___RNAseq.g25485.t1,three_way,55.33266666666667,FUN_029099-T1,P20105,E74EA_DROME,,Ecdysone-induced protein 74EF isoform A (ETS-related protein E74A),Drosophila melanogaster (Fruit fly),52.4,105.0,3.5e-21,103.6,sp|P20105|E74EA_DROME Ecdysone-induced protein 74EF isoform A OS=Drosophila melanogaster OX=7227 GN=Eip74EF PE=2 SV=2,GO:0000981; GO:0001228; GO:0005634; GO:0006357; GO:0006914; GO:0030154; GO:0040034; GO:0043565; GO:0045944; GO:0048102; GO:0048477,"autophagic cell death [GO:0048102]; autophagy [GO:0006914]; cell differentiation [GO:0030154]; oogenesis [GO:0048477]; positive regulation of transcription by RNA polymerase II [GO:0045944]; regulation of development, heterochronic [GO:0040034]; regulation of transcription by RNA polymerase II [GO:0006357]",nucleus [GO:0005634],"DNA-binding transcription activator activity, RNA polymerase II-specific [GO:0001228]; DNA-binding transcription factor activity, RNA polymerase II-specific [GO:0000981]; sequence-specific DNA binding [GO:0043565]",GO:0003677; GO:0005634; GO:0006355; GO:0006914; GO:0012501; GO:0022414; GO:0030154; GO:0043226; GO:0048856; GO:0140110,DNA binding; nucleus; regulation of DNA-templated transcription; autophagy; programmed cell death; reproductive process; cell differentiation; organelle; anatomical structure development; transcription regulator activity
OG_09075,1.2865547298529303,OG_09075,FUN_038804-T1,Peve_00007218,Pocillopora_meandrina_HIv1___RNAseq.g28539.t1c,three_way,93.94983333333332,FUN_038804-T1,Q90YS3,,,,,88.7,231.0,2.5e-113,409.8,sp|Q90YS3|RS2_ICTPU Small ribosomal subunit protein uS5 OS=Ictalurus punctatus OX=7998 GN=rps2 PE=2 SV=1,,,,,,
OG_06782,1.2709025391125817,OG_06782,FUN_031649-T1,Peve_00043575,Pocillopora_meandrina_HIv1___TS.g24400.t2a,three_way,66.82783333333333,FUN_031649-T1,Q96PN7,TREF1_HUMAN,,Transcriptional-regulating factor 1 (Breast cancer anti-estrogen resistance 2) (Transcriptional-regulating protein 132) (Zinc finger protein rapa) (Zinc finger transcription factor TReP-132),Homo sapiens (Human),29.4,486.0,4e-39,165.6,sp|Q96PN7|TREF1_HUMAN Transcriptional-regulating factor 1 OS=Homo sapiens OX=9606 GN=TRERF1 PE=1 SV=1,GO:0000118; GO:0001223; GO:0001650; GO:0003677; GO:0003713; GO:0003714; GO:0005634; GO:0005654; GO:0005667; GO:0005829; GO:0006357; GO:0008270; GO:0033142; GO:0045892; GO:0045893; GO:0045944; GO:0050847; GO:0071393,cellular response to progesterone stimulus [GO:0071393]; negative regulation of DNA-templated transcription [GO:0045892]; positive regulation of DNA-templated transcription [GO:0045893]; positive regulation of transcription by RNA polymerase II [GO:0045944]; progesterone receptor signaling pathway [GO:0050847]; regulation of transcription by RNA polymerase II [GO:0006357],cytosol [GO:0005829]; fibrillar center [GO:0001650]; histone deacetylase complex [GO:0000118]; nucleoplasm [GO:0005654]; nucleus [GO:0005634]; transcription regulator complex [GO:0005667],DNA binding [GO:0003677]; nuclear progesterone receptor binding [GO:0033142]; transcription coactivator activity [GO:0003713]; transcription coactivator binding [GO:0001223]; transcription corepressor activity [GO:0003714]; zinc ion binding [GO:0008270],GO:0003677; GO:0005634; GO:0005654; GO:0005829; GO:0006355; GO:0043226; GO:0060090; GO:0140110,DNA binding; nucleus; nucleoplasm; cytosol; regulation of DNA-templated transcription; organelle; molecular adaptor activity; transcription regulator activity
OG_01505,1.2682549501364524,OG_01505,FUN_006237-T1,Peve_00030695,Pocillopora_meandrina_HIv1___RNAseq.g20447.t1,three_way,90.30166666666666,FUN_006237-T1,Q9GP16,,,,,72.4,123.0,3.5e-48,192.2,sp|Q9GP16|RL31_HELVI Large ribosomal subunit protein eL31 OS=Heliothis virescens OX=7102 GN=RpL31 PE=2 SV=1,,,,,,
OG_08859,1.2667565422956828,OG_08859,FUN_038245-T1,Peve_00007985,Pocillopora_meandrina_HIv1___TS.g5460.t2,three_way,84.75483333333334,FUN_038245-T1,P24733,,,,,61.2,841.0,5e-306,1052.7,"sp|P24733|MYS_ARGIR Myosin heavy chain, striated muscle OS=Argopecten irradians OX=31199 PE=1 SV=1",,,,,,
OG_09798,1.2644256003391323,OG_09798,FUN_042606-T1,Peve_00034915,Pocillopora_meandrina_HIv1___RNAseq.g16848.t1,three_way,70.83866666666667,FUN_042606-T1,O77627,,,,,34.6,318.0,4.900000000000003e-22,107.5,sp|O77627|JUN_BOVIN Transcription factor Jun OS=Bos taurus OX=9913 GN=JUN PE=2 SV=2,,,,,,
OG_02317,1.2632608819832547,OG_02317,FUN_008908-T1,Peve_00017912,Pocillopora_meandrina_HIv1___TS.g30016.t1,three_way,61.309333333333335,FUN_008908-T1,G8HTB6,,,,,95.7,349.0,1.3e-187,657.1,sp|G8HTB6|ZPP_ACRMI ZP domain-containing protein OS=Acropora millepora OX=45264 PE=1 SV=1,,,,,,
OG_08545,1.262603223651183,OG_08545,FUN_037499-T1,Peve_00028563,Pocillopora_meandrina_HIv1___RNAseq.g1314.t1,three_way,52.762,FUN_037499-T1,Q6V0I7,FAT4_HUMAN,,Protocadherin Fat 4 (hFat4) (Cadherin family member 14) (FAT tumor suppressor homolog 4) (Fat-like cadherin protein FAT-J),Homo sapiens (Human),26.9,750.0,3.7e-53,211.8,sp|Q6V0I7|FAT4_HUMAN Protocadherin Fat 4 OS=Homo sapiens OX=9606 GN=FAT4 PE=1 SV=2,GO:0005509; GO:0005886; GO:0007156; GO:0007157; GO:0021987; GO:0022008; GO:0035329; GO:0070062; GO:0098609,cell-cell adhesion [GO:0098609]; cerebral cortex development [GO:0021987]; heterophilic cell-cell adhesion via plasma membrane cell adhesion molecules [GO:0007157]; hippo signaling [GO:0035329]; homophilic cell adhesion via plasma membrane adhesion molecules [GO:0007156]; neurogenesis [GO:0022008],extracellular exosome [GO:0070062]; plasma membrane [GO:0005886],calcium ion binding [GO:0005509],GO:0005886; GO:0007155; GO:0030154; GO:0043226; GO:0048856,plasma membrane; cell adhesion; cell differentiation; organelle; anatomical structure development
OG_09540,1.262257946627922,OG_09540,FUN_041634-T1,Peve_00023645,Pocillopora_meandrina_HIv1___RNAseq.g14222.t1,three_way,82.26466666666667,FUN_041634-T1,Q9H0K1,SIK2_HUMAN,,Serine/threonine-protein kinase SIK2 (EC 2.7.11.1) (Qin-induced kinase) (Salt-inducible kinase 2) (SIK-2) (Serine/threonine-protein kinase SNF1-like kinase 2),Homo sapiens (Human),46.9,631.0,4.8999999999999996e-135,483.4,sp|Q9H0K1|SIK2_HUMAN Serine/threonine-protein kinase SIK2 OS=Homo sapiens OX=9606 GN=SIK2 PE=1 SV=1,GO:0000287; GO:0004674; GO:0005524; GO:0005634; GO:0005737; GO:0005789; GO:0006468; GO:0035556; GO:0046626; GO:0046777; GO:0106310,intracellular signal transduction [GO:0035556]; protein autophosphorylation [GO:0046777]; protein phosphorylation [GO:0006468]; regulation of insulin receptor signaling pathway [GO:0046626],cytoplasm [GO:0005737]; endoplasmic reticulum membrane [GO:0005789]; nucleus [GO:0005634],ATP binding [GO:0005524]; magnesium ion binding [GO:0000287]; protein serine kinase activity [GO:0106310]; protein serine/threonine kinase activity [GO:0004674],GO:0003824; GO:0005634; GO:0016740; GO:0043226; GO:0140096,"catalytic activity; nucleus; transferase activity; organelle; catalytic activity, acting on a protein"
OG_05307,1.2554704245899444,OG_05307,FUN_023981-T1,Peve_00020886,Pocillopora_meandrina_HIv1___RNAseq.g19442.t1,three_way,77.2305,FUN_023981-T1,P21440,MDR3_MOUSE,,Phosphatidylcholine translocator ABCB4 (EC 7.6.2.1) (ATP-binding cassette sub-family B member 4) (Multidrug resistance protein 2) (Multidrug resistance protein 3) (P-glycoprotein 2) (P-glycoprotein 3),Mus musculus (Mouse),52.3,1273.0,0.0,1234.6,sp|P21440|MDR3_MOUSE Phosphatidylcholine translocator ABCB4 OS=Mus musculus OX=10090 GN=Abcb4 PE=1 SV=2,GO:0005524; GO:0005654; GO:0005737; GO:0005829; GO:0005886; GO:0005925; GO:0016020; GO:0016324; GO:0016887; GO:0030136; GO:0032376; GO:0032782; GO:0042626; GO:0045121; GO:0045332; GO:0046581; GO:0055088; GO:0061092; GO:0090554; GO:0140359; GO:1901557; GO:1903413; GO:2001140,bile acid secretion [GO:0032782]; cellular response to bile acid [GO:1903413]; lipid homeostasis [GO:0055088]; phospholipid translocation [GO:0045332]; positive regulation of cholesterol transport [GO:0032376]; positive regulation of phospholipid translocation [GO:0061092]; positive regulation of phospholipid transport [GO:2001140]; response to fenofibrate [GO:1901557],apical plasma membrane [GO:0016324]; clathrin-coated vesicle [GO:0030136]; cytoplasm [GO:0005737]; cytosol [GO:0005829]; focal adhesion [GO:0005925]; intercellular canaliculus [GO:0046581]; membrane [GO:0016020]; membrane raft [GO:0045121]; nucleoplasm [GO:0005654]; plasma membrane [GO:0005886],ABC-type transporter activity [GO:0140359]; ATP binding [GO:0005524]; ATP hydrolysis activity [GO:0016887]; ATPase-coupled transmembrane transporter activity [GO:0042626]; phosphatidylcholine floppase activity [GO:0090554],GO:0003824; GO:0005215; GO:0005654; GO:0005829; GO:0005886; GO:0016787; GO:0031410; GO:0043226; GO:0061024; GO:0140657,catalytic activity; transporter activity; nucleoplasm; cytosol; plasma membrane; hydrolase activity; cytoplasmic vesicle; organelle; membrane organization; ATP-dependent activity
OG_00279,1.2531299266825089,OG_00279,FUN_001064-T1,Peve_00005413,Pocillopora_meandrina_HIv1___RNAseq.g29653.t1,three_way,61.42933333333333,FUN_001064-T1,P22758,,,,,41.1,671.0,1.3e-132,475.3,sp|P22758|TGM1_RABIT Protein-glutamine gamma-glutamyltransferase K OS=Oryctolagus cuniculus OX=9986 GN=TGM1 PE=2 SV=2,,,,,,
OG_05803,1.2527433713360567,OG_05803,FUN_025793-T1,Peve_00021012,Pocillopora_meandrina_HIv1___RNAseq.g10402.t1,three_way,55.269666666666666,FUN_025793-T1,Q6R3M4,POLI_MOUSE,,DNA polymerase iota (EC 2.7.7.7) (Rad30 homolog B),Mus musculus (Mouse),40.9,541.0,1.2e-94,349.0,sp|Q6R3M4|POLI_MOUSE DNA polymerase iota OS=Mus musculus OX=10090 GN=Poli PE=1 SV=1,GO:0003684; GO:0003887; GO:0005634; GO:0006260; GO:0019985; GO:0046872; GO:0071494,cellular response to UV-C [GO:0071494]; DNA replication [GO:0006260]; translesion synthesis [GO:0019985],nucleus [GO:0005634],damaged DNA binding [GO:0003684]; DNA-directed DNA polymerase activity [GO:0003887]; metal ion binding [GO:0046872],GO:0003677; GO:0003824; GO:0005634; GO:0006260; GO:0006281; GO:0016740; GO:0043226; GO:0140097,"DNA binding; catalytic activity; nucleus; DNA replication; DNA repair; transferase activity; organelle; catalytic activity, acting on DNA"
OG_09247,1.2505560605433217,OG_09247,FUN_040037-T1,Peve_00040431,Pocillopora_meandrina_HIv1___RNAseq.g8456.t1,three_way,47.013000000000005,FUN_040037-T1,P02788,TRFL_HUMAN,,Lactotransferrin (Lactoferrin) (EC 3.4.21.-) (Growth-inhibiting protein 12) (Talalactoferrin) [Cleaved into: Lactoferricin-H (Lfcin-H); Kaliocin-1; Lactoferroxin-A; Lactoferroxin-B; Lactoferroxin-C],Homo sapiens (Human),26.8,567.0,3.6e-34,149.1,sp|P02788|TRFL_HUMAN Lactotransferrin OS=Homo sapiens OX=9606 GN=LTF PE=1 SV=6,GO:0001503; GO:0001530; GO:0001817; GO:0002227; GO:0003677; GO:0004252; GO:0004869; GO:0005506; GO:0005576; GO:0005615; GO:0005634; GO:0005737; GO:0005769; GO:0005886; GO:0006508; GO:0006826; GO:0006959; GO:0008201; GO:0009986; GO:0019731; GO:0019732; GO:0030141; GO:0031640; GO:0031665; GO:0032680; GO:0032780; GO:0032991; GO:0033690; GO:0034145; GO:0035580; GO:0042581; GO:0043066; GO:0043123; GO:0043539; GO:0044793; GO:0045071; GO:0045669; GO:0048525; GO:0050829; GO:0051092; GO:0055037; GO:0060349; GO:0061844; GO:0070062; GO:0071902; GO:0097013; GO:0140912; GO:1900159; GO:1900229; GO:1902732; GO:1904724; GO:2000308; GO:2001205,antibacterial humoral response [GO:0019731]; antifungal humoral response [GO:0019732]; antimicrobial humoral immune response mediated by antimicrobial peptide [GO:0061844]; bone morphogenesis [GO:0060349]; defense response to Gram-negative bacterium [GO:0050829]; humoral immune response [GO:0006959]; innate immune response in mucosa [GO:0002227]; iron ion transport [GO:0006826]; killing of cells of another organism [GO:0031640]; negative regulation by host of viral process [GO:0044793]; negative regulation of apoptotic process [GO:0043066]; negative regulation of ATP-dependent activity [GO:0032780]; negative regulation of lipopolysaccharide-mediated signaling pathway [GO:0031665]; negative regulation of osteoclast development [GO:2001205]; negative regulation of single-species biofilm formation in or on host organism [GO:1900229]; negative regulation of tumor necrosis factor (ligand) superfamily member 11 production [GO:2000308]; negative regulation of viral genome replication [GO:0045071]; negative regulation of viral process [GO:0048525]; ossification [GO:0001503]; positive regulation of bone mineralization involved in bone maturation [GO:1900159]; positive regulation of canonical NF-kappaB signal transduction [GO:0043123]; positive regulation of chondrocyte proliferation [GO:1902732]; positive regulation of NF-kappaB transcription factor activity [GO:0051092]; positive regulation of osteoblast differentiation [GO:0045669]; positive regulation of osteoblast proliferation [GO:0033690]; positive regulation of protein serine/threonine kinase activity [GO:0071902]; positive regulation of toll-like receptor 4 signaling pathway [GO:0034145]; proteolysis [GO:0006508]; regulation of cytokine production [GO:0001817]; regulation of tumor necrosis factor production [GO:0032680],cell surface [GO:0009986]; cytoplasm [GO:0005737]; early endosome [GO:0005769]; extracellular exosome [GO:0070062]; extracellular region [GO:0005576]; extracellular space [GO:0005615]; nucleus [GO:0005634]; phagocytic vesicle lumen [GO:0097013]; plasma membrane [GO:0005886]; protein-containing complex [GO:0032991]; recycling endosome [GO:0055037]; secretory granule [GO:0030141]; specific granule [GO:0042581]; specific granule lumen [GO:0035580]; tertiary granule lumen [GO:1904724],cysteine-type endopeptidase inhibitor activity [GO:0004869]; DNA binding [GO:0003677]; heparin binding [GO:0008201]; iron ion binding [GO:0005506]; lipopolysaccharide binding [GO:0001530]; membrane destabilizing activity [GO:0140912]; protein serine/threonine kinase activator activity [GO:0043539]; serine-type endopeptidase activity [GO:0004252],GO:0002376; GO:0003677; GO:0003824; GO:0005576; GO:0005615; GO:0005634; GO:0005768; GO:0005886; GO:0006355; GO:0008289; GO:0016787; GO:0031410; GO:0043226; GO:0098542; GO:0098772; GO:0140096,"immune system process; DNA binding; catalytic activity; extracellular region; extracellular space; nucleus; endosome; plasma membrane; regulation of DNA-templated transcription; lipid binding; hydrolase activity; cytoplasmic vesicle; organelle; defense response to other organism; molecular function regulator activity; catalytic activity, acting on a protein"
OG_06818,1.248184215929152,OG_06818,FUN_031724-T1,Peve_00000894,Pocillopora_meandrina_HIv1___TS.g24210.t1,three_way,56.0895,FUN_031724-T1,Q9P219,DAPLE_HUMAN,,Protein Daple (Coiled-coil domain-containing protein 88C) (Dvl-associating protein with a high frequency of leucine residues) (hDaple) (Hook-related protein 2) (HkRP2),Homo sapiens (Human),35.4,432.0,7.8e-60,235.3,sp|Q9P219|DAPLE_HUMAN Protein Daple OS=Homo sapiens OX=9606 GN=CCDC88C PE=1 SV=3,GO:0001578; GO:0001965; GO:0003383; GO:0005085; GO:0005109; GO:0005576; GO:0005737; GO:0005813; GO:0007026; GO:0007264; GO:0008017; GO:0030054; GO:0030165; GO:0030705; GO:0031122; GO:0031648; GO:0035567; GO:0042802; GO:0043296; GO:0044782; GO:0046330; GO:0046983; GO:0051959; GO:0060071; GO:0090090; GO:0120197; GO:1902691,"apical constriction [GO:0003383]; cilium organization [GO:0044782]; cytoplasmic microtubule organization [GO:0031122]; cytoskeleton-dependent intracellular transport [GO:0030705]; microtubule bundle formation [GO:0001578]; mucociliary clearance [GO:0120197]; negative regulation of canonical Wnt signaling pathway [GO:0090090]; negative regulation of microtubule depolymerization [GO:0007026]; non-canonical Wnt signaling pathway [GO:0035567]; positive regulation of JNK cascade [GO:0046330]; protein destabilization [GO:0031648]; respiratory basal cell differentiation [GO:1902691]; small GTPase-mediated signal transduction [GO:0007264]; Wnt signaling pathway, planar cell polarity pathway [GO:0060071]",apical junction complex [GO:0043296]; cell junction [GO:0030054]; centrosome [GO:0005813]; cytoplasm [GO:0005737]; extracellular region [GO:0005576],dynein light intermediate chain binding [GO:0051959]; frizzled binding [GO:0005109]; G-protein alpha-subunit binding [GO:0001965]; guanyl-nucleotide exchange factor activity [GO:0005085]; identical protein binding [GO:0042802]; microtubule binding [GO:0008017]; PDZ domain binding [GO:0030165]; protein dimerization activity [GO:0046983],GO:0003016; GO:0005576; GO:0005815; GO:0007010; GO:0007018; GO:0008092; GO:0030154; GO:0044782; GO:0098772,respiratory system process; extracellular region; microtubule organizing center; cytoskeleton organization; microtubule-based movement; cytoskeletal protein binding; cell differentiation; cilium organization; molecular function regulator activity
OG_08491,1.2478812449459666,OG_08491,FUN_037330-T1,Peve_00006234,Pocillopora_meandrina_HIv1___RNAseq.g10692.t1,three_way,60.120000000000005,FUN_037330-T1,Q8IVV2,,,,,39.6,273.0,5.8e-47,192.2,sp|Q8IVV2|LOXH1_HUMAN Lipoxygenase homology domain-containing protein 1 OS=Homo sapiens OX=9606 GN=LOXHD1 PE=2 SV=4,,,,,,
OG_05387,1.2455337543599727,OG_05387,FUN_024208-T1,Peve_00031873,Pocillopora_meandrina_HIv1___RNAseq.g18905.t1b,three_way,71.887,FUN_024208-T1,O09167,RL21_MOUSE,,Large ribosomal subunit protein eL21 (60S ribosomal protein L21),Mus musculus (Mouse),65.0,160.0,4.7e-52,206.1,sp|O09167|RL21_MOUSE Large ribosomal subunit protein eL21 OS=Mus musculus OX=10090 GN=Rpl21 PE=1 SV=4,GO:0002181; GO:0003735; GO:0005737; GO:0005783; GO:0005829; GO:0005840; GO:0022625; GO:0045202; GO:0098794,cytoplasmic translation [GO:0002181],cytoplasm [GO:0005737]; cytosol [GO:0005829]; cytosolic large ribosomal subunit [GO:0022625]; endoplasmic reticulum [GO:0005783]; postsynapse [GO:0098794]; ribosome [GO:0005840]; synapse [GO:0045202],structural constituent of ribosome [GO:0003735],GO:0002181; GO:0005198; GO:0005783; GO:0005829; GO:0005840; GO:0043226,cytoplasmic translation; structural molecule activity; endoplasmic reticulum; cytosol; ribosome; organelle
OG_03941,1.2453670827809409,OG_03941,FUN_016076-T1,Peve_00021921,Pocillopora_meandrina_HIv1___RNAseq.g21616.t1,three_way,70.497,FUN_016076-T1,Q9C9C6,,,,,49.4,180.0,1.2e-34,147.9,sp|Q9C9C6|RL62_ARATH Large ribosomal subunit protein eL6y OS=Arabidopsis thaliana OX=3702 GN=RPL6B PE=2 SV=1,,,,,,
