OG_ID,Component_27,group_id,apul,peve,ptua,type,avg_identity,query,accession,id,reviewed,protein_name,organism,pident,length,evalue,bitscore,title,go_ids,go_bp,go_cc,go_mf,goslim_ids,goslim_names
OG_04737,1.243059130562269,OG_04737,FUN_022613-T1,Peve_00012263,Pocillopora_meandrina_HIv1___RNAseq.g4397.t1,three_way,68.725,FUN_022613-T1,A0A0R4IKU3,RECK_DANRE,,Reversion-inducing cysteine-rich protein with Kazal motifs,Danio rerio (Zebrafish) (Brachydanio rerio),38.2,961.0,2.3000000000000002e-201,704.1,sp|A0A0R4IKU3|RECK_DANRE Reversion-inducing cysteine-rich protein with Kazal motifs OS=Danio rerio OX=7955 GN=reck PE=1 SV=3,GO:0001944; GO:0001955; GO:0002040; GO:0004866; GO:0004867; GO:0005886; GO:0008191; GO:0015026; GO:0016055; GO:0030198; GO:0045765; GO:0051726; GO:0060070; GO:0060828; GO:0090049; GO:0090210; GO:0098552; GO:1904684; GO:1990791; GO:1990909,blood vessel maturation [GO:0001955]; canonical Wnt signaling pathway [GO:0060070]; dorsal root ganglion development [GO:1990791]; extracellular matrix organization [GO:0030198]; negative regulation of metalloendopeptidase activity [GO:1904684]; regulation of angiogenesis [GO:0045765]; regulation of canonical Wnt signaling pathway [GO:0060828]; regulation of cell cycle [GO:0051726]; regulation of cell migration involved in sprouting angiogenesis [GO:0090049]; regulation of establishment of blood-brain barrier [GO:0090210]; sprouting angiogenesis [GO:0002040]; vasculature development [GO:0001944]; Wnt signaling pathway [GO:0016055],plasma membrane [GO:0005886]; side of membrane [GO:0098552]; Wnt signalosome [GO:1990909],coreceptor activity [GO:0015026]; endopeptidase inhibitor activity [GO:0004866]; metalloendopeptidase inhibitor activity [GO:0008191]; serine-type endopeptidase inhibitor activity [GO:0004867],GO:0005886; GO:0030198; GO:0048856; GO:0060089; GO:0098772,plasma membrane; extracellular matrix organization; anatomical structure development; molecular transducer activity; molecular function regulator activity
OG_10087,1.2422945142607995,OG_10087,FUN_043414-T1,Peve_00045005,Pocillopora_meandrina_HIv1___RNAseq.g7825.t1,three_way,56.5365,FUN_043414-T1,Q69Z28,ATS16_MOUSE,,A disintegrin and metalloproteinase with thrombospondin motifs 16 (ADAM-TS 16) (ADAM-TS16) (ADAMTS-16) (EC 3.4.24.-),Mus musculus (Mouse),30.5,1138.0,9.8e-129,463.0,sp|Q69Z28|ATS16_MOUSE A disintegrin and metalloproteinase with thrombospondin motifs 16 OS=Mus musculus OX=10090 GN=Adamts16 PE=2 SV=2,GO:0001658; GO:0003073; GO:0004222; GO:0005576; GO:0006508; GO:0030198; GO:0046872; GO:0048232; GO:1902017,branching involved in ureteric bud morphogenesis [GO:0001658]; extracellular matrix organization [GO:0030198]; male gamete generation [GO:0048232]; proteolysis [GO:0006508]; regulation of cilium assembly [GO:1902017]; regulation of systemic arterial blood pressure [GO:0003073],extracellular region [GO:0005576],metal ion binding [GO:0046872]; metalloendopeptidase activity [GO:0004222],GO:0003824; GO:0005576; GO:0016787; GO:0022414; GO:0030198; GO:0140096,"catalytic activity; extracellular region; hydrolase activity; reproductive process; extracellular matrix organization; catalytic activity, acting on a protein"
OG_02734,1.2399737752061075,OG_02734,FUN_011264-T1,Peve_00030536,Pocillopora_meandrina_HIv1___RNAseq.g22310.t1,three_way,79.29683333333332,FUN_011264-T1,P02401,,,,,70.6,68.0,7.3e-19,94.7,sp|P02401|RLA2_RAT Large ribosomal subunit protein P2 OS=Rattus norvegicus OX=10116 GN=Rplp2 PE=1 SV=2,,,,,,
OG_08735,1.2365099367859276,OG_08735,FUN_037992-T1,Peve_00023490,Pocillopora_meandrina_HIv1___RNAseq.g26267.t1,three_way,59.86366666666667,,,,,,,,,,,,,,,,,
OG_04815,1.2341732030726589,OG_04815,FUN_022787-T1,Peve_00030606,Pocillopora_meandrina_HIv1___TS.g22189.t1,three_way,80.07866666666666,FUN_022787-T1,Q95R48,,,,,30.0,397.0,2.1000000000000002e-48,194.5,sp|Q95R48|OCTL_DROME Organic cation transporter-like protein OS=Drosophila melanogaster OX=7227 GN=Orct2 PE=2 SV=2,,,,,,
OG_01995,1.233041945214984,OG_01995,FUN_008104-T1,Peve_00019588,Pocillopora_meandrina_HIv1___RNAseq.g17898.t1,three_way,90.90516666666667,FUN_008104-T1,O57521,HS90B_DANRE,,Heat shock protein HSP 90-beta,Danio rerio (Zebrafish) (Brachydanio rerio),82.0,727.0,2.3e-304,1045.8,sp|O57521|HS90B_DANRE Heat shock protein HSP 90-beta OS=Danio rerio OX=7955 GN=hsp90ab1 PE=1 SV=2,GO:0001568; GO:0005524; GO:0005576; GO:0005634; GO:0005737; GO:0005829; GO:0005886; GO:0006457; GO:0007517; GO:0016887; GO:0030511; GO:0032435; GO:0032991; GO:0034605; GO:0034751; GO:0043627; GO:0046983; GO:0048471; GO:0050821; GO:0050900; GO:0051082; GO:0051726; GO:0120293; GO:0140662; GO:0141069,blood vessel development [GO:0001568]; cellular response to heat [GO:0034605]; leukocyte migration [GO:0050900]; muscle organ development [GO:0007517]; negative regulation of proteasomal ubiquitin-dependent protein catabolic process [GO:0032435]; positive regulation of transforming growth factor beta receptor signaling pathway [GO:0030511]; protein folding [GO:0006457]; protein stabilization [GO:0050821]; regulation of cell cycle [GO:0051726]; response to estrogen [GO:0043627],aryl hydrocarbon receptor complex [GO:0034751]; cytoplasm [GO:0005737]; cytosol [GO:0005829]; dynein axonemal particle [GO:0120293]; extracellular region [GO:0005576]; nucleus [GO:0005634]; perinuclear region of cytoplasm [GO:0048471]; plasma membrane [GO:0005886]; protein-containing complex [GO:0032991],ATP binding [GO:0005524]; ATP hydrolysis activity [GO:0016887]; ATP-dependent protein folding chaperone [GO:0140662]; protein dimerization activity [GO:0046983]; receptor ligand inhibitor activity [GO:0141069]; unfolded protein binding [GO:0051082],GO:0002376; GO:0003824; GO:0005576; GO:0005634; GO:0005829; GO:0005886; GO:0006457; GO:0016787; GO:0043226; GO:0044183; GO:0048856; GO:0048870; GO:0098772; GO:0140657,immune system process; catalytic activity; extracellular region; nucleus; cytosol; plasma membrane; protein folding; hydrolase activity; organelle; protein folding chaperone; anatomical structure development; cell motility; molecular function regulator activity; ATP-dependent activity
OG_06282,1.2326178355373585,OG_06282,FUN_028452-T1,Peve_00003099,Pocillopora_meandrina_HIv1___RNAseq.g16134.t1,three_way,56.43066666666667,FUN_028452-T1,G3V9H8,RET_RAT,,Proto-oncogene tyrosine-protein kinase receptor Ret (EC 2.7.10.1) [Cleaved into: Soluble RET kinase fragment; Extracellular cell-membrane anchored RET cadherin 120 kDa fragment],Rattus norvegicus (Rat),45.5,308.0,6.7000000000000004e-74,279.6,sp|G3V9H8|RET_RAT Proto-oncogene tyrosine-protein kinase receptor Ret OS=Rattus norvegicus OX=10116 GN=Ret PE=1 SV=1,GO:0000165; GO:0001657; GO:0001755; GO:0001838; GO:0004714; GO:0005509; GO:0005524; GO:0005769; GO:0005886; GO:0007156; GO:0007158; GO:0007169; GO:0007399; GO:0009410; GO:0010008; GO:0010628; GO:0010976; GO:0014042; GO:0030155; GO:0030182; GO:0030335; GO:0030424; GO:0030425; GO:0033619; GO:0033630; GO:0035799; GO:0035860; GO:0042551; GO:0043025; GO:0043235; GO:0043410; GO:0045793; GO:0045893; GO:0048265; GO:0048484; GO:0050770; GO:0051897; GO:0060041; GO:0060384; GO:0061146; GO:0071300; GO:0072300; GO:0098797; GO:0160144,cell surface receptor protein tyrosine kinase signaling pathway [GO:0007169]; cellular response to retinoic acid [GO:0071300]; embryonic epithelial tube formation [GO:0001838]; enteric nervous system development [GO:0048484]; GDF15-GFRAL signaling pathway [GO:0160144]; glial cell-derived neurotrophic factor receptor signaling pathway [GO:0035860]; homophilic cell adhesion via plasma membrane adhesion molecules [GO:0007156]; innervation [GO:0060384]; MAPK cascade [GO:0000165]; membrane protein proteolysis [GO:0033619]; nervous system development [GO:0007399]; neural crest cell migration [GO:0001755]; neuron cell-cell adhesion [GO:0007158]; neuron differentiation [GO:0030182]; neuron maturation [GO:0042551]; Peyer's patch morphogenesis [GO:0061146]; positive regulation of cell adhesion mediated by integrin [GO:0033630]; positive regulation of cell migration [GO:0030335]; positive regulation of cell size [GO:0045793]; positive regulation of DNA-templated transcription [GO:0045893]; positive regulation of gene expression [GO:0010628]; positive regulation of MAPK cascade [GO:0043410]; positive regulation of metanephric glomerulus development [GO:0072300]; positive regulation of neuron maturation [GO:0014042]; positive regulation of neuron projection development [GO:0010976]; positive regulation of phosphatidylinositol 3-kinase/protein kinase B signal transduction [GO:0051897]; regulation of axonogenesis [GO:0050770]; regulation of cell adhesion [GO:0030155]; response to pain [GO:0048265]; response to xenobiotic stimulus [GO:0009410]; retina development in camera-type eye [GO:0060041]; ureter maturation [GO:0035799]; ureteric bud development [GO:0001657],axon [GO:0030424]; dendrite [GO:0030425]; early endosome [GO:0005769]; endosome membrane [GO:0010008]; neuronal cell body [GO:0043025]; plasma membrane [GO:0005886]; plasma membrane protein complex [GO:0098797]; receptor complex [GO:0043235],ATP binding [GO:0005524]; calcium ion binding [GO:0005509]; transmembrane receptor protein tyrosine kinase activity [GO:0004714],GO:0003824; GO:0005768; GO:0005886; GO:0006355; GO:0007155; GO:0016740; GO:0030154; GO:0031410; GO:0043226; GO:0048856; GO:0048870; GO:0060089; GO:0140096,"catalytic activity; endosome; plasma membrane; regulation of DNA-templated transcription; cell adhesion; transferase activity; cell differentiation; cytoplasmic vesicle; organelle; anatomical structure development; cell motility; molecular transducer activity; catalytic activity, acting on a protein"
OG_02968,1.231805364460805,OG_02968,FUN_012130-T1,Peve_00035469,Pocillopora_meandrina_HIv1___RNAseq.g23786.t1,three_way,43.8205,FUN_012130-T1,Q5R7K9,,,,,32.1,156.0,7.5e-10,66.6,sp|Q5R7K9|EDIL3_PONAB EGF-like repeat and discoidin I-like domain-containing protein 3 OS=Pongo abelii OX=9601 GN=EDIL3 PE=2 SV=1,,,,,,
OG_06103,1.229344556834616,OG_06103,FUN_027804-T1,Peve_00036486,Pocillopora_meandrina_HIv1___RNAseq.g13899.t1,three_way,84.46000000000001,FUN_027804-T1,Q9U9L2,,,,,82.8,250.0,9.3e-123,441.0,sp|Q9U9L2|RL8_ANOGA Large ribosomal subunit protein uL2 OS=Anopheles gambiae OX=7165 GN=RpL8 PE=2 SV=2,,,,,,
OG_09944,1.2286023678715796,OG_09944,FUN_043111-T1,Peve_00014954,Pocillopora_meandrina_HIv1___RNAseq.g7894.t1,three_way,96.616,FUN_043111-T1,Q8JGS9,,,,,89.1,101.0,5.5e-47,188.0,sp|Q8JGS9|RS18_DANRE Small ribosomal subunit protein uS13 OS=Danio rerio OX=7955 GN=rps18 PE=1 SV=1,,,,,,
OG_02331,1.228349053526438,OG_02331,FUN_008924-T1,Peve_00028630,Pocillopora_meandrina_HIv1___RNAseq.g14267.t1,three_way,80.87533333333333,FUN_008924-T1,O76756,,,,,75.1,209.0,9.500000000000001e-86,317.8,sp|O76756|RS8_APIME Small ribosomal subunit protein eS8 OS=Apis mellifera OX=7460 GN=RpS8 PE=2 SV=2,,,,,,
OG_04621,1.2222464319174149,OG_04621,FUN_022323-T1,Peve_00021645,Pocillopora_meandrina_HIv1___RNAseq.g4644.t1,three_way,86.14483333333334,,,,,,,,,,,,,,,,,
OG_03085,1.2175485010552578,OG_03085,FUN_012358-T1,Peve_00042557,Pocillopora_meandrina_HIv1___RNAseq.g23273.t1,three_way,74.58133333333333,FUN_012358-T1,Q24133,DNAJ1_DROME,,DnaJ protein homolog 1 (DROJ1),Drosophila melanogaster (Fruit fly),53.0,332.0,1.4e-84,314.7,sp|Q24133|DNAJ1_DROME DnaJ protein homolog 1 OS=Drosophila melanogaster OX=7227 GN=DnaJ-1 PE=1 SV=3,GO:0005829; GO:0006457; GO:0009408; GO:0042691; GO:0050821; GO:0051082; GO:0051085; GO:0051087; GO:0140297,chaperone cofactor-dependent protein refolding [GO:0051085]; positive regulation of crystal cell differentiation [GO:0042691]; protein folding [GO:0006457]; protein stabilization [GO:0050821]; response to heat [GO:0009408],cytosol [GO:0005829],DNA-binding transcription factor binding [GO:0140297]; protein-folding chaperone binding [GO:0051087]; unfolded protein binding [GO:0051082],GO:0005829; GO:0006457,cytosol; protein folding
OG_00853,1.2122238689158762,OG_00853,FUN_004115-T1,Peve_00008071,Pocillopora_meandrina_HIv1___RNAseq.g11666.t1,three_way,69.32233333333333,FUN_004115-T1,O94632,EGT1_SCHPO,,Ergothioneine biosynthesis protein 1 (Meiotically up-regulated gene 158 protein) [Includes: L-histidine N(alpha)-methyltransferase (EC 2.1.1.44); Hercynylcysteine S-oxide synthase (EC 1.21.3.10)],Schizosaccharomyces pombe (strain 972 / ATCC 24843) (Fission yeast),28.3,184.0,1.9e-09,66.2,sp|O94632|EGT1_SCHPO Ergothioneine biosynthesis protein 1 OS=Schizosaccharomyces pombe (strain 972 / ATCC 24843) OX=284812 GN=egt1 PE=1 SV=4,GO:0004497; GO:0005509; GO:0005634; GO:0005829; GO:0032259; GO:0051321; GO:0052699; GO:0052706; GO:0061686; GO:1903257,ergothioneine biosynthetic process [GO:0052699]; meiotic cell cycle [GO:0051321]; methylation [GO:0032259]; selenoneine biosynthetic process [GO:1903257],cytosol [GO:0005829]; nucleus [GO:0005634],calcium ion binding [GO:0005509]; hercynylcysteine sulfoxide synthase activity [GO:0061686]; L-histidine N(alpha)-methyltransferase activity [GO:0052706]; monooxygenase activity [GO:0004497],GO:0003824; GO:0005634; GO:0005829; GO:0006575; GO:0006790; GO:0016491; GO:0016740; GO:0022414; GO:0043226,catalytic activity; nucleus; cytosol; modified amino acid metabolic process; sulfur compound metabolic process; oxidoreductase activity; transferase activity; reproductive process; organelle
OG_00033,1.211174080682126,OG_00033,FUN_000239-T1,Peve_00033353,Pocillopora_meandrina_HIv1___RNAseq.g28955.t1,three_way,97.61933333333332,FUN_000239-T1,Q2KHT7,,,,,89.3,84.0,1.7e-38,159.5,sp|Q2KHT7|RS27_BOVIN Small ribosomal subunit protein eS27 OS=Bos taurus OX=9913 GN=RPS27 PE=1 SV=3,,,,,,
OG_01324,1.2101412989507103,OG_01324,FUN_005194-T1,Peve_00001277,Pocillopora_meandrina_HIv1___RNAseq.g15136.t1,three_way,66.81283333333333,,,,,,,,,,,,,,,,,
OG_06574,1.2093915120575782,OG_06574,FUN_029519-T1,Peve_00022876,Pocillopora_meandrina_HIv1___TS.g2888.t1,three_way,93.70616666666666,FUN_029519-T1,Q9JHU4,DYHC1_MOUSE,,"Cytoplasmic dynein 1 heavy chain 1 (Cytoplasmic dynein heavy chain 1) (Dynein heavy chain, cytosolic)",Mus musculus (Mouse),73.3,4665.0,0.0,6825.7,sp|Q9JHU4|DYHC1_MOUSE Cytoplasmic dynein 1 heavy chain 1 OS=Mus musculus OX=10090 GN=Dync1h1 PE=1 SV=2,GO:0003341; GO:0005524; GO:0005737; GO:0005813; GO:0005868; GO:0005874; GO:0008569; GO:0016887; GO:0030175; GO:0030286; GO:0032388; GO:0033962; GO:0034063; GO:0042802; GO:0045505; GO:0051293; GO:0051301; GO:0051959; GO:0060236; GO:0090235; GO:0120162; GO:1905832,cell division [GO:0051301]; cilium movement [GO:0003341]; establishment of spindle localization [GO:0051293]; P-body assembly [GO:0033962]; positive regulation of cold-induced thermogenesis [GO:0120162]; positive regulation of intracellular transport [GO:0032388]; positive regulation of spindle assembly [GO:1905832]; regulation of metaphase plate congression [GO:0090235]; regulation of mitotic spindle organization [GO:0060236]; stress granule assembly [GO:0034063],centrosome [GO:0005813]; cytoplasm [GO:0005737]; cytoplasmic dynein complex [GO:0005868]; dynein complex [GO:0030286]; filopodium [GO:0030175]; microtubule [GO:0005874],ATP binding [GO:0005524]; ATP hydrolysis activity [GO:0016887]; dynein intermediate chain binding [GO:0045505]; dynein light intermediate chain binding [GO:0051959]; identical protein binding [GO:0042802]; minus-end-directed microtubule motor activity [GO:0008569],GO:0003774; GO:0003824; GO:0005815; GO:0007010; GO:0007018; GO:0016787; GO:0016853; GO:0140657,cytoskeletal motor activity; catalytic activity; microtubule organizing center; cytoskeleton organization; microtubule-based movement; hydrolase activity; isomerase activity; ATP-dependent activity
OG_09598,1.2087930814332193,OG_09598,FUN_041745-T1,Peve_00000338,Pocillopora_meandrina_HIv1___RNAseq.g15790.t1,three_way,56.4945,,,,,,,,,,,,,,,,,
OG_01504,1.2081416723844658,OG_01504,FUN_006236-T1,Peve_00011453,Pocillopora_meandrina_HIv1___RNAseq.g20448.t1,three_way,65.54733333333333,,,,,,,,,,,,,,,,,
OG_01161,1.2067122411984617,OG_01161,FUN_004780-T1,Peve_00037744,Pocillopora_meandrina_HIv1___RNAseq.g6689.t1,three_way,84.39833333333334,FUN_004780-T1,Q6P3J5,EF2_DANRE,,Elongation factor 2b (EF-2) (EC 3.6.5.-),Danio rerio (Zebrafish) (Brachydanio rerio),77.6,858.0,0.0,1342.8,sp|Q6P3J5|EF2_DANRE Elongation factor 2b OS=Danio rerio OX=7955 GN=eef2b PE=1 SV=1,GO:0003746; GO:0003924; GO:0005525; GO:0005634; GO:0005829; GO:0006414; GO:0043009; GO:0043022; GO:0071466; GO:1990904,cellular response to xenobiotic stimulus [GO:0071466]; chordate embryonic development [GO:0043009]; translational elongation [GO:0006414],cytosol [GO:0005829]; nucleus [GO:0005634]; ribonucleoprotein complex [GO:1990904],GTP binding [GO:0005525]; GTPase activity [GO:0003924]; ribosome binding [GO:0043022]; translation elongation factor activity [GO:0003746],GO:0003824; GO:0003924; GO:0005634; GO:0005829; GO:0016787; GO:0043226; GO:0048856,catalytic activity; GTPase activity; nucleus; cytosol; hydrolase activity; organelle; anatomical structure development
OG_03743,1.2064592807863472,OG_03743,FUN_015050-T1,Peve_00001172,Pocillopora_meandrina_HIv1___RNAseq.g21265.t1,three_way,70.01583333333333,FUN_015050-T1,Q8CHW5,,,,,38.3,120.0,7.4e-10,67.4,sp|Q8CHW5|BICL2_MOUSE BICD family-like cargo adapter 2 OS=Mus musculus OX=10090 GN=Bicdl2 PE=1 SV=1,,,,,,
OG_08400,1.204685393202081,OG_08400,FUN_037048-T1,Peve_00032330,Pocillopora_meandrina_HIv1___RNAseq.g26794.t1,three_way,85.69433333333333,FUN_037048-T1,Q56JU9,,,,,76.4,127.0,1e-40,167.5,sp|Q56JU9|RS24_BOVIN Small ribosomal subunit protein eS24 OS=Bos taurus OX=9913 GN=RPS24 PE=2 SV=2,,,,,,
OG_07978,1.199313470891198,OG_07978,FUN_035600-T1,Peve_00027480,Pocillopora_meandrina_HIv1___RNAseq.g28038.t1,three_way,84.73833333333333,FUN_035600-T1,Q9T043,,,,,54.9,133.0,1.4e-32,140.6,sp|Q9T043|RL142_ARATH Large ribosomal subunit protein eL14y OS=Arabidopsis thaliana OX=3702 GN=RPL14B PE=1 SV=1,,,,,,
OG_08098,1.199245391880301,OG_08098,FUN_035840-T1,Peve_00032502,Pocillopora_meandrina_HIv1___RNAseq.g11957.t1,three_way,76.54033333333332,FUN_035840-T1,P38532,HSF1_MOUSE,,Heat shock factor protein 1 (HSF 1) (Heat shock transcription factor 1) (HSTF 1),Mus musculus (Mouse),55.7,176.0,1.1e-44,182.6,sp|P38532|HSF1_MOUSE Heat shock factor protein 1 OS=Mus musculus OX=10090 GN=Hsf1 PE=1 SV=2,GO:0000122; GO:0000165; GO:0000776; GO:0000791; GO:0000792; GO:0000978; GO:0001162; GO:0001227; GO:0001228; GO:0001701; GO:0001892; GO:0003677; GO:0003682; GO:0005634; GO:0005654; GO:0005737; GO:0005813; GO:0005829; GO:0006281; GO:0006397; GO:0006952; GO:0007143; GO:0007283; GO:0007584; GO:0008283; GO:0009408; GO:0010628; GO:0010667; GO:0014823; GO:0016605; GO:0019901; GO:0031072; GO:0031333; GO:0031490; GO:0032496; GO:0032720; GO:0032991; GO:0033574; GO:0034605; GO:0034620; GO:0035865; GO:0040018; GO:0042802; GO:0043565; GO:0045120; GO:0045651; GO:0045931; GO:0045944; GO:0046982; GO:0048471; GO:0050673; GO:0050680; GO:0051028; GO:0051879; GO:0060136; GO:0061770; GO:0062029; GO:0065003; GO:0070301; GO:0071222; GO:0071276; GO:0071280; GO:0071392; GO:0071466; GO:0071480; GO:0072738; GO:0090084; GO:0090261; GO:0097165; GO:0097431; GO:0097677; GO:0098847; GO:0101031; GO:0120162; GO:0140296; GO:1900034; GO:1901652; GO:1902512; GO:1903936; GO:1904385; GO:1904843; GO:1904845; GO:1990841; GO:1990904; GO:1990910; GO:1990911; GO:2001033; GO:2001235,cell population proliferation [GO:0008283]; cellular response to angiotensin [GO:1904385]; cellular response to cadmium ion [GO:0071276]; cellular response to copper ion [GO:0071280]; cellular response to diamide [GO:0072738]; cellular response to estradiol stimulus [GO:0071392]; cellular response to gamma radiation [GO:0071480]; cellular response to heat [GO:0034605]; cellular response to hydrogen peroxide [GO:0070301]; cellular response to L-glutamine [GO:1904845]; cellular response to lipopolysaccharide [GO:0071222]; cellular response to nitroglycerin [GO:1904843]; cellular response to potassium ion [GO:0035865]; cellular response to sodium arsenite [GO:1903936]; cellular response to unfolded protein [GO:0034620]; cellular response to xenobiotic stimulus [GO:0071466]; defense response [GO:0006952]; DNA repair [GO:0006281]; embryonic placenta development [GO:0001892]; embryonic process involved in female pregnancy [GO:0060136]; epithelial cell proliferation [GO:0050673]; female meiotic nuclear division [GO:0007143]; in utero embryonic development [GO:0001701]; MAPK cascade [GO:0000165]; mRNA processing [GO:0006397]; mRNA transport [GO:0051028]; negative regulation of cardiac muscle cell apoptotic process [GO:0010667]; negative regulation of double-strand break repair via nonhomologous end joining [GO:2001033]; negative regulation of epithelial cell proliferation [GO:0050680]; negative regulation of inclusion body assembly [GO:0090084]; negative regulation of protein-containing complex assembly [GO:0031333]; negative regulation of transcription by RNA polymerase II [GO:0000122]; negative regulation of tumor necrosis factor production [GO:0032720]; positive regulation of apoptotic DNA fragmentation [GO:1902512]; positive regulation of apoptotic signaling pathway [GO:2001235]; positive regulation of cold-induced thermogenesis [GO:0120162]; positive regulation of gene expression [GO:0010628]; positive regulation of inclusion body assembly [GO:0090261]; positive regulation of macrophage differentiation [GO:0045651]; positive regulation of mitotic cell cycle [GO:0045931]; positive regulation of multicellular organism growth [GO:0040018]; positive regulation of stress granule assembly [GO:0062029]; positive regulation of transcription by RNA polymerase II [GO:0045944]; protein-containing complex assembly [GO:0065003]; regulation of cellular response to heat [GO:1900034]; response to activity [GO:0014823]; response to heat [GO:0009408]; response to hypobaric hypoxia [GO:1990910]; response to lipopolysaccharide [GO:0032496]; response to nutrient [GO:0007584]; response to peptide [GO:1901652]; response to psychosocial stress [GO:1990911]; response to testosterone [GO:0033574]; spermatogenesis [GO:0007283],centrosome [GO:0005813]; cytoplasm [GO:0005737]; cytosol [GO:0005829]; euchromatin [GO:0000791]; heterochromatin [GO:0000792]; kinetochore [GO:0000776]; mitotic spindle pole [GO:0097431]; nuclear stress granule [GO:0097165]; nucleoplasm [GO:0005654]; nucleus [GO:0005634]; perinuclear region of cytoplasm [GO:0048471]; PML body [GO:0016605]; pronucleus [GO:0045120]; protein folding chaperone complex [GO:0101031]; protein-containing complex [GO:0032991]; ribonucleoprotein complex [GO:1990904],"chromatin binding [GO:0003682]; chromatin DNA binding [GO:0031490]; DNA binding [GO:0003677]; DNA-binding transcription activator activity, RNA polymerase II-specific [GO:0001228]; DNA-binding transcription repressor activity, RNA polymerase II-specific [GO:0001227]; general transcription initiation factor binding [GO:0140296]; heat shock protein binding [GO:0031072]; Hsp90 protein binding [GO:0051879]; identical protein binding [GO:0042802]; promoter-specific chromatin binding [GO:1990841]; protein heterodimerization activity [GO:0046982]; protein kinase binding [GO:0019901]; RNA polymerase II cis-regulatory region sequence-specific DNA binding [GO:0000978]; RNA polymerase II intronic transcription regulatory region sequence-specific DNA binding [GO:0001162]; sequence-specific DNA binding [GO:0043565]; sequence-specific single stranded DNA binding [GO:0098847]; STAT family protein binding [GO:0097677]; translation elongation factor binding [GO:0061770]",GO:0003677; GO:0005634; GO:0005654; GO:0005815; GO:0005829; GO:0006281; GO:0006355; GO:0016071; GO:0022414; GO:0043226; GO:0048856; GO:0065003; GO:0140013; GO:0140110,DNA binding; nucleus; nucleoplasm; microtubule organizing center; cytosol; DNA repair; regulation of DNA-templated transcription; mRNA metabolic process; reproductive process; organelle; anatomical structure development; protein-containing complex assembly; meiotic nuclear division; transcription regulator activity
OG_01123,1.1971927312962811,OG_01123,FUN_004691-T1,Peve_00019711,Pocillopora_meandrina_HIv1___TS.g20478.t1,three_way,79.91966666666667,FUN_004691-T1,Q9Y2I6,NINL_HUMAN,,Ninein-like protein,Homo sapiens (Human),30.6,517.0,7.2999999999999975e-47,191.8,sp|Q9Y2I6|NINL_HUMAN Ninein-like protein OS=Homo sapiens OX=9606 GN=NINL PE=1 SV=2,GO:0005509; GO:0005813; GO:0005829; GO:0005874; GO:0034454,microtubule anchoring at centrosome [GO:0034454],centrosome [GO:0005813]; cytosol [GO:0005829]; microtubule [GO:0005874],calcium ion binding [GO:0005509],GO:0005815; GO:0005829; GO:0007010,microtubule organizing center; cytosol; cytoskeleton organization
OG_01413,1.1933938957105688,OG_01413,FUN_005700-T1,Peve_00008485,Pocillopora_meandrina_HIv1___RNAseq.g19563.t1,three_way,75.503,FUN_005700-T1,Q9Z2V9,,,,,40.4,213.0,5.4e-36,152.9,sp|Q9Z2V9|CCNI_MOUSE Cyclin-I OS=Mus musculus OX=10090 GN=Ccni PE=2 SV=4,,,,,,
